pmid,title,authors,first_author,abstract,publication_date,publication_year,journal_info,doi,pmcid,keywords,article_type,country,language
6850274,Callosal apraxia.,"Watson, R T; Heilman, K M",Watson,"A 43-year-old woman suffered a spontaneous corpus callosum disconnection, resulting in apraxia and apraxic agraphia confined to the left hand. She initially had a functionally total callosal disconnection. With time, the splenium of the corpus callosum became functional, and a computerized tomographic scan performed five months after the onset showed infarction of only the body of the corpus callosum. Concomitant with this improvement in callosal function, the apraxia changed from ideational (loss of the concept of skilled movements) to classic ideomotor apraxia. A temporal analysis of this case provided support for Liepmann's (Liepmann, 1900; Liepmann and Maas, 1970) hypothesis that there is a centre for visuokinaesthetic (space-time) engrams in the left hemisphere of right-handed patients that controls skilled motor acts in either hand. This patient's recovery also allowed us a better understanding of the mechanisms underlying various types of apraxia.",{},,Brain : a journal of neurology,10.1093/brain/106.2.391,,,Case Reports; Journal Article,England,eng
30953621,Seeing is not believing.,"Foster, Zane; Kini, Ashwini; Al Othman, Bayan; Lee, Andrew G; Vaphiades, Michael",Foster,"An 84-year-old woman with a history of dry age-related macular degeneration presented with an acute inability to read, but intact writing ability (pure alexia or alexia without agraphia). She denied any difficulty speaking, paresthesias, or hemiparesis. Her visual acuity was 20/20 in each eye. Macular examination, optical coherence tomography, and fluorescein angiography demonstrated the previously diagnosed macular drusen and geographic atrophy of the retinal pigment epithelium consistent with the dry form of age-related macular degeneration both eyes. Automated perimetry revealed a right homonymous hemianopsia. Neuroimaging confirmed a left occipital ischemic infarction with involvement of the splenium of the corpus callosum producing the classic disconnection syndrome of alexia without agraphia.","DictElement({'Year': '2019', 'Month': '04', 'Day': '04'}, attributes={'DateType': 'Electronic'})",2019,Survey of ophthalmology,10.1016/j.survophthal.2019.03.008,,alexia without agraphia; occipital lobe; pure alexia; reading problems; splenium of corpus callosum; stroke,Case Reports; Journal Article,United States,eng
22075046,Callosal warning syndrome.,"Nandhagopal, Ramachandiran; Al-Asmi, Abdullah; Johnston, William James; Jacob, P C; Arunodaya, G R",Nandhagopal,"To report the clinical and imaging findings in a patient with an initial fluctuating disconnection syndrome due to corpus callosal ischemia that ultimately culminated in infarction with persistent symptoms. A 40-year-old, hypertensive, right-handed man presented with transient, stereotyped symptoms of corpus callosal disconnection (intermanual conflict, apraxia, dysgraphia and construction difficulties in his left hand). Serial magnetic resonance imaging scans demonstrated the ischemic nature of the initial fluctuating symptoms and later showed callosal infarction when the symptoms were persistent. Magnetic resonance angiogram did not reveal significant stenosis or occlusion of the internal carotid or proximal portion of anterior cerebral arteries. Patient received standard treatment for ischemic stroke and at follow-up 1 month later, had mild left hand apraxia, dysgraphia and construction difficulties. The case highlights the unusual occurrence of crescendo transient ischemic attacks culminating in infarction in the location of corpus callosum. We have termed this novel stroke syndrome as 'callosal warning syndrome' as the temporal profile was quite indistinguishable from that of relatively well-known stroke warning syndromes in the location of internal capsule and pontine tegmentum.","DictElement({'Year': '2011', 'Month': '11', 'Day': '08'}, attributes={'DateType': 'Electronic'})",2011,Journal of the neurological sciences,10.1016/j.jns.2011.10.007,,,Case Reports; Journal Article,Netherlands,eng
35903929,Capecitabine-related neurotoxicity presenting with agraphia.,"Iscan, Dilek; Tolay, Rumeysa; Bayram, Ertugrul; Demir, Turgay; Bicakci, Sebnem",Iscan,"Capecitabine is a pre-metabolite of 5-fluorouracil and is used as a chemotherapeutic agent. Among the common side effects of capecitabine, there are gastrointestinal side effects including nausea, vomiting, and diarrhea, and dermatological side effects including hand-foot syndrome and skin pigmentation change. However, neurological side effects of capecitabine are very rare. We describe herein a patient who developed neurological side effects in the form of agraphia and dysarthria on the 7th day of capecitabine treatment. A 34-year-old male patient, who was being followed up with the diagnosis of colon cancer, presented with speech and writing disorder that developed while under capecitabine treatment. Dysarthria and agraphia were detected in his neurological examination. Diffusion-weighted magnetic resonance imaging (MRI) revealed acute diffusion restriction in the splenium of the corpus callosum and at the level of the bilateral centrum semiovale. Brain MRI revealed symmetrical T2-weighted fluid-attenuated inversion recovery (T2-FLAIR) signal increases at the right temporoparietal medial, corpus callosum level, and bilateral white matter level. The capecitabine treatment was terminated, and methylprednisolone treatment was administered and plasmapheresis procedure was carried out. Subsequently, significant improvement was observed in the clinical findings and neuroimaging. Capecitabine is used as an oral agent; thus, it provides ease of use. Neurological side effects associated with the use of capecitabine reportedly occur very rarely. The findings of this case demonstrated that leukoencephalopathy can be seen during the use of capecitabine, imaging results are very important in the diagnosis of leukoencephalopathy, and improvement can be achieved with the termination of the capecitabine treatment.","DictElement({'Year': '2022', 'Month': '07', 'Day': '29'}, attributes={'DateType': 'Electronic'})",2022,Journal of oncology pharmacy practice : official publication of the International Society of Oncology Pharmacy Practitioners,10.1177/10781552221116329,,Agraphia; capecitabine; neurotoxicity,Case Reports; Journal Article,England,eng
738066,Paroxysmal alexia.,"Holtzman, R N; Rudel, R G; Goldensohn, E S",Holtzman,"This report describes a case of paroxysmal alexia which progressed to a persistent syndrome of alexia without agraphia. The sequence of symptoms beginning with a sensation of eyeball movement followed by blurred vision in the affected eye, alexia and diminished awareness strongly implicates an ictal mechanism. Anatomical, physiological and psychological considerations suggest that the syndrome arose from functional disruption between the visual cortex and the dominant inferior parietal cortex.",{},,Cortex; a journal devoted to the study of the nervous system and behavior,10.1016/s0010-9452(78)80033-1,,,Case Reports; Journal Article,Italy,eng
6663305,Neglect dysgraphia.,"Baxter, D M; Warrington, E K",Baxter,"A phonological dysgraphic syndrome is documented in a left handed man with a right-hemisphere lesion. His spelling was significantly affected by word length but neither word frequency nor the orthographical irregularity or word class proved to be relevant variables. Words were spelled equally efficiently forwards as backwards. A clear gradient of letter errors was shown to exist with letters on the left being mis-spelled more often than letters on the right of a word, irrespective of word length. These findings are discussed in terms of current models of spelling and their relevance to theories of unilateral neglect.",{},,"Journal of neurology, neurosurgery, and psychiatry",10.1136/jnnp.46.12.1073,PMC491770,,Case Reports; Journal Article,England,eng
21675099,Alexia without agraphia.,"Mulroy, E; Murphy, S; Lynch, T",Mulroy,Alexia without agraphia (also called pure alexia or word blindness) was the first of the disconnection syndromes (syndromes caused by disconnection of the right from the left cerebral hemisphere through interruption of the communication pathways between them) to be described. Déjerine in 1892 reported a patient who developed this syndrome after an infarct of the left occipital lobe and splenium of the corpus callosum. We describe a patient who developed alexia without agraphia due to an embolic left occipital lobe infarct extending to the posterior commissure and splenium of the corpus callosum.,{},,Irish medical journal,,,,Case Reports; Journal Article,Ireland,eng
1630612,Alexia without agraphia.,"Quint, D J; Gilmore, J L",Quint,"Two new cases of alexia without agraphia are presented. Pertinent clinical findings, anatomy, pathophysiology and differential diagnoses are reviewed. The importance of carefully examining the inferior portion of the left side of the splenium of the corpus callosum on CT and/or MR scans in patients who present with this clinical syndrome is stressed.",{},,Neuroradiology,10.1007/BF00596338,,,Case Reports; Journal Article,Germany,eng
1723332,Writing with the right hemisphere.,"Rapcsak, S Z; Beeson, P M; Rubens, A B",Rapcsak,"We studied writing abilities in a strongly right-handed man following a massive stroke that resulted in virtually complete destruction of the language-dominant left hemisphere. Writing was characterized by sensitivity to lexical-semantic variables (i.e., word frequency, imageability, and part of speech), semantic errors in writing to dictation and written naming, total inability to use the nonlexical phonological spelling route, and agrammatism in spontaneous writing. The reliance on a lexical-semantic strategy in spelling, semantic errors, and impaired phonology and syntax were all highly consistent with the general characteristics of right hemisphere language, as revealed by studies of split-brain patients and adults with dominant hemispherectomy. In addition, this pattern of writing closely resembled the syndrome of deep agraphia. These observations provide strong support for the hypothesis that deep agraphia reflects right hemisphere writing.",{},,Brain and language,10.1016/0093-934x(91)90171-v,,,Case Reports; Journal Article,Netherlands,eng
37478549,White matter tract disconnection in Gerstmann's syndrome: Insights from a single case study.,"Ranzini, Mariagrazia; Ferrazzi, Giulio; D'Imperio, Daniela; Giustiniani, Andreina; Danesin, Laura; D'Antonio, Valentina; Rigon, Elena; Cacciante, Luisa; Rigon, Jessica; Meneghello, Francesca; Turolla, Andrea; Vallesi, Antonino; Semenza, Carlo; Burgio, Francesca",Ranzini,"It has been suggested that Gerstmann's syndrome is the result of subcortical disconnection rather than emerging from damage of a multifunctional brain region within the parietal lobe. However, patterns of white matter tract disconnection following parietal damage have been barely investigated. This single case study allows characterising Gerstmann's syndrome in terms of disconnected networks. We report the case of a left parietal patient affected by Gerstmann's tetrad: agraphia, acalculia, left/right orientation problems, and finger agnosia. Lesion mapping, atlas-based estimation of probability of disconnection, and DTI-based tractography revealed that the lesion was mainly located in the superior parietal lobule, and it caused disruption of both intraparietal tracts passing through the inferior parietal lobule (e.g., tracts connecting the angular, supramarginal, postcentral gyri, and the superior parietal lobule) and fronto-parietal long tracts (e.g., the superior longitudinal fasciculus). The lesion site appears to be located more superiorly as compared to the cerebral regions shown active by other studies during tasks impaired in the syndrome, and it reached the subcortical area potentially critical in the emergence of the syndrome, as hypothesised in previous studies. Importantly, the reconstruction of tracts connecting regions within the parietal lobe indicates that this critical subcortical area is mainly crossed by white matter tracts connecting the angular gyrus and the superior parietal lobule. Taken together, these findings suggest that this case study might be considered as empirical evidence of Gerstmann's tetrad caused by disconnection of intraparietal white matter tracts.","DictElement({'Year': '2023', 'Month': '06', 'Day': '27'}, attributes={'DateType': 'Electronic'})",2023,Cortex; a journal devoted to the study of the nervous system and behavior,10.1016/j.cortex.2023.05.016,,Gerstmann's syndrome; Lesion Mapping; Optic ataxia; White matter tract disconnection; stroke,"Case Reports; Research Support, Non-U.S. Gov't",Italy,eng
25564267,Agraphia caused by acute right parietal infarction.,"Lee, Manyong; Suh, Mee Kyung; Lee, Myung Hyun; Lee, Jin Soo; Moon, So Young",Lee,"Injury in the dominant language hemisphere typically leads to agraphia, however we report a patient with agraphia after injury to the right angular gyrus. A 71-year-old Korean woman presented with the complaint of an inability to write for the last 7 days. The patient had been illiterate for most of her life, but had started learning to write Hangul, the Korean alphabet, at a welfare center 3 years ago. On language screening she was unable to write although she could read, and other language functions showed no abnormalities. Brain MRI showed acute infarction in the right angular gyrus. Her writing patterns displayed features of surface agraphia, indicative of phoneme-to-grapheme conversion with phonetic writing of targets. Additionally, she manifested visual errors. A functional MRI indicated that her left hemisphere was language dominant. This patient experienced agraphia resulting from pure impairment of visuo-constructive function after acute infarction in the right angular gyrus.","DictElement({'Year': '2015', 'Month': '01', 'Day': '03'}, attributes={'DateType': 'Electronic'})",2015,Journal of clinical neuroscience : official journal of the Neurosurgical Society of Australasia,10.1016/j.jocn.2014.09.023,,Agraphia; Angular gyrus; Hangul; Parietal; Right; Spatial,"Case Reports; Journal Article; Research Support, Non-U.S. Gov't",Scotland,eng
33175666,A case of inferior frontal gyrus infarction manifesting Gerstmann syndrome.,"Tanabe, Nobuhiko; Komuro, Taro; Mochida, Atsushi; Fujita, Yuko; Nakagawa, Madoka; Hyuga, Junko; Horiguchi, Satoshi; Satow, Takeshi",Tanabe,"A 48-year-old female suffered from cerebral infarction involving the left inferior frontal gyrus. This was due to ischemic complications of endovascular treatment for subarachnoid hemorrhage. She exhibited severe acalculia, agraphia, finger agnosia, and right-left disorientation (the four features of Gerstmann syndrome), but aphasia was scarcely noticeable. Single-photon emission tomography revealed hypoperfusion in the left inferior frontal area and also in the left parietal area. It is possible that Gerstmann syndrome was caused in the present case by disruption of the association fiber connecting the inferior frontal area with the inferior parietal area.","DictElement({'Year': '2020', 'Month': '11', 'Day': '11'}, attributes={'DateType': 'Electronic'})",2020,Neurocase,10.1080/13554794.2020.1846059,,Cerebral infarction; Gerstmann syndrome; SPECT; disconnection syndrome; inferior frontal gyrus,Case Reports; Journal Article,England,eng
32912538,A Rare Clinical Antity; Pure Gerstmann Syndrome.,"Tekgol Uzuner, Gulnur; Ubur, Ahmet; Erten, Murat; Uzuner, Nevzat",Tekgol Uzuner,"Gerstmann syndrome is defined as a tetrad including agraphia, acalculia, finger agnosia, and right-left disorientation. In the case studies presented in the literature, it has been reported that Gerstmann syndrome usually appears as an incomplete tetrad of symptoms or accompanied by cognitive deficits including aphasia, alexia, apraxia and some perceptual disorders. Here, we present of the patient with left angular and supramarginal gyrus infarction affecting the parietal lobe. In addition to the symptoms mentioned above, the patient had alexia and anomic aphasia as well. We discussed the clinic appearance and reviewed the current literature.","DictElement({'Year': '2020', 'Month': '07', 'Day': '29'}, attributes={'DateType': 'Electronic'})",2020,Journal of stroke and cerebrovascular diseases : the official journal of National Stroke Association,10.1016/j.jstrokecerebrovasdis.2020.105161,,Acalculia; Finger agnosia; Gerstmann syndrome; Right-left disorientation; agraphia,Case Reports; Journal Article; Review,United States,eng
34920996,Left hemispheric cortical watershed infarcts triggered by carotid sinus self-massage.,"Haber, Georg; Loffeld, Miriam; Braumiller, Magret; Lorenzl, Stefan",Haber,"A 69-year-old man was presented to our emergency department with acute onset of hemianopsia, aphasia and dizziness. He reported that while he was sitting in front of his computer at home, he had performed a bilateral self-massage of his carotid arteries when suddenly the symptoms occurred. A neurological examination revealed a hemianopsia with a visual field loss on the right side. In addition, a mild aphasic syndrome with agraphia and a word-finding disorder (National Institutes of Health Stroke Scale (NIHSS): 3 points) was diagnosed. The initial brain CT scan with CT angiography showed neither an intracerebral haemorrhage nor a cerebral infarction. Also, no occlusion or any signs of artery dissection or a flow relevant stenosis of the brain supplying arteries were found. After excluding other contraindications, an intravenous thrombolysis with weight-adapted alteplase was performed. The symptoms of the patient significantly improved in the short-term follow-up. Three days after admission no neurological deficits remained. The MRI of the brain revealed multifocal, small, left hemispherical strokes in the middle cerebral artery territory. In general, watershed infarcts after carotid sinus self-massage follow a rare ischaemic stroke mechanism. This case emphasises the importance of a detailed anamnestic evaluation to determine the aetiological classification of ischaemic stroke as well as educating patients' (poststroke) behaviour.","DictElement({'Year': '2021', 'Month': '12', 'Day': '17'}, attributes={'DateType': 'Electronic'})",2021,BMJ case reports,10.1136/bcr-2021-244926,PMC8685934,neuroimaging; neurology; stroke,Case Reports; Journal Article,England,eng
30391309,Dural arteriovenous fistula associated with intratumor hemorrhage.,"Takemoto, Yushin; Kawano, Takayuki; Ohmori, Yuki; Nakagawa, Takashi; Ohta, Kazutaka; Kuroda, Jun-Ichiro; Yano, Shigetoshi; Mukasa, Akitake",Takemoto,"Dural arteriovenous fistula (dAVF) associated with an intracranial tumor is a relatively rare condition. Furthermore, to our knowledge, this is the first case report of dAVF associated with intratumor hemorrhage. We experienced this very rare case and report it here, along with a literature review. A 59-year-old woman presented with transient aphasia and dysgraphia. Computed tomography, magnetic resonance imaging, and angiography showed left anterior cranial fossa dAVF and a tumor with an intratumor hemorrhage. Cerebral angiography demonstrated AV shunts from the left ethmoidal artery via cortical vein flow into the superior sagittal sinus. She underwent shunt-point extirpation for the dAVF and removal of the tumor. The histological finding indicated transitional meningioma. The patient was discharged without any neurological deficit. A dAVF with intratumor hemorrhage is very rare and may be due to the venous congestion of the tumor draining vein by venous hypertension caused by the dAVF.","DictElement({'Year': '2018', 'Month': '10', 'Day': '31'}, attributes={'DateType': 'Electronic'})",2018,Journal of clinical neuroscience : official journal of the Neurosurgical Society of Australasia,10.1016/j.jocn.2018.10.008,,Dural arteriovenous fistula; Meningioma; Tumoral hemorrhage; Venous congestion,Case Reports; Journal Article,Scotland,eng
25791367,Cortical relapses in multiple sclerosis.,"Puthenparampil, Marco; Poggiali, Davide; Causin, Francesco; Rolma, Giuseppe; Rinaldi, Francesca; Perini, Paola; Gallo, Paolo",Puthenparampil,"Multiple sclerosis (MS) is a white and grey matter disease of the central nervous system (CNS). It is recognized that cortical damage (i.e. focal lesions and atrophy) plays a role in determining the accumulation of physical and cognitive disability that is observed in patients with progressive MS. To date, an association of cortical lesions with clinical relapses has not been described. We report clinical and magnetic resonance imaging (MRI) findings of five relapsing-remitting MS (RRMS) patients who had clinical relapses characterized by the acute appearance of cortical symptoms, due to the development of large, snake-like, cortical inflammatory lesions. Symptoms were: acute Wernicke's aphasia mimicking stroke; agraphia with acalculia, not associated to a motor deficit nor linguistic disturbance; hyposthenia of the left arm, followed by muscle twitching of the hand, spreading to arm and face; acute onset of left lower limb paroxysmal hypertonia; and temporal lobe status epilepticus, with psychotic symptoms. Cortical relapses may occur in MS. MRI examination in MS should include sequences, such as double inversion recovery (DIR) or phase sensitive inversion recovery (PSIR), that are aimed at visualizing cortical lesions, especially in the presence of symptoms of cortical dysfunction. Our observation further stresses and extends the clinical relevance of cortical pathology in MS.","DictElement({'Year': '2015', 'Month': '03', 'Day': '19'}, attributes={'DateType': 'Electronic'})",2015,"Multiple sclerosis (Houndmills, Basingstoke, England)",10.1177/1352458514564483,,Case study; cortical lesions; grey matter; inversion recovery; magnetic resonance imaging; multiple sclerosis; relapse; relapse symptoms; relapsing–remitting multiple sclerosis,Case Reports; Journal Article,England,eng
15788252,Writing errors of a Cantonese dysgraphic patient and their theoretical implications.,"Law, Sam-Po",Law,"This paper reports a case study of a Cantonese-speaking dysgraphic patient. Among his written errors were phonologically plausible errors that were mostly homophonous or differed only in tone from their target. They occurred not only in writing-to-dictation but also in written naming. Since his lexico-semantic system is hypothesized to be largely preserved, as evidenced by normal performance on non-verbal semantic tests and word-picture matching, the presence of homophone and tonal errors strengthened previous claims about the existence of lexically mediated non-semantic pathway of writing Chinese and access from the phonological output lexicon to the orthographic output lexicon. In addition, his non-character responses, particularly those involving substitution of constituent(s), almost always maintained the configuration of their target. This observation implies that orthographic representations contain not only information on the identity of components but also structural information. The latter may, among other possibilities, take the form of a template indicating the internal organization of the character or specification for position of occurrence for each constituent within the character.",{},,Neurocase,10.1080/13554790409609944,,,"Case Reports; Journal Article; Research Support, Non-U.S. Gov't",England,eng
23916761,Agraphia caused by an infarction in Exner's area.,"Keller, Catharina; Meister, Ingo G",Keller,"Sigmund Exner postulated in 1881 that lesions of the base of the medial frontal gyrus could specifically produce writing impairments and attributed the writing centre to this area. We report two patients who suffered from strokes in this area. These patients suffered from writing disturbances comprising both omitted words within a sentence or badly written words, as well as aphasia. These patients, in line with prior reports, illustrate the crucial role of the Exner area at the base of the medial frontal gyrus for the cerebral writing network; we suggest that this region plays an important role for phoneme-grapheme conversions.","DictElement({'Year': '2013', 'Month': '07', 'Day': '31'}, attributes={'DateType': 'Electronic'})",2013,Journal of clinical neuroscience : official journal of the Neurosurgical Society of Australasia,10.1016/j.jocn.2013.01.014,,Agraphia; Exner’s area; Stroke,Case Reports; Journal Article,Scotland,eng
