pmid,title,authors,first_author,abstract,publication_date,publication_year,journal_info,doi,pmcid,keywords,article_type,country,language
22033119,Narcoleptic-like hypersomnia and inverted circadian rhythm of body core temperature after traumatic brain injury involving the hypothalamus.,"Pizza, Fabio; Vetrugno, Roberto; Antelmi, Elena; Pierangeli, Giulia; Montagna, Pasquale; Cortelli, Pietro",Pizza,,"DictElement({'Year': '2011', 'Month': '10', 'Day': '26'}, attributes={'DateType': 'Electronic'})",2011,Sleep medicine,10.1016/j.sleep.2011.06.013,,,Case Reports; Letter,Netherlands,eng
9430995,[Hallucination in opsoclonus-polymyoclonus syndrome].,"Fujimoto, Y; Isozaki, E; Ootake, T; Matsubara, S; Hirai, S",Fujimoto,"Here we report 2 cases of opsoclonus-polymyoclonus syndrome (OPS) associated with viral encephalitis. They had sleep disturbance, and visual hallucination. Case 1 had auditory hallucination in addition, and case 2 had dreamlike behavior. Those hallucination, which were colorful and vivid, usually appeared at the bed time. Their hallucinations were similar to peduncular hallucinations and you may also call hypnagogic hallucinations, which are often seen in patients with narcolepsy. Dreamlike behavior is observed during REM sleep in patients with brainstem damage or sometimes in the healthy elderly people. The presence of sleep disturbance, hypnagogic hallucination, and dreamlike behavior suggests that there may be some relationship between OPS and REM sleep. Considering that REM sleep is suppressed by serotonergic projection of the dorsal raphe nucleus in addition to several reports about brainstem lesion with serotonergic abnormalities in this disorder, we considered that dysfunction of serotonergic neurons of the dorsal raphe nucleus might be related in the development of OPS.",{},,Rinsho shinkeigaku = Clinical neurology,,,,Case Reports; English Abstract; Journal Article,Japan,jpn
2349416,[Sleep disorders from the neurological viewpoint].,"Henn, V",Henn,"Sleep can be measured by EEG or a monitor which records motor activity. In this way objective data on sleep behavior can be obtained from patients. Total sleep time over 24 hours remains remarkably constant above age 20. Therefore, any changes in total sleep time can be considered to be pathologic. A true shortening of sleep time is rare and is usually associated with a psychosis. More often ""common sleep disorders"" are encountered, which show a normal total sleep time per 24 hours. Prolonged sleep, usually associated with increased day-time somnolence, is often caused by chronic meningitis or intracranial space occupying lesions. Narcolepsy is a separate entity which has no connection with epilepsy, in which the different physiological components of sleep are desynchronized.",{},,Schweizerische Rundschau fur Medizin Praxis = Revue suisse de medecine Praxis,,,,Case Reports; English Abstract; Journal Article,Switzerland,ger
6132375,[Cataplectic falls disclosing hypercalcemia].,"Laurent, B; Chazot, G; Blanc, A; Setiey, A; Bard, J; Trillet, M; Schott, B",Laurent,"Clinical manifestations of hypercalcaemic encephalopathy were heralded in three patients by isolated cataplexy-like falls without loss of consciousness. In one patient the falls with global hypotonia occurred every 5 to 10 seconds and were unaccompanied by changes in E.E.G. The falls disappeared after hypercalcaemia was corrected by excision of a parathyroid adenoma in two patients and by calcitonin injections in one. For this reason, there is little doubt that they were due to the hypercalcaemia, but their mechanism is poorly understood; it probably involves metabolic disturbances in the reticular systems of the brain stem. The connections between calcium metabolism and neuromediators in the brain stem are discussed.",{},,"Presse medicale (Paris, France : 1983)",,,,Case Reports; English Abstract; Journal Article,France,fre
590883,A method for provoking EEG abnormalities by administration of nialamide.,"Tanio, M; Shimoda, Y",Tanio,"Nialamide, a kind of monoamine oxydase inhibitor, was used for provoking centrencephalic EEG abnormalities and 6-14 Hz positive spikes. It was assumed that these EEG abnormalities have close relationship with dysfunctions of the brainstem which is rich in monoamines and monoamine oxydase. The nialamide provocation was carried out on 49 inpatients who had centrencephalic discharges in their EEG reports. These patients consisted of four cases of epilepsy, one case of anorexia nervosa, two cases of narcolepsy and 42 cases of diencephalosis. Another series of 22 patients suffering from other diseases, in whome EEG no centrencephalic EEG abnormallities were detected, were examined with nialamide. Out of the 49 patients, 35 cases (71.4+) showed increased EEG abnormalities following the administration of nialamide. It was noteworthy that this drug had provocative effect not only for EEG abnormalities, but also for the symptoms from which patients were suffering. In 26 out of 49 patients, both EEG abnormalities and clinical symptoms were provoked by nialamide. And the nialamide administration resulted in negative on all 22 patients who did not register centrencephalic EEG abnormalities. The mechanism and characteristics of this provocative procedure by the use of nialamide were evaluated.",{},,Folia psychiatrica et neurologica japonica,10.1111/j.1440-1819.1977.tb02642.x,,,Case Reports; Journal Article,Japan,eng
