pmid,title,authors,first_author,abstract,publication_date,publication_year,journal_info,doi,pmcid,keywords,article_type,country,language
8033944,Right unilateral agraphia following callosal infarction in a left-hander.,"Tei, H; Soma, Y; Maruyama, S",Tei,"A left-handed Japanese man is reported who presented right-hand agraphia and tactile anomia following callosal infarction. Magnetic resonance imaging revealed an ischemic lesion extending from the posterior half of the trunk to the splenium of the corpus callosum. In his right handwriting, the 'Kana' (phonogram) was more severely impaired than the 'Kanji' (ideogram), and the most frequent typewriting error was morphological followed by neographism. His visuoconstructional ability was also more impaired in the right hand than in the left. Right-hand agraphia in our case is readily explained by the right hemisphere dominance both for language and visuoconstructional ability.",{},,European neurology,10.1159/000117032,,,Case Reports; Journal Article,Switzerland,eng
24674964,Peripheral dysgraphia: dissociations of lowercase from uppercase letters and of print from cursive writing.,"Ingles, Janet L; Fisk, John D; Fleetwood, Ian; Burrell, Steven; Darvesh, Sultan",Ingles,"Clinical analyses of patients with acquired dysgraphia provide unique opportunities to understand the cognitive and neural organization of written language production. We report J.B., a 50-year-old woman with peripheral dysgraphia who had prominent dissociations in her ability to write in lowercase versus uppercase and print versus cursive. We gave J.B. a series of tasks that evaluated her skills at writing uppercase and lowercase print and cursive, spelling aloud and in writing, writing numbers and symbols, and visual letter recognition and imagery. She was impaired in printing letters, with lowercase more affected than uppercase, but her cursive writing was relatively intact. This pattern was consistent across letter, word, and nonword writing tasks. She was unimpaired on tasks assessing her visual recognition and imagery of lowercase and uppercase letters. Her writing of numbers was preserved. J.B.'s handwriting disorder was accompanied by a central phonological dysgraphia. Our findings indicate functional independence of graphomotor programs for print and cursive letter styles and for letters and numbers. We discuss the relationship between peripheral and central writing disorders.",{},,Cognitive and behavioral neurology : official journal of the Society for Behavioral and Cognitive Neurology,10.1097/WNN.0000000000000022,,,Case Reports; Journal Article,United States,eng
20714962,Unilateral paresthesia after isolated infarct of the splenium: case report.,"Chang, Tzu-Pu; Huang, Ching-Feng",Chang,"We describe a patient who presented with unilateral paresthesia after acute isolated infarct of the splenium. A 74-year-old woman presented with acute onset of right sided numbness and tingling. MR imaging of the brain showed hypointensity on T1-weighted images and on apparent diffusion coefficient maps, and hyperintensity on T2-weighted and on diffusion-weighted images in the splenium, suggestive of acute infarction. MR angiography showed narrowing of left posterior cerebral artery with decreased branches. On detailed high cortical function assessment, she did not have frontal lobe dysfunction, alien hand syndrome, apraxia, optic ataxia, cortical sensation dysfunction, alexia, agraphia, visual field defect, nor color agnosia. Infarcts of the splenium are not common. Splenial lesion may be associated with altered mental status, ataxia, recent seizure, hemispheric disconnection, and dysarthria. The presentation of isolated unilateral paresthesia makes the patient different from those previously described. The paresthesia could be caused by selective lacunar infarcts in the diencephalic and mesencephalic regions or could be caused by the diaschisis in the parietal cortex. Single photon emission CT may be indicated to provide further information of central nervous system dysfunction in splenial lesion.",{},,Acta neurologica Taiwanica,,,,Case Reports; Journal Article,China (Republic : 1949- ),eng
15788250,The categorical distinction of vowel and consonant representations: evidence from dysgraphia.,"Miceli, Gabriele; Capasso, Rita; Benvegnù, Barbara; Caramazza, Alfonso",Miceli,"Subject GSI presents with a graphemic buffer deficit following a massive left fronto-parietal lesion. His errors involved essentially only consonants (98.2%). However, he always spelled correctly the first consonant in a string, and produced steadily increasing numbers of errors on the following consonants, while always spelling all the vowels in the target correctly. The pattern of performance observed in this subject provides strong evidence for the separate (categorical) representation of consonants and vowels, and suggests that working memory interacts with independent consonant and vowel representations in spelling.",{},,Neurocase,10.1080/13554790409609942,,,"Case Reports; Journal Article; Research Support, Non-U.S. Gov't; Research Support, U.S. Gov't, P.H.S.",England,eng
20798952,Pure alexia caused by separate lesions of the splenium and optic radiation.,"Maeshima, Shinichiro; Osawa, Aiko; Sujino, Keisuke; Fukuoka, Takuya; Deguchi, Ichiro; Tanahashi, Norio",Maeshima,Pure alexia is severe difficulty in reading and understanding written language but with normal oral language and writing abilities. We report a patient with pure alexia caused by two different infarct lesions in the left lateral thalamus and the left splenium of the corpus callosum. A 56-year-old right-handed man was admitted to hospital with right homonymous hemianopia associated with pure alexia. He could write kana characters but not kanji. His cranial magnetic resonance imaging revealed two different infarct lesions in the left optic radiation and the left splenium of the corpus callosum. Magnetic resonance angiography showed mild stenosis at the origin of the right vertebral artery and stenosis of the left distal posterior cerebral artery. The mechanism of developing pure alexia can be simply explained by disconnection. We assumed that agraphia of kanji was caused by the effect of ischemia and edema following transient obstruction in branches from the distal posterior cerebral artery.,"DictElement({'Year': '2010', 'Month': '08', 'Day': '27'}, attributes={'DateType': 'Electronic'})",2010,Journal of neurology,10.1007/s00415-010-5723-0,,,Case Reports; Journal Article,Germany,eng
588095,Posttraumatic cerebral hemispheric disconnection syndrome.,"Rubens, A B; Geschwind, N; Mahowald, M W; Mastri, A",Rubens,"Gross and microscopic lesions of the corpus callosum and neighboring structures are common in severe closed head injury. This report is the first, to our knowledge, to confirm neuropathologically the occurrence of extensive traumatic destruction of the corpus callosum in a patient with left-sided apraxia and agraphia. It also demonstrates that large traumatic lesions of the corpus callosum may occur without prolonged posttraumatic coma, vegetative state, or death. In our patient, coexisting extracallosal hemispheric lesions may have modified the effects of callosal pathology. Cases of this type may be more common than generally appreciated, but since symptoms of hemispheric disconnection are not apparent in ordinary behavior, specific tests of callosal function must be employed if disconnection phenomena are to be detected in the posttraumatic period.",{},,Archives of neurology,10.1001/archneur.1977.00500240038006,,,"Case Reports; Journal Article; Research Support, U.S. Gov't, P.H.S.",United States,eng
6850277,Alexia without agraphia in a composer.,"Judd, T; Gardner, H; Geschwind, N",Judd,"A 77-year-old composer had a left occipital lobe haemorrhagic infarct giving a severe reading disturbance with well-preserved writing and without appreciable aphasia. He continued to read music and to compose. His text- and music-reading performance under different conditions suggests that this unusual dissociation was primarily due to four factors. (1) He was unusually talented musically and inferred a great deal about the music he was reading. (2) The symbols of staff music notation are more visually distinctive than the symbols of phonetic language writing systems. (3) In staff music notation, pitch is represented ordinally, and other symbols are also distinguishable by their relative positions and sizes. (4) Music notation can be usefully read by interpreting it acoustically, kinaesthetically or in terms of formal musical concepts; in contrast to written language, it need not be interpreted referentially or in terms of auditory-verbal images. His disorder fits the classic visual-verbal disconnection account of alexia without agraphia and the contemporary view that music involves a family of related but distinct skills probably involving many brain areas in both hemispheres, although different cortical areas make characteristic contributions to different musical behaviours.",{},,Brain : a journal of neurology,10.1093/brain/106.2.435,,,"Case Reports; Journal Article; Research Support, Non-U.S. Gov't; Research Support, U.S. Gov't, P.H.S.",England,eng
29681826,Frontal Phonological Agraphia and Acalculia with Impaired Verbal Short-Term Memory due to Left Inferior Precentral Gyrus Lesion.,"Sakurai, Yasuhisa; Furukawa, Emi; Kurihara, Masanori; Sugimoto, Izumi",Sakurai,"We report a patient with phonological agraphia (selective impairment of kana [Japanese phonetic writing] nonwords) and acalculia (mental arithmetic difficulties) with impaired verbal short-term memory after a cerebral hemorrhage in the opercular part of the left precentral gyrus (Brodmann area 6) and the adjacent postcentral gyrus. The patient showed phonemic paragraphia in five-character kana nonword writing, minimal acalculia, and reduced digit and letter span. Mental arithmetic normalized after 8 months and agraphia recovered to the normal range at 1 year after onset, in parallel with an improvement of the auditory letter span score from 4 to 6 over a period of 14 months and in the digit span score from 6 to 7 over 24 months. These results suggest a close relationship between the recovery of agraphia and acalculia and the improvement of verbal short-term memory. The present case also suggests that the opercular part of the precentral gyrus constitutes the phonological route in writing that conveys phonological information of syllable sequences, and its damage causes phonological agraphia and acalculia with reduced verbal short-term memory.","DictElement({'Year': '2018', 'Month': '03', 'Day': '14'}, attributes={'DateType': 'Electronic'})",2018,Case reports in neurology,10.1159/000487849,PMC5903121,Acalculia; Frontal pure agraphia; Phonological agraphia; Verbal short-term memory; Working memory,Case Reports,Switzerland,eng
25489886,Progressive Wallerian Degeneration of the Corpus Callosal Splenium in a Patient with Alexia Without Agraphia: Advanced MR Findings.,"Gandhi, Kriti; Gillihan, Laura; Wozniak, Marcella A; Zhuo, Jiachen; Raghavan, Prashant",Gandhi,"The corpus callosal splenium is an uncommon location for Wallerian degeneration (WD), which may be mistaken for new pathology on magnetic resonance imaging (MRI). We describe the case of a 69-year-old woman with a left posterior cerebral artery infarct in whom progressive WD of the splenium of the corpus callosum seen on MRI was misinterpreted as new infarction or neoplasm. We address how magnetic resonance spectroscopy, perfusion MRI, diffusion tensor MRI, and serial imaging were utilized in establishing the correct diagnosis. Interestingly, the patient also presented with alexia without agraphia, which has never been reported in association with splenial WD. It is conceivable that WD affected critical splenial association fibers resulting in this uncommon dissociation syndrome.","DictElement({'Year': '2014', 'Month': '12', 'Day': '01'}, attributes={'DateType': 'Electronic'})",2014,The neuroradiology journal,10.15274/NRJ-2014-10097,PMC4291795,MR imaging; Wallerian degeneration; magnetic resonance spectroscopy; neuroradiology; stroke,Case Reports; Journal Article,United States,eng
7139266,Deep agraphia.,"Bub, D; Kertesz, A",Bub,,{},,Brain and language,10.1016/0093-934x(82)90011-6,,,Case Reports; Journal Article,Netherlands,eng
6618865,"Pure ""aphasic"" agraphia due to damage of the left superior parietal lobule.","Paolino, E; De Bastiani, P; Monetti, V C; Boldrini, P; Rosati, G",Paolino,"A case of pure agraphia, due to an ischaemic lesion of the left superior parietal lobule, is reported. The neuropsychological analysis of writing performances suggests an aphasic nature of this patient's pure agraphia. The authors discuss the role played by diffuse and/or localized brain lesions in writing function, emphasizing that the left superior parietal lobule in man may be crucial for the sensorimotor linguistic integration needed for writing.",{},,Italian journal of neurological sciences,10.1007/BF02043913,,,Case Reports; Journal Article,Italy,eng
15788255,The crucial role of posterior frontal regions in modality specific components of the spelling process.,"Hillis, Argye E; Chang, Shannon; Breese, Elisabeth; Heidler, Jennifer",Hillis,"Although it is commonly assumed that posterior temporo-parietal regions are the regions of the brain essential for accessing orthographic representations for written output, patients with lesions in these areas also have reading and/or naming impairments at least early after stroke onset. This observation raises the possibility that these regions are important for components of spelling that are not specific to written output. The goal of the present study was to identify any regions of the brain that, when damaged, result in selective impairment in accessing orthographic representations for written output. We studied 54 consecutive right-handed patients with acute, left hemisphere ischemic stroke, who were barely able to perform the motor aspects of writing with the right hand and had at least 10th grade education, on a battery of lexical tasks designed to identify impaired and spared cognitive processes underlying spelling and with advanced magnetic resonance imaging. Only five patients had pure agraphia, and had evidence of impaired access to lexical-orthographic representations for output; and all five had infarct or ischemia in Brodmann's area 44 and 45. Analysis of performance across tasks of three of these patients, whose performance has not been previously reported, provides evidence for additional impairment in converting graphemes to letter shapes or letter-specific motor programs. These three patients, unlike previously reported patients with lexical-orthographic impairment and compromised function in Brodmann's area 44 and 45, also had infarcts in Brodmann's area 6. On the basis of these cases, and those in the literature, we propose a network of brain regions involved in writing words, each with a separate function. This proposal emphasizes the role of the left posterior frontal regions in modality-specific output processes.",{},,Neurocase,10.1080/13554790409609947,,,"Case Reports; Clinical Trial; Journal Article; Research Support, U.S. Gov't, P.H.S.",England,eng
22392754,[Relapsing polychondritis presenting as encephalitis].,"Fujiwara, Satoshi; Zenke, Kiichiro; Iwata, Shinji; Shouda, Daisuke; Suehiro, Satoshi; Kawano, Yuji",Fujiwara,"Relapsing polychondritis (RP) is a rare, generalized autoimmune disorder that is characterized by recurrent inflammation of various cartilaginous structures. Involvement of the central nervous system is rarely observed in RP. Here we report a case of encephalitis associated with RP. A 60-year-old man presented with headache and bilateral ear swelling. Three weeks later, he came to our hospital because of the acute onset of a speech impediment. A non-contrast computed tomography scan of the head showed slight high-density areas in his left frontal lobe, but he refused to be admitted and went home. On the next day, he developed acalculia, agraphia, right-left disorientation, and mild right hemiparesis. Brain MRI revealed hyperintensity areas in the left frontal sulcus on fluid-attenuated inversion recovery (FLAIR) images, and these hyperintensity areas were enhanced by gadolinium. Therefore, the patient's symptoms were diagnosed as focal epilepsy caused by meningoencephalitis. Other examinations, including laboratory blood tests, cerebrospinal fluid tests, and a cerebral angiography, were all negative. Therefore, a brain biopsy of the left frontal cortex was performed 5 days after the patient's admission. Pathological findings revealed chronic inflammation of the meninges, so prednisone was administered. After receiving oral prednisone, the patient's bilateral ear swelling dramatically improved and the lesions apparent on cranial MRI gradually subsided. The patient was diagnosed with RP by a neurologist after discharge from the hospital. In this study, early diagnosis and steroid treatment is recommended for patients with neurological complications due to RP.",{},,No shinkei geka. Neurological surgery,,,,Case Reports; English Abstract; Journal Article,Japan,jpn
2184966,[Motor amusia following a right temporal lobe hemorrhage--a case report].,"Takeda, K; Bandou, M; Nishimura, Y",Takeda,"A 65-year-old female was admitted to our hospital because of left hemiparesis with sudden onset one week before. She was congenitally right-handed. She had been a teacher of Japanese string instrument (samisen) playing and been able to sing Japanese traditional songs well. A tape on which she had recorded her songs one year before the admission also proved her to be a good singer. Neurological examination on admission revealed almost normal findings except for minimal weakness in her left hand fingers. Right temporal lobe hemorrhage was revealed by CT scan. One month after the admission, she complained that she was unable to sing her songs and to play samisen as she used to do. Her intelligence was normal (WAIS VIQ116, PIQ108) and there were no abnormal findings as follows: aprosodia, aphasia, agraphia, memory disturbance, agnosia and ideational, ideomotor, constructional or limb-kinetic apraxia. She could point out her errors while singing. However, musical receptive function was slightly disturbed with tonal memory in Seashore test. When she was asked to sing a song without any instrumental support, she hummed a melody occasionally with wrong pitch, but rhythmically. After hearing a song she knew well, she reproduced it with slight improvement. With the vocal or the instrumental accompaniment, she could sing fairly well. She had some mistakes of pitch while playing a samisen. MRI was performed one year and a half after the brain hemorrhage. It displayed a thin linear of hematoma in the white matter of the right upper temporal and transverse gyrus. It was proved in our case that motor amusia with minimal musical receptive dysfunction could appear following a cerebral lesion and musical function might be independent of intelligence or verbal function.",{},,Rinsho shinkeigaku = Clinical neurology,,,,Case Reports; English Abstract; Journal Article; Review,Japan,jpn
9642020,Selective kana jargonagraphia following right hemispheric infarction.,"Hashimoto, R; Tanaka, Y; Yoshida, M",Hashimoto,"A strongly right-handed Japanese man showed an unusual writing disorder associated with Broca-type aphasia after suffering a right hemispheric infarction. Writing with his right hand produced a fluent output in contrast to his nonfluent speech. The patient's agraphia disproportionately affected the writing of kana (Japanese syllabograms), leaving relatively intact the writing of kanji (Japanese ideograms). His kana agraphia, consisting of substitutions, intrusions, transpositions, and deletions, became apparent as the number of syllables in target words increased. Quantitative analysis of the substitutions in terms of their phonological similarity to the target revealed that most of the substitutions were phonologically dissimilar. Those errors were distributed almost identically for familiar and novel words. Moreover, the errors were observed asymmetrically across the target: more errors occurred near the end than at the beginning of a word. The kana agraphia in association with fluent writing output resulted in kana jargonagraphia. These observations suggest that our patient's selective kana jargonagraphia is best explained by selective damage to the hypothesized kana graphemic buffer and by disinhibition of the motor engrams of writing behavior, both of which resulted from right hemispheric damage.",{},,Brain and language,10.1006/brln.1997.1865,,,Case Reports; Journal Article,Netherlands,eng
7805390,Pure dysgraphia with relative sparing of lower-case writing.,"Trojano, L; Chiacchio, L",Trojano,"We describe the cognitive analysis of a patient with acquired pure dysgraphia. She presented a peculiar dissociation between lower- and upper-case handwriting: lower-case writing was relatively spared and showed a significant superiority of words versus nonwords. Upper-case writing and oral spelling did not show lexical effects, but were affected by item length. In all modalities errors consisted mainly of single graphemic substitutions, deletions, insertions and transpositions, resulting in legal or illegal nonwords, and showed a similar distribution across letter positions. These findings were suggestive of an impairment of the graphemic output buffer, which however revealed itself to different degrees in the two handwriting styles.",{},,Cortex; a journal devoted to the study of the nervous system and behavior,10.1016/s0010-9452(13)80345-0,,,Case Reports; Journal Article,Italy,eng
22713390,Allographic agraphia for single letters.,"Menichelli, Alina; Machetta, Francesca; Zadini, Antonella; Semenza, Carlo",Menichelli,"The case is reported of a patient (PS) who, following acute encephalitis with residual occipito-temporal damage, showed a selective deficit in writing cursive letters in isolation, but no difficulty to write cursive-case words and non-words. Notably, he was able to recognize the same allographs he could not write and to produce both single letters and words in print. In addition to this selective single letter writing difficulty, the patient demonstrated an inability to correctly perform a series of imagery tasks for cursive letters. PS's performance may indicate that single letter production requires explicit imagery. Explicit imagery may not be required, instead, when letters have to be produced in the context of a word: letter production in this case may rely on implicit retrieval of well learned scripts in a procedural way.",{},,Behavioural neurology,10.3233/BEN-2012-119008,PMC5294232,,Case Reports; Journal Article,Netherlands,eng
16712882,Prism adaptation improves spatial dysgraphia following right brain damage.,"Rode, G; Pisella, L; Marsal, L; Mercier, S; Rossetti, Y; Boisson, D",Rode,"Visuo-manual adaptation to prisms produces a long-lasting improvement of visuo-spatial neglect. Improvement is also observed in tasks that do not involve visuo-manual component and that can all be consider to rely on a rightward (ipsilesional) orienting bias. Here, we report positive effects of prism adaptation on spatial dysgraphia, in a neglect patient following right brain damage. A long-lasting improvement concerned the right-page preference reflecting the ipsilesional bias but also the sloping lines and the broken lines reflecting visuo-constructive disorders in handwriting. Moreover, a transient improvement was also evidenced for the graphic errors. These results reinforce the idea that the process of prism adaptation may activate brain functions related to multisensory integration and higher spatial representations and show a generalization at a functional level. Prism adaptation therefore appears as useful tool in the theoretical attempt to identify the underlying 'core' mechanisms of the neglect syndrome.","DictElement({'Year': '2006', 'Month': '05', 'Day': '18'}, attributes={'DateType': 'Electronic'})",2006,Neuropsychologia,10.1016/j.neuropsychologia.2006.04.002,,,"Case Reports; Comparative Study; Journal Article; Research Support, Non-U.S. Gov't",England,eng
7745416,"Agraphia and acalculia after a left prefrontal (F1, F2) infarction.","Tohgi, H; Saitoh, K; Takahashi, S; Takahashi, H; Utsugisawa, K; Yonezawa, H; Hatano, K; Sasaki, T",Tohgi,"A patient presented with agraphia and acalculia associated with a left frontal (F1, F2) infarction. He made mainly phonological but also lexical errors in writing (syllabograms), but his ability to write kanji (morphograms) was relatively preserved. Although he could add and subtract numbers, he could neither multiply nor divide them because of a difficulty in retrieving the multiplication tables and calculation procedures. Positron emission tomography showed decreased cerebral blood flow and metabolism limited to the infarct site. These findings suggest that agraphia and acalculia may occur associated with a left prefrontal lesion, and that the retrieval of arithmetic processes is modality specific.",{},,"Journal of neurology, neurosurgery, and psychiatry",10.1136/jnnp.58.5.629,PMC1073499,,Case Reports; Journal Article,England,eng
