pmid,title,authors,first_author,abstract,publication_date,publication_year,journal_info,doi,pmcid,keywords,article_type,country,language
35907972,"Inositol 1,4,5-trisphosphate receptor type 1 autoantibody (ITPR1-IgG/anti-Sj)-associated autoimmune cerebellar ataxia, encephalitis and peripheral neuropathy: review of the literature.","Jarius, Sven; Bräuninger, Stefan; Chung, Ha-Yeun; Geis, Christian; Haas, Jürgen; Komorowski, Lars; Wildemann, Brigitte; Roth, Christian",Jarius,"In 2014, we first described novel autoantibodies to the inositol 1,4,5-trisphosphate receptor type 1 (ITPR1-IgG/anti-Sj) in patients with autoimmune cerebellar ataxia (ACA) in this journal. Here, we provide a review of the available literature on ITPR1-IgG/anti-Sj, covering clinical and paraclinical presentation, tumour association, serological findings, and immunopathogenesis. Review of the peer-reviewed and PubMed-listed English language literature on ITPR1-IgG/anti-Sj. In addition, we provide an illustrative report on a new patient with ITPR1-IgG-associated encephalitis with cognitive decline and psychosis. So far, at least 31 patients with serum ITPR1-IgG/anti-Sj have been identified (clinical information available for 21). The most common manifestations were ACA, encephalopathy with seizures, myelopathy, and (radiculo)neuropathy, including autonomic neuropathy. In 45% of cases, an underlying tumour was present, making the condition a facultative paraneoplastic neurological disorder. The neurological syndrome preceded tumour diagnosis in all but one case. In most cases, immunotherapy had only moderate or no effect. The association of ITPR1-IgG/anti-Sj with manifestations other than ACA is corroborated by the case of a 48-year-old woman with high-titre ITPR1-IgG/anti-Sj antibodies and rapid cognitive decline, affecting memory, attention and executive function, and psychotic manifestations, including hallucinations, investigated here in detail. FDG-PET revealed right-temporal glucose hypermetabolism compatible with limbic encephalitis. Interestingly, ITPR1-IgG/anti-Sj mainly belonged to the IgG2 subclass in both serum and cerebrospinal fluid (CSF) in this and further patients, while it was predominantly IgG1 in other patients, including those with more severe outcome, and remained detectable over the entire course of disease. Immunotherapy with intravenous methylprednisolone, plasma exchange, and intravenous immunoglobulins, was repeatedly followed by partial or complete recovery. Long-term treatment with cyclophosphamide was paralleled by relative stabilization, although the patient noted clinical worsening at the end of each treatment cycle. The spectrum of neurological manifestations associated with ITPR1 autoimmunity is broader than initially thought. Immunotherapy may be effective in some cases. Studies evaluating the frequency of ITPR1-IgG/anti-Sj in patients with cognitive decline and/or psychosis of unknown aetiology are warranted. Tumour screening is essential in patients presenting with ITPR1-IgG/anti-Sj.","DictElement({'Year': '2022', 'Month': '07', 'Day': '30'}, attributes={'DateType': 'Electronic'})",2022,Journal of neuroinflammation,10.1186/s12974-022-02545-4,PMC9338677,"Anti-Sj; Anti-neuronal autoantibodies; Autoimmune encephalitis; Cancer; Cerebellar ataxia; Cognitive decline; Dementia; IP3R1; Inositol 1,4,5-trisphosphate receptor type 1 antibodies (ITPR1-IgG); InsP3R1; Limbic encephalitis; Medusa head ataxia; Paraneoplastic neurological syndromes; Polyneuropathy; Purkinje cell antibodies",Case Reports; Journal Article; Review,England,eng
24419643,Cerebellar ataxia and epilepsy with anti-GAD antibodies: treatment with IVIG and plasmapheresis.,"Georgieva, Zoya; Parton, Matthew",Georgieva,"Glutamic acid decarboxylase autoantibody (GAD-65) catalyses glutamate conversion into γ-aminobutyric acid (GABA) in the central nervous system and in the pancreatic β cells. Antibodies targeting GAD-65 are of uncertain pathogenic significance and occur in stiff person syndrome, cerebellar ataxia, epilepsy, limbic encephalitis and combinations thereof and diabetes mellitus. A 45-year-old man with a cerebellar gait ataxia, dysmetria, nystagmus and mild cerebellar dysarthria was diagnosed with insulin-dependent diabetes mellitus a year after the onset of neurological symptoms. He also developed complex and tonic-clonic seizures, resistant to anticonvulsant medication and deteriorated cognitively. Blood and cerebrospinal fluid serology, and imaging supported the diagnosis of GAD-65 cerebellar ataxia and epilepsy. He was treated with intravenous immunoglobulin and subsequently plasmapheresis. We report the outcome of 3 years of treatment, which resulted in the improvement of cerebellar signs (particularly gait), with some ultimate decline of efficacy.","DictElement({'Year': '2014', 'Month': '01', 'Day': '13'}, attributes={'DateType': 'Electronic'})",2014,BMJ case reports,10.1136/bcr-2013-202314,PMC3902583,,Case Reports; Journal Article,England,eng
26883351,Pupil-sparing third nerve palsies and hemiataxia: Claude's and reverse Claude's syndrome.,"Bateman, James R; Murty, Pavan; Forbes, Michael; Collier, Kisha Young; Tememe, Danoushka; Marchena, Octavio de; Powers, William J",Bateman,"We report two patients with midbrain infarction with pupil-sparing third nerve palsies and hemiataxia: one with contralateral ataxia (Claude's syndrome) and one with ipsilateral ataxia (which we refer to as reverse Claude's syndrome). We highlight the importance of a thorough neurologic evaluation with partial oculomotor palsies and describe, to our knowledge, the fourth account in the literature of a pupil-sparing third nerve palsy with ipsilateral cerebellar ataxia.","DictElement({'Year': '2016', 'Month': '02', 'Day': '13'}, attributes={'DateType': 'Electronic'})",2016,Journal of clinical neuroscience : official journal of the Neurosurgical Society of Australasia,10.1016/j.jocn.2015.12.010,,Cerebellar ataxia; Claude’s syndrome; Midbrain infarction; Oculomotor nerve palsy,Case Reports; Journal Article,Scotland,eng
30442451,Vertebrobasilar dolichoectasia presenting simultaneously with ischemic and hemorrhagic strokes.,"Chakraborty, Tia; Lanzino, Giuseppe; Flemming, Kelly D",Chakraborty,"Vertebrobasilar dolichoectasia (VBDE) can present with brainstem- compressive symptoms, cerebral ischemia, or hemorrhage. Herein we describe a unique patient with VBDE who presented with hemorrhage and cerebral ischemia simultaneously. Patient is a 76-year-old man presenting with an acute, symptomatic left pontine ischemic stroke heralded by ataxic dysarthria and right ataxic-hemiparesis. MRI scan of the brain demonstrated acute cerebral ischemia in the left pons, a small right thalamic hemorrhage, and evidence of VBDE. The perforating vessels branching off of the pathologic VBDE may result in both ischemia and hemorrhage. This is the first known case, to our knowledge, in which hemorrhage and cerebral ischemia occurred simultaneously.","DictElement({'Year': '2018', 'Month': '11', 'Day': '12'}, attributes={'DateType': 'Electronic'})",2018,Journal of clinical neuroscience : official journal of the Neurosurgical Society of Australasia,10.1016/j.jocn.2018.10.092,,Fusiform aneurysm; Intracerebral hemorrhage; Ischemic stroke; Magnetic resonance imaging; Vertebrobasilar dolichoectasia,Case Reports; Journal Article,Scotland,eng
16769938,Caudal paramedian midbrain syndrome.,"Mossuto-Agatiello, Luigi",Mossuto-Agatiello,"Caudal midbrain lesions involving the entire decussation of the superior cerebellar peduncles have a distinctive clinical picture: bilateral cerebellar ataxia, eye-movement disorders, and palatal myoclonus. Occasionally, unilateral lesions may produce a similar neurologic picture. To define the clinical and radiologic picture of patients with unilateral lower midbrain ischemic lesions of the decussation of the brachium conjunctivum. Five patients with MRI evidence of unilateral paramedian caudal midbrain infarction were investigated, after the acute stage. All patients had bilateral cerebellar dysfunction characterized by dysarthric speech, truncal and gait ataxia, and dysmetric movements of the limbs, which were more pronounced on one side. Ocular movement abnormalities were observed in three cases. A constant MRI finding was a bilateral inferior olivary degeneration, but only one patient displayed a delayed palatal tremor. A single strategically placed unilateral lesion can cause bilateral dysfunction. In addition, a bilateral cerebellar syndrome can occur with unilateral lesions in the lower midbrain with a wide range of other clinical features.",{},,Neurology,10.1212/01.wnl.0000218180.03127.11,,,Case Reports; Journal Article,United States,eng
21960579,Crossed ataxia: a case report and a diffusion tensor imaging tractography study.,"Bally, Julien; Mégevand, Pierre; Nguyen, Duy; Landis, Theodor; Granziera, Cristina",Bally,"Ever since the seminal description of ataxic hemiparesis contralateral to a pontine lesion by Miller-Fisher, the question of why contralesional crossing pontocerebellar fibers do not more frequently produce ipsilesional hemiataxia was raised. The few cases of ""quadrataxic hemiparesis"" or bilateral leg ataxia remain exceptions. We report an even more unusual variant, namely ""crossed ataxia"" of the contralesional arm and the ipsilesional leg subsequent to an anteromedial pontine ischemic stroke. MRI diffusion tensor imaging tractography shows that caudal contralesional crossing pontocerebellar fibers (those for the leg) travel trough the lesion, whereas more rostral fibers (those for the arm) are spared.","DictElement({'Year': '2011', 'Month': '09', 'Day': '29'}, attributes={'DateType': 'Electronic'})",2011,Stroke,10.1161/STROKEAHA.111.623553,,,"Case Reports; Letter; Research Support, Non-U.S. Gov't",United States,eng
30468487,Subacute cerebellar ataxia as presenting symptom of systemic lupus erythematosus.,"Casciato, S; Mascia, A; Quarato, P P; D'Aniello, A; Scoppetta, C; Di Gennaro, G",Casciato,"Neuropsychiatric manifestations are commonly observed in systemic lupus erythematosus (SLE) patients. In particular, neurological involvement is known to be more common in patients with positive anticardiolipin antibodies and lupus anticoagulants. Nevertheless, cerebellar ataxia has rarely been reported, especially as the first clinical manifestation of this systemic autoimmune disorder. Cerebral vascular infarction or ischemia, vasogenic oedema and antibody-mediated cerebral vasculopathy or vasculitic process have been supposed as possible aetiologies of acute cerebellar ataxia related to SLE. We report the clinical and radiological features of a woman who developed a rapidly progressive cerebellar syndrome as first sign of SLE; no other cause explaining her cerebellar ataxia was found. The patient improved after high-dose steroids. The appearance of a cerebellar syndrome with unknown aetiology with associated features of possible systemic autoimmune dysfunction, should be taken into account in clinical practice for appropriate diagnostic workup in order to provide effective therapeutic options.",{},,European review for medical and pharmacological sciences,10.26355/eurrev_201811_16279,,,Case Reports; Journal Article,Italy,eng
37963666,Amantadine withdrawal in a patient with spinocerebellar ataxia.,"Pak, Andrew; Chang, Emiley",Pak,"We report a case of a man with spinocerebellar ataxia (SCA) on high-dose amantadine who was admitted for acute on chronic dysphagia secondary to progression of SCA. Four days after oral medications were held due to patient's dysphagia, he developed fever, tachycardia and mild rigidity in extremities and became obtunded. Despite antibiotics treatment, the vitals and mental status changes persisted for 8 days. When amantadine was resumed, the patient's vital signs and encephalopathy improved within 2 days. This is among the first reports of amantadine withdrawal syndrome (AWS) in a patient without Parkinson's disease. Our case reinforces the importance of careful medication review at admission and consideration of pharmacologic side effects with not only medication initiation but also discontinuation.","DictElement({'Year': '2023', 'Month': '11', 'Day': '14'}, attributes={'DateType': 'Electronic'})",2023,BMJ case reports,10.1136/bcr-2023-256840,PMC10649376,Brain stem / cerebellum; Geriatric medicine; Movement disorders (other than Parkinsons); Neurology (drugs and medicines),Case Reports; Journal Article,England,eng
19404108,Cavernous hemangioma of the mesencephalon: tonsillouveal transaqueductal approach.,"Dammers, Ruben; Delwel, Ernst J; Krisht, Ali F",Dammers,"Recent advances in microsurgical techniques facilitate surgical resection of brainstem lesions that were previously considered inoperable. In this article we present, for the first time, the tonsillouveal transaqueductal approach to access a progressively symptomatic cavernoma within the depth of the tegmentum of the mesencephalon. A 52-year-old woman presented with a history of slowly progressive right-sided hemiparesis and ataxia. On magnetic resonance imaging, a relatively large cavernoma involving the tegmentum of the mesencephalon was shown. The sylvian aqueduct was patent and there was no secondary ventriculomegaly. The patient underwent surgery via a suboccipital craniotomy and C1 laminectomy. The right tonsillouveal and medullotonsillar spaces were opened to the level of the choroidal point of the posteroinferior cerebellar artery. The tela choroidea was incised from the foramen of Magendie to the telovelar junction. Looking through the aqueduct and at a point 5 mm superior to its inferior inlet, there was a small cherry-like blister protruding into the aqueductal anterior surface. This was used as an entry point to access the cavernoma. The space around the cavernoma was gently dissected and the cavernoma was circumferentially coagulated to shrink it in a concentric manner toward its center. The total removal of the lesion was achieved and the histopathological findings were consistent with a cavernoma. As a result of noncommunicating hydrocephalus, the patient needed a ventriculoperitoneal shunt. The 1-year postoperative neurological examination was consistent with preoperative findings. This report shows, for the first time, direct surgical removal of a cavernous hemangioma in the mesencephalic tegmentum via the aqueduct. This approach adds to contemporary microneurosurgery, respecting functional anatomy and minimizing neurological deficits.",{},,Neurosurgery,10.1227/01.NEU.0000341530.36757.20,,,Case Reports; Journal Article,United States,eng
34507433,Acute Cerebellar Ataxia as the Presenting Symptom of Progressive Multifocal Leukoencephalopathy with HIV - A Case Report.,"Singh, Th Suraj; Singh, Kuldeep",Singh,A 45-year-old man presented with acute onset ataxia for last 1 week. On examination he had signs of left-sided cerebellar involement. MRI brain revealed asymmetric altered signal intensities in bilateral cerebellar hemispheres suggesting demyelinating lesions. ELISA for Human Immune Deficiency virus-1 was positive. CSF JC virus DNA PCR was positive. A diagnosis of Progressive Multifocal Leukoencephalopathy (PML) was made on the basis of clinico-radiological picture and JC virus DNA PCR presence in CSF. PML is unknown and under diagnosed CNS infection seen in HIV patients mostly seen with advanced disease. We present an unusual case report where isolated cerebellar involvement occurred as the first AIDS defining event in the absence of appreciable immunodeficiency in a patient with previously undiagnosed HIV infection.,{},,Neurology India,10.4103/0028-3886.325348,,Cerebellar ataxia; HIV; JC virus; progressive multifocal encephalopathy,Case Reports,India,eng
3945982,Hypesthetic-ataxic-hemiparesis in thalamic hemorrhage.,"Verma, A K; Maheshwari, M C",Verma,Acute onset hypesthetic-ataxic-hemiparesis is described in two hypertensive patients. Computed tomography (CT) showed an area of increased attenuation consistent with blood in contralateral thalamus. The pathophysiologic implications of the cerebellar and pyramidal system in thalamic hemorrhage is discussed.,{},,Stroke,10.1161/01.str.17.1.49,,,Case Reports; Journal Article,United States,eng
31858860,Wernekink commissure syndrome secondary to a rare 'V'-shaped pure midbrain infarction: a case report and review of the literature.,"Dong, Mingming; Wang, Lishu; Teng, Weiyu; Tian, Li",Dong,"<b>Purpose:</b> Wernekink commissure syndrome is a typical but extremely rare mesencephalic syndrome, and generally presents with bilateral cerebellar dysfunction, diverse oculomotor disorders and occasionally delayed-onset palatal myoclonus or tremor. However, it has been reported infrequently.<b>Methods:</b> We report a case of a 55-year-old man who suffered an acute paramedian midbrain infarction presenting with bilateral cerebellar ataxia, bilateral anterior internuclear ophthalmoplegia and unilateral pseudoabducens palsy, which is confirmed as Wernekink commissure syndrome by magnetic resonance imaging (MRI). We summarized the clinical data of this entity and performed a literature review of 20 previous reports of patients with this syndrome.<b>Results:</b> In combination with previous reports, we found that the most common symptom was bilateral cerebellar ataxia (100%) and other frequent symptoms were oculomotor disorders (81%), delayed palatal myoclonus or tremor (33%) and consciousness dysfunction (33%). Lesions on brain MRI of all patients affected the area of caudal paramedian midbrain (CPM).<b>Conclusion:</b> Bilateral cerebellar ataxia and lesions involved in the area of CPM on MRI are the major features of Wernekink commissure syndrome and should be the necessary conditions of diagnostic criteria. The simultaneous occurrence of bilateral cerebellar ataxia and oculomotor disorders is significant for localization diagnosis. Consciousness dysfunction is also a relatively frequent symptom of this syndrome. Moreover, pseudoabducens palsy might be attributed to a midbrain lesion. Clinicians should be familiar with and early to recognize this unique syndrome to avoid misdiagnosis.","DictElement({'Year': '2020', 'Month': '01', 'Day': '07'}, attributes={'DateType': 'Electronic'})",2020,The International journal of neuroscience,10.1080/00207454.2019.1707820,,Wernekink commissure syndrome; bilateral cerebellar ataxia; caudal paramedian midbrain infarction; internuclear ophthalmoplegia; pseudoabducens palsy,Case Reports; Journal Article; Review,England,eng
33078722,Isolated truncal contrapulsion as a rare presentation of acute thalamic infarct.,"Sheetal, S; Kumar, S A; Thomas, R",Sheetal,"Infarcts involving the thalamus can yield many deficits, including sensory syndromes, altered consciousness, and cognitive disturbances, depending on the thalamic vascular territory involved. Isolated truncal contrapulsion due to pure thalamic infarct has been rarely reported. Truncal lateropulsion is a compelling sensation of being pulled toward one side that cannot be explained by weakness or limb ataxia. It is commonly reported in lateral medullary infarcts. It may occur with lesions that involve the peripheral vestibular system, brainstem, cerebellum, basal ganglia, ponto-mesencephalic, and thalamic lesions. We hereby report a 64-year-old woman who presented with truncal contrapulsion as the sole manifestation of an acute right lateral thalamic infarct.",{},,Journal of postgraduate medicine,10.4103/jpgm.JPGM_706_19,PMC7819379,Contrapulsion; ipsipulsion; thalamic infarct; truncal lateropulsion,Case Reports,India,eng
19922954,A syndrome of the dentate nucleus mimicking psychogenic ataxia.,"Salih, Farid; Breuer, Eva; Harnack, Daniel; Hoffmann, Karl-Titus; Ploner, Christoph J",Salih,"To date, cerebellar involvement in control of non-motor functions like cognition and emotion is increasingly well established. Current models suggest that motor and non-motor networks connecting the cerebellum with cortical areas operate independently in closed and segregated loops. Here, we report a 59-year-old female patient with a small cerebellar lesion that shows that cognitive activation can significantly influence cerebellar motor control. Surprisingly, this led to a clinical picture mimicking a psychogenic disorder. Similar to non-human primates, this case suggests that the human dentate nucleus consists of distinct cognitive and motor domains with additional somatotopical arrangement of the latter. Extending current models of cerebro-cerebellar interaction, this case further illustrates that there can be significant functional cross-talk between motor and cognitive cerebellar networks.",{},,Journal of the neurological sciences,10.1016/j.jns.2009.10.017,,,Case Reports; Journal Article,Netherlands,eng
22203335,Ataxic hemiparesis in a patient with posterior cortical borderzone infarction.,"Shin, Dong Hoon; Lee, Sun Wook; Hong, Yoon Hue; Hong, Ji Man; Lee, Jin Soo",Shin,,"DictElement({'Year': '2011', 'Month': '12', 'Day': '28'}, attributes={'DateType': 'Electronic'})",2011,Neurological sciences : official journal of the Italian Neurological Society and of the Italian Society of Clinical Neurophysiology,10.1007/s10072-011-0910-z,,,Case Reports; Letter; Review,Italy,eng
11346826,[Opsoclonic-myoclonic-ataxic syndrome].,"Andrade Machado, R; García Espinosa, A; Bárbaro Ramos, L",Andrade Machado,"The opsoclonic-myoclonic-ataxic syndrome (OMAS) is that in which there are at least two of the cardinal signs (opsoclonus, myoclonus and ataxia). To report three cases, their evolution and aetiology, and discuss the main physiopathological basis and guidelines for treatment. We present three cases admitted to the Internal Medicine Department with the diagnosis of OMAS. The investigations included standard biochemical and haematological tests, a full study of the cerebrospinal fluid, computerized axial tomography of the skull and thorax, and magnetic resonance. We describe the clinical presentation, evolution, aetiology and treatment given. The results of the complementary tests are shown in the form of tables. Finally we consider the diagnosis of this condition. Three patients, two men and one woman, aged between 43 and 78 were diagnosed as having OMAS. The causes were: paraneoplasia, acute diffuse encephalomyelitis and probable multiple sclerosis. The patient with lung cancer died whilst the other two showed almost complete recovery on the treatment given. Our cases show that OMAS may be a feature of a diffuse process affecting the brainstem and cerebellum. The commonest causes found are multiple sclerosis, acute diffuse encephalomyelitis and as a paraneoplastic feature of a tumour. It may improve with treatment, but depending on the aetiology, death may occur. Immunomodulation treatment is vital even though symptomatic treatment may be given.",{},,Revista de neurologia,,,,Case Reports; English Abstract; Journal Article,Spain,spa
26479208,Injury of the dentato-rubro-thalamic tract in a patient with mild traumatic brain injury.,"Jang, Sung Ho; Kwon, Hyeok Gyu",Jang,"Several studies using diffusion tensor tractography (DTT) have demonstrated injury of the dentato-rubro-thalamic tract (DRTT) in various brain pathologies. However, no study on traumatic brain injury (TBI) has been reported. This case study attempted to demonstrate injury of the DRTT in a patient with mild TBI, using DTT. A 41-year-old female patient suffered from head trauma resulting from flexion-hyperextension injury by being hit from behind by a running car while stopped at an intersection. The patient lost consciousness and experienced post-traumatic amnesia for ∼1minute from the time of the car-accident. The patient's Glasgow Coma Scale score was 15. No specific lesion was observed on brain MRI. At 2 weeks after onset, the patient began to show resting and intentional tremor (more severe in the right upper and lower extremities) and ataxic gait. Her symptoms had been aggravated with the passage of time. On 1-month DTT, the left DRTT, which originated from the left dentate nucleus of the cerebellum, was thinner than the right DRTT. This study demonstrated injury of the DRTT in a patient with tremor and ataxia following mild TBI, using DTT. It is believed that analysis of the DRTT using DTT would be useful in elucidating the cause of post-traumatic abnormal movements.","DictElement({'Year': '2015', 'Month': '10', 'Day': '19'}, attributes={'DateType': 'Electronic'})",2015,Brain injury,10.3109/02699052.2015.1075170,,Ataxia; dentato-rubro-thalamic tract; diffusion tensor imaging; mild traumatic brain injury; tremor,"Case Reports; Journal Article; Research Support, Non-U.S. Gov't",England,eng
1665768,Capsular ataxic tetraparesis.,"Utku, U; Kars, H Z; Mengü, O",Utku,A 42-year-old man with ataxic tetraparesis is reported. Computerized tomography showed bilateral and symmetrical lacunar infarcts at the junctions of the posterior limb of the internal capsule and the corona radiata. Previously this clinical syndrome had been reported only with a lesion in the pons.,{},,Clinical neurology and neurosurgery,10.1016/0303-8467(91)90100-4,,,Case Reports; Journal Article,Netherlands,eng
