pmid,title,authors,first_author,abstract,publication_date,publication_year,journal_info,doi,pmcid,keywords,article_type,country,language
16542786,Rapid recovery from major depression using magnesium treatment.,"Eby, George A; Eby, Karen L",Eby,"Major depression is a mood disorder characterized by a sense of inadequacy, despondency, decreased activity, pessimism, anhedonia and sadness where these symptoms severely disrupt and adversely affect the person's life, sometimes to such an extent that suicide is attempted or results. Antidepressant drugs are not always effective and some have been accused of causing an increased number of suicides particularly in young people. Magnesium deficiency is well known to produce neuropathologies. Only 16% of the magnesium found in whole wheat remains in refined flour, and magnesium has been removed from most drinking water supplies, setting a stage for human magnesium deficiency. Magnesium ions regulate calcium ion flow in neuronal calcium channels, helping to regulate neuronal nitric oxide production. In magnesium deficiency, neuronal requirements for magnesium may not be met, causing neuronal damage which could manifest as depression. Magnesium treatment is hypothesized to be effective in treating major depression resulting from intraneuronal magnesium deficits. These magnesium ion neuronal deficits may be induced by stress hormones, excessive dietary calcium as well as dietary deficiencies of magnesium. Case histories are presented showing rapid recovery (less than 7 days) from major depression using 125-300 mg of magnesium (as glycinate and taurinate) with each meal and at bedtime. Magnesium was found usually effective for treatment of depression in general use. Related and accompanying mental illnesses in these case histories including traumatic brain injury, headache, suicidal ideation, anxiety, irritability, insomnia, postpartum depression, cocaine, alcohol and tobacco abuse, hypersensitivity to calcium, short-term memory loss and IQ loss were also benefited. Dietary deficiencies of magnesium, coupled with excess calcium and stress may cause many cases of other related symptoms including agitation, anxiety, irritability, confusion, asthenia, sleeplessness, headache, delirium, hallucinations and hyperexcitability, with each of these having been previously documented. The possibility that magnesium deficiency is the cause of most major depression and related mental health problems including IQ loss and addiction is enormously important to public health and is recommended for immediate further study. Fortifying refined grain and drinking water with biologically available magnesium to pre-twentieth century levels is recommended.","DictElement({'Year': '2006', 'Month': '03', 'Day': '20'}, attributes={'DateType': 'Electronic'})",2006,Medical hypotheses,10.1016/j.mehy.2006.01.047,,,Case Reports; Journal Article,United States,eng
26742784,Of grave concern.,"Fraser, Clare L; Taylor, Simon; Reid, Kate; Ahmad, Omar; Moster, Mark L",Fraser,"A 73-year-old woman presented with vision loss and recurrent proptosis with conjunctival chemosis 4 weeks after an uncomplicated fat-only orbital decompression for thyroid eye disease. Her Graves disease was biochemically ""burnt out,"" and she had diabetes mellitus. Initial neuro-imaging showed a straightened optic nerve and orbital apex fat streaking so a bilateral bony decompression of the orbital apex was performed for presumed compressive optic neuropathy. Vision failed to improve, and she experienced cognitive decline. She described metamorphopsia and insomnia. Examination showed a hemifield loss of red sensitivity, difficulties with higher visual processing, and memory problems. Occipital cortical ribboning was seen on diffusion weighted magnetic resonance imaging, cerebrospinal fluid was positive for 14-3-3, and her electroencephalogram showed periodic complexes. A diagnosis of the Heidenhain variant of Creutzfeldt-Jakob disease was made. She became akinetic and mute, dying a few months later.","DictElement({'Year': '2015', 'Month': '12', 'Day': '29'}, attributes={'DateType': 'Electronic'})",2015,Survey of ophthalmology,10.1016/j.survophthal.2015.12.009,,Creutzfeldt-Jacob disease; Heidenhain variant; compressive optic neuropathy; higher visual processing; proptosis; spongiform encephalopathy; thyroid eye disease; visual fields,Case Reports; Journal Article; Review,United States,eng
19667003,Carbamazepine-induced hyperammonemia.,"Adams, Erin N; Marks, Alla; Lizer, Mitsi H",Adams,"A case of carbamazepine-induced hyperammonemia is presented. A 26-year-old man with bipolar disorder, seizures, and mild mental retardation secondary to a traumatic brain injury began treatment with carbamazepine for aggression and seizure control. After three weeks of carbamazepine therapy, the patient arrived at the emergency department (ED) with severe agitation and aggressive behavior. His oral medications included topiramate, carbamazepine, olanzapine, quetiapine, guanfacine, and desmopressin acetate. The patient's medications had been stable for at least six months except for the addition of carbamazepine one month before his arrival at the ED. Upon admission, the patient's vital signs were found to be within normal limits, as were his liver profile results, complete blood count, thyroid-stimulating-hormone level, and serum chemistry panel. His serum carbamazepine concentration was 3.9 microg/mL (reference range, 4-12 microg/mL), and his serum ammonia concentration was 127 microg/dL (reference range, 19-60 microg/dL). Carbamazepine was discontinued upon admission, and the patient was treated with oral lactulose. Since carbamazepine was discontinued and had been prescribed for bipolar disorder, his olanzapine dosage was increased, and trazodone was added at bedtime for insomnia. Of note, the patient had been on carbamazepine therapy one year earlier and had experienced the same adverse event. He had also developed elevated serum ammonia levels while on valproic acid. The patient's serum ammonia level returned to normal by hospital day 4, and he was discharged to his group home. A 26-year-old man with bipolar disorder developed hyperammonemia three weeks after initiating carbamazepine therapy.",{},,American journal of health-system pharmacy : AJHP : official journal of the American Society of Health-System Pharmacists,10.2146/ajhp080454,,,Case Reports; Journal Article,England,eng
37082226,ANTI-NMDA-R encephalitis: case report.,"Tosunoğlu, Bünyamin; Güneş, Hafize Nalan; Kına, Hatice Mediha; Çokal, Burcu Gökçe",Tosunoğlu,"Anti-N-methyl-D-aspartate receptor encephalitis (NMDA-R) is the most common among autoimmune encephalitis caused by antibodies developed against surface antigens. It was first identified in 2007 as presenting with seizures, autonomic dysfunction and movement disorders, in addition to acute or subacute onset of neuropsychiatric symptoms. Multifocal, nonspecific white matter lesions can be seen on cranial magnetic resonance imaging (MRI). Since paraneoplasia is usually found in the etiology, malignancy should be screened in patients with NMDA-R encephalitis. In our case, a 48-year-old patient is presented who has been diagnosed with anti-NMDA-R encephalitis during the examinations, complaining of numbness on the left side of his face, seizures, imbalance, excessive talkativeness and insomnia. Autoimmune encephalitis should be considered in patients with suspected autoimmune encephalitis, which takes severe clinical course and fails to respond to treatment adequately; NMDA receptor antibodies and other autoantibody tests should be requested, malignancy screening should be performed and treatment should be started in the early period.","DictElement({'Year': '2022', 'Month': '10', 'Day': '22'}, attributes={'DateType': 'Electronic'})",2022,Postepy psychiatrii neurologii,10.5114/ppn.2022.120492,PMC9946364,encephalitis; paraneoplasia; seizure,Case Reports,Poland,eng
23385699,Sleep and comorbid neurologic disorders.,"Watson, Nathaniel F; Viola-Saltzman, Mari",Watson,"An understanding of the impact of sleep on neurologic disorders, and the impact of neurologic disorders on sleep, provides fresh opportunities for neurologists to improve the quality of life and functioning of their patients. Sleep-disordered breathing (SDB) is a risk factor for cerebrovascular disease and should be considered in all TIA and stroke patients. Sleep disorders can amplify nociception and worsen headache disorders; and some headaches, including those related to SDB and hypnic headache, are sleep specific. REM sleep behavior disorder may be an early sign of neurodegenerative disease. Focal lesions of almost any etiology (eg, multiple sclerosis and CNS malignancies) in the hypothalamus, basal forebrain, or brainstem may result in sleep disturbance, sleepiness, and insomnia. Sleep-related hypoventilation and fatigue are common in neuromuscular disease. SDB and epilepsy are mutually facilitatory, and poor sleep can exacerbate epilepsy. Continued surveillance for sleep disorders by neurologists is rewarded by new treatment avenues in their patients with the possibility of improved clinical outcomes.",{},,"Continuum (Minneapolis, Minn.)",10.1212/01.CON.0000427208.13553.8c,,,Case Reports; Journal Article; Review,United States,eng
1779254,Peduncular hallucinations.,"Kölmel, H W",Kölmel,Peduncular hallucinations usually present as visual disorders and are often genuine hallucinations associated with thalamic and/or mesencephalic lesions. In this case report we describe the clinical findings in a patient with hallucinations. Magnetic resonance imaging demonstrated bilateral ischaemic lesions in the thalamus and in the mesencephalon. The pathogenesis of hallucinations in these disorders is discussed in the light of the findings provided by imaging techniques.,{},,Journal of neurology,10.1007/BF00314654,,,Case Reports; Journal Article,Germany,eng
26763039,Post-stroke hypersomnia.,"Jang, Sung Ho; Chang, Chul Hoon; Jung, Young Jin; Seo, Jeong Pyo",Jang,,{},,International journal of stroke : official journal of the International Stroke Society,10.1177/1747493015607502,,,"Case Reports; Letter; Research Support, Non-U.S. Gov't",United States,eng
21570037,Managing sleepiness after traumatic brain injury.,"Greenwald, Brian; Lombard, Lisa A; Watanabe, Thomas K",Greenwald,,{},,"PM & R : the journal of injury, function, and rehabilitation",10.1016/j.pmrj.2011.04.010,,,Case Reports; Editorial,United States,eng
29429785,Spinal primary central nervous system lymphoma: Case report and literature review.,"Feng, Li; Chen, Dingbang; Zhou, Hongyan; Shen, Cunzhou; Wang, Haiyan; Sun, Xunsha; Liang, Xiulin; Chen, Ling",Feng,"Primary central nervous system lymphoma (PCNSL) is a very rare tumor of increasing incidence. It is often misdiagnosed due to the unspecific presentation or unavailable biopsy, and results in poor prognosis. PCNSL involved the spinal cord is extremely sparse. Here we report a gentleman presented with one-year history of progressive tremor in the left limbs and slight dysarthria as well as three-month history of paraparesis, tinnitus and insomnia. MR images disclosed the swollen cerebellum and cauda equine, with contrast enhancement in both meninges and nerve roots. The cerebrospinal fluid (CSF) revealed extremely high protein level. Tubercular meningitis was considered and anti-tuberculosis therapy was given for weeks but without relief. With progressive deterioration, the PCNSL was eventually presumed according to positive CSF cytology and exclusion of systemic involvement. However, the patient passed away within days. We then reviewed the current diagnostic methods of PCNSL. The biopsy, as the gold standard for PCNSL diagnosis, is not eligible for all patients suspected PCNSL. The presurgical diagnostic algorithm of PCNSL has been fixed by clinicians and we suggest the early and repeated CSF cytology should be included for definitive diagnosis.","DictElement({'Year': '2018', 'Month': '02', 'Day': '21'}, attributes={'DateType': 'Electronic'})",2018,Journal of clinical neuroscience : official journal of the Neurosurgical Society of Australasia,10.1016/j.jocn.2018.01.034,,CSF cytology; PCNSL; Spinal cord,Case Reports; Journal Article; Review,Scotland,eng
37724203,A Rare Case of Late-Onset Ertapenem-Induced Encephalopathy.,"Teague, Alexander J; Gupta, Sushan; Paul, Vishesh",Teague,"Encephalopathy is a rare side effect associated with carbapenem antibiotics, typically presenting within one week of initiating treatment. It is almost exclusively seen in patients with poor renal function. We present a case of a middle-aged male with a history of cerebral vascular accident and normal renal function admitted for agitation, delirium, and insomnia more than two weeks after starting ertapenem to treat osteomyelitis. He was empirically treated for meningitis on admission, and ertapenem was discontinued. After an extensive negative workup for infectious and neurological etiologies of encephalopathy, a presumptive diagnosis of ertapenem-induced encephalopathy was made. The patient returned to his baseline mental status five days after discontinuing ertapenem. The nature of his neurological symptoms and timely resolution after stopping ertapenem is consistent with ertapenem-induced encephalopathy and represents a notably delayed symptom onset compared to previously described cases.","DictElement({'Year': '2023', 'Month': '08', 'Day': '18'}, attributes={'DateType': 'Electronic'})",2023,Cureus,10.7759/cureus.43713,PMC10505488,drug-induced encephalopathy; drug-reaction; ertapenem; ertapenem induced encephelopathy; ertapenem side-effect,Case Reports,United States,eng
864483,Symptomatic cataplexy.,"Anderson, M; Salmon, M V",Anderson,"The case is described of a man who developed attacks of cataplexy, narcolepsy, and sleep paralysis because of microglioma which infiltrated the walls and floor of the IIIrd ventricle and the upper brain stem. The mechanisms by which the pathology is related to the symptoms are discussed.",{},,"Journal of neurology, neurosurgery, and psychiatry",10.1136/jnnp.40.2.186,PMC492636,,Case Reports; Journal Article,England,eng
37274664,Persistent hiccups following thalamic hemorrhage: A case report.,"Shivkumar, Vikram; Nemade, Dipali; Dhingra, Neelu",Shivkumar,"Persistent hiccups (lasting more than 48 hours) can cause physical and emotional distress. They can result in dehydration, exhaustion, malnutrition, insomnia, wound dehiscence, ventilatory desynchronization, and hemodynamic changes. Hiccups are thought to be due to a complex reflex arc involving peripheral nerves and central structures such as the brainstem, temporal lobe, basal ganglia, hypothalamus, and spinal cord levels C3-5. Medullary strokes, for instance, have been reported to cause hiccups. We report a patient with a thalamic bleed who developed persistent hiccups. A 56-year-old man was brought to the hospital in an unresponsive state. He was intubated for airway protection. CT brain showed a left thalamic hemorrhage with edema and mass effect on the 3rd ventricle, intraventricular extension of hemorrhage, and hydrocephalus. An external ventricular drain was placed successfully with adequate drainage. One week after admission, the patient developed persistent abdominal jerks. These jerks were occurring every 3-4 seconds and would last for hours with brief periods of remission. He was started on levetiracetam 1000 mg IV bid and then increased to 1500 mg IV BID without any improvement of symptoms. The patient was also placed on EEG which did not reveal any epileptiform abnormality but did show an EMG artifact. His electrolytes including sodium, and potassium, and corrected calcium levels were normal. He did not have any evidence of pneumonia or other infections. It was determined that these jerks were likely hiccups. Metoclopramide 10 mg IV was tried without any benefit. He was then started on Baclofen 10 mg PO TID which resulted in a significant improvement in hiccups. Our case suggests that thalamic lesions might also lead to persistent hiccups.","DictElement({'Year': '2023', 'Month': '05', 'Day': '19'}, attributes={'DateType': 'Electronic'})",2023,Heliyon,10.1016/j.heliyon.2023.e16409,PMC10238684,Hiccups; Stroke; Thalamus,Case Reports,England,eng
32560097,Psychiatric Manifestation of Anti-LGI1 Encephalitis.,"Endres, Dominique; Prüss, Harald; Dressing, Andrea; Schneider, Johanna; Feige, Bernd; Schweizer, Tina; Venhoff, Nils; Nickel, Kathrin; Meixensberger, Sophie; Matysik, Miriam; Maier, Simon J; Domschke, Katharina; Urbach, Horst; Meyer, Philipp T; Tebartz van Elst, Ludger",Endres,"Anti-leucine-rich glioma-inactivated 1 (LGI1) encephalitis is typically characterized by limbic encephalitis, faciobrachial dystonic seizures and hyponatremia. The frequency with which milder forms of anti-LGI1 encephalitis mimic isolated psychiatric syndromes, such as psychoses, or may lead to dementia if untreated, is largely unknown. Here, the authors present a 50-year-old patient who had suffered from neurocognitive deficits and predominant delusions for over one and a half years. He reported a pronounced feeling of thirst, although he was drinking 10-20 liters of water each day, and he was absolutely convinced that he would die of thirst. Due to insomnia in the last five years, the patient took Z-drugs; later, he also abused alcohol. Two years prior to admission, he developed a status epilepticus which had been interpreted as a withdrawal seizure. In his serum, anti-LGI1 antibodies were repeatedly detected by different independent laboratories. Cerebrospinal fluid analyses revealed slightly increased white blood cell counts and evidence for blood-brain-barrier dysfunction. Magnetic resonance imaging showed hyperintensities mesio-temporally and in the right amygdala. In addition, there was a slight grey-white matter blurring. A cerebral [<sup>18</sup>F] fluorodeoxyglucose positron emission tomography (FDG-PET) examination of his brain showed moderate hypometabolism of the bilateral rostral mesial to medial frontal cortices. Treatment attempts with various psychotropic drugs remained unsuccessful in terms of symptom relief. After the diagnosis of probable chronified anti-LGI1 encephalitis was made, two glucocorticoid pulse treatments were performed, which led to a slight improvement of mood and neurocognitive deficits. Further therapy was not desired by the patient and his legally authorized parents. This case study describes a patient with anti-LGI1 encephalitis in the chronified stage and a predominant long-lasting psychiatric course with atypical symptoms of psychosis and typical neurocognitive deficits. The patient's poor response to anti-inflammatory drugs was probably due to the delayed start of treatment. This delay in diagnosis and treatment may also have led to the FDG-PET findings, which were compatible with frontotemporal dementia (""state of damage""). In similar future cases, newly occurring epileptic seizures associated with psychiatric symptoms should trigger investigations for possible autoimmune encephalitis, even in patients with addiction or other pre-existing psychiatric conditions. This should in turn result in rapid organic clarification and-in positive cases-to anti-inflammatory treatment. Early treatment of anti-LGI1 encephalitis during the ""inflammatory activity state"" is crucial for overall prognosis and may avoid the development of dementia in some cases. Based on this case, the authors advocate the concept-long established in many chronic inflammatory diseases in rheumatology-of distinguishing between an ""acute inflammatory state"" and a ""state of organ damage"" in autoimmune psychosis resembling neurodegenerative mechanisms.","DictElement({'Year': '2020', 'Month': '06', 'Day': '16'}, attributes={'DateType': 'Electronic'})",2020,Brain sciences,10.3390/brainsci10060375,PMC7348933,anti-LGI1 encephalitis; autoimmune psychosis; limbic encephalitis,Case Reports,Switzerland,eng
36708258,Narcolepsy secondary to anti-Ma2 encephalitis: two case reports.,"Brunet de Courssou, Jean-Baptiste; Testard, Pauline; Sallansonnet-Froment, Magali; Brechemier, Marie-Laure; Ricard, Damien; Psimaras, Dimitri; Ferrand, Mickaël; Maillet, Thibault; Depierre, Patricia; Ohlmann, Charlotte; Capron, Jean; Arnulf, Isabelle; Gales, Ana",Brunet de Courssou,"Recent studies suggest that sleep disorders are present in two-thirds of patients with autoimmune encephalitis. In anti-Ma2 encephalitis, hypersomnia appears to be frequent. However, only few cases of type 1 narcolepsy have been reported to date with anti-Ma2 encephalitis. We report 2 new cases of patients with narcolepsy secondary to anti-Ma2 encephalitis. Patient 1, a 68-year-old man, had narcolepsy type 1, including sleep attacks, cataplexy, abnormal Multiple Sleep Latency Tests and hypocretin-1 deficiency (< 50 ng/L) in the cerebrospinal fluid (CSF), associated with a cerebellar syndrome. Anti-Ma2 antibodies were present in the serum and CSF and antivoltage-gated potassium channel antibodies in the serum. He benefited from a treatment with pitolisant. Patient 2, a 42-year-old man, had narcolepsy type 2, including hypersomnolence, no cataplexy, intermediate CSF levels of hypocretin-1 (138 ng/L), abnormal Multiple Sleep Latency Tests, and a limbic encephalitis presentation. Anti-Ma2 antibodies were present in the serum and CSF, and anti-Ma1 antibodies were in the CSF. For both, repeated polysomnographies were necessary to establish the precise diagnosis of central hypersomnia, emphasizing the importance of carrying out sleep investigations in a tertiary neurology center with sleep medicine expertise in patients with anti-Ma2 encephalitis. Brunet de Courssou J-B, Testard P, Sallansonnet-Froment M, et al. Narcolepsy secondary to anti-Ma2 encephalitis: two case reports. <i>J Clin Sleep Med</i>. 2023;19(4):837-841.",{},,Journal of clinical sleep medicine : JCSM : official publication of the American Academy of Sleep Medicine,10.5664/jcsm.10448,PMC10071386,Ma2; auto-immune encephalitis; hypersomnia; narcolepsy; paraneoplastic; sleep disease,Case Reports,United States,eng
35263922,Bi-Basal Ganglia Involvement with Signal Evolution in a Case of Anti-LGI1 Encephalitis.,"Gai, Qing; Ruan, Shan; Dong, Xiaoyu; Cong, Shuyan",Gai,"Anti-leucine-rich glioma-inactivated 1 (LGI1) encephalitis is a rare type of non-paraneoplastic limbic encephalitis (LE) mainly characterized by seizures, cognitive disorder, faciobrachial dystonic seizures (FBDS), hyponatremia, insomnia, and autonomic dysfunction. Here, we report the case of an elderly female patient who tested positive for antibodies against LGI1 and was initially thought to have Hashimoto encephalopathy (HE) due to its similar clinical features and the patient's high titers of antithyroid antibody. Interestingly, during the course of the disease, the patient exhibited typical FBDS and brain magnetic resonance imaging (MRI) showed a hyperintense signal evolution from T2/Fluid attenuated inversion recovery (FLAIR) to T1-weighted image in the bilateral basal ganglia (BG), which have rarely been reported previously.",{},,Neurology India,10.4103/0028-3886.338681,,Antithyroid antibody; Hashimoto encephalopathy; faciobrachial dystonic seizures; leucine-rich glioma-inactivated 1; magnetic resonance imaging,Case Reports,India,eng
26494569,"Lucid dreams, an atypical sleep disturbance in anterior and mediodorsal thalamic strokes.","Sagnier, S; Coulon, P; Chaufton, C; Poli, M; Debruxelles, S; Renou, P; Rouanet, F; Olindo, S; Sibon, I",Sagnier,"Cognitive, affective, and behavioural disturbances are commonly reported following thalamic strokes. Conversely, sleep disorders are rarely reported in this context. Herein, we report the cases of two young patients admitted for an ischemic stroke located in the territories of the left pre-mammillary and paramedian arteries. Together with aphasia, memory complaint, impaired attention and executive functions, they reported lucid dreams with catastrophic content or conflicting situations. Lucid dreams are an atypical presentation in thalamic strokes. These cases enlarge the clinical spectrum of sleep-wake disturbances potentially observed after an acute cerebrovascular event.","DictElement({'Year': '2015', 'Month': '10', 'Day': '20'}, attributes={'DateType': 'Electronic'})",2015,Revue neurologique,10.1016/j.neurol.2015.08.005,,Cortico-thalamo-limbic network; Infarctus thalamique; Lucid dreams; Réseau cortico-thalamo-limbique; Rêves lucides; Sleep-wake disturbances; Thalamic stroke; Troubles du cycle veille–sommeil,Case Reports; Journal Article; Review,France,eng
