pmid,title,authors,first_author,abstract,publication_date,publication_year,journal_info,doi,pmcid,keywords,article_type,country,language
22847398,Cognitive decline and hypersomnolence: thalamic manifestations of a tentorial dural arteriovenous fistula (dAVF).,"Morparia, Neha; Miller, Gary; Rabinstein, Alejandro; Lanzino, Giuseppe; Kumar, Neeraj",Morparia,"Intracranial dural arteriovenous fistulas (dAVFs) often present with pulsatile tinnitus, orbital congestion, and headache. Occasionally, they present with focal neurologic deficits, a dementia-like syndrome, hemorrhage, or ischemic infarction. This study is based on the case of a 71-year-old gentleman who presented with 6 months of progressive forgetfulness, inattention, and hypersomnolence. Four weeks prior to presentation, he developed symptoms of left-sided pain, numbness, and worsening weakness. Neurologic examination demonstrated hypersomnolence, a score of 30/38 on the Kokmen Short Test of Mental Status, and left hemiparesis. MRI brain revealed bilateral thalamic T2 hyperintensities with associated enhancement. MR venogram (MRV) showed a vascular malformation in the posterior fossa and occlusion of the straight sinus. Conventional cerebral angiogram confirmed a tentorial dAVF. The dAVF was definitively treated with transarterial embolization, followed by clip ligation of the arterialized draining vein. Twelve weeks later, there was clinical resolution of left hemiparesis and improvement in cognitive status. MRI revealed complete resolution of the thalamic hyperintensities. MRV demonstrated recanalization of the straight sinus. Intracranial dAVFs are uncommon but potentially life-threatening acquired vascular malformations. The initiating factor is venous hypertension, causing retrograde flow, venous congestion, ischemia, and sometimes infarction. The spectrum of clinical manifestations in dAVFs reflects the degree of venous congestion present. If retrograde venous flow is surgically obliterated, then venous hypertension may be reversible. Bilateral thalamic venous congestion can present as a thalamic dementia. We conclude that intracranial dAVFs with thalamic venous congestion should be considered in the diagnostic differential for patients who present with subacute cognitive decline and T2 hyperintense thalamic signal change.",{},,Neurocritical care,10.1007/s12028-012-9746-5,,,Case Reports; Journal Article,United States,eng
38682764,Autoimmune encephalitis mediated by postvaccination and infection of SARS-CoV-2 in a patient with a narcolepsy type 1.,"Peraita-Adrados, R; Bravo-Quelle, N",Peraita-Adrados,"We present a narcolepsy type 1 patient that develop an autoimmune encephalitis post vaccine and/or a SARS-CoV-2 infection. At 23 years old, the patient was referred to the emergency room with difficult speaking, headache and tremor followed by changes in behavior, autonomic dysfunction, right focal motor seizure and lethargy. He has received seven weeks before mRNA-1273 (Moderna) vaccine followed by a SARS-CoV-2 infection four weeks after vaccination (positive antigen test). The neurological examination was normal (visual fields, cranial nerves, motor, sensory and reflexes). Nasopharyngeal swab polymerase chain reaction (PCR) testing for COVID-19 was negative. Cerebrospinalfluid (CSF) had highly elevated protein and lymphocytic pleocytosis. CSF bacterial and fungal cultures for viral infections were negative. Brain magnetic resonance imaging (MRI) showed no abnormality on the non-enhanced sequences but the diffusion weighted imaging showed restricted diffusion with high signal on the left hemisphere mainly in the cerebral cortex with a gyro morphology, patched distribution with involvement of the temporal and frontal lobes. Chest, abdomen and pelvis computed tomography; pelvic and scrotum ultrasound, showed no malignancy. Onconeural antibodies were negative. The patient was treated with plasmapheresis and corticosteroids with a good clinical outcome and near complete resolution of the MRI abnormalities. The patient fulfilled the diagnostic criteria for autoimmune encephalitis with subacute onset. COVID-19 infection and vaccination could constitute a risk in a patient with narcolepsy as in this case and, could help to provide better understanding of the implication of immune-mediated processes in the pathophysiology of the diseases.",{},,Revista de neurologia,10.33588/rn.7809.2023306,,,Case Reports; Journal Article,Spain,spa; eng
24210076,Anti-NMDA receptor encephalitis presenting with total insomnia--a case report.,"Marques, Inês Brás; Teotónio, Rute; Cunha, Catarina; Bento, Conceição; Sales, Francisco",Marques,"Fatal insomnia (FI) is the first diagnosis to be considered by most neurologists when approaching a patient presenting with total insomnia followed by personality and cognitive changes, disturbance of alertness, autonomic hyperactivation and movement abnormalities. We report the case of a 30 year-old male patient who presented with total insomnia followed by episodes of psychomotor restlessness resembling anxiety attacks. Twenty days later, he developed refractory convulsive status epilepticus with admission to Intensive Care Unit. He progressed to a state of reduced alertness and responsiveness, presenting periods of agitation with abnormal dyskinetic movements, periods of autonomic instability and central hypoventilation. Workup revealed antibodies against N-methyl-d-aspartate receptor (NMDAR). Immunotherapy treatment led to a very significant improvement with the patient presenting only slight frontal lobe dysfunction after one year of recovery. To the best of our knowledge this is the first report of a patient with anti-NMDAR encephalitis first presenting with total insomnia. Our aim is to alert that anti-NMDAR encephalitis must be considered in the differential diagnosis of FI, especially in sporadic cases. Distinguishing the two conditions is very important as, contrarily to the fatal disclosure of FI, anti-NMDAR encephalitis is potentially reversible with adequate treatment even after severe and prolonged disease.","DictElement({'Year': '2013', 'Month': '10', 'Day': '30'}, attributes={'DateType': 'Electronic'})",2013,Journal of the neurological sciences,10.1016/j.jns.2013.10.034,,Autoimmune encephalitis; Immunotherapy; NMDAR encephalitis; Sporadic fatal insomnia; Total insomnia; Video-EEG monitoring,Case Reports; Journal Article,Netherlands,eng
26535475,SPECT Perfusion Imaging Demonstrates Improvement of Traumatic Brain Injury With Transcranial Near-infrared Laser Phototherapy.,"Henderson, Theodore A; Morries, Larry D",Henderson,"Traumatic brain injury (TBI) is a growing health concern affecting civilians and military personnel. Near-infrared (NIR) light has shown benefits in animal models and human trials for stroke and in animal models for TBI. Diodes emitting low-level NIR often have lacked therapeutic efficacy, perhaps failing to deliver sufficient radiant energy to the necessary depth. In this case report, a patient with moderate TBI documented in anatomical magnetic resonance imaging (MRI) and perfusion single-photon emission computed tomography (SPECT) received 20 NIR treatments in the course of 2 mo using a high-power NIR laser. Symptoms were monitored by clinical examination and a novel patient diary system specifically designed for this patient population. Clinical application of these levels of infrared energy for this patient with TBI yielded highly favorable outcomes with decreased depression, anxiety, headache, and insomnia, whereas cognition and quality of life improved. Neurological function appeared to improve based on changes in the SPECT by quantitative analysis. NIR in the power range of 10-15 W at 810 and 980 nm can safely and effectively treat chronic symptoms of TBI.",{},,Advances in mind-body medicine,,,,Case Reports; Journal Article,United States,eng
33397771,Pediatric Parainfectious Encephalitis Associated With COVID-19.,"Gaughan, Maria; Connolly, Sean; O'Riordan, Sean; Tubridy, Niall; McGuigan, Chris; Kinsella, Justin A",Gaughan,,"DictElement({'Year': '2021', 'Month': '01', 'Day': '04'}, attributes={'DateType': 'Electronic'})",2021,Neurology,10.1212/WNL.0000000000011476,,,Case Reports; Journal Article,United States,eng
32618485,Artery of Percheron Stroke as an Unusual Cause of Hypersomnia: A Case Series and a Short Literature Review.,"Saida, Imen Ben; Saad, Helmi Ben; Zghidi, Maroua; Ennouri, Emna; Ettoumi, Radhouane; Boussarsar, Mohamed",Saida,"The thalamus and the mesencephalon have a complex blood supply. The artery of Percheron (AOP) is a rare anatomical variant. Occlusion of this artery may lead to bithalamic stroke with or without midbrain involvement. Given its broad spectrum of clinical features, AOP stroke is often misdiagnosed. Usually, it manifests with the triad of vertical gaze palsy, memory impairment, and coma. In this article, we report three cases of bilateral thalamic strokes whose clinical presentations were dominated by a sudden onset of hypersomnia. We also reviewed last 5 years' publications related to the AOP strokes in males presenting sleepiness or equivalent terms as a delayed complication. The AOP stroke may present a diagnostic challenge for clinicians which should be considered in the differential diagnosis of hypersomnia.",{},,American journal of men's health,10.1177/1557988320938946,PMC7336829,Percheron infarction; bithalamic; hypersomnolence,Case Reports; Journal Article,United States,eng
11220691,A contemporary case of encephalitis lethargica.,"Kiley, M; Esiri, M M",Kiley,"We present a clinicopathological report of a recent fatal case of a 27-year-old woman whom we consider to have had encephalitis lethargica. Clinical features of note were a presentation with vertigo, persistent vomiting and sleep disturbance including marked daytime somnolence and vivid nightmares. On examination, she had impaired slow pursuit vertical eye movements, dysarthria, an expressionless face and slow tongue movements. She went on to develop gross supranuclear gaze palsy, neck rigidity, bradykinesia, blepharospasm, profound somnolence and anarthria but no tremor, weakness or impairment of cognition. She died after an illness lasting 12 months. On investigation, the cerebrospinal fluid was found to contain a very high level of IgG with oligoclonal bands but no cells. Post-mortem examination revealed an active encephalitis, mainly centered on the upper brainstem and diencephalon with extensive Purkinje cell loss and marked plasma cell infiltrates and morula cells. No virus was recovered.",{},,Clinical neuropathology,,,,Case Reports; Journal Article,Germany,eng
20129821,A case of reversible restless legs syndrome (RLS) and sleep-related eating disorder relapse triggered by acute right leg herpes zoster infection: literature review of spinal cord and peripheral nervous system contributions to RLS.,"Mahowald, Mark W; Cramer Bornemann, Michel A; Schenck, Carlos H",Mahowald,"Restless legs syndrome (RLS) is thought to be due to abnormalities of iron metabolism in the central nervous system; however, occasional cases are associated with lesions of the spinal cord, spinal rootlets, and peripheral nervous system. This is a case report of RLS exacerbated by shingles with a review of the literature of extra-cerebral lesions or disorders causing or contributing to RLS.","DictElement({'Year': '2010', 'Month': '02', 'Day': '02'}, attributes={'DateType': 'Electronic'})",2010,Sleep medicine,10.1016/j.sleep.2009.11.007,,,Case Reports; Journal Article; Review,Netherlands,eng
1811323,Status dissociatus--a perspective on states of being.,"Mahowald, M W; Schenck, C H",Mahowald,"During the course of routine clinical study, it has become apparent that the all-or-none concept of state determination (wakefulness, nonrapid eye movement sleep, rapid eye movement sleep) does not always exist, and that ambiguous, multiple, or rapid oscillation of state-determining variables appear in a wide variety of experimental and clinical situations. Six cases of extreme state dissociation are presented, with a review of the human and animal clinical and experimental literature. This multiple component concept of state determination must be kept in mind when pharmacologic or lesion studies are employed to suppress one or another state. Such manipulation may suppress some of the commonly used markers for that state (i.e., polygraphic) without affecting other variables of that state. The existence of mixed states will be a challenge to the development of automated computerized polysomnogram scoring.",{},,Sleep,10.1093/sleep/14.1.69,,,"Case Reports; Journal Article; Research Support, Non-U.S. Gov't; Review",United States,eng
25186582,Efficacy of tracheostomy for central alveolar hypoventilation syndrome caused by lateral medullary infarction.,"Mishina, Masahiro; Ohkubo, Seiji; Kamiya, Nobuo; Abe, Arata; Suda, Satoshi; Sakamaki, Masanori; Kominami, Shushi; Mizunari, Takayuki; Kobayashi, Shiro; Katayama, Yasuo",Mishina,"Central alveolar hypoventilation syndrome (CAHS) is a rare and potentially fatal condition. However, respiratory care for patients with CAHS caused by lateral medullary infarction (CAHS-LMI) remains an important unsolved problem. We describe 2 patients with CAHS-LMI and review the case reports for 17 previously described patients. Patient 1 was a 78-year-old man who was referred to our hospital because of dizziness. After admission, Wallenberg syndrome developed. Magnetic resonance imaging showed left LMI. He had hypercapnia and respiratory acidosis the next afternoon and temporarily received mechanical ventilation. A tracheotomy was performed on the 12th hospital day, and the patient was weaned from the ventilator on the 18th hospital day. Patient 2 was 72-year-old man who was referred to our hospital because of dizziness and gait disturbance. Wallenberg syndrome was diagnosed after admission, and magnetic resonance imaging showed right LMI. His consciousness deteriorated, and hypercapnia developed on the ninth hospital day. The patient received ventilatory support, and a tracheotomy was performed on the 12th hospital day. He was weaned from the ventilator by the 16th hospital day. Consistent with our findings, most previously reported cases of CAHS-LMI were initially associated with mild symptoms, which subsequently worsened. Five of the 19 patients (26.3%) died within 1 month after onset, and 7 patients (36.8%) died within 1 year. Tracheotomy was performed in 12 patients, 2 of whom died 1 month after onset (16.7%); another patient died of chronic renal failure after 2 years. Tracheotomy seemed to be an effective procedure in patients with CAHS-LMI. We speculate that tracheotomy assists alveolar ventilation by reducing dead space ventilation. Closure of the tracheotomy should, therefore, be avoided in patients with CAHS-LMI, even if respiratory status is good.",{},,Journal of Nippon Medical School = Nippon Ika Daigaku zasshi,10.1272/jnms.81.276,,,Case Reports; Journal Article,Japan,eng
20066515,Ondine's curse with accompanying trigeminal and glossopharyngeal neuralgia secondary to medullary telangiectasia.,"Kapnadak, Siddhartha G; Mikolaenko, Ivan; Enfield, Kyle; Gress, Daryl R; Nathan, Barnett R",Kapnadak,"Central hypoventilation syndrome (""Ondine's Curse"") is an infrequent disorder that can lead to serious acute or chronic health consequences. This syndrome, especially in adults, is rare, and even less frequent in the absence of clear pathogenic lesions on MRI. In addition, we are not aware of any previously reported cases with associated cranial nerve neuralgias. We describe a patient with baseline trigeminal and glossopharyngeal neuralgia, admitted with episodes of severe hypoventilatory failure of central origin, consistent with ""Ondine's Curse"". After evaluation, she was found to have a medullary capillary telangiectasia, thought to be the causative lesion, and which could explain her complete neurologic and hypoventilatory syndrome. The patient was treated with placement of a diaphragmatic pacing system, which has been effective thus far. This case illustrates the need for investigation of centrally mediated apnea, especially when co-occurring cranial nerve neuralgia is present and cardiopulmonary evaluation is negative. It provides an example of capillary telangiectasia as the causative lesion, one that to our knowledge has not been reported before. Placement of a diaphragmatic pacing system was warranted and became lifesaving as the patient was deemed to be severely incapacitated by chronic ventilatory insufficiency.",{},,Neurocritical care,10.1007/s12028-009-9321-x,,,Case Reports; Journal Article,United States,eng
2136093,Secondary mania after ventral pontine infarction.,"Drake, M E; Pakalnis, A; Phillips, B",Drake,"Secondary mania is increasingly recognized clinically, and consists of acute exhibition of manic symptoms without past or family history of affective disorder. It has been reported with toxic and metabolic disturbances, primary and metastatic brain tumors, epilepsy, and cerebrovascular events. A multifactorial etiology has been suggested. We report two men, 52 and 56 years old, who developed grandiosity, sleeplessness, irritable mood, hyperactivity, and paranoid and religious delusions, with attempted violence in one case. Both had no premorbid psychiatric history and were healthy except for hypertension. One patient had a normal neurologic examination, and the other had mild left hemiparesis and hyperreflexia. EEGs, brainstem auditory-evoked responses, and median nerve somatosensory-evoked potentials were normal. Magnetic resonance studies demonstrated infarction of the ventral pons (on the right in the patient with left-sided signs and on the left in the patient with normal neurologic examination). The two patients responded to lithium carbonate and neuroleptics and have not had further psychiatric symptoms in 18 months of follow-up. These cases emphasize the relationship of late-onset mania with predisposing brain disease, and they suggest that brainstem disturbances can influence mood, sleep, libido, and thought.",{},,The Journal of neuropsychiatry and clinical neurosciences,10.1176/jnp.2.3.322,,,Case Reports; Journal Article,United States,eng
19240950,Rapid-eye-movement sleep behavior disorder secondary to acute aseptic limbic encephalitis.,"Lin, Feng-Cheng; Liu, Ching-Kuan; Hsu, Chung-Yao",Lin,Rapid-eye-movement (REM) sleep behavior disorder (RBD) is a parasomnia characterized by complex motor activity associated with dreaming during REM sleep. RBD may be idiopathic or associated with various neurological diseases involving the brainstem. The association of RBD and limbic system impairment was unclear. We report a 46-year-old man with acute aseptic limbic encephalitis in association with RBD. The patient presented with subacute onset of anterograde/retrograde amnesia and persistent fever. Abnormal nocturnal behavior during sleep consisted of waving hands to fight and kicking legs. Brain magnetic resonance imaging showed damage on the bilateral unci and medial temporal lobes. Cerebrospinal fluid analysis indicated aseptic encephalitis. A polysomnography revealed augmented phasic activity in the submental and bilateral tibialis anterior muscles during REM sleep. Our finding suggests that limbic system impairment may lead to the occurrence of RBD.,"DictElement({'Year': '2009', 'Month': '02', 'Day': '25'}, attributes={'DateType': 'Electronic'})",2009,Journal of neurology,10.1007/s00415-009-5067-9,,,Case Reports; Letter,Germany,eng
36672116,Unexplained Progressive Neurological Deficits after Corpus Callosotomy May Be Caused by Autoimmune Encephalitis: A Case of Suspected Postoperative Anti-NMDAR Encephalitis.,"Hatano, Keisuke; Fujimoto, Ayataka; Sato, Keishiro; Yamamoto, Takamichi; Sakuma, Hiroshi; Enoki, Hideo",Hatano,"The main causes of anti-N-methyl-D-aspartate receptor (NMDAR) encephalitis are ovarian teratoma and herpes simplex virus (HSV) encephalitis. We present a rare case of suspected anti-NMDAR encephalitis caused by corpus callosotomy (CC). An 18-year-old woman with Lennox-Gastaut syndrome underwent CC. Although left hemiplegic due to cerebral hemorrhage and impaired consciousness due to cerebral venous sinus thrombosis (CVST) appeared postoperatively, anticoagulant therapy quickly improved CVST and impaired consciousness. However, various unexplained symptoms such as insomnia, hallucination, impulsivity, impaired consciousness, and a new type of drug-resistant cluster seizures gradually developed over a 2-month period. Magnetic resonance imaging revealed the gradual extension of a hyperintense area from the right frontal lobe on fluid-attenuated inversion recovery images. Intravenous methylprednisolone pulse was initiated from postoperative day (POD) 74, followed by intravenous immunoglobulin (IVIg) therapy, although white blood cell counts were normal in all three cerebrospinal fluid (CSF) examinations. After IVIg therapy, the above unexplained symptoms promptly improved. On POD 103, antibodies against NMDAR were revealed in both the serum and CSF collected before these immunotherapies. The patient was transferred to a rehabilitation hospital due to residual left hemiplegia. Psychiatric symptoms and a new onset of drug-resistant seizures may be suggestive of postoperative anti-NMDAR encephalitis, even if CSF findings are mild.","DictElement({'Year': '2023', 'Month': '01', 'Day': '12'}, attributes={'DateType': 'Electronic'})",2023,Brain sciences,10.3390/brainsci13010135,PMC9856623,anti-N-methyl-D-aspartate receptor (anti-NMDAR) encephalitis; autoimmune encephalitis; case report; craniotomy; epilepsy surgery,Case Reports,Switzerland,eng
36989081,Bing Neel Syndrome: A Rare Contributing Factor of Psychosis and Suicidality.,"Alexander, Abigail L; Jackson, Devon; Donahue, John E; Chirkov, Alexander; Banerjee, Priya",Alexander,"Suicide rapidly increased in the United States by 30% from 2000 to 2020, accounting for more than 800,000 deaths ( Neurosci Res Program Bull . 1972; 10: 384-8). Studies have shown that there are a multitude of underlying issues, including mental illness, that elevate an individual's risk of dying by suicide ( CDC WONDER: Underlying cause of death, 1999-2019 . Atlanta, GA: US Department of Health and Human Services, CDC; 2020). Presented here is a case of Bing Neel syndrome (BNS) found in a 69-year-old man who died by suicide by jumping off a 135' bridge. His medical history was significant for traumatic brain injury, Waldenstrom macroglobulinemia (WM), major depressive disorder, suicidal ideation, and anxiety. Bing Neel syndrome is a rare central nervous system complication of WM. His wife reported an abrupt mental deterioration starting 5 years before his death, characterized by paranoia, depression, and insomnia. He had been a high-functioning university professor. His decline culminated with the loss of independence in his activities of daily living. At autopsy, it was found that he experienced blunt force injuries related to the fall, causing his death. A neuropathologic examination revealed a brisk and fulminant clonal CD20 + /immunoglobulin M+ lymphocytic infiltrate, involving all sampled regions of his brain, consistent with WM. This workup was critical to obtaining an accurate pathologic diagnosis of BNS and understanding his full clinical status before death. Although BNS was not the proximate cause of death, this diagnosis aided the death investigation as a causal factor in his suicidality and was vital to providing his family closure.","DictElement({'Year': '2023', 'Month': '03', 'Day': '22'}, attributes={'DateType': 'Electronic'})",2023,The American journal of forensic medicine and pathology,10.1097/PAF.0000000000000824,,,Case Reports; Journal Article,United States,eng
12495644,Magnetoencephalographic localization of peritumoral temporal epileptic focus previous surgical resection.,"Amo, Carlos; Saldaña, Cristóbal; Hidalgo, Mercedes González; Maestú, Fernando; Fernández, Alberto; Arrazola, Juan; Ortiz, Tomás",Amo,"Magnetoencephalography (MEG) is suggested as a localizing technique of epileptogenic areas in drug-resistant seizure patients due to intracraneal lesions. A male 42-year-old patient who begins at 26 with partial complex drug-resistant seizures is put forward. MRI shows a 9 mm diameter lesion located in left superior temporal gyrus which seems compatible with cavernoma. Both conventional and sleep deprivation EEGs have proved normal. Sleep EEG shows sharp waves in left temporal region. MEG helps to localize interictal spike and spike-wave activity, as well as wide slow wave (2-7 Hz) activity areas. Craniotomy under analgesia and aware sedation conditions is carried out. Intrasurgery cortical electric stimulation assisted by neuronavigator causes a limited partial complex seizure which the patient recognizes to be exactly like his. Thus, MEG localization of the epileptogenic area is confirmed. Surgical resection of both the lesion and the epileptogenic area is carried out. The patient remains free from seizures 9 months after surgery. A control MEG study reveals no epileptogenic nor slow wave activity. in this particular case, MEG has proven to be a useful presurgical evaluation technique to localize epileptogenic activity, validated by intrasurgical cortical stimulation.",{},,Seizure,10.1016/s1059131102001486,,,Case Reports; Journal Article,England,eng
