pmid,title,authors,first_author,abstract,publication_date,publication_year,journal_info,doi,pmcid,keywords,article_type,country,language
33647851,Auditory agnosia with anosognosia.,"Klarendić, Maja; Gorišek, Veronika R; Granda, Gal; Avsenik, Jernej; Zgonc, Vid; Kojović, Maja",Klarendić,"A 66-year-old right-handed female medical doctor suffered two consecutive cardioembolic strokes, initially affecting the right frontal lobe and the right insula, followed by a lesion in the left temporal lobe. The patient presented with distinctive phenomenology of general auditory agnosia with anosognosia for the deficit. She did not understand verbal requests and her answers to oral questions were fluent but unrelated to the topic. However, she was able to correctly answer written questions, name objects, and fluently describe their purpose, which is characteristic for verbal auditory agnosia. She was also unable to recognise environmental sounds or to recognise and repeat any melody. These inabilities represent environmental sound agnosia and amusia, respectively. Surprisingly, she was not aware of the problem, not asking any questions regarding her symptoms, and avoiding discussing her inability to understand spoken language, which is indicative of anosognosia. The deficits in our patient followed a distinct pattern of recovery. The verbal auditory agnosia was the first to resolve, followed by environmental sound agnosia. Amusia persisted the longest. The patient was clinically assessed from the first day of symptom onset and the evolution of symptoms was video documented. We give a detailed account of the patient's behaviour and provide results of audiological and neuropsychological evaluations. We discuss the anatomy of auditory agnosia and anosognosia relevant to the case. This case study may serve to better understand auditory agnosia in clinical settings. It is important to distinguish auditory agnosia from Wernicke's aphasia, because use of written language may enable normal communication.","DictElement({'Year': '2021', 'Month': '02', 'Day': '02'}, attributes={'DateType': 'Electronic'})",2021,Cortex; a journal devoted to the study of the nervous system and behavior,10.1016/j.cortex.2020.12.025,,Amusia; Anosognosia; Auditory agnosia; Environmental sound agnosia; Verbal auditory agnosia,Case Reports,Italy,eng
32807488,Dashcam-captured moment of right hemispheric stroke.,"Miyazawa, Haruna; Terayama, Yasuo",Miyazawa,A bus driver presented with neurological abnormalities following a driving mishap. He was diagnosed cardioembolic stroke. The bus was equipped with a dashboard camera that recorded the moment when the patient suffered the stroke. We reported the first case dashcam-captured images at the first sign of a right hemispheric stroke.,"DictElement({'Year': '2020', 'Month': '07', 'Day': '04'}, attributes={'DateType': 'Electronic'})",2020,Journal of stroke and cerebrovascular diseases : the official journal of National Stroke Association,10.1016/j.jstrokecerebrovasdis.2020.105094,,Anosognosia; Dashcam; Driving; Stroke,Case Reports; Video-Audio Media,United States,eng
571567,Thalamic neglect.,"Watson, R T; Heilman, K M",Watson,"Three patients with right thalamic hemorrhage showed contralateral neglect and limb akinesia. They also had anosognosia, visuospatial disorders, and emotional flattening. In animals, neglect can be induced by lesions along a cortico-limbic-reticular loop including the intralaminar thalamic nuclei. We propose that an activation defect is responsible not only for the neglect and akinesia, but also for the visuospatial and emotional defects usually associated with right-hemisphere cortical dysfunction.",{},,Neurology,10.1212/wnl.29.5.690,,,"Case Reports; Journal Article; Research Support, U.S. Gov't, P.H.S.",United States,eng
30661390,Anton's Syndrome associated with autotopagnosia.,"Lo Buono, Viviana; De Salvo, Simona; Paladina, Giuseppe; Corallo, Francesco; Palmeri, Rosanna; Morabito, Rosa; Bramanti, Alessia; Marino, Silvia; Sessa, Edoardo",Lo Buono,"We describe an unusual case of a 68-year-old male affected by cerebral amyloid angiopathy and cortical blindness associated with Anton's syndrome. In addition, our patient presented with autotopagnosia, a form of agnosia characterized by loss of body spatial representation. Neuropsychological assessment evidenced cognitive impairment. Magnetic Resonance Imaging showed hemorrhagic foci in the left occipital and right occipito-parietal lobe, paratrigonal white matter, and post-ischemic parenchymal gliosis. The pattern-reversal of visual evoked potentials were indicative bilateral visual pathway of integrity of the. After a neurological damage, patients could show a denial of their own deficit; however, the association between anosognosia and autotopagnosia represents a rare neurological condition. The simultaneous onset of unusual neuropsychological syndromes could be related to involvement of a complex brain network.","DictElement({'Year': '2019', 'Month': '01', 'Day': '20'}, attributes={'DateType': 'Electronic'})",2019,Applied neuropsychology. Adult,10.1080/23279095.2018.1538048,,Anosognosia; anton’s syndrome; autotopagnosia; cerebral amyloid angiopathy,Case Reports; Journal Article,United States,eng
38586806,Anton-Babinski Syndrome: A Visual Anosognosia.,"Ziaul, Yasir H; Mittal, Jimmy; Afroze, Tazeen; Kumar, Vivek",Ziaul,"Anton-Babinski syndrome is a rare extension of cortical blindness following injury to the occipital lobe. The patient behaves as sighted but has visual function derangements. The posterior cerebral artery (PCA) stroke represents 5% to 10% of total strokes. The COVID-19 pandemic has shown a rise in stroke cases. We present a case of this rare PCA stroke, first diagnosed by an ophthalmologist. This case had an inconsistent initial presentation, but subsequent computed tomography of the brain and other neurological investigations confirmed the diagnosis. If such cases are diagnosed early, they could have better management. Timely intervention can decrease morbidity as well as mortality.","DictElement({'Year': '2024', 'Month': '03', 'Day': '06'}, attributes={'DateType': 'Electronic'})",2024,Cureus,10.7759/cureus.55679,PMC10997746,anton-babinski syndrome; cortical blindness; posterior cerebral artery; stroke; visual anosognosia,Case Reports,United States,eng
34567463,Bilateral occipital lobe infarct neglect deficit (BLIND) syndrome.,"Shanmugam, S; Haver, H L; Knecht, S M; Rajjoub, R; Ali, O; Chow, R",Shanmugam,"Cortical blindness is characterized by loss of vision due to dysfunction of the visual cortices, most commonly secondary to bilateral ischemic infarcts of the occipital lobe. Other causes include surgery such as aortic valve replacement, laryngeal surgery, craniotomy, cerebral angiography, head trauma, and partial seizures. Visual anosognosia is a distinct feature of cortical blindness, wherein patients claim they can see and confabulate visual perceptions, despite loss of sight. We herewith present a rare phenomenon known as Anton Syndrome, an eponym named after the Austrian neurologist and psychiatrist, Gabriel Anton (1858-1933). There are a limited number of cases of Anton's Syndrome in the literature, with only 28 case reports published from 1965-2016. Although he was bestowed a neurologic eponym, Anton was an advocate of eugenics and racial hygiene. He publicly advocated for 'superior breeding' and 'selection' in order to 'build a brave and noble race.' We therefore propose replacing the eponym with Bilateral Occipital Lobe Infarct Neglect Deficit (BLIND) Syndrome, with intention of raising awareness of this unique presentation as well as of the widespread interest in eugenics in the early 1900s amongst physicians, notably Gabriel Anton.","DictElement({'Year': '2021', 'Month': '09', 'Day': '20'}, attributes={'DateType': 'Electronic'})",2021,Journal of community hospital internal medicine perspectives,10.1080/20009666.2021.1974730,PMC8462920,Anton syndrome; atrial tachyarrhythmia; blind syndrome; cortical blindness; visual anosognosia,Case Reports,United States,eng
7201116,Subcortical neglect.,"Healton, E B; Navarro, C; Bressman, S; Brust, J C",Healton,"Unilateral neglect is usually caused by lesions of the right cerebral cortex, especially parietal. Neglect after subcortical lesions has been reported rarely in thalamic or striatal hemorrhage, and after infarction of thalamus or striatum and internal capsule shown by CT. In these patients, there may have been compression or ischemia of overlying cerebral cortex and white matter. We report a patient with sensory hemineglect, asomatognosia, and anosognosia caused by infarction of striatum and deep white matter, with involvement of neither cortex nor thalamus and without mass effect. This is the first autopsy-confirmed example of human neglect with involvement of only the striatum and deep white matter.",{},,Neurology,10.1212/wnl.32.7.776,,,Case Reports; Journal Article,United States,eng
36596042,Case report of anosognosia for hemiplegia: A fMRI study.,"Formica, Caterina; De Salvo, Simona; Corallo, Francesco; Latella, Desiree; Mìcchia, Katia; Bonanno, Lilla; Quartarone, Angelo; Marino, Silvia",Formica,"The aim of this study is to verify the functional activation in a patient with anosognosia for hemiplegia following left brain lesions. We report a case of a 53-year-old right-handed female patient. She came to our rehabilitative unit with a diagnosis of an ischemic major stroke in the left internal carotid artery and important hemiplegia to the right side. She underwent functional magnetic resonance imaging (fMRI), during which she performed a motor imagery task. The fMRI assessment showed an ischemic lesion in the frontotemporal and insular left areas. In the fMRI experiment, we revealed activation of the residual neural patterns of both hemispheres. We underlined an interest in the compensation mechanism that involved neural networks near brain lesions and some areas of the contro-lesional hemisphere, suggesting that the synaptic plasticity permitted an intra and inter-hemispheric reorganization of the cerebral system.",{},,Medicine,10.1097/MD.0000000000032526,PMC9803421,,Case Reports; Journal Article,United States,eng
37860783,Anton syndrome with bilateral occipital infarct: A case report.,"Mankoo, Dylan",Mankoo,"Anton syndrome results from damage to the visual cortex of the occipital lobes, where the anterior visual pathways remain intact. This damage results in the characteristic triad of cortical blindness, visual anosognosia, and visual confabulation. This case describes an 80-year-old male with a background of renal transplant 7 years prior, admitted to hospital with worsening transplant function, and soon after developed sudden onset cortical blindness. On examination, the patient was found to be in denial of his blindness and showed signs of visual confabulation, both of which pointed toward a diagnosis of Anton syndrome. Radiological investigation with computed tomography (CT) and magnetic resonance imaging (MRI) revealed bilateral ischemic stroke of the occipital lobes, which was later theorized to have occurred due to sirolimus-induced thrombotic microangiopathy (TMA). To the author's knowledge, this is the first case report of sirolimus-induced TMA, bilateral ischemic occipital lobe stroke, and Anton's syndrome, within the same diagnosis. This case highlights that a diagnosis of bilateral occipital stroke with denial of blindness should suggest a diagnosis of Anton syndrome. This report also discusses the importance of differentiating bilateral occipital infarction on CT imaging, from posterior reversible encephalopathy syndrome (PRES), using MRI.","DictElement({'Year': '2023', 'Month': '10', 'Day': '10'}, attributes={'DateType': 'Electronic'})",2023,Radiology case reports,10.1016/j.radcr.2023.09.036,PMC10582287,Anton syndrome; Neuroradiology; Stroke,Case Reports,Netherlands,eng
25300957,"""Crossed"" somatoparaphrenia: an unusual new case and a review of the literature.","Perren, Fabienne; Heydrich, Lukas; Blanke, Olaf; Landis, Theodor",Perren,"Somatoparaphrenia is a delusional misidentification and confabulation of body parts, usually arm or hand, opposite to a cerebral lesion, generally of the ""minor"" right hemisphere. There is some controversy concerning lesion site (fronto-parietal; parieto-temporal; posterior insula, additional subcortical nuclei) or necessary associated symptoms (hemiparesis/plegia, anosognosia, neglect, position sense deficit). We here present a patient who is unusual in many respects, that is: (1) he is a right-hander with somatoparaphrenia after a ""dominant"" left-hemisphere lesion associated with aphasia and ideo-motor apraxia, but also with right hemineglect. He thus has ""crossed"" somatoparaphrenia; (2) his delusional misidentification concerned the right leg and not the arm or hand; (3) he has no anosognosia; (4) his proprioception is disturbed for the leg only; and (5) the lesion site is very posterior, a left occipito-parietal haemorrhage without involvement of the frontal lobe or the posterior insula. We present this case together with the seven other cases of ""crossed somatoparaphrenia"" with and without aphasia we found since 1935 in the literature and discuss their relevance in relation to the above controversies.","DictElement({'Year': '2014', 'Month': '10', 'Day': '10'}, attributes={'DateType': 'Electronic'})",2014,Experimental brain research,10.1007/s00221-014-4101-z,,,"Case Reports; Journal Article; Research Support, Non-U.S. Gov't; Review",Germany,eng
36324705,Anton syndrome after subarachnoid hemorrhage and delayed cerebral ischemia: A case report.,"Ricardo, Barojas-Alvarez Manuel; Mariana, Longoria-Ibarrola Erika; Al, Sosa-Ortiz; Manuel, Calleja-Castillo Juan; Jesus, Ramirez-Bermudez",Ricardo,"We report the case of a patient with ruptured middle cerebral artery aneurysm, subarachnoid hemorrhage and frontal intracerebral hemorrhage, who secondarily presented with delayed cerebral ischemia and bilateral occipital infarcts, with complete vision loss, visual anosognosia, and confabulations as the main symptoms. Additionally, the patient had defined features of Cotard syndrome, as revealed by persistent nihilistic delusions. The brain imaging studies showed a bilateral occipital ischemic lesion, as well as frontal and parietal hemorrhagic lesions in the right hemisphere. We address the general theories of anosognosia, confabulation and the problem of why a bilateral occipital lesion is not enough for these metacognitive defects to exist. The presence of right frontal and or parietal hemisphere lesions could be necessary features in most cases.","DictElement({'Year': '2021', 'Month': '06', 'Day': '30'}, attributes={'DateType': 'Electronic'})",2021,Cerebral circulation - cognition and behavior,10.1016/j.cccb.2021.100023,PMC9616440,Anton syndrome; Cotard syndrome; Metacognition; Right hemisphere; Stroke; Subarachnoid hemorrhage,Case Reports,Netherlands,eng
34054464,Intentional Supernumerary Motor Phantom Limb after Right Cerebral Stroke: A Case Report.,"Yamada, Mai; Sasahara, Yoshimi; Seto, Makiko; Satoh, Akira; Tsujihata, Mitsuhiro",Yamada,"A 47-year-old right-handed man was admitted to our hospital for rehabilitation after right basal ganglion hematoma. On day 57, he noticed a supernumerary motor phantom limb (SPL) involving his right arm, originating at the level of the elbow. The most notable finding of his SPL was the motor characteristic. When the subject had the intention to move the upper paralyzed limb simultaneously with the trainer's facilitating action, he said ""there is another arm."" The intention to move the paralyzed arm alone or passive movement of the paralyzed arm did not induce the SPL. He showed a severe left sensorimotor impairment and mild hemineglect, but no neglect syndromes of the body (e.g., asomatognosia, somatoparaphrenia, personification and misoplegia, or anosognosia) were observed. Brain MRI demonstrated a hematoma in the right temporal lobe subcortex, subfrontal cortex, putamen, internal capsule, and thalamus. Single-photon emission computed tomography images showed more widespread hypoperfusion in the right hemisphere in comparison to the lesions on MRI. However, the premotor cortex was preserved. Our case is different from Staub's case in that SPL was not induced by the intention to move the paralyzed limb alone; rather, it was induced when the patient intended to move the paralyzed limb with a trainer's simultaneous facilitating action. The SPL may reflect that an abnormal closed-loop function of the thalamocortical system underlies the phantom phenomenon. However, despite the severe motor and sensory impairment, the afferent pathway from the periphery to the premotor cortex may have been partially preserved, and this may have been related to the induction of SPL.","DictElement({'Year': '2021', 'Month': '04', 'Day': '26'}, attributes={'DateType': 'Electronic'})",2021,Case reports in neurology,10.1159/000513302,PMC8138257,Intentional motor phantom limb; Premotor cortex; Stroke; Supernumerary phantom limb,Case Reports,Switzerland,eng
8441373,Elements of cognitive rehabilitation after right hemisphere stroke.,"Calvanio, R; Levine, D; Petrone, P",Calvanio,"There are two basic approaches to cognitive training: (1) impairment training and (2) task specific training. Impairment training addresses impairments common to a number of tasks and attempts to offer a general benefit to all of the tasks at once. Task specific training focuses on the impairments that arise in a single task and attempts to improve performance on that task. Impairment training of spatial disorders following right hemisphere stroke has shown some success when curricula are properly designed. The success, however, is quite limited because of normal cognitive constraints and those occurring after brain damage. Task specific training in conjunction with the combined application of various cognitive principles appears more promising, but as yet, only a few studies exist. The neurologic factors are likely to be the same factors that influence recovery. The factors that influence trainability are lesion topography (size and location of the focus plus premorbid atrophy), lesion chronicity, and the presence of additional cognitive impairments (anosognosia, confusion, and abulia). Other interventions that may be beneficial, even for training resistant patients, include behavior modification, cognitive prostheses, and drugs.",{},,Neurologic clinics,,,,Case Reports; Journal Article; Review,United States,eng
34258945,Rehabilitation of somatoparaphrenia with misoplegia: insights from a single case-pilot study.,"Maggio, Maria Grazia; Naro, Antonino; Calatozzo, Patrizia; Rosa, Gianluca La; Porcari, Bruno; Latella, Desiree; Marzullo, Pietro; Calabrò, Rocco Salvatore",Maggio,"Somatoparaphrenia lacka ownership of a paralyzed limb, i.e., the illusion that one's limbs belong to someone else. Somatoparaphrenia is one of the many forms of body misperceptions. We report a case of somatoparaphrenia with misoplegia, characterized by the absence of anosognosia for hemiplegia and personal neglect, following a surgical operation for left parietal meningioma. The patient received a novel multidisciplinary treatment, including motor rehabilitation training, traditional physiotherapy and robotic rehabilitation using the Hunova Movendo Technology and psychological counseling. At the end of the training, the patient improved in global cognitive functioning, mood, motor abilities, and the perception of herself and her body, reducing the sense of estrangement and repulsion in the lower right limb. Our result showed the importance of a specific neuropsychological assessment in patients with parietal brain lesions and the usefulness of an integrated psychological and motor approach in rehabilitating patients with somatoparaphrenia, primarily when associated with misoplegia.",{},,Journal of integrative neuroscience,10.31083/j.jin2002046,,Anosognosia; Body representation; Psychological counseling; Robotic device; Robotic rehabilitation,Case Reports,Singapore,eng
34629044,Safety of Intravenous Thrombolysis and Mechanical Thrombectomy in Bilateral Posterior Cerebral Artery Territory Infarction.,"Acampa, Maurizio; Guideri, Francesca; Bracco, Sandra; Tassi, Rossana; Domenichelli, Carlo; Lazzerini, Pietro Enea; Cioni, Samuele; Martini, Giuseppe",Acampa,"Acute bilateral blindness is an uncommon phenomenon that requires immediate diagnosis and action. The emergent evaluation should concentrate on an early distinction between ocular, cortical, and psychogenic etiologies. To present a case of cortical blindness without anosognosia due to the embolic occlusion of both posterior cerebral arteries (PCAs) and treated by intravenous and mechanical thrombolysis. A 67-year-old woman was admitted to the Stroke Unit due to cortical blindness without anosognosia. At the admission to the hospital, an emergent computed tomography scan of the brain ruled out intracranial acute hemorrhage and showed subtle changes consistent with hyperacute ischemia of the left occipital cortex, while a CT angiography demonstrated the occlusion of the P3 segment of both right and left posterior cerebral arteries. The patient was treated with combined thrombolysis (intravenous and mechanical thrombolysis), obtaining complete revascularization and a significant clinical improvement. Even if there is no randomized controlled trial to compare the effectiveness and safety of mechanical thrombectomy (MT) to intravenous thrombolysis in patients with posterior circulation occlusion, the good outcome of this case encourages combined stroke treatments in posterior circulation stroke, even in case of mild but disabling neurological deficits.",{},,Current drug safety,10.2174/1574886316666211008140212,,Cortical blindness; Penumbra 4Max; alteplase; case report; mechanical thrombolysis; posterior cerebral artery; stent retriever,Case Reports,United Arab Emirates,eng
31977238,The behavioral presentation of an individual with a disordered sense of self.,"Johnstone, Brick; Kvandal, Aimee; Winslow, Robin; Kilgore, Jocelyn; Guerra, Melissa",Johnstone,"There is increased recognition that the brain processes a ""sense of self"" (best understood as a sense of ""mineness"") in the right hemisphere association area and which can be distorted due to neurologic injury. Although there are numerous descriptions of types of disorders of the self (e.g., asomatognosia, anosognosia, mirror misidentification disorder, Capgras syndrome, schizophrenia), there are few descriptions of the subjective experiences of individuals with traumatic brain injury (TBI) who experience a reduced sense of self. This article presents a longitudinal case study of a woman in her early 40s with a primarily right hemisphere TBI and disorder of the self who had difficulties relating her experiences from the perspective of the self. Subjective interviews, neuropsychological test scores, and objective personality testing illustrate how she reported her experiences of a diminished sense of self, and how this sense of self improved over the normal course of recovery following the TBI. This case demonstrates clinically relevant information regarding how individuals with a reduced ""sense of self"" (i.e., ""mineness"") associated with a right hemisphere TBI may report their subjective experiences and perform on objective testing.","DictElement({'Year': '2020', 'Month': '01', 'Day': '24'}, attributes={'DateType': 'Electronic'})",2020,Brain injury,10.1080/02699052.2020.1717622,,Traumatic brain injury; disorder of the self; right hemisphere parietal lobe; sense of self,Case Reports; Journal Article,England,eng
37795056,Anton-Babinski Syndrome in a Recurrent Ischemic Stroke Patient: A Case Report.,"Pong, Mei Yin; Yap, Jun Fai; Chung, Tze Yang; Chan, Soo Chin; Sabirin, Sakinah",Pong,"Anton-Babinski syndrome (ABS) is a rare neuropsychiatric condition characterized by visual anosognosia (denial of vision loss) and confabulation in the presence of intact anterior visual tracts. The most common cause of ABS is a cerebrovascular accident involving bilateral occipital lobe injuries with varying degrees of cortical blindness. In this report, we present the case of a woman with suspected ABS following a recurrent ischemic stroke in Malaysia. Establishing a proper diagnosis of stroke is crucial for modifying rehabilitation goals to ensure improved functional outcomes.","DictElement({'Year': '2023', 'Month': '09', 'Day': '03'}, attributes={'DateType': 'Electronic'})",2023,Cureus,10.7759/cureus.44599,PMC10546808,cerebrovascular accident; confabulation; cortical blindness; malaysia; visual anosognosia,Case Reports,United States,eng
