pmid,title,authors,first_author,abstract,publication_date,publication_year,journal_info,doi,pmcid,keywords,article_type,country,language
34079388,Fatal Autoimmune Anti-NMDA-Receptor Encephalitis with Poor Prognostication Score in a Young Kenyan Female.,"Rakiro, Joe; Sokhi, Dilraj",Rakiro,"Auto-immune N-methyl-D-aspartate receptor encephalitis (NMDARE) is a relatively recently described cause of acute encephalopathy with very few reports from sub-Saharan Africa (SSA). We report a case of NMDARE in a young Kenyan female who was transferred to our facility with headaches, insomnia, behaviour changes and latterly pathognomonic orofacial dyskinesias. We comprehensively ruled out infectious and other inflammatory/auto-immune causes. She was diagnosed with NMDARE by positive antibody testing in serum and cerebrospinal fluid and changes on brain magnetic resonance imaging. She was immunosuppressed with high-dose steroids, intravenous immunoglobulins, plasma exchange and rituximab, and showed signs of neurological improvement clinically and radiologically. Unfortunately, she succumbed to septic shock from prolonged intensive care. This is the first report of NMDARE in an indigenous patient from the eastern SSA. The majority (>80%) of patients are either left with mild disability or make a full recovery after NMDARE, but some factors - which comprise the NMDARE One-Year Functional Status (NEOS) prognostication score - can adversely affect outcome, as was the case in our patient.","DictElement({'Year': '2021', 'Month': '05', 'Day': '24'}, attributes={'DateType': 'Electronic'})",2021,International medical case reports journal,10.2147/IMCRJ.S311071,PMC8164334,anti-NMDA receptor encephalitis; auto-immune encephalitis; sub-Saharan Africa,Case Reports,New Zealand,eng
20201914,Chronic traumatic encephalopathy (CTE) in a National Football League Player: Case report and emerging medicolegal practice questions.,"Omalu, Bennet I; Hamilton, Ronald L; Kamboh, M Ilyas; DeKosky, Steven T; Bailes, Julian",Omalu,"We present a case of chronic traumatic encephalopathy (CTE) in a retired National Football League (NFL) Player with autopsy findings, apolipoprotein E genotype, and brain tissue evidence of chronic brain damage. This 44-year-old retired NFL player manifested a premortem history of cognitive and neuropsychiatric impairment, which included in part, chronic depression, suicide attempts, insomnia, paranoia, and impaired memory before he finally committed suicide. A full autopsy was performed with Polymerase Chain Reaction-based analyses of his blood to determine the apolipoprotein genotype. Histochemical and immunohistochemical analyses were performed on topographical gross sections of the brain. Autopsy confirmed a fatal gunshot wound of the head. The apolipoprotein E genotype was E3/E3 and the brain tissue revealed diffuse cerebral taupathy (Neurofibrillary Tangles and Neuritic Threads). This will be the third case of CTE in a national football player, which has been reported in the medical literature. Omalu et al., reported the first two cases in 2005 and 2006. This case series manifested similar premortem history of neuropsychiatric impairment with autopsy evidence of cerebral taupathy without any neuritic amyloidopathy. For a definitive diagnosis of CTE to be made, and for medicolegal purposes, a full autopsy must be performed with histochemical and immunohistochemical analyses of the brain to identify the presence of Neurofibrillary Tangles (NFTs) and Neuritic Threads (NTs). Further longitudinal prospective studies are required to confirm the common denominators and epidemiology of CTE in professional American football players, which have been identified by this case series.",{},,Journal of forensic nursing,10.1111/j.1939-3938.2009.01064.x,,,Case Reports; Journal Article,United States,eng
26922624,Sleep disturbances in voltage-gated potassium channel antibody syndrome.,"Barone, Daniel A; Krieger, Ana C",Barone,"Voltage-gated potassium channels (VGKCs) are a family of membrane proteins responsible for controlling cell membrane potential. The presence of antibodies (Ab) against neuronal VGKC complexes aids in the diagnosis of idiopathic and paraneoplastic autoimmune neurologic disorders. The diagnosis of VGKC Ab-associated encephalopathy (VCKC Ab syndrome) should be suspected in patients with subacute onset of disorientation, confusion, and memory loss in the presence of seizures or a movement disorder. VGKC Ab syndrome may present with sleep-related symptoms, and the purpose of this communication is to alert sleep and neurology clinicians of this still-under-recognized condition. In this case, we are presenting the VGKC Ab syndrome which improved after treatment with solumedrol. The prompt recognition and treatment of this condition may prevent the morbidity associated with cerebral atrophy and the mortality associated with intractable seizures and electrolyte disturbances.","DictElement({'Year': '2015', 'Month': '12', 'Day': '02'}, attributes={'DateType': 'Electronic'})",2015,Sleep medicine,10.1016/j.sleep.2015.11.012,,Insomnia; Neuromyotonia; Paraneoplastic; Parasomnia; Voltage-gated potassium antibody syndrome,Case Reports; Journal Article,Netherlands,eng
21112466,"Neuromyelitis optica, psychiatric symptoms and primary polydipsia: a case report.","Woolley, Josh; Douglas, Vanja C; Cree, Bruce A C",Woolley,"Neuromyelitis optica (NMO) is an aggressive demyelinating disease that typically affects the optic nerves and spinal cord. While it is increasingly recognized that cerebral lesions are common in NMO, there have been no reported cases of NMO presenting with psychiatric symptoms and polydipsia. We describe a patient with classic signs and symptoms of NMO who also demonstrated prominent psychiatric symptoms and polydipsia that were tied to his flares and resolved with treatment of his NMO. This case expands our understanding of possible presentations of NMO.",{},,General hospital psychiatry,10.1016/j.genhosppsych.2010.07.009,,,Case Reports; Journal Article,United States,eng
26087849,Successful delivery of adjuvant external beam radiotherapy for ependymoma in a patient with Ondine׳s curse.,"Choi, Mehee; Thoma, Miranda; Tolekidis, George; Byrne, Richard W; Diaz, Aidnag Z",Choi,"Ondine׳s curse is a rare, potentially life-threatening disorder characterized by loss of automatic breathing during sleep and preserved voluntary breathing. It is seldom encountered in the radiotherapy clinic but can pose significant technical challenges and safety concerns in the delivery of a prescribed radiation course. We report a unique case of successful delivery of radiotherapy for ependymoma in a patient with Ondine׳s curse. A 53-year-old gentleman presented with vertigo when lying down. Brain magnetic resonance imaging revealed an enhancing mass in the floor of the fourth ventricle. He underwent maximal safe resection. Pathology revealed ependymoma. The patient was referred for radiotherapy. Computed tomography simulation was performed in supine position with 3-point thermoplastic mask immobilization. Sequential TomoTherapy plans were developed. At first scheduled treatment, shortly after mask placement, his arms went limp and he was unresponsive. Vitals showed oxygen saturation 83%, pulse 127, and blood pressure 172/97mmHg. He was diagnosed with Ondine׳s curse thought secondary to previous brainstem damage; the combination of lying flat and pressure from the mask was causing him to go into respiratory arrest. As supine positioning did not seem clinically advisable, he was simulated in prone position. A RapidArc plan and a back-up conformal plan were developed. Prescriptions were modified to meet conservative organs-at-risk constraints. Several strategies were used to minimize uncertainties in set-up reproducibility associated with prone positioning. He tolerated prone RapidArc treatments well. The report highlights the importance of applying practical patient safety and treatment planning/delivery strategies in the management of this challenging case.","DictElement({'Year': '2015', 'Month': '06', 'Day': '15'}, attributes={'DateType': 'Electronic'})",2015,Medical dosimetry : official journal of the American Association of Medical Dosimetrists,10.1016/j.meddos.2015.05.002,,Ependymoma; Ondine׳s curse; Prone positioning; Radiotherapy,Case Reports; Journal Article,United States,eng
8925593,Multiple sclerosis with medullary plaques and fatal sleep apnea (Ondine's curse).,"Auer, R N; Rowlands, C G; Perry, S F; Remmers, J E",Auer,"We report 2 patients with multiple sclerosis (MS) who were symptomatic but ambulatory, and died in their sleep. Sleep studies in 1 patient showed hypercarbia and hypoxia accompanying sleep. In both cases autopsy showed plaques of multiple sclerosis in the medulla oblongata, incompletely involving the neuroanatomic areas of the medullary reticular formation controlling automatic breathing. A systematic analysis of the location of the plaques in relation to areas known to be important in breathing control revealed that the regions corresponding to the ventral nuclear complex of respiratory control in animals were incompletely and unilaterally involved in both cases. Close correlation with nuclei that have been demonstrated in animal experiments to be important in descending respiratory control of phrenic and intercostal musculature was not possible due to possible differences in anatomy between animals and humans, and the fact that plaques of MS affect axons of passage and spare neuronal cell bodies. Nevertheless, the cases clearly illustrate that patchy, unilateral lesions of the medullary reticular formation in humans can give rise to sleep disordered breathing. The cases also illustrate the risk of death during sleep in MS patients with demyelination in the medulla oblongata, and demonstrate the need to carefully examine the medulla in MS patients if they die unexpectedly during sleep.",{},,Clinical neuropathology,,,,Case Reports; Journal Article,Germany,eng
10570765,Persisting insomnia following traumatic brain injury.,"Tobe, E H; Schneider, J S; Mrozik, T; Lidsky, T I",Tobe,"Persisting insomnia secondary to traumatic brain injury, rarely reported and documented, is described in an adult male following head injury. The neuronal mechanisms underlying this sleep disorder as well as the neuropsychological concomitants and therapeutic approaches are discussed.",{},,The Journal of neuropsychiatry and clinical neurosciences,10.1176/jnp.11.4.504,,,Case Reports; Journal Article,United States,eng
15273856,Acquired Ondine's curse: case report.,"Schestatsky, Pedro; Fernandes, Luis Nelson Teixeira",Schestatsky,"We report and discuss the case of a 55-year old man who presented a history of stroke as well as chronic obstructive pulmonary disease. When admitted into the emergency room, he was diagnosed with a vertebro-basilar syndrome. A brain MRI showed a hyperintense area in the lower right brainstem laterally within the medulla, which corresponds to the area of the pathways descending from the autonomic breathing control center. During hospitalization, the patient had several episodes of prolonged apnea, mainly when asleep, having often to be ""reminded"" to breath. A tracheostomy was then performed with the patient under mechanical ventilation. Treatment with medroxyprogesterone, fluoxetine and acetazolamide was also started. He was discharged after 64 days breathing environmental air with no apparent episodes of apnea. He returned to the emergency room in the following day with a clinical picture of aspiration bronchopneumonia, followed by septic shock and death. the Ondine's curse is one of the posterior stroke's presentation characterized by loss of automatic breathing and for the unpredictability of clinical evolution and prognosis. Such a syndrome has rarely been reported in adults and the diagnostic criteria are not consensual in the reviewed literature. Thus any diagnostic confirmation should be flexible. There are many therapeutic symptomatic options in such cases, ranging from pharmacologic approach, use of bilevel positive airway pressure and implantation of diaphragmatic pacemaker.","DictElement({'Year': '2004', 'Month': '07', 'Day': '20'}, attributes={'DateType': 'Electronic'})",2004,Arquivos de neuro-psiquiatria,10.1590/s0004-282x2004000300027,,,Case Reports; Journal Article,Germany,eng
18226667,Transient reversal of anoxic brain injury-related minimally conscious state after zolpidem administration: a case report.,"Shames, Jeffrey L; Ring, Haim",Shames,"Zolpidem is a unique nonbenzodiazepine sedative hypnotic drug that selectively binds to omega-1 gamma-aminobutyric acid receptors in the brain. Although used for years in Israel and abroad for insomnia, there have been periodic reports of unusual or remarkable neurologic effects in patients with various brain pathologies. Here, we report on a 50-year-old woman 18 months after severe anoxic brain injury in a minimally conscious state. Residual deficits included mutism, athetoid movements of the extremities, and complete dependence for all personal care. After the administration of 5 to 10mg of zolpidem, within 45 minutes, the patient's condition improved markedly, including the cessation of athetoid movements, regained speaking ability, and ability to perform various tasks including self-feeding. These effects lasted 3 to 4 hours, after which the patient returned to her former state. This effect was repeatable on a daily basis. Existing evidence and possible mechanisms to explain zolpidem's effects in brain injury are described.",{},,Archives of physical medicine and rehabilitation,10.1016/j.apmr.2007.08.137,,,Case Reports; Journal Article,United States,eng
28072702,Hypersomnia due to injury of the ventral ascending reticular activating system following cerebellar herniation: A case report.,"Jang, Sung Ho; Chang, Chul Hoon; Jung, Young Jin; Kwon, Hyeok Gyu",Jang,"We report on a patient with hypersomnia who showed injury of the lower ascending reticular activating system (ARAS) following cerebellar herniation due to a cerebellar infarct, detected on diffusion tensor tractography (DTT). A 53-year-old male patient was diagnosed as a left cerebellar infarct, and underwent decompressive suboccipital craniectomy due to brain edema at 2 days after the onset of a cerebellar infarct. Three weeks after onset when the patient started rehabilitation, he showed hypersomnia without impairment of consciousness; he fell asleep most of daytime without external stimulation and showed an abnormal score on the Epworth Sleepiness Scale: 15 (full score: 24, cut off for hypersomnia: 10). On 3-week DTT, narrowing of the upper portion of the lower ventral ARAS between the pontine reticular formation and the hypothalamus was observed on both sides. In addition, partial tearing was observed in the middle portion of the right lower ventral ARAS. In conclusion, we found injury of the lower ventral ARAS in a patient with hypersomnia following cerebellar herniation due to a cerebellar infarct.",{},,Medicine,10.1097/MD.0000000000005678,PMC5228662,,Case Reports; Journal Article,United States,eng
34031349,Immature ovarian teratoma with anti-NMDA-receptor encephalitis in a 13-year-old Japanese female patient.,"Imataka, G; Yoshihara, S",Imataka,"We report a 13-year-old Japanese female with ovarian teratoma due to anti-NMDAR encephalitis. The patient was admitted with psychiatric symptoms, including memory impairment, insomnia, binge eating and mouth and hand twisting, associated with constipation. Serum alphafetoprotein and neopterin levels were elevated 102 ng/mL and 19 pmol/mL, respectively. Electroencephalography showed epileptic spikes in frontal and temporal regions. Cerebrospinal fluid (CSF) examination exhibited a pleocytosis. Thereafter, her consciousness level immediately worsened. Brain magnetic resonance imaging (MRI) noted hyper intense lesions in bilateral hippocampi, she was diagnosed with limbic encephalitis. Abdominal echogram showed a solid right ovarian tumour. and also confirmed as a tumour by abdominal MRI. The next day, right ovariectomy was performed and she treated two courses of methyl-prednisolone steroid pulse with high-dose immunoglobulins. Later days, CSF analysis revealed anti- NMDAR antibodies. Pathological diagnosis of the tumour was immature round shaped grade 3 ovarian teratoma, measuring 11cm. Two years follow up after admission, she completely recovered and no neurological sequelae.",{},,The Medical journal of Malaysia,,,,Case Reports; Journal Article,Malaysia,eng
26346787,Sleep bruxism possibly triggered by multiple sclerosis attacks and treated successfully with botulinum toxin: Report of three cases.,"Sevim, Serhan; Kaleağası, Hakan; Fidancı, Halit",Sevim,"Sleep bruxism refers to a nocturnal parafunctional activity including the clenching, grinding or gnashing of teeth. While most of the nocturnal bruxism cases seen in the general population are apparently idiopathic, it has been reported to be associated with a range of neurological diseases such as Huntington's disease, cranio-cervical dystonia and post-anoxic brain damage, but not multiple sclerosis (MS). We describe three cases of MS patients who have had moderate to severe complaints of bruxism in the two weeks following their relevant MS attacks. None of the three patients had a diagnosis of bruxism prior to her attack. The diagnosis was confirmed in one out of three by a polysomnography. One patient did not have any complaints related to bruxism previous to her attack, whereas two had mild and infrequent complaints. The symptoms of the relevant attacks were left hemihypesthesia in all and hemiparesis in two. None of the patients had spasticity that could result in severe teeth clenching. All three patients presented with morning headaches and jaw pain or tightness and were treated successfully with botulinum toxin (Btx) injections applied to their masseter and temporalis muscles. The cause of bruxism is controversial but lesions of the cortico-basalganglia-thalamo-cotrical loops are thought to be most likely. However, acute or chronic lesions in those pathways were not demonstrated in the 3 patients. It is feasible that they had normal appearing white matter interruptions in their cortico-basalganglia-thalamocortical loops along with their relevant attack.","DictElement({'Year': '2015', 'Month': '06', 'Day': '14'}, attributes={'DateType': 'Electronic'})",2015,Multiple sclerosis and related disorders,10.1016/j.msard.2015.06.006,,Attack; Botulinum toxin; Bruxism; Multiple sclerosis; Treatment,Case Reports; Journal Article,Netherlands,eng
25160125,Sudden onset of sleep due to hypothalamic lesions in neuromyelitis optica spectrum disorder positive for anti-aquaporin-4 antibody.,"Okuma, H; Matsumura, K; Hatanaka, Y; Saito, F; Sonoo, M",Okuma,"We report a patient with neuromyelitis optica spectrum disorders who presented with sudden onset of sleep as the sole manifestation. Magnetic resonance imaging investigation revealed lesions in the hypothalamus bilaterally, which vanished completely after methylprednisolone pulse therapy.",{},,"Multiple sclerosis (Houndmills, Basingstoke, England)",10.1177/1352458514540359,,MRI findings; Multiple sclerosis; anti-aquaporin-4 antibody; hypothalamic lesion; neuromyelitis optica; sudden onset of sleep,Case Reports; Journal Article,England,eng
15295756,Cognitive behavioral therapy for insomnia associated with traumatic brain injury: a single-case study.,"Ouellet, Marie-Christine; Morin, Charles M",Ouellet,"To test the efficacy of a cognitive behavioral therapy (CBT) for insomnia with a patient with traumatic brain injury (TBI). Single-case study. Outpatient rehabilitation center. A man in his late thirties who sustained a moderate TBI in a motor vehicle crash and who developed insomnia. He complained of difficulties falling asleep and staying asleep, despite pharmacotherapy with zopiclone. Eight weekly individual CBT sessions. Treatment included stimulus control, sleep restriction, cognitive therapy, and sleep hygiene education. Sleep diary and polysomnography data. Sleep onset decreased from 47 to 18 minutes, and nocturnal awakenings dropped from 85 to 28 minutes on average at posttreatment. Sleep efficiency also increased substantially (58% to 83%). Polysomnography evaluations corroborated the diary data by showing a decrease in total time awake (63.2 to 26.3 min) and in the number of awakenings (21 to 7.5). The majority of gains were well maintained at 1- and 3-month follow-up assessments. These preliminary results suggest that sleep disturbances after TBI can be alleviated with a nonpharmacologic intervention. CBT for post-TBI insomnia is a promising therapeutic avenue deserving more scientific and clinical attention.",{},,Archives of physical medicine and rehabilitation,10.1016/j.apmr.2003.11.036,,,"Case Reports; Journal Article; Research Support, Non-U.S. Gov't",United States,eng
37982250,Peduncular hallucinosis associated with pontine hemorrhage in an adult patient.,"Papantoniou, Michail; Panagou, Georgia; Gryllia, Maria",Papantoniou,"Peduncular hallucinosis refers to a rare neurophychiatric disorder presenting with vivid visual hallucinations, disturbances of sleep, and oculomotor dysfunction. It is typically caused by mesencephalic lesions. Nonetheless, a few cases have also been reported, in which the same syndrome was associated with thalamic and pontine lesions. We report the case of a 63-year-old male patient presenting to the Emergency Department of our hospital with irritability, gait difficulty, and diplopia of sudden onset two hours ago. Neurological examination revealed dysarthria, right facial palsy, bilateral gaze palsy, dysmetria of his left extremities, left-sided hemihypaethesia and extensory plantar response on the left. Brain computerized tomography (CT) showed a hemorrhagic lesion on the right lateral side of the pons. During his hospitalization at the Department of Neurology, he developed visual hallucinations, confusion, disorientation, insomnia, and strong emotional response. An extensive laboratory screening was performed and showed no abnormal findings. Suspecting peduncular hallucinosis due to the brainstem lesion, treatment with quetiapine and melatonin was administered to the patient and symptoms resolved completely within days. Subsequently, gradual neurological clinical improvement was also noted and two weeks after his admission, a repeated brain CT and a brain magnetic resonance imaging (MRI) showed partial absorption of the brainstem hemorrhage. The patient underwent rehabilitation for two months, showing further clinical improvement, and treatment with quetiapine and melatonin was discontinued without any further episodes being noted. A repeated brain MRI was performed two months after his admission to our hospital and showed no hemorrhage, but a mixed signal intensity core and a hypointense hemosiderin rim at the location of the absorbed hemorrhagic lesion, compatible with pontine carvenoma. Peduncular hallucinosis is most commonly associated with ischemic lesions of the posterior brain blood circulation, but different lesions have been reported, like vasospasm, brain tumors, encephalitis, hemorrhage associated with vascular malformations, such as a carvenoma, as seen in our case, representing a very rare form of peduncular hallucinosis.","DictElement({'Year': '2023', 'Month': '11', 'Day': '14'}, attributes={'DateType': 'Electronic'})",2023,Psychiatrike = Psychiatriki,10.22365/jpsych.2023.026,,Peduncular hallucinosis; carvenoma; case report; hemorrhage; pons,Case Reports,Greece,eng
3717910,Narcolepsy following cerebral hypoxic ischemia.,"Rivera, V M; Meyer, J S; Hata, T; Ishikawa, Y; Imai, A",Rivera,"A 51-year-old man with non-HLA-DR2 histocompatibility developed classic signs and symptoms of the narcoleptic tetrad soon after recovering from an episode of cardiopulmonary insufficiency, which occurred during induction of surgical anesthesia. Symptoms included excessive daytime sleepiness, hypnagogic hallucinations, sleep paralysis, and cataplexy. The diagnosis was confirmed by repeated polysomnographic examinations in the sleep laboratory. Cerebral hemodynamic changes during the onset of sleep showed remarkable increases of cerebral blood flow during the onset of rapid-eye-movement sleep similar to those reported previously in patients with narcolepsy. Magnetic resonance imaging showed focal regions of abnormal spin-echo signals in the ventral pons.",{},,Annals of neurology,10.1002/ana.410190516,,,"Case Reports; Journal Article; Research Support, Non-U.S. Gov't; Research Support, U.S. Gov't, Non-P.H.S.",United States,eng
