pmid,title,authors,first_author,abstract,publication_date,publication_year,journal_info,doi,pmcid,keywords,article_type,country,language
34726562,Application of step and beat alignment approaches and its effect on gait in progressive multiple sclerosis with severe cerebellar ataxia: A proof of concept case study.,"Moumdjian, Lousin; Moens, Bart; Van Wijmeersh, Bart; Leman, Marc; Feys, Peter",Moumdjian,"In a case report of a progressive multiple sclerosis with cerebellar impairments, we reported that synchronisation of steps to beats was possible only at -12% of usual walking cadence during 1 minute of walking. Here, we investigate the effect of synchronisation using two different alignment approaches on the patient's gait pattern over 2 minutes of walking, compared to walking in silence. This proof of concept showed that the adaptive approach was successful resulting in an improved gait pattern compared to the other conditions, providing preliminary evidence to support a full-scale intervention study.","DictElement({'Year': '2021', 'Month': '11', 'Day': '02'}, attributes={'DateType': 'Electronic'})",2021,"Multiple sclerosis (Houndmills, Basingstoke, England)",10.1177/13524585211054000,,Multiple sclerosis; adaptive alignment approach; gait; music; non-adaptive alignment approach; synchronisation; −12% tempo,"Case Reports; Journal Article; Research Support, Non-U.S. Gov't",England,eng
15995831,Multiple sclerosis coinciding with Machado-Joseph disease.,"Röhl, J E; Lünemann, J D; Zimmer, C; Zschenderlein, R; Valdueza, J M",Röhl,"Although inflammatory demyelination is considered to be the key feature in multiple sclerosis (MS) pathogenesis, histopathological investigations and MRI studies recently highlighted the extent of neuronal damage that occurs even in the early stages of the disease. We report the unusual case of a patient with Machado-Joseph disease (MJD; spinocerebellar ataxia (SCA) III) and discuss this coincidence in light current pathogenetic paradigms of CNS autoimmunity.",{},,Neurological sciences : official journal of the Italian Neurological Society and of the Italian Society of Clinical Neurophysiology,10.1007/s10072-005-0447-0,,,Case Reports; Journal Article,Italy,eng
11721107,Internuclear ophthalmoplegia and cerebellar ataxia: report of one case.,"Krespi, Y; Aykutlu, E; Coban, O; Tunçay, R; Bahar, S",Krespi,"Deep hemispheric or brainstem small infarcts can lead to atypical lacunar syndromes. Unilateral internuclear ophthalmoplegia (INO) and cerebellar ataxia has not been reported previously. A 57-year-old hypertensive female presented with bilateral appendicular and left truncal cerebellar ataxia and right INO. Cranial MRI showed a right paramedian infarct of lacunar size located in the tegmentum of caudal mesencephalon. At this level the involvement of medial longitudinal fascicle (MLF) led to right INO and the lesion of brachium conjunctivum caused the bilateral cerebellar ataxia. Ipsilateral involvement of both cerebellofugal fibers, before and after decussation, was responsible for bilateral cerebellar ataxia.",{},,"Cerebrovascular diseases (Basel, Switzerland)",10.1159/000047733,,,Case Reports; Journal Article,Switzerland,eng
15804250,Thalamic infarct presenting with thalamic astasia.,"Lee, P H; Lee, J H; Joo, U S",Lee,"Astasia, inability to stand unsupported despite good strength, resembles the marked balance impairment of patients with vestibulocerebellar disease. We describe a patient with unilateral thalamic infarct that presented with astasia. A 76-year-old hypertensive woman was admitted to our hospital because of marked unsteadiness. On neurological examination, she could not stand unsupported and the woman's body swayed back and forth markedly. The swaying was not compensated for by her taking a step forward or backward, and she frequently collapsed when support was withdrawn. Diffusion-weighted magnetic resonance image revealed a discrete infarct within the right posterolateral thalamus. Brain single photon emission computerized tomography revealed markedly decreased regional cerebral blood flow within in the right thalamus with concomitant left superior cerebellar region. We discuss the possible pathomechanisms of thalamic astasia.",{},,European journal of neurology,10.1111/j.1468-1331.2004.01020.x,,,Case Reports; Journal Article,England,eng
26483389,Intimal (spindle cell) sarcoma of the left atrium presenting with abnormal neurological examination.,"Saith, Sunil Evan; Duzenli, Anthony; Zavaro, Doris; Apergis, George",Saith,"A 43-year-old man with an unremarkable medical history presented to our hospital with 2 weeks of headaches, ataxia and confusion. CT of the head revealed a large haemorrhagic cystic lesion. A subsequent chest CT revealed a large left atrial mass. The mass was subsequently biopsied with positive immunohistochemistry staining for MDM2, FLI1 and vimentin. Real-time PCR revealed MDM2 amplification, confirming the diagnosis of intimal sarcoma. The patient underwent surgical resection and reconstruction of the atrium with subsequent discharge to short-term rehabilitation, but his symptoms continued to progress. A repeat CT of the head revealed a new cerebellar mass. He underwent a second resection, but continued to experience worsening symptoms. He was diagnosed with stage IV intimal sarcoma and referred to hospice. The patient died 5 months after initial presentation. Autopsy was performed and revealed the cause of death as pneumonia. There was no involvement of the pulmonic or aortic vessels.","DictElement({'Year': '2015', 'Month': '10', 'Day': '19'}, attributes={'DateType': 'Electronic'})",2015,BMJ case reports,10.1136/bcr-2015-209493,PMC4612733,,Case Reports; Journal Article,England,eng
30191089,Steroid-responsive Encephalopathy Associated with Autoimmune Thyroiditis (SREAT) Presenting with Pure Cerebellar Ataxia.,"Termsarasab, Pichet; Pitakpatapee, Yuvadee; Frucht, Steven J; Srivanitchapoom, Prachaya",Termsarasab,"Myoclonus and tremor are common movement disorder phenomenologies in steroid-responsive encephalopathy associated with autoimmune thyroiditis (SREAT). Pure ataxia without encephalopathy has rarely been reported. We report 21- and 40-year-old females who presented with subacute pure ataxia without encephalopathy. After immunotherapies, both exhibited initial improvement of ataxia, and subsequently remained in plateau phase. This treatable disorder should be added to the differential diagnoses of progressive cerebellar ataxia, and anti-thyroid peroxidase and anti-thyroglobulin should be considered as part of the workup. It is crucial not to misdiagnose SREAT presenting with pure cerebellar ataxia as degenerative or spinocerebellar ataxia.","DictElement({'Year': '2018', 'Month': '08', 'Day': '09'}, attributes={'DateType': 'Electronic'})",2018,"Tremor and other hyperkinetic movements (New York, N.Y.)",10.7916/D8CZ4QQQ,PMC6125737,Hashimoto encephalopathy; SREAT; ataxia; autoimmune; autoimmune thyroiditis; movement disorders; steroid-responsive encephalopathy associated with autoimmune thyroiditis,Case Reports; Journal Article; Video-Audio Media,England,eng
12847080,"Thalamic involvement in a spinocerebellar ataxia type 2 (SCA2) and a spinocerebellar ataxia type 3 (SCA3) patient, and its clinical relevance.","Rüb, U; Del Turco, D; Del Tredici, K; de Vos, R A I; Brunt, E R; Reifenberger, G; Seifried, C; Schultz, C; Auburger, G; Braak, H",Rüb,"In spite of the considerable progress in clinical and molecular research, knowledge regarding brain damage in spinocerebellar ataxia type 2 (SCA2) and type 3 (SCA3) still is limited and the extent to which the thalamus is involved in both diseases is uncertain. Accordingly, we performed a pathoanatomical analysis on serial thick sections stained for lipofuscin granules and Nissl substance through the thalami of two genetically confirmed cases: one an SCA2 patient, the other an SCA3 patient. During this systematic study, we detected severe destruction of the reticular (RT), fasciculosus (FA), ventral anterior (VA), ventral lateral (VL), ventral posterior lateral (VPL), ventral posterior medial (VPM), cucullar (CU) and mediodorsal thalamic nuclei (MD), the lateral geniculate body (LGB) and inferior nucleus of the pulvinar (PU i) in the SCA2 case, and a severe neuronal loss in the RT, FA, VA and PU i of the SCA3 case. In the SCA2 patient, additional obvious neuronal loss was observed in all nuclei of the anterior and rostral intra laminar groups, in the lateral posterior nucleus (LP), the lateral (PU l) and the medial subnuclei of the pulvinar (PU m), whereas in the SCA3 patient only two of the nuclei that belong to the anterior thalamic group, the VL, VPL, VPM, LP, LGB, PU l and PU m, displayed marked neurodegeneration. These novel findings indicate that thalamic involvement in SCA2 and SCA3 patients has been underestimated in the past. In view of what is known about the functions of the affected thalamic nuclei, the present findings provide an appropriate pathoanatomical explanation for some of the disease-related symptoms seen in both of our and other SCA2 and SCA3 patients: gait, stance, truncal and limb ataxia, dysarthria or anarthria, falls, dysdiadochokinesia and bradykinesia, problems with writing, somatosensory deficits, saccadic dysfunctions, executive dysfunctions and abnormalities of visual evoked potentials.","DictElement({'Year': '2003', 'Month': '07', 'Day': '07'}, attributes={'DateType': 'Electronic'})",2003,Brain : a journal of neurology,10.1093/brain/awg234,,,Case Reports; Journal Article; Review,England,eng
16354739,Sneeze related area in the medulla: localisation of the human sneezing centre?,"Seijo-Martínez, M; Varela-Freijanes, A; Grandes, J; Vázquez, F",Seijo-Martínez,"Sneezing is a rarely explored symptom in neurological practice. In the cat, a sneeze evoking centre is located in the medulla. The existence of a sneezing centre has not been confirmed in humans. A case with abnormal sneezing secondary to a strategic infarct in the right latero-medullary region is presented. A 66 year old man suddenly presented paroxysmal sneezing followed by ataxia, right sided motor and sensory symptoms, and hoarseness. The application of stimuli to the right nasal fossa did not evoke sneezing nor the wish to sneeze. The same stimuli to the contralateral nasal fossa evoked normal sneezing. The preservation of the superficial sensitivity of the nasal fossa indicates that the lesion was localised in the hypothetical human sneezing centre, very close to the spinal trigeminal tract and nucleus. This centre appears to be bilateral and functionally independent on both sides.","DictElement({'Year': '2005', 'Month': '12', 'Day': '14'}, attributes={'DateType': 'Electronic'})",2005,"Journal of neurology, neurosurgery, and psychiatry",10.1136/jnnp.2005.068601,PMC2077498,,Case Reports; Journal Article,England,eng
6689883,Pontine ataxic hemiparesis.,"Van Buggenhout, E; Dehaene, I; Van Zandijcke, M",Van Buggenhout,,{},,Archives of neurology,10.1001/archneur.1984.04050130018011,,,Case Reports; Letter,United States,eng
2305412,Ataxic hemiparesis following thalamic infarction.,"Boiten, J; Lodder, J",Boiten,We describe a 73-year-old man with ataxic hemiparesis following infarction of the ventrolateral nucleus of the thalamus demonstrated by computed tomography and magnetic resonance imaging. Cerebellar ataxia was most likely due to interruption of the dentatorubrothalamocortical fibers at the level of the injured ventrolateral nucleus. Hemiparesis was probably caused by local edema compressing the corticospinal tract in the adjacent posterior limb of the internal capsule. We believe this to be the first reported case of classic ataxic hemiparesis following thalamic infarction.,{},,Stroke,10.1161/01.str.21.2.339,,,Case Reports; Journal Article,United States,eng
19246870,Anterior inferior cerebellar artery dissecting aneurysm in a juvenile: case report.,"Fukushima, Shintaro; Hirohata, Masaru; Okamoto, Yuji; Yamashita, Shin; Ishida, Shigenobu; Shigemori, Minoru",Fukushima,"A 15-year-old girl presented with a distal anterior inferior cerebellar artery (AICA) dissecting aneurysm manifesting as sudden onset of general tonic-clonic convulsion while singing a song. Physical and neurological examinations found headache, vomiting, right perceptive deafness, and right cerebellar ataxia. Cranial magnetic resonance imaging demonstrated a hemorrhagic mass in the brainstem region, and digital subtraction angiography revealed a fusiform dilatation of the anterior pontine segment of the right AICA. The diagnosis was dissecting aneurysm. Endovascular embolization was performed for aneurysm and parent artery occlusion using a Guglielmi detachable coil and 9 TruFill detachable coil systems, respectively, 2 weeks after occipital artery-AICA anastomosis. No ischemic complications were seen, and her neurological deficits completely recovered after the interventional therapy.",{},,Neurologia medico-chirurgica,10.2176/nmc.49.81,,,Case Reports; Journal Article,Japan,eng
8856659,Analysis of ballistic movements in ataxic hemiparesis following a pontine stroke.,"Bartholomé, E; Manto, M; Jacquy, J; Hildebrand, J",Bartholomé,"Although cerebellar-like ataxia is a well known component of the ataxic hemiparesis (AH), the mechanism of hypermetria in AH has not been established. We describe a patient presenting a left AH following a right pontine infarction. We investigated the ballistic flexion movements of both wrists and the associated agonist and antagonist electromyographic (EMG) activities, before and after addition of inertial loads. At the time of motion analysis, neurological examination showed cerebellar-like dysmetria of the left side but the patient had recovered a normal strength. In the basal state (without addition of loads), movements of the left wrist were hypermetric. The duration of the agonist EMG activity was prolonged and the onset latency of the antagonist EMG activity was not delayed. Moreover, when a mass was added, the hypermetria was unchanged because the patient was unable to adapt appropriately neither the agonist, nor the antagonist EMG activity. We suggest that the hypermetria was due to an imbalance between the duration of the agonist EMG activity (the launching force) and the duration of the antagonist EMG activity (the braking force).",{},,Journal of the neurological sciences,,,,"Case Reports; Journal Article; Research Support, Non-U.S. Gov't",Netherlands,eng
31462589,Steroid-responsive Nivolumab-induced Involuntary Movement with Anti-thyroid Antibodies.,"Maetani, Yuta; Nezu, Tomohisa; Ueno, Hiroki; Aoki, Shiro; Hosomi, Naohisa; Maruyama, Hirofumi",Maetani,"We herein report a 68-year-old man with neurologic immune-related adverse events (irAEs) who exhibited nivolumab-induced steroid-responsive progressive ataxia, tremor, and anti-thyroid antibodies. His symptoms matched abnormalities on N-isopropyl-p-(123I)-iodoamphetamine single-photon emission computed tomography (SPECT) and dopamine transporter SPECT. Based on these clinical findings, we diagnosed the patient with a condition similar to the cerebellar type of Hashimoto's encephalopathy with nivolumab-induced anti-thyroid antibodies. Neurologic irAEs can be difficult to diagnose due to their varied clinical courses and lack of specific examinations. Therefore, a comprehensive approach, including assessments of autoantibodies and functional imaging, might be important for the diagnosis of neurologic irAEs.","DictElement({'Year': '2019', 'Month': '08', 'Day': '28'}, attributes={'DateType': 'Electronic'})",2019,"Internal medicine (Tokyo, Japan)",10.2169/internalmedicine.3200-19,PMC6949439,DAT; Hashimoto's encephalopathy; SPECT; anti-thyroid antibody; immune related adverse event; nivolumab,Case Reports; Journal Article,Japan,eng
33001408,Hyperkinetic manifestations in superficial siderosis: evidence for pathogenic network disruption.,"De Mase, Antonio; Saracino, Dario; Andreone, Vincenzo",De Mase,"Superficial siderosis (SS) of central nervous system is a rare condition characterized by hemosiderin deposition diffusely involving supratentorial and infratentorial compartments. SS usually manifests with ataxia and sensorineural hearing loss. Basal ganglia are almost always spared by the degenerative process, and movement disorders are only rarely reported. We describe the case of an aged woman with apparently idiopathic SS presenting with cerebellar ataxia, hearing loss, and orofacial dyskinesias. Together with some previously reported patients affected by SS and presenting with dystonic manifestations, our case reinforces the current hypothesis supporting a wide network disruption, rather than a direct basal ganglia damage, as the likely underlying cause of some dystonic syndromes.","DictElement({'Year': '2020', 'Month': '10', 'Day': '01'}, attributes={'DateType': 'Electronic'})",2020,Neurological sciences : official journal of the Italian Neurological Society and of the Italian Society of Clinical Neurophysiology,10.1007/s10072-020-04771-1,,Dystonia; MRI; Movement disorders; Orofacial dyskinesias; Superficial siderosis,Case Reports; Journal Article,Italy,eng
37864649,Bilateral Cerebellar Repetitive Transcranial Magnetic Stimulation for Chronic Ataxia After Hemorrhagic Stroke: a Case Report.,"Einstein, Evan Hy; Corlier, Juliana; Matthews, Cole; Ngo, Doan; Leuchter, Michael K; Citrenbaum, Cole; Vince-Cruz, Nikita; Ramesh, Bhavna; Slan, Aaron; Wilke, Scott A; Ginder, Nathaniel; Strouse, Thomas; Leuchter, Andrew F",Einstein,"There are insufficient treatment options available for recovery related to cerebellar ataxia. Limited data using repetitive transcranial magnetic stimulation (rTMS) have demonstrated reduction of symptom burden, though associated with nonuniform cerebellar ataxia etiologies and differing rTMS treatment protocols. Additionally, there are limited available data for use of rTMS in individuals suffering from stroke-related symptoms. We present the case of a patient with chronic cerebellar ataxia following a hemorrhagic stroke who underwent inhibitory rTMS to bilateral cerebellar targets with demonstrated improvement in symptoms.","DictElement({'Year': '2023', 'Month': '10', 'Day': '21'}, attributes={'DateType': 'Electronic'})",2023,"Cerebellum (London, England)",10.1007/s12311-023-01618-1,,Ataxia; Cerebellar lesion; Neuromodulation; Post-stroke; rTMS,Case Reports; Journal Article,United States,eng
31843039,Skull Base Calcifying Pseudoneoplasms of the Neuraxis: Two Case Reports and a Systematic Review of the Literature.,"Yang, Kaiyun; Reddy, Kesava; Ellenbogen, Yosef; Wang, Bill Hao; Bojanowski, Michel W; Lu, Jian-Qiang",Yang,"Calcifying pseudoneoplasm of the neuraxis (CAPNON) is a rare tumefactive lesion. CAPNONs can mimic calcified meningiomas at the skull base. Here, we report two cases of CAPNON and present a systematic review of the literature on skull base CAPNONs, to compare CAPNONs with calcified meningiomas. Case 1: A 57-year-old man presented with right-sided lower cranial neuropathies and gait ataxia. He underwent a subtotal resection of a right cerebellopontine angle lesion, with significant improvement of his gait ataxia. However, his cranial neuropathies persisted. Pathological examination of the lesion was diagnostic of CAPNON, with the entrapped nerve fibers identified at the periphery of the lesion, correlating with the patient's cranial neuropathy. Case 2: A 70-year-old man presented with progressive headache, gait difficulty, and cognitive impairment. He underwent a frontotemporal craniotomy for a near-total resection of his right basal frontal CAPNON. He remained neurologically stable 7 years after the initial resection without evidence of disease recurrence. We analyzed 24 reported CAPNONs at the skull base in our systematic review of the literature. Cranial neuropathies were present in 11 (45.8%) patients. Outcomes regarding cranial neuropathies were documented in six patients: two had sacrifice of the nerve function with surgical approaches and four had persistent cranial neuropathies. While CAPNON can radiologically and grossly mimic calcified meningiomas, they are two distinctly different pathologies. CAPNONs located at the skull base are commonly associated with cranial neuropathies, which may be difficult to reverse despite surgical intervention.",{},,The Canadian journal of neurological sciences. Le journal canadien des sciences neurologiques,10.1017/cjn.2019.339,,Calcifying pseudoneoplasm of the neuraxis; Cranial neuropathy; Epithelial membrane antigen; Meningioma mimicker; Skull base,Case Reports; Journal Article; Systematic Review,England,eng
23465509,"Caspr2 antibodies in limbic encephalitis with cerebellar ataxia, dyskinesias and myoclonus.","Balint, Bettina; Regula, Jens Uwe; Jarius, Sven; Wildemann, Brigitte",Balint,"Here we report on a case of contactin-associated protein-2 (Caspr2) antibody positive but voltage gated potassium channel (VGKC) antibody negative limbic encephalitis associated with cerebellar ataxia, myoclonus and dyskinesias with favorable response to immunotherapy. This case underlines the importance of Caspr2-specific antibody testing and demonstrates that Caspr2 antibodies are associated with a broader clinical spectrum than hitherto described.","DictElement({'Year': '2013', 'Month': '03', 'Day': '05'}, attributes={'DateType': 'Electronic'})",2013,Journal of the neurological sciences,10.1016/j.jns.2013.01.040,,,Case Reports; Journal Article,Netherlands,eng
36990717,Clinical Reasoning: An 82-Year-Old Woman With Subacute Ophthalmoparesis and Ataxia.,"Rodrigo-Gisbert, Marc; Llaurado, Arnau; Baucells, Andres; Auger, Cristina; González, Victoria",Rodrigo-Gisbert,"We present the case of an 82-year-old woman with subacute altered mental status, oculomotor disturbances, and ataxia. On examination, she exhibited bilateral ptosis, complete horizontal ophthalmoplegia, and limited vertical eye movements during upgaze associated with prominent truncal ataxia. Cerebral MRI showed a mild hyperintensity on T2 and fluid-attenuated inversion recovery sequences in the posterior brainstem extending to the upper cervical cord, without gadolinium enhancement. Clinical and radiologic features suggested an encephalomyelitis with prominent brainstem involvement. We summarize the comprehensive differential diagnosis in patients with subacute brainstem encephalitis, which includes infectious paraneoplastic syndromes and inflammatory disorders. This case highlights the relevance of performing a wide methodical screening for malignancy in case of negative initial workup.","DictElement({'Year': '2023', 'Month': '03', 'Day': '29'}, attributes={'DateType': 'Electronic'})",2023,Neurology,10.1212/WNL.0000000000207246,PMC10401681,,Case Reports; Journal Article,United States,eng
2360789,The dysarthria-clumsy hand syndrome: a distinct clinical entity related to pontine infarction.,"Glass, J D; Levey, A I; Rothstein, J D",Glass,"Using magnetic resonance imaging, we studied 6 patients with the dysarthria-clumsy hand syndrome. All were found to have pontine infarctions contralateral to the symptomatic side. Clinically, these patients exhibited dysarthria; ""clumsiness,"" characterized by dysmetria, dysrhythmia, dysdiadochokinesia and sometimes truncal and gait ataxia; and mild ipsilateral weakness. Previous clinical-anatomical correlations for this syndrome are limited by inconsistencies in clinical diagnostic criteria and low-resolution imaging methods. In our patients, and in a review of the literature, the overwhelming majority of patients with the dysarthria-clumsy hand syndrome had pontine infarcts. We conclude that if rigid clinical criteria are used, the label of the dysarthria-clumsy hand syndrome predicts a lesion in the contralateral basis pontis.",{},,Annals of neurology,10.1002/ana.410270506,,,Case Reports; Journal Article,United States,eng
18566032,Midbrain lesions and paroxysmal dysarthria in multiple sclerosis.,"Blanco, Y; Compta, Y; Graus, F; Saiz, A",Blanco,"We describe three patients with relapsing-remitting multiple sclerosis who presented with paroxysmal dysarthria. In one patient, the symptoms were the only manifestation of an acute relapse. In the other two patients, the attacks appeared during the recovery of a brainstem relapse. All three patients had an acute lower midbrain lesion. The location was central in two patients and left paramedian in the other, and probably involving cerebellothalamocortical pathways. Treatment with carbamazepine was effective.",{},,"Multiple sclerosis (Houndmills, Basingstoke, England)",10.1177/1352458507087846,,,"Case Reports; Journal Article; Research Support, Non-U.S. Gov't",England,eng
