pmid,title,authors,first_author,abstract,publication_date,publication_year,journal_info,doi,pmcid,keywords,article_type,country,language
23756449,Intra-arterial tissue plasminogen activator for an ischemic stroke in a 21-year-old Hispanic woman with elevated beta human chorionic gonadotropin and complex clinical history.,"Green, Nicholas M",Green,"The following case report discusses a 21-year-old Hispanic woman who was brought to the emergency room for evaluation because of experiencing acute left-sided hemiparesis with anosognosia. Upon further assessment, the patient was found to have a positive blood test for methamphetamines, positive human chorionic gonadotropin for pregnancy, and a history of patent foramen ovale. Neurological examination of the patient revealed left hemiparesis, dysarthria, and homonymous hemianopsia of the left side with a National Institutes of Health Stroke Scale of 12. Given the patient's assessment and positive radiological findings of a clot located within the right M1 segmental branch of the middle cerebral artery territory through the use of computed tomography angiography, deployment of intra-arterial thrombolytics within 6 hours of symptom onset was utilized. The patient's clinical course was complicated by brain swelling requiring intubation. Return of neurological function was assessed with noninvasive and invasive neurological evaluation, which showed full cognitive and physical return of the functional baseline level at discharge.",{},,The Journal of neuroscience nursing : journal of the American Association of Neuroscience Nurses,10.1097/JNN.0b013e318298629c,,,Case Reports; Journal Article,United States,eng
9888147,[Depersonalization syndrome after acquired brain damage. Overview based on 3 case reports and the literature and discussion of etiological models].,"Paulig, M; Böttger, S; Sommer, M; Prosiegel, M",Paulig,"Depersonalization after brain damage is still only rarely reported and poorly understood. We describe three patients between the ages of 21 and 25 who experienced depersonalization and derealization for periods of 6 weeks to 4 months, two after traumatic brain injury, the third after surgical and radiation treatment of a pineocytoma. Each one believed to be living in a nightmare and thought about committing suicide in order to wake up. One patient developed symptoms as described in Cotard delusion. Aspects of neuroanatomy, psychodynamics, and anthropology are discussed with reference to the literature. Frontal and temporal lesions seem only to play a facilitating role but not to be a necessary condition. There is evidence for additional influence of psychological and premorbid personality factors. Summarizing the current state of information we consider depersonalization with the experience of being in a dream or being dead as a heuristic reaction to brain damage. Similar models have already been discussed in neuropsychological disorders as for instance reduplicative paramnesias, neglect, and anosognosia.",{},,Der Nervenarzt,10.1007/s001150050388,,,Case Reports; English Abstract; Journal Article; Review,Germany,ger
21959618,Evaluation of differentiated neurotherapy programs for a patient after severe TBI and long term coma using event-related potentials.,"Pachalska, Maria; Łukowicz, Małgorzata; Kropotov, Juri D; Herman-Sucharska, Izabela; Talar, Jan",Pachalska,"This article examines the effectiveness of differentiated rehabilitation programs for a patient with frontal syndrome after severe TBI and long-term coma. We hypothesized that there would be a small response to relative beta training, and a good response to rTMS, applied to regulate the dynamics of brain function. M. L-S, age 26, suffered from anosognosia, executive dysfunction, and behavioral changes, after a skiing accident and prolonged coma, rendering him unable to function independently in many situations of everyday life. Only slight progress was made after traditional rehabilitation. The patient took part in 20 sessions of relative beta training (program A) and later in 20 sessions of rTMS (program B); both programs were combined with behavioral training. We used standardized neuropsychological testing, as well as ERPs before the experiment, after the completion of program A, and again after the completion of program B. As hypothesized, patient M.L-S showed small improvements in executive dysfunction and behavioral disorders after the conclusion of program A, and major improvement after program B. Similarly, in physiological changes the patient showed small improvement after relative beta training and a significant improvement of the P300 NOGO component after the rTMS program. The rTMS program produced larger physiological and behavioral changes than did relative beta training. A combination of different neurotherapeutical approaches (such as neurofeedback, rTMS, tDCS) can be suggested for similar severe cases of TBI. ERPs can be used to assess functional brain changes induced by neurotherapeutical programs.",{},,Medical science monitor : international medical journal of experimental and clinical research,10.12659/msm.881970,PMC3539468,,Case Reports; Journal Article,United States,eng
6465386,Secondary mania with focal cerebrovascular lesions.,"Cummings, J L; Mendez, M F",Cummings,"The authors describe two patients with secondary mania associated with right thalamic infarctions. Both patients exhibited hemisensory loss, denial of illness, and amnesia for the manic episode. One improved with lithium therapy and the other recovered without specific pharmacologic intervention. A review of reported cases reveals that most focal lesions associated with secondary mania involve the diencephalic region and that the majority of lateralized lesions are on the right side.",{},,The American journal of psychiatry,10.1176/ajp.141.9.1084,,,"Case Reports; Journal Article; Research Support, U.S. Gov't, Non-P.H.S.",United States,eng
21830864,Mirror writing resulting from an egocentric representation disorder: a case report.,"Canzano, L; Piccardi, L; Bureca, I; Guariglia, C",Canzano,"Buchwald (1878 ) used the term 'mirror writing' to indicate writing in the reverse direction to what is normal in a particular language and in which the individual letters are also reversed. Cases of healthy individuals (i.e., Leonardo da Vinci and Lewis Carroll) as well as brain-damaged patients have been described in the literature. Here, we report the case of PM, a 70-year-old right-handed woman who showed right hemiplegia and mirror writing following a stroke in the left lenticular nucleus and internal capsulae. PM underwent a complete neuropsychological evaluation, which included copying, dictation and spontaneous writing in both hemispaces with both hands. She was also tested for topographical disorientation, visuo-spatial disorders and body schema deficits. We observed isolated mirror writing only when PM wrote with the left hand, without differences between hemispaces. She also showed a left-right disorientation, a body topological map disorder and an egocentric misrepresentation. The presence of mirror writing not confined to one hemispace and the co-presence of executive function disorders, as well as anosognosia, suggests damage to our patient's sub-cortical frontal network. As no previous interpretation fits with PM's symptoms, we hypothesize that mirror writing resulted from damage to her egocentric frame of reference. This hypothesis allows us to interpret the patient's array of disorders, including mirror writing, body topological map disorder, left-right confusion and egocentric representation.","DictElement({'Year': '2011', 'Month': '08', 'Day': '10'}, attributes={'DateType': 'Electronic'})",2011,Neurocase,10.1080/13554794.2010.532143,,,Case Reports; Journal Article,England,eng
8810853,[Difficulty in eye opening following left hemispheric infarction-- causative lesion and pathophysiology of abnormalities of the eye and eyelids movements].,"Waragai, M; Shinotoh, H; Kaneko, M; Hattori, T",Waragai,"We reported a patient suffering from difficulty in eye opening following left hemispheric infarction. A 78-year-old left-handed woman with atrial fibrillation had an acute onset of right hemiparesis and difficulty in eye opening. On admission, mild disorientation, vertical gaze palsy, right homonymous hemianopia, anosognosia of right hemiparesis, agnosia of right side of the body and forced grasping reflex of the left hand were seen. She was aware of her difficulty in opening her eyelids. Vertical saccadic eye movements were absent to command but when her head was free to move, the vertical saccadic eye movements improved that may suggest oculomotor apraxia. Bell's phenomenon was absent, and optokinetic responses were normal. Aphasia and facial apraxia were not seen. Brain CT and MRI demonstrated infarction in the territory of the anterior divisions of the left middle cerebral artery which includes the inferior frontal gyrus, middle frontal gyrus, fronto-parietal operculum and temporal operculum. SPECT disclosed hypoperfusion area in the left frontal lobe. No lesion was seen in the midbrain and pons. On the basis of these findings, cerebral emboli of the divisions of the left middle cerebral artery were diagnosed. Until about 11th days from onset, she could not open her eyelids by our verbal commands or even voluntarily, and showed paradoxical contraction of the bilateral orbicularis oculi muscles by verbal commands to open her eyes or when her eyes were forcedly opened by hands. After the 12th days from the onset, she became to be able to open her eyes voluntarily when she was asked to count the number of fingers presented in front of her face and when her families called her, but she could not open her eyes by verbal commands, which may be characteristic of apraxia of eyelid opening. She also had bilateral blephaloptosis when she opened her eyes. Considering this case together with previous reports, embolic lesion of the left cerebral hemisphere including the frontal eye field area and its adjacent areas which may be involved in higher control of eye lid movements and supranuclear vertical gaze movements was thought to cause difficulties in eye opening and vertical gaze palsy.",{},,Rinsho shinkeigaku = Clinical neurology,,,,Case Reports; English Abstract; Journal Article; Review,Japan,jpn
6890164,Embarrassment as the aura of a complex partial seizure.,"Devinsky, O; Hafler, D A; Victor, J",Devinsky,"A man with a grade II astrocytoma in the medial frontal lobe exhibited complex partial seizures, with the aura being a feeling of extreme embarrassment. This previously unreported ictus suggests that an electric discharge in the prefrontal cortex may produce the opposite effect of prefrontal lesions, in which there is a lack of insight and an absence of the capacity for embarrassment.",{},,Neurology,10.1212/wnl.32.11.1284,,,Case Reports; Journal Article,United States,eng
8777393,Modification of perseverative behaviour in an adult with anoxic brain damage.,"Matthey, S",Matthey,"A single-case study is reported of an adult female exhibiting perseverative behaviour on the ward, following anoxic brain damage subsequent to an attempted suicide by hanging. Her behaviour consisted of excessive requests to use the telephone, and was accompanied by a lack of insight, impaired memory and blunted affect, with no evidence of anxiety when prevented from using the telephone. Treatment to reduce the persistent requests was given in two stages, and consisted of feedback, and feedback plus extinction. Results indicated a marked reduction in the perseverative behaviour, though it appeared that this did not generalize to the home environment following the woman's discharge from hospital.",{},,Brain injury,10.1080/026990596124539,,,Case Reports; Journal Article,England,eng
19428388,Self-observation reinstates motor awareness in anosognosia for hemiplegia.,"Fotopoulou, Aikaterini; Rudd, Anthony; Holmes, Paul; Kopelman, Michael",Fotopoulou,"We report a patient with severe anosognosia for hemiplegia, who recovered instantly and permanently when viewing herself in a video replay. We believe the observed dramatic reinstatement of the patient's awareness related to her self-observation 'from the outside' (3rd person perspective) and 'off-line' (at a time later than the actual attempt to execute a movement); her anosognosia had been unaltered when she observed her plegic arm in her ipsilateral visual field (self-observation from a 1st-person perspective and 'on-line'). To our knowledge, the role of self-observation in videos or mirrors has not being assessed in AHP to date. Our study provides preliminary evidence that, when right hemisphere damage impairs the ability to update one's body representation, judgements relying on 3rd-person and off-line self-observation may be spared in some patients and may facilitate 1st person awareness.","DictElement({'Year': '2009', 'Month': '01', 'Day': '19'}, attributes={'DateType': 'Electronic'})",2009,Neuropsychologia,10.1016/j.neuropsychologia.2009.01.018,,,"Case Reports; Journal Article; Research Support, Non-U.S. Gov't",England,eng
2582688,[A case of ischemic oculopathy followed by border zone infarction].,"Oda, Y; Hashimoto, Y; Ueyama, H; Uchino, M; Araki, S",Oda,"We reported a 72-year-old male with ischemic oculopathy due to ophthalmic artery stenosis followed by ipsilateral border zone infarction due to internal carotid artery stenosis. The patient had history of hypertension and diabetes mellitus. He had severe headache and visual disturbance of the right eye. He was diagnosed right neovascular glaucoma and left diabetic retinopathy (simple type), and received diuretics, beta-blockade and other anti-hypertensive drugs. One month later, he noticed left mild hemiparesis in a morning, and he experienced progression of left hemiparesis over a week. He was admitted to our hospital on the 11th day. He showed left complete hemiplegia, left sensory disturbance, anosognosia and left unilateral spatial neglect. His right eye was diagnosed neovascular glaucoma but left eye was normal. The 5th days CT showed low density area in the right terminal zone and bilateral periventricular lucency. At the same area, the 46th days MRI showed high intensity area in the T2-weighted image and low intensity area in the T1-weighted image. Cerebral angiography performed on the 33rd day, disclosed severe kinking at the cervical segment and 50% stenosis at the intracavernous segment in the right internal carotid artery, and 90% stenosis and post-stenotic dilatation of the right ophthalmic artery. Left internal carotid artery had each 60% stenosis at the cervical segment and the intracavernous segment. Left ophthalmic artery had severe stenosis from its beginning to distal part. This infarction was considered berder zone infarction by it's localization (terminal zone) and internal carotid artery stenosis.(ABSTRACT TRUNCATED AT 250 WORDS)",{},,Rinsho shinkeigaku = Clinical neurology,,,,Case Reports; English Abstract; Journal Article,Japan,jpn
19504154,Transient encephalopathy from angiographic contrast: a rare complication in neurointerventional procedures.,"Guimaraens, Leopoldo; Vivas, Elio; Fonnegra, Andrés; Sola, Teresa; Soler, Lluis; Balaguer, Ernest; Medrano, Jaime; Gandolfo, Carlo; Casasco, Alfredo",Guimaraens,"Neurotoxicity from contrast media used in angiography is a rare complication from these procedures. The infrequency with which it is encountered makes it a diagnostic challenge. We present the case of a 51-year-old male who, 30 min after successful angiography for treatment of a right carotid-ophthalmic fusiform aneurysm with a stent, developed psychomotor agitation, disorientation, and progressive left faciobrachial hemiparesis (4/5). An emergency nonenhanced CT showed marked cortical enhancement and edema in the right cerebral hemisphere. Cortical enhancement is thought to be secondary to contrast extravasation due to disruption of the blood-brain barrier. Angiography was performed immediately, without any pathologic findings. After this procedure there was an increase in the left faciobrachial hemiparesis (3/5), right gaze deviation, Gerstmann syndrome, and left anosognosia and left homonymous hemianopsia. Endovenous dexamethasone and mannitol were initiated. Twenty-four hours later an MRI showed no signs of acute infarct, just gyriform signal increase in the right cerebral hemisphere on FLAIR and a decrease in the edema observed before. The patient had progressive improvement of his neurological deficit. A control MRI done 5 days later was normal. The patient recovered completely and was discharged. This rare entity should be kept in mind but diagnosed only when all other causes have been ruled out, because more important and frequent causes, such as acute infarct, must be excluded promptly.","DictElement({'Year': '2009', 'Month': '06', 'Day': '06'}, attributes={'DateType': 'Electronic'})",2009,Cardiovascular and interventional radiology,10.1007/s00270-009-9609-4,,,Case Reports; Journal Article,United States,eng
2364631,[Right-left dissociation of voluntary eyelid closure following right middle cerebral artery infarction].,"Ohkawa, S; Yamadori, A",Ohkawa,"We encountered two patients with right middle cerebral artery infarction who showed a unique eye sign not described so far. Both had suddenly developed central facial weakness, hemiplegia and hemisensory deficit in the left side. Anosognosia for the left hemiplegia, motor impersistence and left unilateral spatial neglect were also present. Initially they showed difficulty in keeping their eyes closed to the same degree on both eyes. However, this symmetrical motor impersistence of eye closing developed into a differential pattern over the days. Thus, on verbal command to close the eyes, the right eye in the non-paretic side would be closed continuously and excessively and in the left eye in the paretic side would be closed slightly and impresistently. This dissociation of eye closure was not observed in spontaneous eye closure. This symptom is close to the contralateral motor impersistence of eye closure which has been attributed to the right hemispheric lesion. But the concurrence of the ipsilateral overcontraction of the orbicularis oculi has not been described to the authors' knowledge. We proposed a hypothesis on this unique right-left dissociation of eye closing behavior.",{},,Rinsho shinkeigaku = Clinical neurology,,,,Case Reports; English Abstract; Journal Article,Japan,jpn
19570175,Anosognosia for right hemiplegia from dominant anterior cerebral artery stroke.,"Robbins, Matthew S; Markowitz, Shira; Saleeb, Mariam; Swerdlow, Michael L; Mabie, Peter C",Robbins,,{},,Journal of the American Geriatrics Society,10.1111/j.1532-5415.2009.02336.x,,,Case Reports; Letter,United States,eng
2598531,[Korsakoff's syndrome as a prominent feature of bilateral paramedian thalamic infarction--a case report].,"Ujike, H; Matsueda, H; Kazahaya, Y; Kuroda, S; Otsuki, S",Ujike,"We reported the first Japanese case of bilateral paramedian thalamic infarction associated with prominent Korsakoff's syndrome. 53-year-old man suffered from semicoma on the morning of September 16th, 1988. After recovery of consciousness disturbance, neurological examination revealed vertical eye gaze palsy, areflexia of lower extremities, apathy with hypersomnia and amnesia. Amnesia was accompanied with prominent confabulation, disorientation and lack of insight into his own disability. While X ray-CT revealed only ambiguous low density area in the bilateral thalamus, MRI of horizontal section by short spin echo revealed symmetrical low signal area restricted in the paramedian area of bilateral thalamus, and that of coronal section revealed characteristic butterfly-shaped lesion. Left BAG revealed that both posterior thalamoperforating arteries showed type 3 variation of Percheron's classification which arisen from artery arcade bridging between both side of interpeduncular segment of posterior cerebral artery. He showed gradual improvement in apathy with hypersomnia and disorientation but not in Korsakoff's syndrome nor ophthalmoplegia.",{},,Rinsho shinkeigaku = Clinical neurology,,,,Case Reports; English Abstract; Journal Article,Japan,jpn
17260805,[Blunt traumatic dissection in common carotid artery with serial morphological changes detected by carotid ultrasonography in the acute phase].,"Ueda, Akihiko; Inatomi, Yuichiro; Yonehara, Toshiro; Hashimoto, Yoichiro; Hirano, Teruyuki; Uchino, Makoto",Ueda,"A 68-year-old man was admitted to our hospital with left hemiparesis, unilateral spatial neglect, and anosognosia at nine hours after blunt neck trauma. Carotid ultrasonography and angiography revealed occlusion of the right common carotid artery. A second ultrasonographic examination detected a double lumen, intimal flap, and a movable thrombus at the occlusion site, with reversed flow in the external cerebral artery and antegrade flow in the internal cerebral artery. Magnetic resonance angiography showed occlusion of the M1 distal section of the right middle cerebral artery. We diagnosed dissection of the right common carotid artery and artery-to-artery embolism from the thrombus in the dissecting common carotid artery. We started anticoagulation on the second hospital day. The patient was able to walk independently at discharge. The finding of carotid dissection on ultrasonography varied during the acute phase. We observed a mural thrombus in the true lumen and vessel recanalization. Treated only by anticoagulants without surgical therapy, the patient had a good outcome without reattack or hyperperfusion syndrome.",{},,Rinsho shinkeigaku = Clinical neurology,,,,Case Reports; Journal Article; Review,Japan,jpn
1719136,Limb apraxia without aphasia from a left sided lesion in a right handed patient.,"Selnes, O A; Pestronk, A; Hart, J; Gordon, B",Selnes,"A right handed man had a massive left middle cerebral artery stroke. CT and MRI revealed extensive destruction of both anterior and posterior areas typically associated with language. There was, however, no aphasia, but instead a marked limb apraxia, dyscalculia, dense right visual neglect, and anosognosia. These uncommon dissociations and associations support the hypothesis that cerebral control of motor function of the limbs is not fundamentally related to the motor control involved in speech, and the notion that handedness is related to laterality of motor control, and only accidentally to laterality of language control.",{},,"Journal of neurology, neurosurgery, and psychiatry",10.1136/jnnp.54.8.734,PMC1014482,,"Case Reports; Journal Article; Research Support, U.S. Gov't, P.H.S.",England,eng
6661333,[Agraphia of the left hand--its characteristics and mechanism of development].,"Ohigashi, Y; Hamanaka, T; Asano, K; Morimune, S",Ohigashi,"We observed 62 y.o. right-handed woman, whose truncus of corps callosum was damaged by infarction of left anterior cerebral artery, that was verified by coronal CT scan finding. She was apraxic and agraphic only with left hand. We examined the characteristics of her unilateral left agraphia from the point of quantitative and qualitative views. These analysis seemed to reveal three main characteristics of unilateral left agraphia of this patient. These were as follows; 1) productive, 2) neographic and 3) iterative. Another important feature of this patient was the mute state during her left-hand writing. Her left agraphia could not explained by apraxic factor, because her copying capacity was remarkably preserved in comparison with her dictation or written naming ability. Furthermore, this agraphia was not aphasic because her right-hand writing was almost intact. We agreed with Yamadori who insisted that this type of agraphia was neither apraxic nor aphasic, but the particular third agraphia which was named as ""disconnection agraphia"". We considered that the mute state during her left-hand writing might some kind of transient aphasia, which may reflect the functional disturbance of left hemisphere, and the reduced energy in the left hemisphere could increase the activity of right hemisphere. Partial interhemispheric disconnection might induce transient ""linguistic anosognosia"" in this patient. We believe that these transient hyperactivity and transient linguistic anosognosia could generate above mentioned characteristics of her left agraphia; productive, neographic and iterative.",{},,No to shinkei = Brain and nerve,,,,Case Reports; English Abstract; Journal Article,Japan,jpn
2752645,[A case of auditory agnosia with the lesion of bilateral auditory radiation].,"Hasegawa, M; Bando, M; Iwata, M; Mannen, T; Kaga, K",Hasegawa,"A 53-year-old man showed central auditory disturbance with recurrent cerebral hemorrhage. At his acute stage he had deafness and auditory anosognosia. Two or three months later, there was no deafness and auditory anosognosia, but he could not comprehend words, environmental sounds and music. Auditory brainstem responses showed no peripheral or brainstem damage, and the lesion of bilateral auditory radiation was detected by MRI. His auditory agnosia did not improve over one and a half year. There is no report like such permanent auditory agnosia with the lesion of bilateral subcortical temporal lobe.",{},,Rinsho shinkeigaku = Clinical neurology,,,,Case Reports; English Abstract; Journal Article,Japan,jpn
