pmid,title,authors,first_author,abstract,publication_date,publication_year,journal_info,doi,pmcid,keywords,article_type,country,language
19298971,Speech and language disorders secondary to diffuse subcortical vascular lesions: Neurolinguistic and acoustic analysis. A case report.,"Tomić, Gordana; Stojanović, Milena; Pavlović, Aleksandra; Stanković, Predrag; Zidverc-Trajković, Jasna; Pavlović, Dragan; Marković-Jovanović, Zagorka; Covicković-Sternić, Nadezda",Tomić,"Subcortical white matter (WM) plays an important role in speech production and language processing. Most frequently, cerebral WM lesions are secondary to small vessel disease in patients with vascular risk factors. We report the case of a 53-year-old man with history of hypertension and ischemic subcortical lesions, who presented with speech difficulties and mild cognitive impairment. Language and cognitive assessment included Boston Diagnostic Aphasia Examination, Boston Naming Test, Rey Auditory-Verbal Learning Test, Rey-Osterrieth Complex Figure Test, Trail Making Test A and B, Wisconsin Card Sorting Test, Scale for Evaluation of Perceptive Characteristics of Voice and Speech, and Multidimensional Evaluation of Speech and Voice. Brain MRI showed ischemic WM lesions and lacunar infarcts in the brainstem and right cerebellum. Cognitive testing revealed mild cognitive impairment, predominantly affecting attention and executive functions. Speech and language analysis demonstrated dysarthria, dysphonia with hypophonia, and imprecise articulation, as well as short rushes of speech, palilalia and mild subcortical dysphasia. Neurolinguistic and acoustic analysis in patients with ischemic WM lesions can provide additional information in the understanding of language and speech disturbances, and can assist in patient management.","DictElement({'Year': '2009', 'Month': '03', 'Day': '18'}, attributes={'DateType': 'Electronic'})",2009,Journal of the neurological sciences,10.1016/j.jns.2009.02.361,,,Case Reports; Journal Article,Netherlands,eng
18025656,A serious pain in the neck.,"Yap, Yew Chong; Kodati, Shyam; Kosmin, Alan; Damani, Nisar; Werring, David J",Yap,"We describe a case of internal carotid artery dissection, an important cause of ischemic cerebrovascular disease. Presentations include a headache, which is usually unilateral to the side of carotid dissection, sharp, nonthrobbing in nature with radiation from the neck. The clinical presentations, investigations, and treatment of the disease are discussed.",{},,"Annals of ophthalmology (Skokie, Ill.)",10.1007/s12009-007-9011-2,,,Case Reports; Journal Article,United States,eng
12682329,Pure dysarthria due to small cortical stroke.,"Kim, Jong S; Kwon, Sun U; Lee, Te G",Kim,"The authors describe six patients who presented with dysarthria as their isolated or major symptom from a small cortical stroke. Five had infarction and one had hemorrhage. In the patients with ischemic stroke, the lesions were identified by diffusion-weighted MRI but not by T-2 weighted MRI. The lesions were located lateral to the precentral knob usually at the most lateral part of the imaging. The presumed pathogenesis included embolism in five patients and hypertensive hemorrhage in one.",{},,Neurology,10.1212/01.wnl.0000055930.28954.e9,,,Case Reports; Journal Article,United States,eng
18644912,Pontine infarction due to intracranial venous thrombosis.,"Emsley, H C A; Ramtahal, J; Das, K S V; Ray, P S",Emsley,,{},,Practical neurology,10.1136/pn.2008.152587,,,Case Reports; Journal Article,England,eng
25746121,[Traumatic brain injury. Intracraneal foreign body].,"Jiménez-García, P; Yagüe-Zapico, R; Domínguez-Berrot, A",Jiménez-García,,"DictElement({'Year': '2015', 'Month': '03', 'Day': '06'}, attributes={'DateType': 'Electronic'})",2015,Medicina intensiva,10.1016/j.medin.2015.01.004,,,Case Reports; Journal Article,Spain,spa
12357087,Interhemispheric intracranial pressure gradients in massive cerebral infarction.,"Carhuapoma, J Ricardo; Qureshi, Adnan I; Bhardwaj, Anish; Williams, Michael A",Carhuapoma,"We report continuous bilateral intracranial pressure (ICP) monitoring immediately after transtentorial herniation in a patient with massive cerebral infarction to: 1) determine presence and time course of compartmental ICP differences, and 2) to study effects of therapy on both hemispheres. A 55-year-old man admitted with watershed infarctions in the left anterior-middle-posterior cerebral arteries distribution. Initial investigations demonstrated highly narrowed left extracranial internal carotid artery. Eight days later he developed unexplained lethargy and anisocoria. Head computerized tomography (CT) showed massive left hemispheric infarction, edema, and midline shift. Bilateral subarachnoid bolts demonstrated equally elevated ICP in both hemispheres. Hyperventilation and osmotic therapy produced near-identical ICP reduction bilaterally with resolution of anisocoria. Later, plateau waves and autonomic instability developed. Shortly before loss of brainstem function, interhemispheric ICP gradients (left greater than right) of 30-40 mm Hg developed. Intracranial pressure did not equalize prior to brain death determination. Bilateral ICP monitoring did not reveal an interhemispheric ICP gradient soon after transtentorial herniation in massive MCA infarction. The presence of interhemispheric ICP gradients in massive stroke remains unproven and further clinical study is necessary.",{},,Journal of neurosurgical anesthesiology,10.1097/00008506-200210000-00005,,,"Case Reports; Journal Article; Research Support, Non-U.S. Gov't",United States,eng
31811300,Localization and Microsurgical Resection of Left Postcentral Gyrus Spetzler-Martin Grade 3 Arteriovenous Malformation by Intraoperative Neuronavigation and Tracing of Subcortical Draining Vein: 3-Dimensional Operative Video.,"Zeeshan, Qazi; Carrasco Hernandez, Juan P; Sekhar, Laligam N",Zeeshan,"This 42-yr-old man presented with a history of sudden right-sided facial and right arm weakness and dysarthria. Head computed tomography showed a left frontal-parietal blood clot. An intra-arterial digital subtraction angiography demonstrated a left subcortical postcentral, Spetzler-Martin Grade 3 arteriovenous malformation (AVM) with a diffuse nidus, measuring 2.1 × 1.5 cm, supplied by branches of the left MCA, and draining into a cortical vein and a deep vein, which was going toward the ventricle. Preoperative embolization was not possible.  The patient underwent left frontal-parietal craniotomy with intraoperative motor and sensory mapping. No arterialized veins were visible on the cortical surface. Neuronavigation localized the AVM in the subcortical postcentral gyrus. Through an incision in the postcentral sulcus, microdissection led to a yellowish gliotic plane. The large cortical vein was in the gliotic area and traced to the AVM. Circumferential microdissection was performed around the AVM. It had a very diffuse nidus; the arterial feeders were cauterized and divided, and the superior superficial and inferior deep draining veins were finally occluded, and AVM was removed.  Postoperative angiogram showed total removal of the AVM. At discharge, his right arm weakness had improved (power 5/5), and facial weakness and dysarthria were improving (modified Rankin Scale (mRS) 2). At 1-yr follow-up, facial weakness and dysarthria had improved considerably, and patient returned to work (mRS 1).  This video shows microsurgical resection of an AVM by neuronavigation and tracing of the subcortical draining vein. The technique of cauterizing the perforating arteries after temporary clipping with flow arrest is shown in the video. Informed consent was obtained from the patient prior to the surgery that included videotaping of the procedure and its distribution for educational purposes. All relevant patient identifiers have also been removed from the video and accompanying radiology slides.",{},,"Operative neurosurgery (Hagerstown, Md.)",10.1093/ons/opz383,,,Case Reports; Journal Article; Video-Audio Media,United States,eng
15199761,[A case of cerebellar infarction with pure dysarthria].,"Ogawa, Katsuhiko; Suzuki, Yutaka; Kamei, Satoshi; Mizutani, Tomohiko",Ogawa,"We report a 69-year-old man with pure ataxic speech. He was admitted to the surgical ward of our hospital because of exercise-induced pain in the right arm. He underwent angiography of the right arm, and was discharged the next day. When he returned home, he exhibited an acute-onset dysarthria. He was admitted to our neurology ward the next day because the dysarthria did not improve. On admission, neurological examinations revealed moderately ataxic speech, but other neurological findings were within normal limits. Cranial MRI revealed an infarct localized from the lobulus simplex to the lobulus quadrangularis in the right cerebellum. Three cases of pure dysarthria due to cerebellar infarction have been reported previously. We compared cerebellar lesions in the 4 cases of pure dysarthria due to cerebellar infarction. Since the lobulus simplex of the upper cerebellar hemisphere was involved in all 4 cases, we speculated that ataxic speech occurred from the impairment of this cerebellar area.",{},,Rinsho shinkeigaku = Clinical neurology,,,,Case Reports; English Abstract; Journal Article; Review,Japan,jpn
3224620,"Progressive multifocal leukoencephalopathy of the posterior fossa in an AIDS patient: clinical, radiographic and evoked potential findings.","Lipton, R B; Krupp, L; Horoupian, D; Hershkovitz, S; Arezzo, J C; Kurtzberg, D",Lipton,"A 39-year-old intravenous drug user presented with dysarthria and a syndrome of the left cerebellar hemisphere. While in hospital, he developed progressive brainstem findings. Repeated CT scans revealed a lucency in the white matter of the left cerebellar hemisphere. Brainstem auditory and short-latency somatosensory evoked potentials provided evidence of brainstem dysfunction without corresponding lesions on CT. Biopsy of the cerebellum established the diagnosis of progressive multifocal leukoencephalopathy (PML) and the acquired immunodeficiency syndrome (AIDS). Postmortem examination revealed brainstem lesions appropriate to the evoked potential findings and a radiographically inapparent lesion in the right internal capsule. Based on this case and a review of the literature we conclude that: (1) PML occurs with significant prevalence in AIDS patients and may involve the posterior fossa; (2) the diagnosis of posterior fossa PML is suggested by certain clinical and radiographic criteria and may be confirmed by brain biopsy; (3) evoked potentials may be abnormal in PML and can reveal functional abnormalities of white matter without apparent CT abnormalities.",{},,European neurology,10.1159/000116280,,,Case Reports; Journal Article,Switzerland,eng
3379423,Lacunar syndromes due to brainstem infarct and haemorrhage.,"Huang, C; Woo, E; Yu, Y L; Chan, F L",Huang,"Nine patients with brainstem infarct and two with brainstem haemorrhage presented with pure motor stroke, pure supranuclear facial palsy, sensorimotor stroke or ataxic hemiparesis. Despite the clinical similarity with hemispheric lacunes, brainstem infarcts causing lacunar syndromes probably have a greater tendency to progress. Small brainstem haemorrhages should also be considered as a cause of lacunar syndromes and the difficulty in differentiating them from small infarcts without CT is emphasised.",{},,"Journal of neurology, neurosurgery, and psychiatry",10.1136/jnnp.51.4.509,PMC1032960,,Case Reports; Journal Article,England,eng
19632340,Quantitative imaging of spontaneous neuromagnetic activity for assessing cerebral ischemia using sLORETA-qm.,"Sakamoto, Shinichi; Tanaka, Hiroaki; Tsuyuguchi, Naohiro; Terakawa, Yuzo; Ohata, Kenji; Inoue, Yuichi; Miki, Yukio; Hara, Mitsuhiro; Takahashi, Yoshinobu; Nitta, Kazumi; Sawa, Hiroki; Satone, Akira; Ide, Wataru; Hashimoto, Ikuo; Kamada, Hajime",Sakamoto,"To image cerebral neural activity in ischemic areas, we proposed a novel technique to analyze spontaneous neuromagnetic fields based on standardized low-resolution brain electromagnetic tomography modified for a quantifiable method (sLORETA-qm). Using a 160-channel whole-head-type magnetoencephalographic system, cerebral magnetic fields were obtained pre- and postoperatively from 5 patients with unilateral internal carotid artery occlusive disease and 16 age-matched healthy volunteers. For quantitative imaging, voxel-based time-averaged intensities of slow waves in 4 frequency bands (0.3-2 Hz, 2-4 Hz, 4-6 Hz and 6-8 Hz) were obtained by the proposed technique based on sLORETA-qm. Positron emission tomography with (15)O gas inhalation ((15)O-PET) was also performed in these patients to evaluate cerebral blood flow and metabolism. In all 5 patients, slow waves in every frequency band were distributed in the area of cerebrovascular insufficiency, as confirmed by (15)O-PET preoperatively. In 4 patients, slow-wave intensities in theta bands (4-6 Hz, 6-8 Hz) decreased postoperatively along with improvements in cerebral blood flow and metabolism, whereas delta bands (0.3-2 Hz, 2-4 Hz) showed no significant differences between pre- and postoperatively. One patient with deterioration of cerebral infarction after surgery showed marked increases in slow-wave intensities in delta bands (0.3-2 Hz, 2-4 Hz) postoperatively, with distribution close to the infarct region. The proposed quantitative imaging of spontaneous neuromagnetic fields enabled clear visualization and alternations of cerebral neural conditions in the ischemic area. This technique may offer a novel, non-invasive method for identifying cerebral ischemia, although further studies in a larger number of patients are warranted.","DictElement({'Year': '2009', 'Month': '07', 'Day': '24'}, attributes={'DateType': 'Electronic'})",2009,NeuroImage,10.1016/j.neuroimage.2009.07.039,,,Case Reports; Journal Article,United States,eng
15128614,The human basis pontis: motor syndromes and topographic organization.,"Schmahmann, Jeremy D; Ko, Ryeowon; MacMore, Jason",Schmahmann,"Clinical-anatomic correlations were performed in 25 patients with focal infarcts in the basilar pons to determine whether pontine lacunar syndromes conform to discrete clinical entities, and whether there is topographic organization of the motor system within the human basis pontis. Twelve clinical signs were scored on a 6-point scale, neuroimaging lesions were mapped and defined with statistical certainty, and structure-function correlation was performed to develop a topographic map of motor function. Clinical findings ranged from major devastation following extensive lesions (pure motor hemiplegia) to incomplete basilar pontine syndrome and restricted deficits after small focal lesions (ataxic hemiparesis, dysarthria-clumsy hand syndrome, dysarthria-dysmetria and dysarthria-facial paresis). The syndromes are not absolutely discrete, and are distinguished from each other by the relative degree of involvement of each clinical feature. Structure-function correlations indicate that strength is conveyed by the corticofugal fibres destined for the spinal cord, whereas dysmetria results from lesions involving the neurons of the basilar pons that link the ipsilateral cerebral cortex with the contralateral cerebellar hemisphere. Facial movement and articulation are localized to rostral and medial basilar pons; hand coordination is medial and ventral in rostral and mid-pons; and arm function is represented ventral and lateral to the hand. Leg coordination is in the caudal half of the pons, with lateral predominance. Swallowing is dependent upon the integrity of a number of regions in the rostral pons. Gait is in medial and lateral locations throughout the rostral- caudal extent of the pons. Dysmetria ipsilateral to the lesion constitutes a disconnection syndrome, as it occurs when the hemipontine lesion is extensive and interrupts pontocerebellar fibres traversing from the opposite, intact side of the pons. The heterogeneity of manifestations reflects the well-organized topography of motor function in the human basis pontis, in agreement with the anatomic organization of the motor corticopontine projections in the monkey. Higher order impairments including motor neglect, paraphasic errors and pathological laughter result from rostral and medial pontine lesions, and may result from disruption of the pontine component of associative corticopontocerebellar circuits.","DictElement({'Year': '2004', 'Month': '05', 'Day': '05'}, attributes={'DateType': 'Electronic'})",2004,Brain : a journal of neurology,10.1093/brain/awh138,,,"Case Reports; Journal Article; Research Support, Non-U.S. Gov't",England,eng
38134117,Sudden bilateral deafness in a patient with vertebrobasilar artery occlusion: A case report.,"Zhang, Ying; Zhao, Xin; Zhou, Ming; Chang, Pengfei; Liu, Tao; Li, Yang",Zhang,"Sudden bilateral deafness is often associated with serious systematic conditions such as neoplasms, vascular events, autoimmune diseases, infections, and iatrogenic injury, but very rarely to cerebrovascular disease. This is a rare case of sudden bilateral deafness in a patient with the vertebrobasilar artery occlusion. A 46-year-old man was admitted to a local hospital for sudden bilateral deafness, the patient suffered inarticulate speech and walking unsteadily 6 days later. Difusion-weighted magnetic resonance imagin demonstrated acute cerebral infarction in the pons and bilateral cerebellum; Magnetic resonance angiography showed vertebrobasilar artery occlusion. Aspirin and clopidogrel were given for antiplatelet therapy, revascularization was obtained by endovascular treatment. The symptoms of dysarthria, ataxia and weakness gradually improved and were discharged 14 days after admission revascularization. After 3 months telephone followed-up the patient was self-cared. Deafness sometimes can be an early warning sign of impending vertebrobasilar ischemic stroke. Early recognition of deafness with acute ischemic stroke should allow special management, and misdiagnosis may result in significant morbidity, or even mortality.",{},,Medicine,10.1097/MD.0000000000036691,PMC10735165,,Case Reports; Journal Article,United States,eng
8681482,Isolated cerebellar dysarthria associated with a heat stroke.,"Manto, M U",Manto,Patients presenting with heat stroke may develop an acute pancerebellar syndrome. A patient presenting with an isolated cerebellar dysarthria after a heat stroke is reported. The dysarthria lasted two weeks. An isolated cerebellar dysarthria has been previously described in lesions of the paravermal zone of the rostral cerebellum. It is suggested that this region of the cerebellum is particularly vulnerable to fever.,{},,Clinical neurology and neurosurgery,10.1016/0303-8467(95)00089-5,,,"Case Reports; Journal Article; Research Support, Non-U.S. Gov't",Netherlands,eng
30579022,Multiple Brain Metastases from Pancreatic Adenocarcinoma Manifesting with Simultaneous Intratumoral Hemorrhages.,"Matsuo, Satoshi; Amano, Toshiyuki; Kawauchi, Shigeto; Nakamizo, Akira",Matsuo,"Pancreatic adenocarcinoma rarely metastasizes to the brain, and clinical features of brain metastasis in such cases remain elusive. To the best of our knowledge, only 21 cases of brain metastasis from pancreatic adenocarcinoma have been previously reported in the English language literature. A 61-year-old woman was diagnosed with pancreatic adenocarcinoma and began chemotherapy 1 year 4 months before the current admission. Three days before the current admission, she developed acute dysarthria. She was referred to a cancer center, where neuroradiologic examination showed multiple metastatic brain tumors, including a 30-mm-diameter tumor in the right cerebellar region. She was transferred to our institute. Three days after admission, she developed sudden-onset disturbance of consciousness and left hemiparesis. Computed tomography and magnetic resonance imaging of the head showed that the metastatic lesions had increased in size with development of intratumoral hemorrhage and obstructive hydrocephalus. She underwent urgent removal of the tumor in the cerebellum. Obstructive hydrocephalus was relieved, and her consciousness improved immediately after surgery. She was transferred to the palliative care unit of the cancer center and died under hospice care 3 weeks after surgery. This case demonstrates that brain metastases from pancreatic adenocarcinoma can enlarge suddenly and simultaneously with intratumoral hemorrhage even without coagulation disorders, resulting in neurologic deterioration in a short time. Surgical resection of metastatic brain lesions from pancreatic adenocarcinoma has an extremely limited role, but such treatment can remove neurologic symptoms and temporarily improve the patient's quality of life in selected cases.","DictElement({'Year': '2018', 'Month': '12', 'Day': '20'}, attributes={'DateType': 'Electronic'})",2018,World neurosurgery,10.1016/j.wneu.2018.12.036,,Intratumoral hemorrhage; Metastatic brain tumor; Pancreatic adenocarcinoma,Case Reports; Journal Article,United States,eng
23115678,Atypical metronidazole-induced encephalopathy in anaerobic brain abscess.,"Jang, Han Jin; Sim, Sook Young; Lee, Jong Yun; Bang, Ji Hwan",Jang,"Metronidazole-induced encephalopathy is a very rare complication of the long standing use of metronidazole. The encephalopathy is bilateral and symmetric in nature. We report on the magnetic resonance imaging (MRI) and clinical course of metronidazole-induced encephalopathy in a 60-year-old female with a persistent anaerobic brain abscess after draining of the abscess. After 3 months of metronidazole administration, the patient complained of dysarthria, tingling sense of all extremities, and left hemiparesis. MRI revealed symmetric hyperintensity lesions in medulla, pons, dentate nuclei of cerebellum, and splenium of corpus callosum, all of which represent typical findings of metronidazole-induced encephalopathy. In addition, asymmetric lesions in midbrain, thalamus, putamen and cerebral subcortical white matter were noted. The patient recovered after discontinuation of metronidazole and the remaining abscess was successfully treated with meropenem and levofloxacine.","DictElement({'Year': '2012', 'Month': '09', 'Day': '30'}, attributes={'DateType': 'Electronic'})",2012,Journal of Korean Neurosurgical Society,10.3340/jkns.2012.52.3.273,PMC3483336,Brain abscess; Magnetic resonance imaging; Metabolic encephalopathy; Metronidazole,Case Reports,Korea (South),eng
24140283,'All the better for not seeing you': effects of communicative context on the speech of an individual with acquired communication difficulties.,"Bruce, Carolyn; Braidwood, Ursula; Newton, Caroline",Bruce,"Evidence shows that speakers adjust their speech depending on the demands of the listener. However, it is unclear whether people with acquired communication disorders can and do make similar adaptations. This study investigated the impact of different conversational settings on the intelligibility of a speaker with acquired communication difficulties. Twenty-eight assessors listened to recordings of the speaker reading aloud 40 words and 32 sentences to a listener who was either face-to-face or unseen. The speaker's ability to convey information was measured by the accuracy of assessors' orthographic transcriptions of the words and sentences. Assessors' scores were significantly higher in the unseen condition for the single word task particularly if they had heard the face-to-face condition first. Scores for the sentence task were significantly higher in the second presentation regardless of the condition. The results from this study suggest that therapy conducted in situations where the client is not able to see their conversation partner may encourage them to perform at a higher level and increase the clarity of their speech. Readers will be able to describe: (1) the range of conversational adjustments made by speakers without communication difficulties; (2) differences between these tasks in offering contextual information to the listener; and (3) the potential for using challenging communicative situations to improve the performance of adults with communication disorders.","DictElement({'Year': '2013', 'Month': '09', 'Day': '20'}, attributes={'DateType': 'Electronic'})",2013,Journal of communication disorders,10.1016/j.jcomdis.2013.08.002,,Acquired communication difficulties; Intelligibility; Speaker adaptation,Case Reports; Journal Article,United States,eng
