pmid,title,authors,first_author,abstract,publication_date,publication_year,journal_info,doi,pmcid,keywords,article_type,country,language
15663551,A case report of plasma exchange therapy in non-paraneoplastic cerebellar ataxia associated with anti-Yo antibody.,"Meloni, Carlo; Iani, Cesare; Dominijanni, Sara; Arciprete, Flavio; Cipriani, Silvia; Caramiello, Maria Stella; Tozzo, Carmela; Lombardo, Pietrina Angela; Tatangelo, Paola; Cecilia, Annalisa; Straccialano, Emilia; Casciani, Carlo Umberto",Meloni,"A 71-year-old-woman was admitted to the S. Eugenio Hospital for a history of progressively impaired standing and gait. Anamnesis revealed systemic hypertension, gastric polyposis and juvenile pulmonary tuberculosis. Neurological examination showed a severe truncal and gait ataxia, without any sensory-motor impairment. Motor and somato-sensory evoked potentials were normal. Brain Magnetic Resonance Imaging (MRI) showed minimal signs of chronic ischemia only at a supratentorial level. Cerebral Single Photon Emission Computed Tomography, spinal MRI, total body computed tomography, Esophagogastroduodenoscopy, and finally total body Positron Emission Tomography resulted negative for neoplasms. Oncological serum markers were negative. Serum antibody against Purkinje's cells (Anti-Yo) was detected and titer was 1:80, while normally it should be undetectable. Other autoantibodies (Anti-Hu, Anti-Ri) were undetectable. Two sessions of plasma exchange (PE) were thus performed, leading to a rapid, marked and durable improvement of standing and gait and to a reduction of the autoantibody, which became undetectable. No serious adverse effect was noted. Although no definite therapy for autoimmune cerebellar ataxia has been established, PE should be considered as one of the main therapeutic choices.",{},,"Therapeutic apheresis and dialysis : official peer-reviewed journal of the International Society for Apheresis, the Japanese Society for Apheresis, the Japanese Society for Dialysis Therapy",10.1111/j.1774-9987.2004.00198.x,,,Case Reports; Journal Article,Australia,eng
1402983,Lacunar thalamic stroke with pure cerebellar and proprioceptive deficits.,"Gutrecht, J A; Zamani, A A; Pandya, D N",Gutrecht,Case reports of two patients with cerebellar ataxia and proprioceptive sensory loss are presented. MRI of the brain revealed lesions of the ventroposterior part of the thalamus. These patients illustrate clinically the anatomical independence of cerebellar and sensory pathways in the thalamus. We suggest that the ataxic deficit is caused by interruption of cerebellar outflow pathways in the thalamus and not secondary to sensory deafferentation.,{},,"Journal of neurology, neurosurgery, and psychiatry",10.1136/jnnp.55.9.854,PMC1015118,,Case Reports; Journal Article,England,eng
6157798,Cerebellar ataxia. Clinical and CT findings in two cases of rare etiology.,"Zeumer, H; Kotlarek, F; Blankennagel, A",Zeumer,"Two low density lesions of the cerebellum which did not occupy space are reported. The neuropathological diagnosis of one case was subacute leucencephalitis. In the other case, the diagnosis of a Pelizaeus-Merzbacher's disease is discussed, taking into consideration the clinical observation, development and the CT findings.",{},,Journal of neurology,10.1007/BF00313206,,,Case Reports; Journal Article,Germany,eng
10717402,Acute cerebellar ataxia of a patient with SLE.,"Yaginuma, M; Suenaga, M; Shiono, Y; Sakamoto, M",Yaginuma,"We described a 28-year-old woman with systemic lupus erythematosus (SLE) presented with digestive tract, skin and renal symptoms and afterwards developed acute cerebellar ataxia, a paresis of the right inferior rectus muscle, left abducens paralysis and left facial palsy which seemed to be consistent with a brainstem lesion visible on magnetic resonance imaging (MRI). This lesion disappeared within 9 days of corticosteroid treatment. It is suggested that this lesion is focal edema induced by acute changes in the blood brain barrier secondary to a vasculopathy. Other causes, including local infarction, are unlikely.",{},,Clinical neurology and neurosurgery,10.1016/s0303-8467(99)00078-5,,,Case Reports; Journal Article,Netherlands,eng
629655,Ataxic hemiparesis. A pathologic study.,"Fisher, C M",Fisher,Three stroke patients showed weakness and pyramidal signs on one side combined with a cerebellar-like ataxia on the same side. Pathologic study in each case showed an old infarct cavity in the basis pontis at the level of the junction of the upper one third and lower two thirds on the side opposite the neurologic deficit. The basilar artery was patent and the infarcts were probably the result of occlusion of penetrating arteries. This study demonstrates that a lesion of the basis pontis may be associated with a contralateral ataxia that is cerebellar in character. The designation ataxic hemiparesis is suggested for the syndrome.,{},,Archives of neurology,10.1001/archneur.1978.00500270008002,,,"Case Reports; Journal Article; Research Support, U.S. Gov't, P.H.S.",United States,eng
224149,Ataxia-telangiectasia. Report of a case with Lewy bodies and vascular abnormalities within cerebral tissue.,"Agamanolis, D P; Greenstein, J I",Agamanolis,"The neuropathologic findings in a 31 year old patient with ataxia-telangiectasia are presented. There was an unusually severe and widespread distribution of the recognized abnormalities within the nervous system. In addition, there were Lewy bodies in the substantia nigra and widely distributed vascular changes in cerebral tissue. The nature of the vascular changes is discussed. These findings underline and expand the known spectrum of nervous system involvement in this condition.",{},,Journal of neuropathology and experimental neurology,10.1097/00005072-197909000-00003,,,Case Reports; Journal Article,England,eng
21376630,"Rapidly progressive cognitive impairment, ataxia, and myoclonus: an unusual presentation of a dural arteriovenous fistula.","Geraldes, Ruth; Albuquerque, Luisa; Ferro, José Manuel; Sousa, Rita; Sequeira, Paulo; Campos, Jorge",Geraldes,"Dural arteriovenous fistulas (DAVFs) have a wide range of clinical presentations, including dementia associated with white matter changes (WMCs). We report a case of DAVF presenting as a rapid progressive dementia and myoclonus without WMCs. A 64-year-old hypertensive and diabetic man was admitted because of a 3-month history of progressive cognitive decline, extrapyramidal and cerebellar signs, and myoclonus. Magnetic resonance imaging (MRI) scans of the brain showed dilated cerebellar veins and T2WI hypersignal in the basal ganglia without WMCs. After admission, he suffered sequential bilateral deep intracerebral hemorrhages. A repeated angioMRI disclosed thrombosis of the distal sagittal and the proximal lateral sinuses. Angiography revealed a torcullar region DAVF. Embolization of the dural fistula was performed. On follow-up, the patients' cognitive deficits improved and myoclonus disappeared. The clinical picture may be explained by venous hypertension in the deep venous system, producing bilateral basal ganglia/thalamic dysfunction and in the posterior fossa. This case shows that DAVFs can produce subcortical dementia without involvement of the deep white matter.","DictElement({'Year': '2011', 'Month': '03', 'Day': '04'}, attributes={'DateType': 'Electronic'})",2011,Journal of stroke and cerebrovascular diseases : the official journal of National Stroke Association,10.1016/j.jstrokecerebrovasdis.2011.01.002,,,Case Reports; Journal Article,United States,eng
6701944,"Ataxic-hemiparesis, localization and clinical features.","Huang, C Y; Lui, F S",Huang,"Five additional cases of ataxic-hemiparesis are reported. In 3 cases, computed tomography showed an area of decreased attenuation in the posterior limb of the internal capsule, and in 1 case, 2 areas of attenuation in the corona radiata. A review of previously reported cases suggest that brainstem ataxic-hemiparesis may be separated from supratentorial forms of ataxic-hemiparesis by the presence of nystagmus, dysarthria, cranial neuropathy, and the absence of sensory abnormality.",{},,Stroke,10.1161/01.str.15.2.363,,,Case Reports; Journal Article,United States,eng
16322493,Novel representation of astasia associated with posterior cingulate infarction.,"Kataoka, Hiroshi; Sugie, Kazuma; Kohara, Nobuo; Ueno, Satoshi",Kataoka,"The representation elicited in the cingulate motor area has been demonstrated in animals, but remains unclear in humans. In particular, the representation and pathogenic mechanisms of the posterior cingulate cortex are poorly understood, especially in humans. We describe a case of posterior cingulate infarction associated with contralateral astasia. A 67-year-old right-handed man with a 10-year history of hypertension suddenly presented with right-sided pulsion on attempting to stand or sit. On the following day, he could not maintain a sitting position. The patient immediately fell to the floor because of instability, characterized by marked right-sided pulsion despite no muscle weakness, sensorial deficits, or cerebellar ataxia. Magnetic resolution imaging of the brain showed abnormal intensity in the posterior parts of the cingulate, with no other clinically significant lesions. Because the cingulate motor area is connected to the vestibulocerebellar system through the thalamic nuclei, disruption of this connection by posterior cingulate infarction may result in astasia.","DictElement({'Year': '2005', 'Month': '12', 'Day': '01'}, attributes={'DateType': 'Electronic'})",2005,Stroke,10.1161/01.STR.0000195046.89926.98,,,Case Reports; Journal Article,United States,eng
31219822,Subtle Dysmetria After a Hemorrhage in the Basal Ganglia and Lentiform Nucleus.,"Tam, Eric; Kaner, Mahmut T; Magracia, Cristi Marie; Thompson, Haley; Altschuler, Eric L",Tam,,{},,American journal of physical medicine & rehabilitation,10.1097/PHM.0000000000001238,,,Case Reports; Journal Article; Video-Audio Media,United States,eng
8229054,An immunologic abnormality common to Bickerstaff's brain stem encephalitis and Fisher's syndrome.,"Yuki, N; Sato, S; Tsuji, S; Hozumi, I; Miyatake, T",Yuki,"The nosological position of Bickerstaff's brain stem encephalitis (BBE) has yet to be established, and its etiology is not clear. Because anti-GQ1b antibody frequently occurs in patients with Fisher's syndrome (FS) and there are clinical similarities between FS and BBE, we investigated anti-ganglioside antibodies in sera from 3 BBE patients who had transient long tract signs in addition to acute ophthalmoplegia and cerebellar-like ataxia in order to clarify the etiology and nosological position of BBE. High IgG anti-GQ1b antibody titers were present in all 3 sera samples but decreased with the clinical course of the illness. In contrast, no anti-GQ1b antibody was found in sera from patients with other neurologic diseases which were able to produce transient brain stem disturbance: multiple sclerosis, neuro-Behçet's disease, brain stem infarction, herpes simplex virus encephalitis, and Wernicke's encephalopathy. The finding that BBE and FS shared common autoantibody suggests that autoimmune mechanism common to FS is likely in BBE, and that both conditions represent a distinct disease with a wide spectrum of symptoms that include ophthalmoplegia and ataxia.",{},,Journal of the neurological sciences,10.1016/0022-510x(93)90250-3,,,"Case Reports; Journal Article; Research Support, Non-U.S. Gov't",Netherlands,eng
31473646,Neurosyphilis presenting as pure cerebellar ataxia: an atypical manifestation.,"Garg, Divyani; Vibha, Deepti; Pandit, Awadh Kishor; Srivastava, Achal Kumar",Garg,"Neurosyphilis has become an uncommon diagnosis in the current era. Neurological manifestations of syphilis usually lie within the spectrum of meningovascular syphilis, tabes dorsalis or general paresis of the insane. Although sensory ataxia may occur as part of spinal cord involvement, cerebellar ataxia has been rarely described as a manifestation of neurosyphilis. In this report, we describe a rare case neurosyphilis presenting in the form of a pure pancerebellar syndrome of subacute progression.","DictElement({'Year': '2019', 'Month': '08', 'Day': '31'}, attributes={'DateType': 'Electronic'})",2019,BMJ case reports,10.1136/bcr-2019-231058,PMC6720618,brain stem/cerebellum; infection (neurology); meningitis,Case Reports; Journal Article,England,eng
3379423,Lacunar syndromes due to brainstem infarct and haemorrhage.,"Huang, C; Woo, E; Yu, Y L; Chan, F L",Huang,"Nine patients with brainstem infarct and two with brainstem haemorrhage presented with pure motor stroke, pure supranuclear facial palsy, sensorimotor stroke or ataxic hemiparesis. Despite the clinical similarity with hemispheric lacunes, brainstem infarcts causing lacunar syndromes probably have a greater tendency to progress. Small brainstem haemorrhages should also be considered as a cause of lacunar syndromes and the difficulty in differentiating them from small infarcts without CT is emphasised.",{},,"Journal of neurology, neurosurgery, and psychiatry",10.1136/jnnp.51.4.509,PMC1032960,,Case Reports; Journal Article,England,eng
1479393,Homolateral ataxia and crural paresis: a syndrome of anterior cerebral artery territory infarction.,"Bogousslavsky, J; Martin, R; Moulin, T",Bogousslavsky,"Five patients with superficial anterior cerebral artery territory infarcts in the paracentral area are reported, who developed a hemiparesis which was predominant in the leg, and with homolateral ataxia in the arm. A similar neurological picture was not observed in 1736 patients who were admitted over an eight year period to a primary care stroke centre with their first stroke. Involvement of corticopontine fibres at their origin, together with damage to the lower limb motor strip or underlying white matter, appears to have been the cause of a clinical syndrome (homolateral ataxia and crural paresis) which has been ascribed to lacunar infarction.",{},,"Journal of neurology, neurosurgery, and psychiatry",10.1136/jnnp.55.12.1146,PMC1015329,,"Case Reports; Journal Article; Research Support, Non-U.S. Gov't",England,eng
10690738,Isolated cerebellar involvement in Rosai-Dorfman disease: case report.,"Gaetani, P; Tancioni, F; Di Rocco, M; Rodriguez y Baena, R",Gaetani,"Sinus histiocytosis or Rosai-Dorfman disease (RDD) is a rare but well-recognized disorder characterized by an unusual proliferation of histiocytic cells. Intracranial localization is a rare manifestation of RDD. Only three cases of localization in the posterior fossa have been reported in the literature. The present report describes the first case, to our knowledge, of cerebellar localization of RDD. A 67-year-old woman was admitted to our institution with a 5-month history of cerebellar ataxia. Her medical history was unremarkable. The patient was alert and cooperative. No cranial nerve deficits were evident; Romberg positivity to the left side was recorded. No cutaneous abnormalities, lymphadenopathy, or hepatosplenomegaly were revealed by physical examination. Routine hematological and biochemical studies were normal except for the erythrocyte sedimentation rate, which was elevated. Radiologically, the lesion appeared as a well-defined and avascular mass in the right cerebellar lobe. Meningioma was considered the most likely diagnosis. The patient underwent a suboccipital craniotomy with complete excision of the lesion. Microscopic examination of the operative specimen revealed the presence of a mixed cellular population with predominant mature histiocytes. A peculiar feature was the presence of lymphocytes and monocytes within the cytoplasm of histiocytes (emperipolesis). Immunohistochemical study of the histiocytes revealed strong positivity for S-100, CD-68 antigen, and vimentin. Involvement of the central nervous system in RDD appears to have a benign prognosis, especially in the absence of nodal diseases. Surgery is essential for diagnosis, and, when total removal is achieved, the outcome is generally good without risk of recurrence.",{},,Neurosurgery,10.1097/00006123-200002000-00041,,,Case Reports; Journal Article,United States,eng
9471108,Brain SPECT imaging and treatment with IVIg in acute post-infectious cerebellar ataxia: case report.,"Daaboul, Y; Vern, B A; Blend, M J",Daaboul,"A 19 year-old man presented with pharyngitis and cervical lymphadenopathy, followed by vomiting and acute cerebellar ataxia. Serologic studies were consistent with a recent Epstein-Barr virus infection. Although contrast-enhanced brain computed tomography and MRI scans were normal, brain perfusion single photon emission tomography (SPECT) examination using 99mTc-HMPAO, performed on the 15th day of illness, showed marked cerebellar hyperperfusion, suggesting a diagnosis of acute post-infectious cerebellitis. After treatment with intravenous human immunoglobulin (IVIg, 2 g kg-1 over three days), progressive neurologic improvement occurred over two weeks. A brain SPECT study repeated after two additional weeks demonstrated a normal perfusion pattern. We conclude that brain perfusion SPECT examination is useful in identifying post-infectious cerebellitis and in monitoring its clinical course. In addition, IVIg may be helpful in treating this condition.",{},,Neurological research,10.1080/01616412.1998.11740489,,,Case Reports; Journal Article,England,eng
16760349,Ordered motor-unit firing behavior in acute cerebellar stroke.,"Sauvage, Chloe; Manto, Mario; Adam, Alexander; Roark, Rick; Jissendi, Patrice; De Luca, Carlo J",Sauvage,"It is known that at any given force level, the lower-threshold motor units generally fire at greater rates than the higher-threshold units during isometric tasks of extremity muscles. In addition to this hierarchical arrangement, firing rates of motor units fluctuate in unison with nearly no time delay; an observation that has led to the concept of common drive, a basic motoneuronal rule. Although it is established that the cerebellum plays a critical function in motor control, its role in the genesis, triggering, selection, and monitoring of motor-unit firing pattern discharges during isometric tasks is unknown. We applied an electromyographic (EMG) decomposition technique, known as precision decomposition, to accurately identify motor-unit firing times from the EMG signal recorded from the first dorsal interosseous muscle to unravel the features of motor-unit firings in three patients presenting a unilateral cerebellar stroke and exhibiting an acute cerebellar syndrome. We observed ataxic isometric force during visually guided abduction of the index finger on the affected side. However, the hierarchical response of individual motor units was spared. Furthermore, acute cerebellar ataxia was not associated with a loss of the common drive.","DictElement({'Year': '2006', 'Month': '06', 'Day': '07'}, attributes={'DateType': 'Electronic'})",2006,Journal of neurophysiology,10.1152/jn.00268.2006,,,"Case Reports; Journal Article; Research Support, N.I.H., Extramural",United States,eng
29068990,Aggravation of an injured dentato-rubro-thalamic tract in a patient with mild traumatic brain injury: A case report.,"Jang, Sung Ho; Kwon, Hyeok Gyu",Jang,"We report on a patient with mild traumatic brain injury (TBI) by follow-up diffusion tensor tractography (DTT), and observed for approximately nine monthsby serial diffusion tensor tractography (DTT). A 66-year-old male patient was injured in a car crash. Approximately four weeks after the crash, he developed a tremor in the right hand and leg. His symptoms worsened over time. Approximately six months after the crash, he developed a mild tremor in the left hand. Nine months after the crash, he manifested severe tremor in his right hand, mild resting and intentional tremor in his left hand and both legs, and mild trunkal ataxia. N/A. On 3-week DTT, well reconstructed DRTTs were observed in both hemispheres, except for the thinned lower portion of the right DRTT. On 9-month DTT, the right lower DRTT had thinned compared with the 3-week DTT and showed a disruption at the upper portion. The left DRTT showed thinning in the lower portion and tearing in the upper portion compared with 3-week DTT. Aggravation of an injured DRTT was demonstrated in a patient with mild TBI, using serial DTT examination.",{},,Medicine,10.1097/MD.0000000000008253,PMC5671823,,Case Reports; Journal Article,United States,eng
15128614,The human basis pontis: motor syndromes and topographic organization.,"Schmahmann, Jeremy D; Ko, Ryeowon; MacMore, Jason",Schmahmann,"Clinical-anatomic correlations were performed in 25 patients with focal infarcts in the basilar pons to determine whether pontine lacunar syndromes conform to discrete clinical entities, and whether there is topographic organization of the motor system within the human basis pontis. Twelve clinical signs were scored on a 6-point scale, neuroimaging lesions were mapped and defined with statistical certainty, and structure-function correlation was performed to develop a topographic map of motor function. Clinical findings ranged from major devastation following extensive lesions (pure motor hemiplegia) to incomplete basilar pontine syndrome and restricted deficits after small focal lesions (ataxic hemiparesis, dysarthria-clumsy hand syndrome, dysarthria-dysmetria and dysarthria-facial paresis). The syndromes are not absolutely discrete, and are distinguished from each other by the relative degree of involvement of each clinical feature. Structure-function correlations indicate that strength is conveyed by the corticofugal fibres destined for the spinal cord, whereas dysmetria results from lesions involving the neurons of the basilar pons that link the ipsilateral cerebral cortex with the contralateral cerebellar hemisphere. Facial movement and articulation are localized to rostral and medial basilar pons; hand coordination is medial and ventral in rostral and mid-pons; and arm function is represented ventral and lateral to the hand. Leg coordination is in the caudal half of the pons, with lateral predominance. Swallowing is dependent upon the integrity of a number of regions in the rostral pons. Gait is in medial and lateral locations throughout the rostral- caudal extent of the pons. Dysmetria ipsilateral to the lesion constitutes a disconnection syndrome, as it occurs when the hemipontine lesion is extensive and interrupts pontocerebellar fibres traversing from the opposite, intact side of the pons. The heterogeneity of manifestations reflects the well-organized topography of motor function in the human basis pontis, in agreement with the anatomic organization of the motor corticopontine projections in the monkey. Higher order impairments including motor neglect, paraphasic errors and pathological laughter result from rostral and medial pontine lesions, and may result from disruption of the pontine component of associative corticopontocerebellar circuits.","DictElement({'Year': '2004', 'Month': '05', 'Day': '05'}, attributes={'DateType': 'Electronic'})",2004,Brain : a journal of neurology,10.1093/brain/awh138,,,"Case Reports; Journal Article; Research Support, Non-U.S. Gov't",England,eng
3881693,Ataxic Creutzfeldt-Jakob disease: diagnostic techniques and neuropathologic observations in early disease.,"Jones, H R; Hedley-Whyte, E T; Freidberg, S R; Baker, R A",Jones,"We studied two cases of ataxic Creutzfeldt-Jakob disease. EEG, CT, evoked responses, and CSF were normal in one purely ataxic patient. Diagnosis was established by cerebellar biopsy. Autopsy demonstrated devastating spongiform changes in the cerebellum, basal ganglia, and thalamus with rare focal changes in cerebral cortex. In the second patient, late generalized changes developed with dementia. Diagnostic studies included abnormal visual evoked responses, CSF with abnormal oligoclonal bands and IgG, and subacute spongiform encephalopathy in frontal lobe biopsy. Early diagnosis is best established by biopsy of brain areas most likely to be involved on the basis of clinical neurologic findings.",{},,Neurology,10.1212/wnl.35.2.254,,,Case Reports; Journal Article,United States,eng
19027125,Kinetic tremor and cerebellar ataxia as initial manifestations of Kikuchi-Fujimoto's disease.,"Moon, Ju-Sun; Il Kim, Gwang; Koo, Young-Ho; Kim, Hyun-Sook; Kim, Won-Chan; Kim, Ok-Joon; Oh, Seung-Hun",Moon,"Involvement of central nervous system occasionally occurs as a form of aseptic meningitis in Kikuchi-Fujimoto disease (KFD). However, acute cerebellar symptoms are very rare in KFD. We describe a 42 year-old woman presenting kinetic tremor and gait ataxia preceding cervical lymphadenopathy. The diagnosis of KFD was made based on pathology. Lymphocyte-dominant pleocytosis was observed in cerebrospinal fluid. Brain and spinal magnetic resonance imaging showed no structural abnormalities. Acute cerebellar symptoms and cervical lymphadenopathy disappeared spontaneously within 2 months. This case of KFD involved unusual acute cerebellar symptoms. Selective involvement of the cerebellar system by viral or immunologic response may be attributed to acute cerebellar symptoms in KFD.","DictElement({'Year': '2008', 'Month': '11', 'Day': '22'}, attributes={'DateType': 'Electronic'})",2008,Journal of the neurological sciences,10.1016/j.jns.2008.10.021,,,Case Reports; Journal Article,Netherlands,eng
