pmid,title,authors,first_author,abstract,publication_date,publication_year,journal_info,doi,pmcid,keywords,article_type,country,language
11865559,[Post-traumatic Korsakoff's syndrome: clinical and anatomical report].,"Brion, S; Plas, J; Mikol, J; Jeanneau, A; Brion, F",Brion,"Clinical and anatomical report of a post traumatic amnestic syndrome (Korsakoff's syndrome), associating anterograde amnesia persisting for fifteen years, with temporal disorientation, false recognitions, initially intense transitory confabulation and secondarily bursts of confabulation, intact remote memory and persistence of old learnings. Death after twelve years from mesenteric infarction. Anatomically, post-traumatic sequellae are limited to both cingulate gyri in their anterior part. This cingula involvement is easy to understand if one knows that post-traumatic Korsakoff's syndrome appears after severe cranial traumatisms, with at least three days of coma, and develops constantly, even if transitory, after long duration comas with 20 to 30 days of loss of consciousness. Anatomical explanation depends on the fact that Korsakoff's syndromes from various etiologies need, to be produced, a bilateral damage of the limbic circuit and that severe head traumatisms, when dying early in the evolution without possibility of a neuro-psychological investigation, have always a destruction of corpus callosum or cingulate gyri or both, resulting from crushing of these structures by the edge of the faulx cerebri. Consistent with these constatations, it is logical that a Korsakoff's syndrome develops after severe head traumas with bilateral lesions of the limbic circuit and especially of the cingulate gyri. But anatomical evidence remains rare, because early fatal evolution does not permit psychological evaluation and, reversely, long survivals who may die from another pathology would not have brain examination. We prefer the name of ""Korsakoff's syndrome"" rather than that of ""amnesic syndrome"" to denominate the anterograd amnesia (amnésie des faits récents) encountered in nutritional disorders due to B1 deficiency in true Korsakoff's disease, but also with other etiologies such as cerebral tumours, vascular cerebral disorders, post-commital anoxia, herpetic encephalopathy, head traumas, all of them developing amnesia for recent events, formerly classified under the title of ""korsakowian syndrome"" or ""mental syndrome of Korsakoff"" and more recently under the denomination of ""amnesic syndrome"". But whatever is the etiology of the memory disorder, the amnesic syndrome remains identical and the advanced small differences, such as euphoria in alcoholics or mood depression in tumours, are often fallacious, so that the only way of differentiation deals with accessory symptoms such as intracranial hypertension in tumours, sudden onset in vascular etiologies or polyneuritis in B1 deficiency. Post-traumatic Korsakoff's syndrome joins with this scheme, for its clinical aspect is so similar to that of nutritional disorders that it might be difficult to reach the exact diagnosis when an alcohol addict develops, after a head trauma, an amnesia which could be the consequence of the trauma but also of a nutritional disorder developed after the accident with inadequate parenteral treatment. Our case, which is the first well documented observation of this disease reported with long clinical survey and final pathological examination, was presented in 1981 at a joint meeting of the French and Dutch neurological societies. It gives the proof of the importance, in limbic circuit, of the cingulate gyri. A comparison is made with four other clinical cases of post traumatic amnestic syndrome with MNR procedures which show, for two of them, cingula lesions explaining the clinical features, for one of them a bilateral lesion of Ammon's homs and for the last one extra-limbic lesions, with destruction of the inferior part of both frontal lobes, associated with a possible deafferentation of the right cingula cortex.",{},,L'Encephale,,,,Case Reports; English Abstract; Journal Article,France,fre
27812504,Medio-dorsal thalamus and confabulations: Evidence from a clinical case and combined MRI/DTI study.,"Onofrj, Valeria; Delli Pizzi, Stefano; Franciotti, Raffaella; Taylor, John-Paul; Perfetti, Bernardo; Caulo, Massimo; Onofrj, Marco; Bonanni, Laura",Onofrj,"The Medio-Dorsal Nuclei (MDN) including the thalamic magnocellular and parvocellular thalamic regions has been implicated in verbal memory function. In a 77 year old lady, with a prior history of a clinically silent infarct of the left MDN, we observed the acute onset of spontaneous confabulations when an isolated new infarct occurred in the right MDN. The patient and five age-matched healthy subjects underwent Magnetic Resonance Imaging (MRI) and Diffusion Tensor Imaging (DTI). The thalamic lesions were localized by overlapping Morel Thalamic Atlas with structural MRI data. DTI was used to assess: i) white matter alterations (Fractional Anisotropy, FA) within fibers connecting the ischemic areas to cortex; ii) the micro-structural damage (Mean Diffusivity) within the thalamic sub-regions defined by their structural connectivity to the Anterior Cingulate Cortex (ACC) and to the temporal lobes. These target regions were chosen because their damage is considered associated with the appearance of confabulations. Thalamic lesions were localized within the parvocellular regions of the right and left MDNs. The structural connectivity study showed that the fiber tracts, connecting the bilaterally damaged thalamic regions with the frontal cortex, corresponded to the anterior thalamic radiations (ATR). FA within these tracts was significantly lower in the patient as compared to controls. Mean diffusivity within the MDNs projecting to Broadman area (BA) 24, BA25 and BA32 of ACC was significantly higher in the patient than in control group. Mean diffusivity values within the MDN projecting to temporal lobes in contrast were not different between patient and controls. Our findings suggest the involvement of bilateral MDNs projections to ACC in the genesis of confabulations and help provide clarity to the longstanding debate on the origin of confabulations.","DictElement({'Year': '2016', 'Month': '10', 'Day': '12'}, attributes={'DateType': 'Electronic'})",2016,NeuroImage. Clinical,10.1016/j.nicl.2016.10.011,PMC5079356,"ACC, Anterior Cingulate Cortex; ACoA, Anterior communicating artery; AN, Anterior thalamic nuclei; ATR, Anterior thalamic radiations; Amnesia; BA, Broadman area; BEDPOSTX, Bayesian Estimation of Diffusion Parameters obtained using Sampling; BET, Brain Extraction Tool; CSF, cerebrospinal fluid; Confabulation; DTI, Diffusion Tensor Imaging; DWI-SE, Diffusion Weighted Image Spin-Echo; FA, Fractional Anisotropy; FAST, FMRIB's Automated Segmentation Tool; FIRST, FMRIB's Integrated Registration and Segmentation Tool; FLIRT, FMRIB's Linear Image Registration Tool; FNIRT, FMRIB's Non-Linear Registration Tools; KS, Korsakoff Syndrome; MDN, Medio-dorsal thalamic nuclei; MNI, Montreal Neurological Institute (MNI); MRI, Magnetic Resonance Imaging; Medio-dorsal thalamic region; SUSAN, Smallest Univalue Segment Assimilating Nucleus; TE, Echo time; TR, Repetition time; W TFE, Weighted Turbo Field-Echo W TFE","Case Reports; Journal Article; Research Support, Non-U.S. Gov't",Netherlands,eng
23962109,Phantabulation: a case of visual imagery interference on visual perception.,"Cocchini, Gianna; Lello, Owen; McIntosh, Robert D; Della Sala, Sergio",Cocchini,"We report the case of a 52-year old man who, following rupture of an anterior communicating artery aneurysm, presented with a phenomenon not previously described, which we have labelled ""Phantabulation."" Phantabulation is characterized by frequent and purposeful interactions with contextually appropriate imagined objects. We suggest that this phenomenon results from confusion between real and imagined objects, caused by failure to inhibit florid visual imagery, facilitated by cortical release mechanisms.","DictElement({'Year': '2013', 'Month': '08', 'Day': '21'}, attributes={'DateType': 'Electronic'})",2013,Neurocase,10.1080/13554794.2013.826689,,Confabulation; Perception; Stroke; Visual imagery,Case Reports; Journal Article,England,eng
25515048,Anton-Babinski syndrome in an old patient: a case report and literature review.,"Chen, Jiann-Jy; Chang, Hsin-Feng; Hsu, Yung-Chu; Chen, Dem-Lion",Chen,"Anton-Babinski syndrome is a rare disease featuring bilateral cortical blindness and anosognosia with visual confabulation, but without dementia or any memory impairment. It has a unique neuropsychiatric presentation and should be highly suspected in those with odd visual loss and imaging evidence of occipital lobe injury. In the case discussed herein, a 90-year-old man presented with bilateral blindness, obvious anosognosia, and vivid visual confabulation, which he had had for 3 days. Brain computed tomography demonstrated recent hypodense infarctions at the bilateral occipital lobes. Thus, the patient was diagnosed with Anton-Babinski syndrome. Because of his age and the thrombolytic therapy during the golden 3 hours after ischemic stroke, the patient received aspirin therapy rather than tissue plasminogen activator or warfarin. He gradually realized he was blind during the following week, but died of pneumonia 1 month later. In the literature, it is difficult to establish awareness of blindness in patients with Anton-Babinski syndrome, but optimistically, in one report, a patient was aware of blindness within 2 weeks, without vision improvement. Our case illustrates that elderly patients with Anton-Babinski syndrome can partially recover and that 1 week is the shortest time for the establishment of awareness of blindness for sufferers without vision improvement.","DictElement({'Year': '2014', 'Month': '12', 'Day': '16'}, attributes={'DateType': 'Electronic'})",2014,Psychogeriatrics : the official journal of the Japanese Psychogeriatric Society,10.1111/psyg.12064,,Anton-Babinski syndrome; blind anosognosia; cortical blindness; occipital lobe infarction; visual confabulation,Case Reports; Journal Article; Review,England,eng
10871831,Confabulation and multiple sclerosis: a rare association.,"Feinstein, A; Levine, B; Protzner, A",Feinstein,"Fantastic confabulation in the context of Multiple Sclerosis (MS) has not previously been reported in the literature. The association is of interest because clearly demonstrable brain pathology in MS together with other cognitive and behavioural correlates may further our understanding of the neural basis underlying confabulation. A single case report with magnetic resonance imaging of the brain and detailed neuropsychological evaluation. Confabulation occurred together with disinhibited and stimulus bound behaviour. While the patient's physical and emotional state limited the range of psychometric tests administered, the results revealed an inability to maintain focused, regulated information processing. Although memory difficulties were present, they were not in the nature of a severe amnesic disorder. The patient appeared to have a broad fund of knowledge, but the associations binding the information together and putting it into context were loose. All three features of a triad of responses previously described in confabulating patients were present, namely an inability to withhold answers, to monitor one's own responses and provide verbal self corrections. MRI of the brain showed bilateral periventricular lesions and discrete frontal lesions with 53% of the total lesion volume distributed in frontal areas. Cortical atrophy, most marked in frontal regions also was conspicuous. Confabulation linked to frontal lobe involvement may occur as part of the changes in mentation found in MS. It is, however, rare and although associated with impaired memory, may be found in the absence of a severe amnesic disorder. This conclusion is discussed in the light of observations from the literature suggesting that frontal involvement is a prerequisite before fantastic confabulation occurs.",{},,"Multiple sclerosis (Houndmills, Basingstoke, England)",10.1177/135245850000600309,,,"Case Reports; Journal Article; Research Support, Non-U.S. Gov't",England,eng
8124934,Different patterns of confabulation.,"Dalla Barba, G",Dalla Barba,"In this study we investigated the amnesic-confabulatory condition of two patients, M.B. and S.D., exhibiting different patterns of confabulation. Neuropsychological examination showed in M.B. a normal intellectual efficiency and a selective deficit of episodic memory, whereas S.D. was impaired in tests of intellectual efficiency, episodic memory, semantic knowledge and frontal functions. The relation of confabulation to retrieval conditions and the degree of impairment of the semantic memory system was investigated with a set of questions involving the retrieval of various kinds of information. In M.B. confabulation was restricted to episodic memory tasks, whereas in S.D. it also affected the retrieval of semantic information. S.D.'s confabulatory reports were 'semantically anomalous', whereas the semantic structure of M.B.'s confabulations was appropriate. Further investigation using the encoding specificity paradigm showed an interaction of encoding/retrieval conditions in M.B. but not in S.D. This pattern of results is discussed in terms of a different level of disruption of processes that normally monitor the retrieval of information. It is further argued that the confabulation content must be considered in terms of its semantic structure and relies on the level of integrity of semantic knowledge.",{},,Cortex; a journal devoted to the study of the nervous system and behavior,10.1016/s0010-9452(13)80281-x,,,Case Reports; Journal Article,Italy,eng
33233982,Anton's syndrome as a presentation of Trousseau syndrome involving the bilateral optic radiation.,"Cao, Shugang; Zhu, Xiaoxia; Zhang, Wenting; Xia, Mingwu",Cao,"Anton's syndrome is a rare neuropsychiatric syndrome that is characterized by cortical blindness and anosognosia with visual confabulation, but without global cognitive impairment. We herein report a rare case of Anton's syndrome as a presentation of Trousseau syndrome involving the bilateral optic radiation. The patient had been diagnosed with gallbladder cancer 2 months previously, and he was admitted to the hospital with confusion and quadriplegia. He was found to be blind, but denied any visual impairment and demonstrated visual confabulation despite evidence of his blindness. These signs were consistent with a diagnosis of Anton's syndrome. Brain computed tomography (CT) and magnetic resonance imaging revealed infarcts in the bilateral temporo-parieto-occipital junction with hemorrhagic transformation, mainly involving the bilateral optic radiation. The presence of gallbladder cancer with peripheral metastasis on abdominal CT, as well as markedly increased tumor markers and D-dimer levels, supported the presence of cancer-related hypercoagulability and the diagnosis of Trousseau syndrome.",{},,The Journal of international medical research,10.1177/0300060520972907,PMC7705385,Anton’s syndrome; Trousseau syndrome; cortical blindness; optic radiation; stroke; tumor,Case Reports; Journal Article,England,eng
29130385,Developing awareness of confabulation through psychological formulation: A case report and first-person perspective.,"Fish, Jessica; Forrester, Joseph",Fish,"Confabulation, or the unintentional production of false, distorted or displaced memories, is commonly seen in people who have brain injury. However, it is most common in the acute phase, with persistent confabulation being comparatively rare. In this paper, we describe the case of Joe, a 24-year-old man who showed confabulation in the chronic phase of his rehabilitation, three years after traumatic brain injury. We describe our approach to therapy for this confabulation, and in particular how collaborative formulation enabled Joe to understand his confabulation, and then to manage it effectively, using a diary and ""detective"" procedure to identify whether or not evidence existed to support potentially confabulated memories. Furthermore, we include Joe's own perspective on what it is like to be confabulating, and on his experience of rehabilitation. This is an example of a successful insight-based therapeutic intervention, which is rare in this domain. To the best of our knowledge, this is also the first example of a first-person perspective on confabulation.","DictElement({'Year': '2017', 'Month': '11', 'Day': '12'}, attributes={'DateType': 'Electronic'})",2017,Neuropsychological rehabilitation,10.1080/09602011.2017.1397031,,False memory; Management; Psychological therapy; Treatment,Case Reports; Journal Article,England,eng
19172453,Injury and recovery: severe amnestic syndrome following traumatic brain injury.,"Collinson, Simon L; Meyyappan, Amutha; Rosenfeld, Jeffrey V",Collinson,"To illustrate the clinical course of a patient with a marked amnestic syndrome resulting from a closed head injury that had significant effects on frontal and thalamic memory structures. The patient underwent a series of brain imaging investigations (CT and MRI) and neuropsychological investigations to determine the severity and course of behavioural and cognitive impairments. Three months post-injury, the patient demonstrated dense retrograde and anterograde amnesia for auditory-verbal and visuo-spatial information, disorientation and confabulation. In contrast, memory for faces appeared unimpaired. One month later the patient's behaviour, orientation and spatial memory had improved with no concomitant improvement in auditory-verbal memory. The findings indicate that injury to the diencephalon manifests in a verbal amnesic syndrome that is anterograde in nature if localized in the region of the anterior left thalamus, but leaves a relatively intact visual memory. Furthermore, injuries to the frontal and temporal lobes and their projections to the diencephalon may be more important in the emergence and resolution of retrograde amnesia and disturbances in autobiographical recall than previously appreciated.",{},,Brain injury,10.1080/02699050802649647,,,Case Reports; Journal Article,England,eng
30314761,Bioccipital Lobe Hypoperfusion and Anton's Syndrome Resolution with Intravenous Thrombolysis.,"Rotkopf, Lukas T; Kunz, Wolfgang G; Meinel, Felix G; Plate, Annika; Langner, Sönke; Klein, Matthias; Thierfelder, Kolja M",Rotkopf,"Anton's syndrome is a rare neurological disorder characterized by a combination of visual anosognosia and confabulation of visual experience, most often seen after bilateral ischemic damage to the posterior occipital cortex. We report the first case of an acute synchronous P2 occlusion as confirmed by multiparametric computed tomography (CT) including perfusion. After the administration of Recombinant tissue plasminogen activator (rtPA), Anton's syndrome completely resolved. Multiparametric CT imaging may aid in quickly proving the underlying stroke in Anton's syndrome, especially helpful considering the discrepancy between the patient's perception and clinical examination results.","DictElement({'Year': '2018', 'Month': '10', 'Day': '10'}, attributes={'DateType': 'Electronic'})",2018,Journal of stroke and cerebrovascular diseases : the official journal of National Stroke Association,10.1016/j.jstrokecerebrovasdis.2018.09.016,,Anton's syndrome; CT perfusion; Stroke; anosognosia; posterior cerebral artery occlusion,Case Reports; Journal Article,United States,eng
36482648,A case report of Wernicke Korsakoff syndrome in a patient with cholangiocellular carcinoma: An underestimated cause of encephalopathy in cancer patients.,"Koca, Oguzhan; Demir, Bilal; Derin, Sumeyra; Turna, Zeynep Hande",Koca,"Wernicke's encephalopathy, a disorder caused by thiamin deficiency, is characterized by a classical triad of encephalopathy, ataxia, and ophthalmoplegia. Although alcoholism is the most common predisposing factor, it can also be associated with nonalcoholic states (hyperemesis gravidarum, intestinal obstruction, bariatric surgery, and others). This work presents a case of nonalcoholic Wernicke-Korsakoff syndrome diagnosed in a cholangiocellular carcinoma patient and literature review. A 65-year-old male patient with a history of cholangiocellular carcinoma (Klatskin tumor) was treated with radiotherapy at the operation site after Roux-en-Y hepaticojejunostomy. During follow-up, the patient developed gastric outlet obstruction and was diagnosed with peritoneal carcinomatosis after a palliative gastrojejunostomy. As the patient could not tolerate oral nutrition during hospitalization, total parenteral nutrition was administered. After 10 days of admission, the patient showed decreased response to verbal stimuli as well as bilateral horizontal nystagmus, lethargy, and disorientation. Furthermore, the patient displayed confabulation. Clinical and imaging findings were consistent with Wernicke's encephalopathy. Therefore, treatment with intravenous thiamin replacement was initiated. The patient's encephalopathy regressed on the second day after treatment, and he recovered the place-person-time orientation. In the following month, the abnormal imaging findings were almost entirely resolved. In order to prevent irreversible brain damage induced by chronic thiamin deficiency, thiamin replacement therapy with parenteral nutrition solutions should be included as a treatment for hospitalized cancer patients unable to receive enteral nutrition for a long time.",{},,Medicine,10.1097/MD.0000000000031904,PMC9726370,,Case Reports; Journal Article,United States,eng
11557825,Profound amnesia and confabulation following traumatic brain injury.,"Demery, J A; Hanlon, R E; Bauer, R M",Demery,"Amnesia and confabulation may persist following acute aneurysmal hemorrhage of the anterior communicating artery, chronic alcoholic Korsakoff's syndrome, and late-stage dementia of the Alzheimer type. However, there is a paucity of information regarding the persistence of these symptoms following traumatic brain injury. We present the case of JL, a 43-year-old male with persistent and severe anterograde amnesia for verbal and visual information with co-occurring provoked confabulation which persists well into the chronic phase of recovery after a severe traumatic brain injury. Neuropsychological testing at 7 weeks post-injury demonstrated severe anterograde amnesia with co-occurring confabulation. Follow-up testing at 9.5 months post-injury showed persistent and severe anterograde amnesia and provoked confabulation despite superior non-verbal intelligence and above average attentional and perceptual abilities. Late computed tomography showed chronic hypodense regions in the temporal lobes, bilaterally (L > R), and in the region of the left ventrolateral frontal lobe. This case demonstrates that anterograde amnesia and provoked confabulation may persist long after the acute phase of recovery after traumatic brain injury, and also supports previous research which asserts that medial temporal lobe damage must be accompanied by ventral frontal lobe pathology to produce the amnestic-confabulatory syndrome.",{},,Neurocase,10.1093/neucas/7.4.295,,,Case Reports; Journal Article,England,eng
11887126,Frontal impairment and confabulation after herpes simplex encephalitis: A case report.,"Del Grosso Destreri, Nicoletta; Farina, Elisabetta; Calabrese, Elena; Pinardi, Giovanna; Imbornone, Emilia; Mariani, Claudio",Del Grosso Destreri,"We describe the rehabilitation training of a 53-year-old woman with severe confabulatory and dysexecutive syndrome, as well as memory impairment, after herpes simplex encephalitis (HSE). Secondary narcolepsy was also present. Neuropsychologic deficits were detailed through an extensive examination, and specific techniques were used to improve performances in each defective cognitive domain. Improvement of vigilance and attention was reached through appropriate and timed periods of rest, along with attentional tasks of growing difficulty. Different external aids were used to reduce temporal disorientation, to contrast confabulation and inertia, and to overcome memory deficits in everyday life. Their independent use by the patient was implemented through cues that were progressively reduced. Treatment also focused on planning, categorization, and topographic orientation. The patient's family gave constant support during rehabilitation and provided informal training after discharge. The patient was able to regain independence in everyday life at home.",{},,Archives of physical medicine and rehabilitation,10.1053/apmr.2002.29646,,,Case Reports; Journal Article,United States,eng
