pmid,title,authors,first_author,abstract,publication_date,publication_year,journal_info,doi,pmcid,keywords,article_type,country,language
37828390,"Footloose (footloose), footloose.","Mumoli, Laura; Magro, Giuseppe; Bosco, Domenico",Mumoli,"A 78-year-old woman without past relevant medical history presented to the emergency department for acute transient dysarthria. NIHSS was 0/42. Neurological examination revealed chorea-like movements over the left limbs, especially the foot. No other neurological signs were present. CT perfusion showed right cortical hypoperfusion due to right M2 occlusion, basal-ganglia perfusion was normal. Brain MRI revealed a small focus of restricted diffusion in the right insula, sparing basal ganglia. Based on the neuroimaging features and clinical correlation, despite the NIHSS score, we decided to treat the patient with alteplase, after iv-thrombolysis hyperkinetic movements ceased completely. Brain-MRI performed 72 h after symptom onset confirmed a confined insular ischemic lesion without the involvement of deep gray matter structures. Hyperkinetic movement disorders, such as hemichorea hemiballismus, are rare presentations of stroke, basal ganglia are mainly involved even if the insular cortex has been described too. Clinical decision on whether to treat ischemic stroke does not include movement disorders. Our case underscores NIHSS limitations in clinical practice.","DictElement({'Year': '2023', 'Month': '10', 'Day': '13'}, attributes={'DateType': 'Electronic'})",2023,Neurological sciences : official journal of the Italian Neurological Society and of the Italian Society of Clinical Neurophysiology,10.1007/s10072-023-07112-0,,Acute ischemic stroke; Hemichorea; Movement disorders; NIHSS limitations; Stroke,Case Reports; Journal Article,Italy,eng
24008760,Cortical hemichorea-hemiballism.,"Hwang, Kyoung Jin; Hong, Il Ki; Ahn, Tae-Beom; Yi, Sang Hun; Lee, Dokyung; Kim, Deog Yoon",Hwang,"Hemichorea-hemiballism (HCHB) was infrequently related to cortical lesions such as tumor or infarction. Although functional derangement of the basal ganglia (BG) or the thalamus (Th) was suggested, pathomechanism of HCHB secondary to cortical lesions remains uncertain. We recruited the patients with HCHB secondary to cerebrovascular diseases, excluding other causes such as hyperglycemia. All the patients were studied with brain magnetic resonance imaging/angiography (MRI/MRA) and single-photon emission computed tomography (SPECT). Those with only cortical abnormalities in neuroimaging studies were sorted out as the cases of cortical HCHB. Statistical parametric mapping (SPM) analysis of SPECT was performed to investigate the pathomechanism of cortical HCHB. Ten patients (three males and seven females) were included in our study. Six patients had acute BG lesions with SPECT abnormalities, and one had old BG lesions with abnormal SPECT. Three patients were classified as cortical HCHB with lesions only in the frontal and parietal cortices in MRI and SPECT. SPM analysis revealed additional hypoperfusion in frontal areas, leaving BG and Th free of any perfusion abnormalities. Although cortical HCHB was strictly defined by MRI and SPECT, cortical HCHB was not uncommon (30 %). Further analysis showed intertwined networks among the frontal and parietal lobes for cortical HCHB. Cortical dysfunction is important in the pathogenesis of cortical HCHB even without significant involvement of BG and Th.","DictElement({'Year': '2013', 'Month': '09', 'Day': '06'}, attributes={'DateType': 'Electronic'})",2013,Journal of neurology,10.1007/s00415-013-7096-7,,,Case Reports; Journal Article,Germany,eng
30872840,[Hemichorea–hemiballismus].,"Alstadhaug, Karl Bjørnar; Karlberg, Merethe",Alstadhaug,,"DictElement({'Year': '2019', 'Month': '03', 'Day': '06'}, attributes={'DateType': 'Electronic'})",2019,"Tidsskrift for den Norske laegeforening : tidsskrift for praktisk medicin, ny raekke",10.4045/tidsskr.18.0779,,,Case Reports; Video-Audio Media,Norway,nor
34507431,Uncommon Presentation of Rasmussen's Encephalitis.,"Vyas, Arvind; Ghunawat, Jaypalsing Ramdhan; Bagaria, Amit Kumar; Khandelwal, Dinesh",Vyas,"Rasmussen's encephalopathy (RE) is an uncommon neurological disease of inflammatory origin which is characterized by intractable focal epilepsy, progressive limb weakness, and cognitive deterioration. RE presenting as movement disorder like hemidystonia or hemichorea is a rare occurrence. The duration of prodromal stage of RE is usually in weeks or months. Prolonged prodromal stage like in years is rarely reported. Magnetic resonance imaging (MRI) is a good biomarker in RE and it also suggests the sequential progression of disease. Here we report two cases of RE, one presenting with hemidystonia and other case with unusually prolonged prodromal stage duration of 7 years. In spite of severe hemi-atrophy of brain in second case response to immunomodulators was dramatic.",{},,Neurology India,10.4103/0028-3886.325325,,Cerebellar diaschisis; Rasmussen's encephalopathy; hemi-dystonia; tacrolimus,Case Reports,India,eng
31351828,Pure Cortical Stroke Causing Hemichorea-Hemiballismus.,"Strauss, Sara; Rafie, Daniel; Nimma, Anitha; Romero, Raquel; Hanna, Philip A",Strauss,"Movement disorders including hemichorea-hemiballism as the initial presentation of an acute ischemic stroke are uncommon. Structures outside of the deep subcortical areas such as the subthalamic nucleus or basal ganglia are rarely involved. We report a case of a 72-year-old man with vascular risk factors who presented with acute onset right-sided hemichorea-hemiballism. Metabolic-, infectious-, and toxic-related conditions were ruled out, his EEG was without epileptiform changes. An MRI confirmed an acute ischemic stroke in the parieto-occipital region without any subcortical structures involved. Atrial Fibrillation was later discovered during his hospitalization and was treated appropriately. Although rare, strokes outside of the subthalamic nucleus can result in hemichorea-hemiballism.","DictElement({'Year': '2019', 'Month': '07', 'Day': '25'}, attributes={'DateType': 'Electronic'})",2019,Journal of stroke and cerebrovascular diseases : the official journal of National Stroke Association,10.1016/j.jstrokecerebrovasdis.2019.07.003,,Stroke—movement disorder—hemichorea—hemiballism,Case Reports; Journal Article,United States,eng
33708093,Hemichorea Neglect after Stroke.,"Aiba, Yosuke; Sakakibara, Ryuji; Ogata, Tsuyoshi; Tateno, Fuyuki",Aiba,"We report a case of a 74-year-old Japanese woman who, after left thalamic infarction, developed right hemichorea and its neglect. This rare finding was associated with ipsi- and contralateral brain perfusion changes, presumably reflecting de-afferentiation within the brain.","DictElement({'Year': '2021', 'Month': '01', 'Day': '28'}, attributes={'DateType': 'Electronic'})",2021,Case reports in neurology,10.1159/000512266,PMC7923730,Hemichorea; Neglect; Striatum; Stroke,Case Reports,Switzerland,eng
25473878,Vascular hemichorea: case report and review.,"Martínez Alfonzo, Bárbara; Blanco, Andrés Enrique; Rojano, Jairo; Calleja, José Luis",Martínez Alfonzo,"Chorea rarely complicates ischemic or hemorrhagic cerebral vascular lesions. Clinical symptoms usually involve one side of the body while the injury is situated on the contralateral cerebral hemisphere. Spontaneous remission is the norm, but sometimes symptomatic treatment is required. A 58-year-old male patient who suffers from untreated high blood pressure, type II obesity, smokes 6 packs of cigarettes per year and has a moderate intake of alcohol is presented. The patient's recent history began three days before he appeared at the Emergency Department. His symptoms were ceaseless, involuntary movements in his left arm and foot during day and night with no restriction of voluntary movements. Physical examination and laboratory tests revealed no other findings. Magnetic resonance imaging of the brain showed hyperintensity in the right posterolateral thalamic region consistent with ischemic cerebrovascular disease. Symptomatic therapy was indicated and his underlying conditions were addressed. The importance of this case lies on the low prevalence as well as the scarcity of publications regarding vascular causes of hemichorea, including diagnosis, therapy and prognosis.","DictElement({'Year': '2014', 'Month': '04', 'Day': '09'}, attributes={'DateType': 'Electronic'})",2014,Medwave,10.5867/medwave.2014.03.5936,,vascular hemichorea,Case Reports; Journal Article; Review,Chile,eng; spa
38050508,Acute Caudate Nucleus Stroke Presenting As Hemiballismus.,"Babici, Denis; Mohamed, Ali A; Mattner, Olivia; Demiraj, Francis; Hammond, Thomas",Babici,"Hemiballismus is defined as irregular, involuntary, large-amplitude flinging movements by the limbs, confined to one side of the body. Hemichorea refers to a state of excessive and irregularly timed, non-repetitive and randomly distributed, spontaneous, involuntary, and abrupt movements. It is widely believed that hemiballismus and chorea are suggestive of a lesion to the basal ganglia and subthalamic nucleus (STN). However, there are other etiologies that may influence the clinical presentation. Patients may present with certain common clinical features corresponding to the affected area of the brain. For example, infarctions of the motor cortex present with hemiplegia or paralysis of one side of the body. Similarly, infarctions involving the language areas of the brain present with aphasia and are detrimental to speech production or comprehension and the ability to read and write. Typically, acute-onset hemichorea is suggestive of a lesion in the STN. Herein, we present a rare case of acute hemiballismus and hemichorea following infarction of the left caudate nucleus, as determined by magnetic resonance imaging (MRI) and computerized tomography (CT) imaging modalities.","DictElement({'Year': '2023', 'Month': '11', 'Day': '03'}, attributes={'DateType': 'Electronic'})",2023,Cureus,10.7759/cureus.48209,PMC10693717,basal ganglia infarction; basal ganglia stroke; chorea and hemiballismus; haloperidol; subthalamic nucleus,Case Reports,United States,eng
34430108,Cryptococcal Meningitis Causing Refractory Hemichorea-Hemiballismus Treated With Pallidotomy.,"Buell, Kevin G; Vickers, Brian P; Bloch, Karen C; Brown, Amy E; Hedera, Peter; Jermakowicz, Walter; Konrad, Peter E; Wesley Ely, E",Buell,"We report a case of a 31-year-old immunocompetent male who presented with altered mental status and agitation requiring intubation. As sedation was weaned, he demonstrated choreiform movements with associated hemiballismus of the right upper and lower extremities, and he was ultimately diagnosed with cryptococcal meningitis. The patient's chorea did not terminate after the completion of induction antifungal therapy and all pharmacologic options for the management of chorea were ineffective. He underwent a successful unilateral pallidotomy using standard stereotactic methodology targeting the posterior-ventral pallidum, and his choreiform movements dramatically improved post-operatively within 48 hours.","DictElement({'Year': '2021', 'Month': '07', 'Day': '19'}, attributes={'DateType': 'Electronic'})",2021,Cureus,10.7759/cureus.16493,PMC8372680,cryptococcal meningitis; cryptococcus neoformans; hemiballismus; hemichorea; pallidotomy,Case Reports,United States,eng
38367007,Diabetic striatopathy: a case report.,"Guan, Yi; Yuan, Lu; Yuan, Lei",Guan,"Diabetic striatopathy, a rare condition also known as hyperglycemic nonketotic hemichorea, is characterized by chorea or hemiballismus and distinctive basal ganglia abnormalities visible on neuroimaging. We present the case of an 86-year-old woman with diabetic striatopathy exhibiting hemichorea. She had a history of poorly controlled type 2 diabetes and presented with involuntary movements of her left limb along with facial expressions suggestive of chorea. Laboratory tests confirmed hyperglycemia, with an elevated hemoglobin A1c level. Neuroimaging revealed T1-hyperintensity in the right basal ganglia. The patient was diagnosed with diabetic striatopathy and responded well to intensive insulin therapy with a rapid resolution of symptoms.","DictElement({'Year': '2024', 'Month': '02', 'Day': '17'}, attributes={'DateType': 'Electronic'})",2024,Neurocase,10.1080/13554794.2024.2317788,,Diabetic striatopathy; chorea; hemichorea; hyperglycemic; neuroimaging,Case Reports; Journal Article,England,eng
38468351,Nonketotic hyperglycemia hemichorea and hemiballismus: a case report.,"Dixit, Abhishek",Dixit,"Diabetic striatopathy, also known as hyperglycemic hemichorea-hemiballismus, is a rare movement disorder associated with nonketotic hyperglycemia in patients with poorly controlled diabetes mellitus. The pathophysiology is not fully elucidated but may involve hyperviscosity, ischemia, and alterations in basal ganglia neurotransmitters. We present a case of a 64-year-old Asian female patient with longstanding poorly controlled type 2 diabetes mellitus who developed abrupt-onset right-sided hemichorea-hemiballismus. Laboratory results showed hyperglycemia without ketoacidosis. Neuroimaging revealed left putaminal hyperdensity on computed tomography and T1 hyperintensity on magnetic resonance imaging. With insulin therapy and tetrabenazine, her movements improved but persisted at 1-month follow-up. This case illustrates the typical features of diabetic striatopathy, including acute choreiform movements contralateral to neuroimaging abnormalities in the setting of nonketotic hyperglycemia. While neuroleptics may provide symptomatic relief, prompt glycemic control is critical given the risk of recurrence despite imaging normalization. Diabetic striatopathy should be recognized as a rare disorder that can occur with poorly controlled diabetes. Further study of its pathophysiological mechanisms is needed to better guide management. Maintaining tight glycemic control is essential to prevent recurrence of this debilitating movement disorder.","DictElement({'Year': '2024', 'Month': '03', 'Day': '12'}, attributes={'DateType': 'Electronic'})",2024,Journal of medical case reports,10.1186/s13256-023-04332-y,PMC10929169,Acute choreiform movements; Diabetic striatopathy; Hyperglycemic hemichorea-hemiballismus; Neurotransmitter alterations; Nonketotic hyperglycemia; Putaminal hyperdensity; Type 2 diabetes mellitus,Case Reports; Journal Article,England,eng
34545348,Neurological complications of SARS-CoV-2: A single-center case series authors.,"Hassan, Muhammad; Khan, Naveed Ullah; Iqbal, Mansoor; Jan, Zakir; Rajput, Haris Majid; Dewey, Rebecca Susan; Badshah, Mazhar",Hassan,"The neurological manifestations of SARS-CoV-2 are wide-ranging from simple headache to severe demyelinating brain disease. This is a review of collected case reports of patients with SARS-CoV-2 with neurological manifestations presenting to the Pakistan Institute of Medical Sciences (PIMS). Neurological manifestations associated with SARS-CoV-2 such as encephalitis, acute cerebrovascular disease, encephalitis with chorea, post-COVID myositis and Guillain-Barré Syndrome (GBS) are of great concern but are often overlooked in the presence of life-threatening abnormal vital signs in severely ill SARS-CoV-2 patients. There is a need to diagnose these manifestations at the earliest opportunity to limit long-term consequences and complications. Much research is needed to explore the role of SARS-CoV-2 in causing these neurological manifestations by isolating it either from the cerebrospinal fluid (CSF) or the brain tissue of the deceased on autopsy. We also recommend exploring the risk factors that lead to the development of these neurological manifestations.","DictElement({'Year': '2021', 'Month': '09', 'Day': '16'}, attributes={'DateType': 'Electronic'})",2021,Brain hemorrhages,10.1016/j.hest.2021.09.004,PMC8443530,Covid-19; Encephalitis; Guillian Barre Syndrome; Polymyositis; Stroke,Case Reports,Netherlands,eng
32226699,Chorea as the First Manifestation of Cerebral Infarction.,"Hernandez Fustes, Otto Jesus; Puppi Munhoz, Renato; Arteaga Rodriguez, Carlos; Hernandez Fustes, Olga Judith",Hernandez Fustes,"Cerebrovascular disease (CVD), which usually manifests as a focal neurological deficit, is presented here as a movement disorder. This unusual manifestation corresponds to 1% of the CVDs and 8% of the striatal lesions. We report a 37-year-old right-handed woman who developed choreic movements as the first manifestation of an acute stroke. The computed tomography (CT) scan revealed a cortical/subcortical hypodense lesion in the right middle cerebral artery territory. This picture slowly improved and remitted completely after six weeks. Basal ganglia infarcts are crucial for the development of hemichorea, however, in spite of its frequency, movement disorders are disproportionally rare. In the majority of cases, the prognosis is good with spontaneous remission after two to four weeks.","DictElement({'Year': '2020', 'Month': '03', 'Day': '24'}, attributes={'DateType': 'Electronic'})",2020,Cureus,10.7759/cureus.7384,PMC7096072,basal ganglia; hemichorea; ischemic cerebrovascular disease; movement disorder,Case Reports,United States,eng
34307580,Hemichorea due to ipsilateral thalamic infarction: A case report.,"Li, Zhao-Sheng; Fang, Jia-Jia; Xiang, Xiao-Hui; Zhao, Guo-Hua",Li,"Hemichorea usually results from vascular lesions of the basal ganglia. Most often, the lesion is contralateral to the affected limb but rarely, it may be ipsilateral. The pathophysiology of ipsilateral hemichorea is still poorly understood. We review the literature on hemichorea due to ipsilateral cerebral infarction and explore possible mechanisms for its occurrence. A 72-year-old woman presented with complaints of involuntary movements of the muscles of the left side of the face and mild weakness of the right limbs. Her symptoms had started suddenly 1 d earlier. After admission to the hospital, the involuntary movements spread to involve the left limbs also. Magnetic resonance imaging revealed a left thalamic infarction. The patient's hemichorea subsided after treatment with haloperidol (2 mg per time, 3 times/d) for 3 d; the hemiparesis resolved with rehabilitation physiotherapy. She is presently symptom free and on treatment for prevention of secondary stroke. We review the literature on the occurrence of ipsilateral hemichorea following thalamic infarction and discuss the possible pathomechanisms of this unusual presentation. Ipsilateral hemichorea following a thalamic stroke is rare but it can be explained by structure of the extrapyramidal system. The thalamus is a relay station that exerts a bilateral control of motor function.",{},,World journal of clinical cases,10.12998/wjcc.v9.i19.5287,PMC8283608,Case report; Hemichorea; Hemiparesis; Ipsilateral; Stroke; Thalamic infarction,Case Reports,United States,eng
36316784,Hemiballismus-hemichorea syndrome in an acute rehabilitation setting: two case reports.,"Tsai, Luke; Shekhtman, Benjamin; Stenquist, Ryan; Schneider, Ashley; Mapa, Meilani; Amirianfar, Edwin; Gater, David R",Tsai,"We report two similar cases of patients diagnosed with hemiballismus-hemichorea syndrome secondary to uncontrolled hyperglycemia. Both patients were treated at an inpatient rehabilitation center and made a significant recovery in both function and activities of daily living. Although hemiballismus-hemichorea syndrome has known pharmacological treatments, little has been reported on the effectiveness of acute rehabilitation on managing and treating this syndrome. The first case involves a 44-year-old Hispanic male with past medical history of type 2 diabetes mellitus, hypertension, anxiety, and depression who presented with continuous, uncontrollable, unilateral movements 1 month following a hospital admission for hyperglycemia. Magnetic resonance imaging findings showed lesions in the basal ganglia, confirming the diagnosis of hemiballismus-hemichorea syndrome. The patient was started on antipsychotic medications and antihyperglycemic medications controlling glucose levels, but continued to have hemiballismus symptoms. The second case involves a 78-year-old Haitian female with past medical history of type 2 diabetes mellitus and hypertension who presented with weakness and continuous, involuntary movements in her upper and lower extremities 1 month following a hospital admission for hyperglycemia and encephalopathy. Magnetic resonance imaging findings were positive for bilateral lesions in the basal ganglia, establishing a diagnosis of hemiballismus-hemichorea syndrome. After a 2-week stay at an acute rehabilitation center, both patients made a significant recovery in function and activities of daily living. The aim in presenting these cases is to elucidate the etiology and progression of a rare disease process known as hemiballismus-hemichorea syndrome and to provide evidence for the potential positive impact of acute rehabilitation on patients with unresolved hemiballismus-hemichorea following an episode of hyperglycemia.","DictElement({'Year': '2022', 'Month': '10', 'Day': '31'}, attributes={'DateType': 'Electronic'})",2022,Journal of medical case reports,10.1186/s13256-022-03577-3,PMC9623901,Basal ganglia; Case report; Dyskinesias; Hyperglycemia; Rehabilitation,Case Reports; Journal Article,England,eng
36762000,Hypoglycemic Encephalopathy Manifesting with Cortical Hemichorea-Hemiballismus Syndrome: A Case Report.,"Pasini, Francesco; Karantzoulis, Aristotelis; Fanella, Gaia; Brovelli, Francesco; Iacobucci, Davide; Aprea, Vittoria; Storti, Benedetta; Santangelo, Francesco; Canonico, Francesco; Remida, Paolo; Ferrarese, Carlo; Brighina, Laura",Pasini,"Hyper-/hypoglycemic states are rare but well-established causes of hyperkinetic movements, including chorea and ballismus, usually associated with brain lesions in the basal ganglia. We report a case of hemichorea-hemiballismus (HCHB) syndrome that developed after a severe hypoglycemic episode in a 71-year-old man with poorly controlled type 2 diabetes mellitus. Uncommonly, brain MRI showed contralateral cortical-subcortical T2 and T2-FLAIR-hyperintense frontoparietal lesions, with cingulate gyrus involved, while the basal ganglia were unaffected. In patients with hypoglycemic encephalopathy associated with cortical lesions, the long-term prognosis is usually poor. Nevertheless, in our patient, the dyskinesias and the cerebral lesions progressively regressed by achieving good glycemic control. After four and 12 months, the patient's neurological examination was normal. To our knowledge, this is the first evidence of hypoglycemic etiology of cortical HCHB syndrome, supporting recent theories that cortical circuitries may independently contribute to the pathogenesis of chorea and ballismus. This is also the first report of cingulate gyrus involvement in hypoglycemic encephalopathy. Finally, this case may indicate that a subset of patients with cortical lesions due to hypoglycemia could present a good clinical outcome, likely depending on the size of the lesions and the duration and severity of the hypoglycemic episode.","DictElement({'Year': '2023', 'Month': '02', 'Day': '07'}, attributes={'DateType': 'Electronic'})",2023,Case reports in neurology,10.1159/000528880,PMC9906039,Hemiballismus; Hemichorea; Hemichorea-hemiballismus syndrome; Hypoglycemia; Hypoglycemic encephalopathy,Case Reports,Switzerland,eng
26209754,Gluten chorea.,"Andrade, Carlos; Rocha, Helena; Albuquerque, Andreia; Sá, Maria José",Andrade,,"DictElement({'Year': '2015', 'Month': '07', 'Day': '17'}, attributes={'DateType': 'Electronic'})",2015,Clinical neurology and neurosurgery,10.1016/j.clineuro.2015.07.009,,Celiac disease; Chorea; Gluten encephalopathy; Gluten sensitivity,Case Reports; Journal Article,Netherlands,eng
34873977,Hyperglycemic hemichorea due to diabetic striatopathy: case-based review.,"Tsalta-Mladenov, Mihael Emilov; Georgieva, Darina Kirilova; Andonova, Silva Peteva",Tsalta-Mladenov,"Diabetic Striatopathy (DS) is a rare complication of diabetes mellitus (DM) with poor glycemic control and typical neuroimaging findings. DS predominantly leads to a unilateral reversible injury of the basal ganglia resulting in various movement disorders such as hemichorea and hemibalismus. We present a rare case of DS with left-sided hemichorea as a first presentation for a newly diagnosed Diabetes Mellitus (DM) type II and to make a thorough review of this disorder and to provide a practical approach to its management. A 63-year-old female was admitted to the neurology ward with symptoms of involuntary hyperkinetic movements for the left limbs and the left half of the face. The blood samples revealed random serum glucose of 30.8 mmol/l and an HbA1c of 15.13%. The computed tomography of the brain showed asymmetric, unilateral hyperdensity in the right basal ganglia (BG) - the putamen and nucleus caudatus. The patient was managed with Insulin and Haloperidol as the symptoms entirely resolved on the tenth day. In conclusion (DS) is a condition with a good prognosis and reversible clinical and neuroimaging findings after a prompt diagnosis and management. DS should be considered a possible differential diagnosis in patients with abrupt onset of hyperkinetic movement disorders.","DictElement({'Year': '2021', 'Month': '12', 'Day': '14'}, attributes={'DateType': 'Electronic'})",2021,Current medical research and opinion,10.1080/03007995.2021.2015159,,Diabetic striatopathy; basal ganglia; chorea; diabetes mellitus; movement disorders; non-ketotic hyperglycemia,Case Reports; Journal Article; Review,England,eng
