pmid,title,authors,first_author,abstract,publication_date,publication_year,journal_info,doi,pmcid,keywords,article_type,country,language
29298550,Maximising recovery from aphasia with central and peripheral agraphia: The benefit of sequential treatments.,"Beeson, Pélagie M; Bayley, Chelsea; Shultz, Christine; Rising, Kindle",Beeson,"Maximal recovery from acquired language impairment may require progression from one behavioural treatment protocol to the next in order to build upon residual and relearned cognitive-linguistic and sensory-motor processes. We present a five-stage treatment sequence that was initiated at one year post stroke in a woman with acquired impairments of spoken and written language. As is typical of individuals with left perisylvian damage, she demonstrated marked impairment of phonological retrieval and sublexical phonology, but she also faced additional challenges due to impaired letter shape knowledge and visual attention. The treatment sequence included (1) written spelling of targeted words, (2) retraining sublexical sound-to-letter correspondences and phonological manipulation skills, (3) training strategic approaches to maximise interactive use of lexical, phonological, and orthographic knowledge, (4) lexical retrieval of spoken words, and finally (5) sentence-level stimulation to improve grammatical form of written narratives. This Phase II clinical study documented positive direct treatment outcomes along with evidence of a significant reduction in the underlying deficits and generalisation to untrained items and language tasks. Improvements on a comprehensive assessment battery were realised as functional gains in everyday written and spoken communication, including improved lexical retrieval and grammatical complexity of written narratives. This case provides a valuable example of the cumulative therapeutic benefit of sequential application of theoretically motivated treatment protocols.","DictElement({'Year': '2018', 'Month': '01', 'Day': '03'}, attributes={'DateType': 'Electronic'})",2018,Neuropsychological rehabilitation,10.1080/09602011.2017.1417873,,Allographic agraphia; Aphasia; Aphasia treatment; Lexical retrieval treatment; Phonological agraphia; Phonological treatment; Writing impairment,Case Reports; Journal Article,England,eng
7845566,Transcortical alexia with agraphia following a right temporo-occipital hematoma in a right-handed patient.,"Davous, P; Boller, F",Davous,"We describe the case of a 51-year-old right-handed man who was affected by a transcortical alexia with agraphia and aphasia. Transcortical alexia produces errors in both reading and writing while copying is preserved. The patient had a severe alexia and was unable to read letters, words or sentences. Language examination showed mild aphasia with reduced fluency, intermittent paraphasia but a good comprehension and a normal repetition. Spontaneously and from dictation, writing was impaired by an agraphic jargon, but copying was excellent even though the patient was unable to read his own written production. There was no visual agnosia nor hemianopia. CT scan and MRI of the brain showed that there was a single right temporo-occipital hemorrhage but no lesion in the left hemisphere. Following surgical evacuation of the hematoma, the patient improved. One month after onset, his language was quite intact and reading was possible. We hypothesize that this particular syndrome was the result of a double disconnection: alexia would result from a disconnection of the right angular gyrus and the occipital associative areas by a subangular lesion; agraphia would result from a disconnection of the right angular gyrus and the semantic store, probably located in the right hemisphere.",{},,Neuropsychologia,10.1016/0028-3932(94)90108-2,,,Case Reports; Journal Article,England,eng
29354229,Gerstmann's syndrome and unilateral optic ataxia in the emergency department.,"Barbosa, Breno José Alencar Pires; de Brito, Marcelo Houat; Rodrigues, Júlia Chartouni; Kubota, Gabriel Taricani; Parmera, Jacy Bezerra",Barbosa,"A 75-year-old right-handed woman presented to the emergency department with simultanagnosia and right unilateral optic ataxia. Moreover, the patient had agraphia, acalculia, digital agnosia and right-left disorientation, consistent with complete Gerstmann's syndrome. This case highlights the concurrence of Gerstmann's syndrome and unilateral optic ataxia in the acute phase of a left middle cerebral artery stroke.",{},,Dementia & neuropsychologia,10.1590/1980-57642016dn11-040018,PMC5770007,Gerstmann syndrome; agnosia; carotid artery diseases; stroke,Case Reports,Brazil,eng
26397830,Alexia Without Agraphia in a Right-Handed Individual Following Right Occipital Stroke.,"Robinson, Jordan S; Collins, Robert L; Mukhi, Shalini V",Robinson,"Alexia without agraphia is a disconnection syndrome that typically involves damage to the occipital lobe, with splenium involvement, in the dominant left hemisphere. We describe an exceptionally rare case of a right-handed individual displaying this deficit following a right-sided occipital stroke. A report of a single case of a 65-year-old man is presented with data from appointments with the neurology and neuropsychology departments that occurred approximately 10 and 12 months following the patient's stroke. During the evaluation, he exhibited a marked deficit in his ability to read, with vision grossly intact. His ability to write single words and short phrases from dictation was intact, but he was later unable to read them. This case demonstrates the complexity of the organization of language in the human brain. Although a large majority of individuals exhibit language dominance in their left hemispheres, it remains possible that some right-handed individuals may show atypical organization of language. This highlights the need for clinicians to consider atypical cortical organization when observed deficits may not necessarily match expected lesions within the cortex.","DictElement({'Year': '2015', 'Month': '09', 'Day': '23'}, attributes={'DateType': 'Electronic'})",2015,Applied neuropsychology. Adult,10.1080/23279095.2014.973495,,alexia; assessment/diagnosis; cerebral stroke; cognition; magnetic resonance imaging; neuropsychology,"Case Reports; Journal Article; Research Support, U.S. Gov't, Non-P.H.S.",United States,eng
36824415,Case report: Reversible punctate inflammatory foci in the corpus callosum: A novel radiological finding of CAR T-cell therapy-related neurotoxicity.,"Pensato, Umberto; de Philippis, Chiara; Pistolese, Flavio; Mannina, Daniele; Marcheselli, Simona; Politi, Letterio S; Santoro, Armando; Bramanti, Stefania",Pensato,"Chimeric antigen receptor T-cell therapy-related neurotoxicity is a novel cytokine-mediated neurological syndrome that may present with a broad spectrum of manifestations. Descriptions of novel distinctive features are pivotal to untangling this condition's clinical and instrumental signature in order to inform diagnosis and pathophysiology. A 27-year-old female patient received anti-CD19 CAR T cells for a refractory primary mediastinal B-cell lymphoma. At 6 days after the infusion, she developed mild ideo-motor slowing, dysgraphia, and drowsiness. Despite specific treatment with dexamethasone, her neurological status progressively worsened to a comatose state within 24 h. EEG and CSF analyses were non-specific, showing background slowing and inflammatory findings. Brain MRI revealed multiple focal punctate areas of T2-weighted hyperintensity localized in the body and isthmus of the corpus callosum. Following the administration of high-dose intravenous methylprednisolone, her neurological status resolved within 48 h. Notably, the follow-up brain MRI did not reveal any abnormalities in the corpus callosum, except for a reduction of fractional anisotropy. Reversible punctate inflammatory foci of the body and isthmus of the corpus callosum may represent a novel radiological finding of CAR T-cell therapy-related neurotoxicity.","DictElement({'Year': '2023', 'Month': '02', 'Day': '07'}, attributes={'DateType': 'Electronic'})",2023,Frontiers in neurology,10.3389/fneur.2023.1125121,PMC9941663,B-cell lymphoma; brain MRI; cancer immunotherapy; cytokine storm-associated encephalopathy (CySE); hematological cancer; neuroimaging; neuroinflammation; neuroradiology,Case Reports,Switzerland,eng
21319033,A case of pure agraphia due to left thalamic hemorrhage.,"Toyokura, Minoru; Kobayashi, Ryouko; Aono, Kouji",Toyokura,"Pure agraphia is an isolated writing disturbance without intellectual impairment, aphasia, alexia, or apraxia. The authors report a case of pure agraphia following left thalamic hemorrhage. The patient showed impairment in the writing of both kanji and kana. The most frequent error in the writing of kanji was substitution (46%) followed by no reaction (23%) and partial omission or addition of characters (21%). The copying of kanji by hand was normal. Even when the patient was unable to write a kanji character, he understood the meaning and correctly recited the other readings. He complained that he could not recall the graphic image of the kanji. When we cued the patient by writing a part of a kanji he initially failed to recall, he correctly completed the character. The kanji and kana he was unable to write were inconsistent over time: in some cases he was unable to write words he had successfully written a week before, and vice versa. These findings suggested that the patient's pure agraphia resulted from combined impairments in recalling and selecting letters. While the thalamic lesion might have influenced the manifestation of pure agraphia, the dysfunction seemed to originate from the secondary negative effect of the lesion on the function of the left cerebral cortex.","DictElement({'Year': '2010', 'Month': '09', 'Day': '20'}, attributes={'DateType': 'Electronic'})",2010,The Tokai journal of experimental and clinical medicine,,,,Case Reports; Journal Article,Japan,eng
21894554,Functional dissociation between Kana and Kanji: agraphia following a thalamic hemorrhage.,"Maeshima, S; Osawa, A; Ogura, J; Sugiyama, T; Kurita, H; Satoh, A; Tanahashi, N",Maeshima,"We report the case of a 61-year-old woman with a left thalamic hemorrhage causing agraphia of Kanji (morphograms). Single-photon emission computed tomography (SPECT) showed a decrease in the blood flow in the left thalamus from the superior temporal convolution to the parietal lobe, as well as in the frontal lobe while computed tomography showed no remarkable lesions in the cortex. The agraphia in this case may be due to the thalamic lesion itself, but the SPECT findings strongly suggest that a secondary cortical lesion may be involved in producing the higher cognitive disorder.","DictElement({'Year': '2011', 'Month': '09', 'Day': '06'}, attributes={'DateType': 'Electronic'})",2011,Neurological sciences : official journal of the Italian Neurological Society and of the Italian Society of Clinical Neurophysiology,10.1007/s10072-011-0753-7,,,Case Reports; Journal Article,Italy,eng
16006345,Post graphemic impairments of writing: the case of micrographia.,"Denes, Gianfranco; Signorini, Matteo; Volpato, Chiara",Denes,"Micrographia (MG), an acquired impairment of writing characterized by diminution of letter size, coupled with slowing and loss of accuracy, is most frequently observed in the course of degenerative disease of basal ganglia, such as Parkinson's Disease. Only a few cases of MG without concomitant extrapyramidal signs have been described, mostly following vascular lesion of the left basal ganglia. In this article we report an isolated pattern of MG following an extensive traumatic cerebral lesion centered in the left basal ganglia. The nature of this impairment is analyzed according to a cognitive model of writing and interpreted as a specific example of peripheral dysgraphia.",{},,Neurocase,10.1080/13554790590944636,,,Case Reports; Journal Article,England,eng
12810770,Cognitive presentation of multiple sclerosis: evidence for a cortical variant.,"Zarei, M; Chandran, S; Compston, A; Hodges, J",Zarei,"Although neuropsychiatric complications are well recognised, the presentation of multiple sclerosis with cognitive or neuropsychiatric symptoms has generally been considered a rare occurrence and to reflect subcortical pathology. To document the clinical, neuropsychological, and radiological features of six cases of cognitive presentation of multiple sclerosis, to review the relevant literature, and to propose a possible cortical basis for this clinical presentation. Six patients (five women; age range 38 to 60 years) presented to the memory and cognitive disorders clinic in Cambridge with an initially undiagnosed cognitive/neuropsychiatric syndrome. All underwent neuropsychological evaluation, brain imaging, and ancillary investigations to establish a diagnosis of multiple sclerosis. The six cases all had a progressive dementia syndrome with prominent amnesia, often accompanied by classic cortical features including dysphasia, dysgraphia, or dyslexia. Mood disturbance was ubiquitous and in three patients there was a long history of preceding severe depression. All six developed characteristic physical signs on follow up, with marked disabilities. A review of 17 previously reported cases highlighted the prominence of memory impairment and depression in the early stages. On clinical, pathological, and radiological grounds, the neuropsychiatric presentation of multiple sclerosis may represent a clinicopathological entity of ""cortical multiple sclerosis."" Failure to recognise this will delay diagnosis and may expose patients to potentially dangerous and invasive investigation. Because the neuropsychiatric features of cortical multiple sclerosis are a major cause of handicap, their early recognition may be particularly important in view of emerging treatments.",{},,"Journal of neurology, neurosurgery, and psychiatry",10.1136/jnnp.74.7.872,PMC1738531,,Case Reports; Journal Article,England,eng
26928117,Callosal apraxia: a 34-year follow-up study.,"Falchook, Adam D; Watson, Robert T; Heilman, Kenneth M",Falchook,"Loss of ability of the left upper limb (LUL) to correctly produce spatial and temporal components of skilled purposeful movements was reported 34 years ago in a woman with a callosal infarction. To learn about recovery, we recently reexamined this woman. This woman was tested for ideomotor apraxia by asking her to pantomime to command and to seeing pictures of tools. Whereas she performed normally with her right upper limb, her LUL remained severely apraxic, making many spatial (postural and movement) errors. Initially, she did not reveal loss of finger-hand deftness (limb-kinetic apraxia), and when tested again with the coin rotation task, her left hand performance was normal. Without vision, she could name objects placed in her left hand but not name numbers written in this hand. Since this woman had a callosal lesion, failure to recover cannot be accounted for by left hemisphere inhibition of her right hemisphere. Although failure for her LUL to improve may have been related to not using her LUL for skilled actions, her right hemisphere was able to observe transitive actions, and this failure of her LUL to produce skilled purposeful movements suggests her right hemisphere may have not had the capacity to learn these movement representations. Without vision, her ability to recognize objects with her left hand, but not numbers written on her left palm, suggests graphesthesia may require that her left hand did not have access to movement representations important for programming these numbers when writing.","DictElement({'Year': '2016', 'Month': '02', 'Day': '29'}, attributes={'DateType': 'Electronic'})",2016,Neurocase,10.1080/13554794.2016.1148743,,Corpus callosum; agraphesthesia; agraphia; ideomotor apraxia; limb kinetic apraxia,"Case Reports; Journal Article; Research Support, N.I.H., Extramural; Research Support, U.S. Gov't, Non-P.H.S.; Research Support, Non-U.S. Gov't",England,eng
2324759,Pure agraphia after deep left hemisphere haematoma.,"Croisile, B; Laurent, B; Michel, D; Trillet, M",Croisile,Pure agraphia is reported following haematoma in the left centrum semiovale sparing both parietal and frontal cortices. There was total inability to produce graphemes in the absence of limb apraxia. The lesion is assumed to have prevented linguistic and graphemic systems from gaining access to the frontal motor programme.,{},,"Journal of neurology, neurosurgery, and psychiatry",10.1136/jnnp.53.3.263,PMC1014141,,Case Reports; Journal Article,England,eng
471199,Anatomical study of a posterior cerebral lesion producing dyslexia.,"Van Buren, J M",Van Buren,"After an ""occipital lobectomy"" that resulted in a severe dyslexia and a moderate dysgraphia-dyscalculia, anatomical study showed damage to the posterior extremity of the angular gyrus and degeneration in the posteroinferior pulvinar. This is in contrast to an earlier case that had degeneration in the anterosuperior pulvinor associated with a small anterior temporoparietal infarct and a well-documented receptive-expressive aphasia. However, the role of the pulvinar in speech function remains uncertain. The surgeon should be aware of the short distance between the angular gyrus and both the midline and the occipital pole because a lesion here during an ""occipital lobectomy"" produces a distressing and durable speech impairment.",{},,Neurosurgery,10.1227/00006123-197907010-00001,,,Case Reports; Journal Article,United States,eng
24045760,Dystypia in acute stroke not attributable to aphasia or neglect.,"Cook, Fabian Alexander Blyth; Makin, Stephen D J; Wardlaw, Joanna; Dennis, Martin S",Cook,"A 68-year-old right-handed man had a sudden onset of impaired typing ability due to an ischaemic stroke that recovered over 2 months. The typing impairment was grossly out of proportion to his transient handwriting disturbance. Diffusion MRI showed a recent acute left temporoparietal infarct. There was no evidence of aphasia, alexia, agraphia, visuospatial inattention, sensory loss, neglect or poor coordination that could account for his isolated typing impairment. This example of a stroke that disproportionately affected typing more than handwriting abilities has practical implications for what deficits to look for in patients with stroke when assessing their fitness for work and rehabilitation requirements.","DictElement({'Year': '2013', 'Month': '09', 'Day': '17'}, attributes={'DateType': 'Electronic'})",2013,BMJ case reports,10.1136/bcr-2013-200257,PMC3794161,,"Case Reports; Journal Article; Research Support, Non-U.S. Gov't",England,eng
23528139,Alexia due to ischemic stroke of the visual word form area.,"Turkeltaub, Peter E; Goldberg, Ethan M; Postman-Caucheteux, Whitney A; Palovcak, Merisa; Quinn, Colin; Cantor, Charles; Coslett, H Branch",Turkeltaub,"The visual word form area (VWFA) is a region in the posterior left occipitotemporal cortex adjacent to the fusiform gyrus hypothesized to mediate word recognition. Evidence supporting the role of this area in reading comes from neuroimaging studies of normal subjects, case-controlled lesion studies, and studies of patients with surgical resection of the VWFA for tumors or epilepsy. Based on these prior reports, a small discrete lesion to the VWFA would be expected to cause alexia in a literate person without prior brain process, but such a case has not previously been reported to our knowledge. Here, we report the case of a previously-healthy 63-year-old man with the acute onset of alexia without other significant impairments. Magnetic resonance imaging (MRI) of the brain revealed a small ischemic stroke localized to the inferior left occipitotemporal cortex, corresponding to the approximate location of the putative VWFA. Characteristic of pure alexia, testing in the weeks following the stroke revealed a letter-by-letter reading strategy and a word length effect on single word reading. Formal visual field testing was normal. There was no color anomia, or object or face recognition deficits, although a mild agraphia may have been present. This case of acute-onset alexia in a previously normal individual due to a small stroke restricted to the VWFA and sparing occipital cortex and white matter pathways supports the conclusion that the VWFA is crucial for reading.","DictElement({'Year': '2013', 'Month': '03', 'Day': '25'}, attributes={'DateType': 'Electronic'})",2013,Neurocase,10.1080/13554794.2013.770873,,,Case Reports; Journal Article,England,eng
25224202,Contrast-induced encephalopathy after coil embolization of an unruptured internal carotid artery aneurysm.,"Nagamine, Yuito; Hayashi, Takeshi; Kakehi, Yoshiaki; Yamane, Fumitaka; Ishihara, Shoichiro; Uchino, Akira; Tanahashi, Norio",Nagamine,"A 58-year-old woman developed agraphia and mild right hemiparesis approximately one month after undergoing coil embolization of an unruptured left internal carotid artery aneurysm. MRI performed on day 39 post-coil embolization showed multiple lesions in the white matter with signal hyperintensity on T2-weighted and FLAIR images in the left middle cerebral artery territory. The patient's cerebrospinal fluid exhibited an elevated protein level at 46 mg/dL; however, no other findings suggested another underlying disease. Corticosteroids were administered, and, by day 50 post-coil embolization, the clinical findings and abnormal features on MRI had improved. The patient was therefore diagnosed with contrast-induced encephalopathy after coil embolization.","DictElement({'Year': '2014', 'Month': '09', 'Day': '15'}, attributes={'DateType': 'Electronic'})",2014,"Internal medicine (Tokyo, Japan)",10.2169/internalmedicine.53.2380,,,Case Reports; Journal Article,Japan,eng
36439680,The Orthographic Ambiguity of the Arabic Graphic System: Evidence from a Case of Central Agraphia Affecting the Two Routes of Spelling.,"Boumaraf, Assia; Bekal, Sonia; Macoir, Joël",Boumaraf,"The Arabic writing system includes ambiguities that create difficulties in spelling. These ambiguities relate mainly to the long vowels, some phoneme-grapheme conversions, lexical particularities, and the connectivity of letters. In this article, the first to specifically explore acquired spelling impairments in an Arabic-speaking individual, we report the case of CHS, who presented with agraphia following a stroke. Initial testing indicated substantial impairment of CHS's spelling abilities in the form of mixed agraphia. The experimental study was specifically designed to explore the influence of the orthographic ambiguity of the Arabic graphemic system on CHS's spelling performance. The results revealed that CHS had substantial difficulties with orthographic ambiguity and tended to omit ambiguous graphemes. Some of the errors she produced suggested reliance on the sublexical route of spelling, while others rather reflected the adoption of the lexical-semantic route. These findings from a case involving a non-Western, non-Indo-European language contribute to discussions of theoretical models of spelling. They show that CHS's pattern of impairment is consistent with the <i>summation hypothesis</i>, according to which the lexical-semantic and the sublexical routes interactively contribute to spelling.","DictElement({'Year': '2022', 'Month': '11', 'Day': '16'}, attributes={'DateType': 'Electronic'})",2022,Behavioural neurology,10.1155/2022/8078607,PMC9683975,,Case Reports; Journal Article,Netherlands,eng
38047091,Patient With Crossed Aphasia Undergoing Long-Term Speech Therapy: A Case Report.,"Kim, Tae-Hwan; Yoon, Myeong-Kwon; Choi, Seung-Gue; Kim, Jeong-Seob; Choi, Jyul-Lee",Kim,"Crossed aphasia (CA) is a type of aphasia caused by cerebral hemispheric lesions on the same side of the dominant hand. The prevalence of CA is extremely rare. To the best of our knowledge, this is the first case report in Korea to conduct 6 years of long-term speech therapy in a case of a patient with CA. The patient was a 57-year-old right-handed man with aphasia caused by extensive acute infarction in the right middle cerebral artery territory. He presented with global aphasia, right-left disorientation, and agraphia. Language function recovered in the first 6 months and then plateaued.","DictElement({'Year': '2023', 'Month': '09', 'Day': '20'}, attributes={'DateType': 'Electronic'})",2023,Brain & NeuroRehabilitation,10.12786/bn.2023.16.e23,PMC10689864,Crossed aphasia; Long-term speech therapy; Stroke,Case Reports,Korea (South),eng
24606031,Characteristics of dyslexia and dysgraphia in a Chinese patient with semantic dementia.,"Wu, Xiao-qin; Liu, Xiao-Jia; Sun, Zhao-chun; Chromik, Lindsay; Zhang, Ya-wei",Wu,"We describe a 44-year-old Chinese-speaking patient with semantic dementia (SD), who demonstrates dyslexia and dysgraphia. The man was administered a series of neuropsychological inspections, including general language tests and reading and writing examinations. The patient demonstrated surface dyslexia when reading single Chinese characters aloud. While most writing errors demonstrated by the patient were orthographically similar errors and noncharacter responses, such as pictograph, logographeme, and stroke errors, rather than phonologically plausible errors that were homophonous or different only in tone from the targets. We suggest that the type of acquired dysgraphia demonstrated by Chinese-speaking SD patients is determined by the unique features of the Chinese writing system.","DictElement({'Year': '2014', 'Month': '03', 'Day': '10'}, attributes={'DateType': 'Electronic'})",2014,Neurocase,10.1080/13554794.2014.892621,,Chinese characters; dysgraphia; dyslexia; semantic dementia,Case Reports; Journal Article,England,eng
