pmid,title,authors,first_author,abstract,publication_date,publication_year,journal_info,doi,pmcid,keywords,article_type,country,language
30593199,Discrepancy between perfusion- and diffusion-weighted images in ischemic stroke: A case report.,"Hur, Wook; Kim, Bum Joon; Shin, Byoung-Soo; Kang, Hyun Goo",Hur,"With the development of multi-slice computed tomography (CT) technology, perfusion CT angiography (p-CTA) is now widely used for the diagnosis of acute cerebral infarction. Although p-CTA has the advantage of distinguishing between an ischemic penumbra and an infarct core, more research is needed with respect to its clinical use. A healthy 36-year-old man experienced sudden dizziness while swimming. His dizziness persisted irrespective of the change in position, and then improved during transport. He had no neurological abnormality when he arrived at the emergency room. CT perfusion findings suggested left cerebellar infarction. P-CTA revealed a markedly delayed mean transit time, delayed time to peak, and increased cerebral blood volume in the left posterior inferior cerebellar artery territory at admission. However, the diffusion-weighted image (DWI) taken a few hours later revealed a large right cerebellar infarction. Because of the time window, thrombolysis could not be performed and anti-platelet therapy was started. Dysarthria and right-sided limb ataxia were newly developed before DWI (after p-CTA). Persistent foramen ovale was detected through transesophageal echography and identified as the cause of the stroke. This case report suggests that dynamic image changes can occur within a short period of time depending on the vascular status and hemodynamic changes of the patients.",{},,Medicine,10.1097/MD.0000000000013894,PMC6314731,,Case Reports; Journal Article,United States,eng
33402440,Teaching Video NeuroImages: Paroxysmal Dysarthria-Ataxia in Multiple Sclerosis.,"Shah, Shailee; Klassen, Bryan T; Flanagan, Eoin P",Shah,,"DictElement({'Year': '2021', 'Month': '01', 'Day': '05'}, attributes={'DateType': 'Electronic'})",2021,Neurology,10.1212/WNL.0000000000011498,,,Case Reports; Journal Article,United States,eng
30529220,Successful mechanical thrombectomy in stroke with thrombolysis-associated intracerebral hemorrhage-a case report.,"Weller, Johannes M; Hattingen, Elke; Petzold, Gabor C; Bode, Felix J",Weller,"Intravenous thrombolysis and mechanical thrombectomy are the standard of care for patients with acute ischemic stroke with large vessel occlusion. Intracerebral hemorrhage is a main complication of intravenous thrombolysis, however, no data are available on the efficacy and safety of mechanical thrombectomy in patients with thrombolysis-associated intracerebral hemorrhage. This constellation is expected to become more frequent as increasing numbers of patients are treated under the drip-and-ship paradigm. A 75-year-old male patient was admitted to an emergency department with acute onset dysarthria and left side hemiparesis due to right middle cerebral artery occlusion. Intravenous thrombolysis was initiated and the patient transferred to our center for mechanical thrombectomy. Upon arrival, cerebral imaging showed persistent right middle cerebral artery occlusion and new onset left frontal, temporal, and parietal intracerebral hemorrhage. Thrombectomy was performed and perfusion completely re-established with excellent neurological outcome. Follow-up imaging revealed probable cerebral amyloid angiopathy. Mechanical thrombectomy may be safe and effective in ischemic stroke with large vessel occlusion and thrombolysis-associatied intracerebral hemorrhage.","DictElement({'Year': '2018', 'Month': '10', 'Day': '24'}, attributes={'DateType': 'Electronic'})",2018,Journal of stroke and cerebrovascular diseases : the official journal of National Stroke Association,10.1016/j.jstrokecerebrovasdis.2018.09.045,,Infarction; Stroke; cerebral hemorrhage.; intracerebral hemorrhage; large vessel occlusion; rtPA; thrombectomy; thrombolytic therapy,Case Reports; Journal Article,United States,eng
30442451,Vertebrobasilar dolichoectasia presenting simultaneously with ischemic and hemorrhagic strokes.,"Chakraborty, Tia; Lanzino, Giuseppe; Flemming, Kelly D",Chakraborty,"Vertebrobasilar dolichoectasia (VBDE) can present with brainstem- compressive symptoms, cerebral ischemia, or hemorrhage. Herein we describe a unique patient with VBDE who presented with hemorrhage and cerebral ischemia simultaneously. Patient is a 76-year-old man presenting with an acute, symptomatic left pontine ischemic stroke heralded by ataxic dysarthria and right ataxic-hemiparesis. MRI scan of the brain demonstrated acute cerebral ischemia in the left pons, a small right thalamic hemorrhage, and evidence of VBDE. The perforating vessels branching off of the pathologic VBDE may result in both ischemia and hemorrhage. This is the first known case, to our knowledge, in which hemorrhage and cerebral ischemia occurred simultaneously.","DictElement({'Year': '2018', 'Month': '11', 'Day': '12'}, attributes={'DateType': 'Electronic'})",2018,Journal of clinical neuroscience : official journal of the Neurosurgical Society of Australasia,10.1016/j.jocn.2018.10.092,,Fusiform aneurysm; Intracerebral hemorrhage; Ischemic stroke; Magnetic resonance imaging; Vertebrobasilar dolichoectasia,Case Reports; Journal Article,Scotland,eng
29437728,Large vessel stroke as initial presentation of thrombotic thrombocytopenic purpura.,"Sugarman, Ryan; Tufano, Andrea M; Liu, Johnson M",Sugarman,"A 67-year-old right-handed woman presented with dysarthria, left upper extremity weakness and right-sided neglect of 3 hours duration. Imaging of the brain revealed acute right middle cerebral artery stroke; however, tissue plasminogen activator could not be administered due to severe thrombocytopenia. A peripheral smear revealed schistocytes and the patient was treated empirically for thrombotic thrombocytopenic purpura (TTP) with therapeutic plasma exchange. An extensive workup revealed no embolic source or other cause for stroke, and a diagnosis of large vessel infarct secondary to TTP was made. After a prolonged hospital course, the patient had partial neurological recovery and was discharged to a rehabilitation facility. Although transient neurologic deficits due to small vessel occlusions are well described in TTP, large vessel infarct can occur as well. This diagnosis should be considered in patients presenting with concomitant stroke and thrombocytopenia, as untreated TTP is nearly always fatal.","DictElement({'Year': '2018', 'Month': '02', 'Day': '05'}, attributes={'DateType': 'Electronic'})",2018,BMJ case reports,10.1136/bcr-2017-221857,PMC5836606,haematology (drugs and medicines); haematology (incl blood transfusion); neuroimaging; stroke,Case Reports; Journal Article,England,eng
37009377,Wernekink Commissure Syndrome With Bilateral Cerebellar Signs and Holmes Tremor in a Patient With a Preexisting Movement Disorder.,"Agarwal, Ketan; Biswas, Ratnadeep; Kumar, Vijay",Agarwal,"Wernekink commissure syndrome (WCS) is an extremely rare midbrain syndrome, in which there is the selective destruction of the decussation of the superior cerebellar peduncle, which commonly presents with bilateral cerebellar signs. We describe a case of WCS with Holmes tremor in a patient having an undiagnosed involuntary movement disorder since childhood following an undocumented case of meningitis. The patient presented with sudden onset gait instability with bilateral cerebellar signs (more prominent on the left side), Holmes tremor in bilateral limbs, slurred speech, and marked dysarthria. No ophthalmoplegia or palatal tremors were noted. The patient was conservatively managed along the lines of a stroke, and there was a marked improvement in cerebellar signs and Holmes tremor with time but no evolution (improvement or worsening) was observed in the involuntary movements of limbs and face that were present before the onset of WCS.","DictElement({'Year': '2023', 'Month': '03', 'Day': '01'}, attributes={'DateType': 'Electronic'})",2023,Cureus,10.7759/cureus.35674,PMC10065355,ischemic stroke; neurology; neuropathology; rare diseases; tegmentum mesencephali;  mesencephalon;  movement disorders;  stroke,Case Reports,United States,eng
24807293,Acute functional reactivation of the language network during awake intraoperative brain mapping.,"Spena, Giannantonio; Costi, Emanuele; Panciani, Pier Paolo; Roca, Elena; Migliorati, Karol; Fontanella, Marco Maria",Spena,"Acute brain plasticity during resection of central lesions has been recently described. In the cases reported, perilesional latent networks, useful to preserve the neurological functions, were detected in asymptomatic patients. In this paper, we presented a case of acute functional reactivation (AFR) of the language network in a symptomatic patient. Tumor resection allowed to acutely restore the neurological deficit. Intraoperative direct cortical stimulation (DCS) and functional neuroimaging showed new epicentres of activation of the language network after tumor excision. DCS in awake surgery is mandatory to reveal AFR needful to improve the extent of resection preserving the quality of life.","DictElement({'Year': '2014', 'Month': '05', 'Day': '07'}, attributes={'DateType': 'Electronic'})",2014,Neurocase,10.1080/13554794.2014.910306,,awake surgery; brain mapping; functional MR imaging; glioma; plasticity,Case Reports; Journal Article,England,eng
27842285,Posterior fossa syndrome with a large inflammatory ponto-mesencephalic lesion.,"Breit, S; Keserü, B; Nyffeler, T; Sturzenegger, M; Krestel, H",Breit,"Demonstration of a posterior fossa syndrome (PFS) in a 32-year-old male patient with clinically isolated syndrome which subsequently developed into relapsing-remitting Multiple Sclerosis. The patient suffered from double vision, coordination problems including unsteady gait and atactic dysarthria, concentration difficulties, as well as adynamia and impaired decision making. The patient clinically presented a cerebellar and dysexecutive syndrome. Cerebral magnetic resonance imaging (MRI) revealed a contrast enhancing ponto-mesencephalic lesion with a volume of 4.8cm<sup>3</sup>. Neuropsychological tests showed pronounced executive dysfunctions, reduced visuoconstructive skills, attentional deficits, echolalia, and non-fluent speech production. After cortisone and plasmapheresis, the cerebellar syndrome improved but manual fine motor skills and executive dysfunctions persisted. After three months, symptoms remitted except for a slight gait imbalance. After six months, neuropsychological tests were normal except for a moderate attention deficit. MRI revealed a clear regression of the ponto-mesencephalic lesion to a volume of 2.4cm<sup>3</sup> without contrast enhancement. This case report intends to provide an overview of the symptomatology and etiology of PFS and offers new insights into its pathomechanism demonstrating a pontine disconnection syndrome caused by a large demyelinating plaque.","DictElement({'Year': '2016', 'Month': '11', 'Day': '12'}, attributes={'DateType': 'Electronic'})",2016,Brain and cognition,10.1016/j.bandc.2016.09.013,,Cerebellar cognitive affective syndrome; Clinically isolated syndrome; Contrast enhancing ponto-mesencephalic lesion; Disconnection syndrome; Posterior fossa syndrome,Case Reports; Journal Article,United States,eng
38666275,Lateral Medullary Syndrome With Ipsilateral Upper Motor Neuron Facial Palsy.,"Ryan, Dylan; Gaini, Rahul; Snider, Michael; Qing, Janie; Feng, Wuwei",Ryan,"Lateral medullary syndrome is a common presentation of posterior circulation ischemia that presents with ipsilateral Horner syndrome, ipsilateral facial numbness, contralateral body numbness, vestibular symptoms, ataxia, dysphagia, and dysarthria. Here, we describe an 84-year-old who presented to the hospital with right upper motor neuron facial weakness and gait abnormality found to have a right lateral medullary ischemic stroke. Multiple MRI's, including with thin brainstem slices, were without evidence of pontine, midbrain or cerebral ischemia outside the medulla. We postulate that the patient's ipsilateral upper motor neuron facial weakness was caused by involvement of aberrant corticobulbar fibers in the medulla ascending to the facial nucleus.","DictElement({'Year': '2023', 'Month': '12', 'Day': '02'}, attributes={'DateType': 'Electronic'})",2023,The Neurohospitalist,10.1177/19418744231220175,PMC11040634,cerebrovascular disorders; neuroanatomy < techniques; stroke < cerebrovascular disorders,Case Reports,United States,eng
32754407,"A Rare Case of a Large, Deceitfully Quiet Brainstem Arteriovenous Malformation Presenting Only as Dizziness.","Rao, Swathi; Giron, Fanny",Rao,"Dizziness is one of the most frequent complaints encountered in the medical practice affecting 15%-20% of adults yearly, and can be challenging to assess. Most patients use dizziness as a non-specific term, and thus suffer prejudice from the physicians' end and can be disregarded frequently. Dizziness can be a symptom of various diseases, some with sinister pathologies. We present a case of garden-variety vertigo that unfurled to be not-so-simple, emphasizing the importance of a thorough history and physical examination again even in the era of technology. A 32-year-old male patient with no past medical history presented with dizziness, later clarified as gradually progressive vertigo for two years, with unstable gait, dysarthria, and occasional diplopia. Physical examination found sustained nystagmus that changed direction with horizontal gaze, vertical nystagmus with upward gaze, dysarthria, and a wide-based ataxic gait. CT head without contrast revealed indeterminate hypodense areas in the left midbrain, pons, and cerebellar hemisphere. MRI brain identified a 2.8 x 3.4 x 4.2 cm Spetzler-Martin grade IV brainstem arteriovenous malformation (AVM) involving the left midbrain, pons, and cerebellum. Feeders were mostly from the posterior circulation, with three intranidal aneurysms, all draining into the deep venous system. The AVM was deemed inoperable, and the patient was treated with onyx embolization for two/three feeding vessel aneurysms. After treatment, the symptoms persisted, and the patient was diagnosed with major depressive disorder (MDD) six months after diagnosis, and was admitted a year later with suicidal ideation and substance use disorder. Brain AVMs are rare clinical entities that present in 0.1% of the population, mostly presenting as intracranial bleeds. When they do rarely present with isolated focal neurologic deficits, it has been attributed to a vascular steal phenomenon, hemorrhage, or a mass effect. The isolated findings of vertigo and dysarthria are highly non-specific; with such presentation, clinicians should consider etiologies under the realm of vertigo of central origin. An untreatable AVM reduces patients' quality of life and has been linked to depression and anxiety, and thus patients may benefit from psychosocial therapy. Although preventing intracranial hemorrhage (ICH) is the primary concern with brain AVMs, the rest of the patient's profile should not be forgotten.","DictElement({'Year': '2020', 'Month': '06', 'Day': '27'}, attributes={'DateType': 'Electronic'})",2020,Cureus,10.7759/cureus.8870,PMC7387078,arteriovenous malformation; dizziness; nystagmus; vertigo,Case Reports,United States,eng
37388256,Wallerian degeneration of the ipsilateral middle cerebellar peduncle after lower pontine paramedian infarct diagnosed by magnetic resonance imaging.,"Uchino, Akira; Uemiya, Nahoko",Uchino,"We reported a case of Wallerian degeneration of the unilateral middle cerebellar peduncle (MCP) that developed after ipsilateral paramedian lower pontine infarction. The patient was a 70-year-old woman with right hemiparesis and dysarthria. Using a 3-Tesla scanner, cranial magnetic resonance imaging was performed, and an infarct was found at the left paramedian lower pons. Seven months later, an abnormal signal was found at the central portion of the left MCP, indicative of Wallerian degeneration of the pontocerebellar tract (PCT). There was no abnormality at the contralateral MCP. Usually, Wallerian degeneration of the bilateral MCPs may develop after unilateral paramedian pontine infarction, because bilateral PCTs cross each other at the midline of the basis pontis. In the present case, however, Wallerian degeneration was found at only the ipsilateral MCP. The contralateral PCT was not affected because the PCT runs in the craniocaudal direction, and our patient had a lower pontine infarct. The location of the pontine infarct (affected PCT) and the Wallerian degeneration of the side of the MCP were well correlated.","DictElement({'Year': '2023', 'Month': '06', 'Day': '08'}, attributes={'DateType': 'Electronic'})",2023,Radiology case reports,10.1016/j.radcr.2023.05.033,PMC10300453,Cerebral infarct; Magnetic resonance imaging; Middle cerebellar peduncle; Pontine infarct; Pontocerebellar tract; Wallerian degeneration,Case Reports,Netherlands,eng
26040828,Successful treatment of a giant pediatric fusiform basilar trunk aneurysm with surpass flow diverter.,"Kan, Peter; Mokin, Maxim; Puri, Ajit S; Wakhloo, Ajay K",Kan,"Fusiform aneurysms present a unique challenge to traditional microsurgical and endovascular treatment because of the lack of a discernible neck and the involvement of parent vessel. Flow diversion has increasingly become the treatment of choice for fusiform aneurysms in the anterior circulation, but its results in the posterior circulation are variable. We report successful treatment of a giant fusiform upper basilar trunk aneurysm with the Surpass flow diverter in an adolescent, and discuss the potential advantages of this emerging technology in the treatment of fusiform posterior circulation aneurysms.","DictElement({'Year': '2015', 'Month': '06', 'Day': '03'}, attributes={'DateType': 'Electronic'})",2015,BMJ case reports,10.1136/bcr-2015-011718,PMC4460403,,Case Reports; Journal Article,England,eng
33476883,Progressive micrographia without parkinsonism caused by autoimmune brainstem encephalitis: A case report.,"Hanyu, Ryutaro; Hatakeyama, Masahiro; Namekawa, Masaki; Otsu, Yutaka; Sukegawa, Mayura; Hashida, Hiromi; Kawachi, Izumi; Kanazawa, Masato; Onodera, Osamu",Hanyu,,"DictElement({'Year': '2021', 'Month': '01', 'Day': '15'}, attributes={'DateType': 'Electronic'})",2021,Clinical neurology and neurosurgery,10.1016/j.clineuro.2021.106496,,Autoimmune encephalitis; Brainstem encephalitis; Cerebellar ataxia; Progressive micrographia,Case Reports; Journal Article,Netherlands,eng
21250796,Primary glioblastoma of the cerebellopontine angle in adults.,"Wu, Bo; Liu, Weidong; Zhu, Hong; Feng, Hailong; Liu, Jinping",Wu,"Gliomas are rare entities in the cerebellopontine angle (CPA) in adults. The authors present clinical, neuroradiological, serological, and neuropathological findings in a 60-year-old man with an extraaxial CPA glioblastoma arising from the proximal portion of cranial nerve VIII. The patient presented with progressive left-sided deafness and left-sided facial palsy lasting less than 2 months and progressive dysarthria and dysphagia lasting 2 weeks. Preoperative neuroimaging suggested the diagnosis of CPA meningioma with ""dural-tail"" sign and involvement of the internal auditory canal. Serological examination showed an increase in the malignant markers of ferritin and neuron-specific enolase, which suggested underlying malignancy. The tumor was subtotally removed, and it was confirmed to be completely separated from the brainstem and cerebellum. Cranial nerves VII and VIII were destroyed and sacrificed. Transient severe bradycardia occurred during surgery due to entrapment of the caudal cranial nerve complex by the tumor in such an infiltrative way. The neuropathological examination revealed a glioblastoma. The patient underwent no further treatment and died of cachexia 2 months postoperatively. To the authors' knowledge, this represents the first case of a primary glioblastoma in the CPA in an adult. A high index of suspicion along with reliance on clinical assessment, radiological findings, and serum detection of specific malignant markers is essential to diagnose such uncommon CPA lesions.","DictElement({'Year': '2011', 'Month': '01', 'Day': '21'}, attributes={'DateType': 'Electronic'})",2011,Journal of neurosurgery,10.3171/2010.12.JNS10912,,,Case Reports; Journal Article,United States,eng
31136397,An unusual case of bilateral anterior opercular syndrome from a neuro-rehabilitation perspective.,"Eventide, Chad; Nair, Ajoy; Tai, Yen F; Timms, Katie; Lichtblau, Nicole",Eventide,"Bilateral anterior opercular syndrome, also known as Foix-Chavany-Marie syndrome, is relatively rare and is characterized by inability of voluntary activation of facial, lingual, pharyngeal, and masticatory muscles with preserved automatic and reflex movements such as smiling and yawning. The syndrome is caused by bilateral lesions of the anterior opercula and results in severe impairments with speech and swallowing. This article describes a patient with bilateral anterior opercular syndrome secondary to embolic strokes and how neuro-rehabilitation improved symptoms.",{},,JAAPA : official journal of the American Academy of Physician Assistants,10.1097/01.JAA.0000554222.25758.8b,,,Case Reports; Journal Article,United States,eng
34566850,Ornidazole-Induced Recurrent Encephalopathy in a Chinese Man: A Rare Case Report and Literature Review.,"Tang, Rong; Liang, Jia; Li, Yuanfang; Wu, Tingting; Zhang, Yuhao; Ma, Yu; Liu, Xu",Tang,"Ornidazole-induced encephalopathy (OIE) is seldom seen in the clinic. In this study, we report a new case of a patient who had taken 1,000 mg ornidazole daily for nearly 4 years because of suspected diarrhea and proctitis and presented with subacute symptoms such as unsteady gait, slurred speech, and psychiatric disorder. These symptoms were significantly relieved 3 days after the patient stopped taking ornidazole. When he took this medicine again, however, similar symptoms occurred 4 months later, which were again reduced after 4 days of drug discontinuation. After the second onset, abnormal signals were identified around the aqueduct of the midbrain, around the fourth ventricle, and in the dentate nuclei of the cerebellum bilaterally. After 9 days of drug discontinuation, lesions disappeared in the magnetic resonance imaging (MRI) results. According to the clinical manifestations, imaging features, and the reduced symptoms after drug withdrawal, we clinically diagnosed the patient with OIE. This paper also reviews the literature on OIE. Only five cases (including our case) have been reported, all of whom presented with cerebellar ataxia and dysarthria and three with additional mental symptoms such as agitation and irritability. All five patients had abnormal lesions in the dentate nucleus of the cerebellum bilaterally, among whom four also had lesions in the corpus callosum and three around the periaqueduct of the midbrain. After withdrawal of ornidazole, the symptoms in all patients vanished or were alleviated, and three of them showed reduced or disappeared lesions in a head MRI reexamination. Overall, OIE has rarely been reported. Our case report and literature review show that the lesions in the cerebellum, corpus callosum, and brainstem can be reversed. The main manifestations of the lesions-cerebellar ataxia, dysarthria, and mental symptoms-quickly weaken or disappear after drug withdrawal, with good prognosis. Nevertheless, clear pathogenesis has yet to be further investigated.","DictElement({'Year': '2021', 'Month': '09', 'Day': '09'}, attributes={'DateType': 'Electronic'})",2021,Frontiers in neurology,10.3389/fneur.2021.706094,PMC8458754,MRI; ataxia; dentate nucleus; ornidazole-induced encephalopathy; toxicity,Case Reports,Switzerland,eng
20852877,Paroxysmal dysarthria and ataxia in multiple sclerosis and corresponding magnetic resonance imaging findings.,"Li, Yongmei; Zeng, Chun; Luo, Tianyou",Li,"Paroxysmal dysarthria (PD) and paroxysmal dysarthria-ataxia (PDA) syndromes are uncommon symptoms of the neurological dysfunction in multiple sclerosis (MS). We describe two patients who had clinically definite MS presented with symptomatic PD and PDA syndromes, respectively, related to demyelinating lesions. In one patient, the PD symptom was the initial manifestation of an acute episode. In the other patient, the episode of dysarthria was accompanied by ataxia disorders. Both patients had midbrain lesions at or below the level of the right red nucleus on magnetic resonance imaging (MRI), confirming that this area is critically involved. Both responded well to carbamazepine (CBZ).","DictElement({'Year': '2010', 'Month': '09', 'Day': '18'}, attributes={'DateType': 'Electronic'})",2010,Journal of neurology,10.1007/s00415-010-5748-4,,,Case Reports; Journal Article,Germany,eng
