pmid,title,authors,first_author,abstract,publication_date,publication_year,journal_info,doi,pmcid,keywords,article_type,country,language
35630076,Wernicke Encephalopathy Mimicking MELAS.,"Finsterer, Josef",Finsterer,"a stroke-like lesion, the morphological equivalent of a stroke-like episode and the hallmark of mitochondrial encephalopathy, lactic acidosis, and stroke-like episodes (MELAS) syndrome, have not been reported as manifestations of thiamine deficiency. a 62-year-old man with a history of chronic alcoholism was admitted after a series of epileptic seizures. Upon waking up from the coma, he presented with disorientation, confusion, confabulation, psychomotor agitation, aggressiveness, right hemianopsia, aphasia, and right hemineglect over weeks. Electroencephalography showed a questionable focal status epilepticus over the left hemisphere, responsive to lorazepam and oxcarbazepine. Follow-up electroencephalographies no longer recorded epileptiform discharges. Cerebral magnetic resonance imaging (MRI) revealed T2-/diffusion weighted imaging (DWI) hyperintensity in the left occipito-temporal region that was not congruent to a vascular territory which persisted for at least nine weeks. Since a lactate-peak could be seen in this lesion by magnetic resonance-spectroscopy, this was interpreted as a stroke-like lesion. Since thiamine was reduced, the stroke-like lesion was attributed to thiamine deficiency after the exclusion of differential diseases, including MELAS and status epilepticus. The patient's behavioural and cognitive dysfunctions largely resolved upon vitamin-B1 substitution. the case suggests that thiamine deficiency presumably causes mitochondrial dysfunction with cerebrospinal fluid lactic acidosis and a stroke-like lesion mimicking MELAS syndrome. It should be further studied whether nutritional deficits, such as thiamine deficiency, could give rise to secondary stroke-like lesions.","DictElement({'Year': '2022', 'Month': '05', 'Day': '13'}, attributes={'DateType': 'Electronic'})",2022,"Medicina (Kaunas, Lithuania)",10.3390/medicina58050660,PMC9144475,Wernicke encephalopathy; lactic acidosis; spectroscopy; stroke-like episode; stroke-like lesion; thiamine deficiency,Case Reports,Switzerland,eng
943070,Reduplicative paramnesia.,"Benson, D F; Gardner, H; Meadows, J C",Benson,"A striking behavioral abnormality is described in three individuals who had severe head trauma. At a point when general mnestic capabilities had returned to a near normal level, the patients persistently relocated the hospital at another geographical site, even in the face of compelling counter-evidence. The strong parallels in the etiology and course of the three cases justify the positing of a syndrome, here termed reduplicative paramnesia. A neuropsychologic analysis of the disorder stresses the cognitive operations entailed in geographical localization and confabulation. Clinical-pathologic considerations underline the role of right hemisphere and frontal lobe structures in the syndrome.",{},,Neurology,10.1212/wnl.26.2.147,,,"Case Reports; Journal Article; Research Support, U.S. Gov't, P.H.S.",United States,eng
29859732,"Anton-Babinski syndrome, case report.","Martín Juan, A; Madrigal, R; Porta Etessam, J; Sáenz-Francés San Baldomero, F; Santos Bueso, E",Martín Juan,"A 22 year-old woman complained about blurred vision after an episode of recovered cardiorespiratory arrest. She had bilateral low visual acuity («count fingers») and no ophthalmological or visual pathways changes. She also had an apparent lack of awareness of the deficit. The Magnetic Resonance Imaging (MRI) showed ischaemic changes in both occipital lobes. As a result, she was diagnosed with Anton-Babinski syndrome. This is a rare disease that should be suspected in strange or poorly congruent visual loss. It is usually due to an ischaemic injury in this region of brain, manifesting itself with low vision not perceived by the patient (visual confabulation). It can simulate a non-organic visual loss or psychiatric disease.","DictElement({'Year': '2018', 'Month': '05', 'Day': '30'}, attributes={'DateType': 'Electronic'})",2018,Archivos de la Sociedad Espanola de Oftalmologia,10.1016/j.oftal.2018.04.004,,Agudeza visual; Blindness; Ceguera; Neurology; Neurología; Oftalmología; Ophthalmology; Visual acuity,Case Reports; Journal Article,Spain,eng; spa
10369091,Content-specific confabulation.,"Burgess, P W; McNeil, J E",Burgess,"This report describes a person who confabulated following an anterior communicating artery aneurysm. His confabulation was limited to one very circumscribed area of his life and remained stable for twelve weeks, eventually improving with rehabilitation. It is argued that a content-specific confabulation of this nature challenges current theories of confabulation, and an integrative explanation is given based on previous findings by Burgess and Shallice (1996b) of the mechanisms of autobiographical recollection in healthy people.",{},,Cortex; a journal devoted to the study of the nervous system and behavior,10.1016/s0010-9452(08)70792-5,,,"Case Reports; Journal Article; Research Support, Non-U.S. Gov't",Italy,eng
37860783,Anton syndrome with bilateral occipital infarct: A case report.,"Mankoo, Dylan",Mankoo,"Anton syndrome results from damage to the visual cortex of the occipital lobes, where the anterior visual pathways remain intact. This damage results in the characteristic triad of cortical blindness, visual anosognosia, and visual confabulation. This case describes an 80-year-old male with a background of renal transplant 7 years prior, admitted to hospital with worsening transplant function, and soon after developed sudden onset cortical blindness. On examination, the patient was found to be in denial of his blindness and showed signs of visual confabulation, both of which pointed toward a diagnosis of Anton syndrome. Radiological investigation with computed tomography (CT) and magnetic resonance imaging (MRI) revealed bilateral ischemic stroke of the occipital lobes, which was later theorized to have occurred due to sirolimus-induced thrombotic microangiopathy (TMA). To the author's knowledge, this is the first case report of sirolimus-induced TMA, bilateral ischemic occipital lobe stroke, and Anton's syndrome, within the same diagnosis. This case highlights that a diagnosis of bilateral occipital stroke with denial of blindness should suggest a diagnosis of Anton syndrome. This report also discusses the importance of differentiating bilateral occipital infarction on CT imaging, from posterior reversible encephalopathy syndrome (PRES), using MRI.","DictElement({'Year': '2023', 'Month': '10', 'Day': '10'}, attributes={'DateType': 'Electronic'})",2023,Radiology case reports,10.1016/j.radcr.2023.09.036,PMC10582287,Anton syndrome; Neuroradiology; Stroke,Case Reports,Netherlands,eng
25300957,"""Crossed"" somatoparaphrenia: an unusual new case and a review of the literature.","Perren, Fabienne; Heydrich, Lukas; Blanke, Olaf; Landis, Theodor",Perren,"Somatoparaphrenia is a delusional misidentification and confabulation of body parts, usually arm or hand, opposite to a cerebral lesion, generally of the ""minor"" right hemisphere. There is some controversy concerning lesion site (fronto-parietal; parieto-temporal; posterior insula, additional subcortical nuclei) or necessary associated symptoms (hemiparesis/plegia, anosognosia, neglect, position sense deficit). We here present a patient who is unusual in many respects, that is: (1) he is a right-hander with somatoparaphrenia after a ""dominant"" left-hemisphere lesion associated with aphasia and ideo-motor apraxia, but also with right hemineglect. He thus has ""crossed"" somatoparaphrenia; (2) his delusional misidentification concerned the right leg and not the arm or hand; (3) he has no anosognosia; (4) his proprioception is disturbed for the leg only; and (5) the lesion site is very posterior, a left occipito-parietal haemorrhage without involvement of the frontal lobe or the posterior insula. We present this case together with the seven other cases of ""crossed somatoparaphrenia"" with and without aphasia we found since 1935 in the literature and discuss their relevance in relation to the above controversies.","DictElement({'Year': '2014', 'Month': '10', 'Day': '10'}, attributes={'DateType': 'Electronic'})",2014,Experimental brain research,10.1007/s00221-014-4101-z,,,"Case Reports; Journal Article; Research Support, Non-U.S. Gov't; Review",Germany,eng
36324705,Anton syndrome after subarachnoid hemorrhage and delayed cerebral ischemia: A case report.,"Ricardo, Barojas-Alvarez Manuel; Mariana, Longoria-Ibarrola Erika; Al, Sosa-Ortiz; Manuel, Calleja-Castillo Juan; Jesus, Ramirez-Bermudez",Ricardo,"We report the case of a patient with ruptured middle cerebral artery aneurysm, subarachnoid hemorrhage and frontal intracerebral hemorrhage, who secondarily presented with delayed cerebral ischemia and bilateral occipital infarcts, with complete vision loss, visual anosognosia, and confabulations as the main symptoms. Additionally, the patient had defined features of Cotard syndrome, as revealed by persistent nihilistic delusions. The brain imaging studies showed a bilateral occipital ischemic lesion, as well as frontal and parietal hemorrhagic lesions in the right hemisphere. We address the general theories of anosognosia, confabulation and the problem of why a bilateral occipital lesion is not enough for these metacognitive defects to exist. The presence of right frontal and or parietal hemisphere lesions could be necessary features in most cases.","DictElement({'Year': '2021', 'Month': '06', 'Day': '30'}, attributes={'DateType': 'Electronic'})",2021,Cerebral circulation - cognition and behavior,10.1016/j.cccb.2021.100023,PMC9616440,Anton syndrome; Cotard syndrome; Metacognition; Right hemisphere; Stroke; Subarachnoid hemorrhage,Case Reports,Netherlands,eng
33022431,Delayed Brain Cyst Formation After Gamma Knife Anterior Capsulotomy.,"Kasabkojian, Stephanie Toscano; Dwan, Alexandre Jack; Maziero, Maria Paula; de Salles, Antonio; Gorgulho, Alessandra; Miguel, Eurípedes Constantino; Fillipo de Queiroz Vattimo, Edoardo; Lopes, Antonio Carlos",Kasabkojian,"Gamma Knife ventral anterior capsulotomy is an effective option to treat refractory obsessive-compulsive disorder. Although well tolerated, complications can develop years after radiosurgery. We describe a case in which abnormal complications induced by very high doses of radiation evolved. A 55-year-old man with refractory obsessive-compulsive disorder was treated with Gamma Knife ventral anterior capsulotomy using a dose of 180 Gy. His obsessive-compulsive symptoms improved, but his condition evolved with a manic episode, cognitive memory changes, visual hallucinations, confabulation, and frontal lobe symptoms. Magnetic resonance imaging showed brain edema in the left hemisphere and a 6-mm brain cyst in the right hemisphere at postoperative month 20. This case shows the consequences of affecting more fibers related to the anterior frontal region than intended with a radiosurgical procedure and illustrates the importance of careful clinical and imaging follow-up after Gamma Knife ventral anterior capsulotomy.","DictElement({'Year': '2020', 'Month': '10', 'Day': '03'}, attributes={'DateType': 'Electronic'})",2020,World neurosurgery,10.1016/j.wneu.2020.07.199,,Brain edema; Case report; Cysts; Obsessive-compulsive disorder; Radiosurgery,Case Reports,United States,eng
7420099,Confabulation and frontal lobe dysfunction.,"Kapur, N; Coughlan, A K",Kapur,"A patient is reported who displayed marked confabulation after frontal lobe damage, and whose pattern of performance on memory tests was not typically amnesic. He initially displayed both ""fantastic"" and ""momentary"" confabulation, but several months later showed only ""momentary"" confabulation, which was apparent on direct questioning. This change in type of confabulation was paralleled by improved performance on frontal lobe tests, although his overall pattern of performance on memory tests was unchanged. It is suggested that severity of frontal lobe dysfunction determines the type of confabulation displayed.",{},,"Journal of neurology, neurosurgery, and psychiatry",10.1136/jnnp.43.5.461,PMC490577,,Case Reports; Journal Article,England,eng
35578314,Bromisoval-induced bromism with status epilepticus mimicking Wernicke's encephalopathy: report of two cases.,"Biyajima, Masahiro; Satoh, Shunichi; Morikawa, Takahiro; Morita, Yuki; Watanabe, Rie; Matsui, Daisuke; Konno, Masataka; Morimoto, Nobutoshi; Yatsu, Yuichi; Hirasaki, Akihito; Yahikozawa, Hiroyuki",Biyajima,"Bromine compounds are used in several drugs, including over-the-counter drugs. They sometimes cause intoxication known as bromism. Although the acute neurological symptoms and sequelae of bromism vary, few reports have mentioned acute encephalopathy. We report two cases of bromisoval-induced bromism with status epilepticus. Presence of pseudohyperchloremia and history of over-the-counter medication use guided the diagnosis. In the acute phase, our patients showed bilateral medial thalamic lesions on magnetic resonance imaging. The imaging findings were similar to those of Wernicke's encephalopathy. Although these findings improved in the chronic phase, neuropsychiatric sequelae, such as confabulation and amnesia, occurred. Bromism can cause acute encephalopathy, and it is important to differentiate it from Wernicke-Korsakoff syndrome.","DictElement({'Year': '2022', 'Month': '05', 'Day': '16'}, attributes={'DateType': 'Electronic'})",2022,BMC neurology,10.1186/s12883-022-02712-3,PMC9109394,Bromism; Bromisoval; Bromovalerylurea; Korsakoff’s syndrome; Status epilepticus; Wernicke’s encephalopathy,Case Reports; Journal Article,England,eng
18609017,False selves in neuropsychological rehabilitation: the challenge of confabulation.,"Fotopoulou, Aikaterini",Fotopoulou,"The presence of confabulation following brain damage can obstruct neuropsychological rehabilitation and management. A recent theoretical approach to confabulation emphasises that neurocognitive deficits are not sufficient to account for the content of confabulation. As a result, they are also insufficient to address the unique rehabilitation challenges that confabulation raises. Instead, confabulation could be best understood as the magnification of existing reconstructive memory processes, influenced by both neurocognitive and motivational factors. The paper reviews recent experimental findings showing that confabulations serve important functions of self-coherence and self-enhancement, despite their poor correspondence to reality. Case material is used to illustrate the meaningfulness of confabulation from the subjective perspective of the patient and to demonstrate that such a theoretical approach to confabulation can best inform management and rehabilitation efforts.",{},,Neuropsychological rehabilitation,10.1080/09602010802083545,,,Case Reports; Journal Article; Review,England,eng
37795056,Anton-Babinski Syndrome in a Recurrent Ischemic Stroke Patient: A Case Report.,"Pong, Mei Yin; Yap, Jun Fai; Chung, Tze Yang; Chan, Soo Chin; Sabirin, Sakinah",Pong,"Anton-Babinski syndrome (ABS) is a rare neuropsychiatric condition characterized by visual anosognosia (denial of vision loss) and confabulation in the presence of intact anterior visual tracts. The most common cause of ABS is a cerebrovascular accident involving bilateral occipital lobe injuries with varying degrees of cortical blindness. In this report, we present the case of a woman with suspected ABS following a recurrent ischemic stroke in Malaysia. Establishing a proper diagnosis of stroke is crucial for modifying rehabilitation goals to ensure improved functional outcomes.","DictElement({'Year': '2023', 'Month': '09', 'Day': '03'}, attributes={'DateType': 'Electronic'})",2023,Cureus,10.7759/cureus.44599,PMC10546808,cerebrovascular accident; confabulation; cortical blindness; malaysia; visual anosognosia,Case Reports,United States,eng
29744565,Different patterns of confabulation in left visuo-spatial neglect.,"Dalla Barba, Gianfranco; Brazzarola, Marta; Barbera, Claudia; Marangoni, Sara; Causin, Francesco; Bartolomeo, Paolo; Thiebaut de Schotten, Michel",Dalla Barba,"Confabulating patients produce statements and actions that are unintentionally incongruous to their history, background, present and future situation. Here we present the very unusual case of a patient with right hemisphere damage and signs of left visual neglect, who, when presented with visual stimuli, confabulated both for consciously undetected and for consciously detected left-sided details. Advanced anatomical investigation suggested a disconnection between the parietal and the temporal lobes in the right hemisphere. A disconnection between the ventral cortical visual stream and the dorsal fronto-parietal networks in the right hemisphere may contribute to confabulatory behaviour by restricting processing of left-sided stimuli to pre-conscious stages in the ventral visual stream.","DictElement({'Year': '2018', 'Month': '05', 'Day': '09'}, attributes={'DateType': 'Electronic'})",2018,Experimental brain research,10.1007/s00221-018-5281-8,,Confabulation; Implicit knowledge; Neglect,Case Reports; Journal Article,Germany,eng
38347991,Silent Echoes: A Case Report of Wernicke Encephalopathy's Unheard Voice.,"Gafoor, Stefan; Robertson, Raheem",Gafoor,"Wernicke encephalopathy (WE) is an acute neuropsychiatric emergency that is caused by a deficiency in vitamin B1 (thiamine). This condition is most commonly seen in patients with alcohol use disorder; however, patients with other disorders of severe malnourishment are also at increased risk. In severe cases, this disease may be followed by Korsakoff's psychosis and even death.  We present a case of a 64-year-old African American female with a history of alcohol use disorder who presented to the emergency department on account of an acute confusional state. Neurological examination revealed right beating nystagmus on the left gaze and a wide-based gait. Initial laboratory work-up was unrevealing; however, magnetic resonance imaging (MRI) of the brain demonstrated an abnormal T2 fluid-attenuated inversion recovery (FLAIR) signal involving the bilateral mammillary bodies and surrounding lateral ventricles that extended into the periaqueductal parenchyma. The patient was admitted to the neurology unit, and high-dose intravenous thiamine was commenced. During hospitalization, the patient's confusion improved and they were subsequently discharged with oral thiamine. The spectrum of severity of WE is wide, ranging from fatal disease and can lead to permanent brain damage or even Korsakoff syndrome, characterized by severe memory loss and confabulation. The diagnosis is mainly clinical and based on the presence of symptoms in the classic triad of mental status change, oculomotor abnormality, and ataxia. This triad is only present in about 10% of cases, making the diagnosis very challenging. Laboratory testing can assist in making the diagnosis, but it is not always reliable or available. In situations of clinical uncertainty, imaging may also be used to support diagnosis or rule out other differentials. The mainstay of treatment is with high-dose parenteral thiamine.","DictElement({'Year': '2024', 'Month': '01', 'Day': '12'}, attributes={'DateType': 'Electronic'})",2024,Cureus,10.7759/cureus.52151,PMC10859680,alcohol use; non-alcoholic wernicke's encephalopathy; thiamine defecincy; wernicke-korsakoff syndrome; wernicke’s,Case Reports,United States,eng
3816246,Confabulation in aphasia.,"Sandson, J; Albert, M L; Alexander, M P",Sandson,"We describe a brain-damaged patient who produced two distinctive forms of confabulation, typical and atypical (aphasic), both of which were associated with perseveration, poor self-monitoring, and denial of deficit. We propose that the typical confabulations are triggered by gaps in memory for the period surrounding the onset of his illness, while the aphasic (fantastic) confabulations are triggered by gaps in semantic representation. These observations suggest that confabulations may comprise a portion of the language deficit in patients with other varieties of fluent aphasia.",{},,Cortex; a journal devoted to the study of the nervous system and behavior,10.1016/s0010-9452(86)80021-1,,,"Case Reports; Journal Article; Research Support, Non-U.S. Gov't; Research Support, U.S. Gov't, Non-P.H.S.; Research Support, U.S. Gov't, P.H.S.",Italy,eng
38713498,A neuropsychiatric case of delayed post-hypoxic leukoencephalopathy from opioid intoxication resulting in Anton-Babinski syndrome and quadriplegia.,"Cardona Quiñones, Roberto A; Salem Hernández, Saidy A; Sekimitsu, Sayuri; Antongiorgi Torres, Joalex; Yerstein, Oleg; Safar, Laura T",Cardona Quiñones,"This is the case of a 26-year-old male who developed Anton Babinski syndrome (ABS), quadriplegia, and delayed post-hypoxic leukoencephalopathy (DPHL) after an opioid overdose. He exhibited cortical blindness, visual anosognosia, and confabulation upon awakening. Several days later, he experienced acute psychosis and agitation. T2-FSE MRI revealed extensive supratentorial leukoencephalopathy involving both cerebral hemispheres, extending to the posterior corpus callosum due to cerebral anoxia. This case report will discuss different types of encephalopathy from opioid abuse, ABS, visual anosognosia, and confabulation's pathogenic mechanisms. It underscores the necessity of researching substance-induced neuropsychiatric disorders and their pathogenic mechanisms for effective treatments.","DictElement({'Year': '2024', 'Month': '05', 'Day': '07'}, attributes={'DateType': 'Electronic'})",2024,Neurocase,10.1080/13554794.2024.2350103,,Anton-Babinski syndrome; cortical blindness; delayed Post-hypoxic leukoencephalopathy; leukoencephalopathy; opioid intoxication,Case Reports; Journal Article,England,eng
