pmid,title,authors,first_author,abstract,publication_date,publication_year,journal_info,doi,pmcid,keywords,article_type,country,language
20309801,Outcome of craniocerebral gunshot injuries in the civilian population. Prognostic factors and treatment options.,"Petridis, A K; Doukas, A; Barth, H; Mehdorn, M",Petridis,"Gunshot wounds to the head are rare in Europe. They may be inflicted by low-velocity handguns, captive bolt guns and tear gas cartridges and mostly result from suicide attempts. The experience of neurosurgeons with this kind of traumatic injury is decreasing; the aim of this study was therefore to analyse prognostic factors which help to decide whether or not to operate and to discuss treatment options. Thirty patients with gunshot head injuries treated in our hospital from 1993 to 2008 were retrospectively evaluated. Glasgow Coma Scale (GCS) score, pupil reactivity, lesion localisation, number of bone fragments, intracranial pressure (ICP), midline shift, hypotension, and dural penetration were analysed for their prognostic value. Surgically and non-surgically treated patients were evaluated separately. Complications were registered. A low GCS of 3-8, fixed pupils, >2 bone fragments, bilobar or posterior fossa/brainstem lesions and ICP >45 mmHg were indicators of a poor prognosis. Patients with a GCS of 3-8 and two non-reactive pupils should not be operated. If one or both of the pupils are reactive, surgery should be performed irrespective of the GCS score, except in patients with translobar/transventricular wounds. Even if there are no clear contraindications to surgery, the outcome is expected to be poor in patients with a low GCS score, midline shift >10 mm, >2 bone fragments in the brain, and a bilobar, posterior fossa/brainstem or ventricular lesion and ICP >45 mmHg. When surgery is performed the wound and the missile or bone track should be debrided meticulously, the wound and dura should be closed in a watertight fashion and antibiotic prophylaxis as well as tetanus serum should be given.","DictElement({'Year': '2010', 'Month': '03', 'Day': '22'}, attributes={'DateType': 'Electronic'})",2010,Central European neurosurgery,10.1055/s-0029-1241850,,,Case Reports; Journal Article,Germany,eng
25452633,An augmented cognitive behavioural therapy for treating post-stroke depression: description of a treatment protocol.,"Kootker, Joyce A; Rasquin, Sascha M C; Smits, Peter; Geurts, Alexander C; van Heugten, Caroline M; Fasotti, Luciano",Kootker,"Currently, no evidence-based treatment is available for mood problems after stroke. We present a new psychological intervention designed to reduce depressive complaints after stroke. This intervention was based on cognitive behavioural therapy principles and was shown feasible in a pilot study. In order to meet the specific needs of stroke patients (concerning both sensori-motor, cognitive, and behavioural problems), we incorporated motivational interviewing, grief resolution, and psycho-education. We emphasised for each session to take into account the cognitive deficits of the patients (i.e. be concrete, accessible, structured, specific, and repeat information). Moreover, we augmented the psychologist-administered therapy with the contribution of an occupational or movement therapist aimed at facilitating patients' goal-setting and attainment. The intervention consisted of 12 one-hour sessions with a psychologist and three or four one-hour sessions with an occupational or movement therapist. Currently, the effectiveness of the intervention is evaluated in a randomised controlled trial. The proposed psychological treatment protocol is innovative, as it applies cognitive behavioural therapy in a stroke-specific manner; moreover, it supports goal attainment by incorporating occupational or movement therapy sessions.","DictElement({'Year': '2014', 'Month': '12', 'Day': '01'}, attributes={'DateType': 'Electronic'})",2014,Clinical rehabilitation,10.1177/0269215514559987,,Stroke; anxiety; cognitive behavioural therapy; depression; treatment protocol,Case Reports; Journal Article,England,eng
10357519,Electroconvulsive treatment of a bipolar adolescent postcraniotomy for brain stem astrocytoma.,"Ghaziuddin, N; DeQuardo, J R; Ghaziuddin, M; King, C A",Ghaziuddin,"This is the first reported use of electroconvulsive treatment (ECT) in an adolescent with bipolar mania who had been treated with craniectomy for an intracranial neoplasm. The reported case is of a 16-year-old girl with a history of brain stem glioma (pontomesencephalic astrocytoma) diagnosed at 13 years of age. She presented in a psychiatric emergency room with suicidal ideation, depressed mood, irritability, olfactory hallucinations, early insomnia, grandiosity, and guilt. Her symptoms failed to respond to a trial of an antidepressant, mood stabilizer alone, and mood stabilizer in conjunction with a neuroleptic. The decision to use ECT was based on suicidal ideation, extreme disinhibition, and danger to self and others. Significant improvement in mood and remission in psychosis were noted after the eighth treatment. Comparison of 2-week pre-ECT and 3-month post-ECT cognitive testing revealed no change in IQ. This report highlights rapid response and the ability to tolerate ECT in an adolescent diagnosed with bipolar disorder, who had also been treated with radiation and craniotomy.",{},,Journal of child and adolescent psychopharmacology,10.1089/cap.1999.9.63,,,Case Reports; Journal Article,United States,eng
36989081,Bing Neel Syndrome: A Rare Contributing Factor of Psychosis and Suicidality.,"Alexander, Abigail L; Jackson, Devon; Donahue, John E; Chirkov, Alexander; Banerjee, Priya",Alexander,"Suicide rapidly increased in the United States by 30% from 2000 to 2020, accounting for more than 800,000 deaths ( Neurosci Res Program Bull . 1972; 10: 384-8). Studies have shown that there are a multitude of underlying issues, including mental illness, that elevate an individual's risk of dying by suicide ( CDC WONDER: Underlying cause of death, 1999-2019 . Atlanta, GA: US Department of Health and Human Services, CDC; 2020). Presented here is a case of Bing Neel syndrome (BNS) found in a 69-year-old man who died by suicide by jumping off a 135' bridge. His medical history was significant for traumatic brain injury, Waldenstrom macroglobulinemia (WM), major depressive disorder, suicidal ideation, and anxiety. Bing Neel syndrome is a rare central nervous system complication of WM. His wife reported an abrupt mental deterioration starting 5 years before his death, characterized by paranoia, depression, and insomnia. He had been a high-functioning university professor. His decline culminated with the loss of independence in his activities of daily living. At autopsy, it was found that he experienced blunt force injuries related to the fall, causing his death. A neuropathologic examination revealed a brisk and fulminant clonal CD20 + /immunoglobulin M+ lymphocytic infiltrate, involving all sampled regions of his brain, consistent with WM. This workup was critical to obtaining an accurate pathologic diagnosis of BNS and understanding his full clinical status before death. Although BNS was not the proximate cause of death, this diagnosis aided the death investigation as a causal factor in his suicidality and was vital to providing his family closure.","DictElement({'Year': '2023', 'Month': '03', 'Day': '22'}, attributes={'DateType': 'Electronic'})",2023,The American journal of forensic medicine and pathology,10.1097/PAF.0000000000000824,,,Case Reports; Journal Article,United States,eng
9081558,Multiple sclerosis and bipolar disorder: a case report with autopsy findings.,"Casanova, M F; Kruesi, M; Mannheim, G",Casanova,"An 81-year-old woman with postmenopausal onset of a bipolar disorder had multiple individual manic and depressive episodes over the span of 31 years. Autopsy disclosed widespread periventricular demyelinated plaques. Although the late age at onset of bipolar symptoms suggested an underlying organic disorder, the multiple affective episodes and lack of additional neurological manifestations make the case atypical. The authors stress the use of modern imaging modalities such as MRI in investigating secondary mood disorders.",{},,The Journal of neuropsychiatry and clinical neurosciences,10.1176/jnp.8.2.206,,,Case Reports; Journal Article,United States,eng
33648417,Effect of transcranial direct current stimulation (tDCS) delivered via dorsolateral prefrontal cortex on central post-stroke pain and depression: a case report.,"Hassan, Auwal Bello; Danazumi, Musa Sani; Abdullahi, Auwal; Yakasai, Abdulsalam Mohammed",Hassan,"Transcranial direct current stimulation (tDCS) is effective in the management of patients with central post-stroke pain (CPSP) and post-stroke depression (PSD) individually. However, it is not known if tDCS delivered via dorsolateral prefrontal cortex (DLPFC) can be used to ameliorate both symptoms. The purpose of this case report was to share the effectiveness of using tDCS of the DLPFC with short inter-session intervals to reduce central pain and depression in a stroke survivor. A 45-year-old patient presented with CPSP and depression following a stroke. The CPSP and depression were diagnosed using the Douleur Neuropathique 4 Questionnaire (DN4Q) and the Beck Depression Index (BDI) respectively. The pain score was 10 on a visual analogue scale (VAS) and it was a hemi-body burning sensation, with a score of 7 on DN4Q, and the depression score was 25 on the BDI. The patient received anodal tDCS to the left DLPFC using two different application protocols. Initially, a stimulation session of 2 milliamperes (mA) intensity for 20 minutes was given every working day for 2 weeks. After 3 weeks, she then received 7 daily sessions of periodic stimulations of 2 mA intensity for 13 minutes each with 20 minutes inter-session intervals for 1 week. The patient was followed up for 6 months post-intervention. Immediately following the last session of the initial protocol of stimulation, the BDI score reduced from 25 to 7 and the pain became abolished. However, the symptoms relapsed at 3 weeks post-intervention to the initial BDI score of 25, VAS score of 10 and DN4Q score of 7. Following the application of the second protocol of stimulation, the BDI score improved to 18 at three weeks and later to 7 at six months post-intervention while the pain (both VAS and DN4Q) became completely abolished. Further research is needed to determine if a series of periodic tDCS with short-intersession intervals applied to the DLPFC may be more effective than a single tDCS with long inter-session intervals, in decreasing pain and inducing long-term improvement in mood in people with stroke.","DictElement({'Year': '2021', 'Month': '03', 'Day': '02'}, attributes={'DateType': 'Electronic'})",2021,Physiotherapy theory and practice,10.1080/09593985.2021.1891591,,Transcranial direct current stimulation; central post-stroke pain; long-term potentiation; noninvasive brain stimulation; post-stroke depression,Case Reports; Journal Article,England,eng
15140611,Nonparaneoplastic limbic encephalitis with relapsing polychondritis.,"Ohta, Yasuyuki; Nagano, Isao; Niiya, Daigo; Fujioka, Hideki; Kishimoto, Takumi; Shoji, Mikio; Abe, Koji",Ohta,"Relapsing polychondritis (RP), which shows pain, swelling and destruction of the affected parts, is a rare autoimmune disorder affecting cartilage. We report a patient with RP that affected skull cartilage, who subsequently developed multifocal meningoencephalitis. The patient presented with severe recent memory disturbance, anxiety and moderate depression. MRI study showed bilateral median temporal lobe lesions including hippocampi and amygdaloidal bodies, abnormal findings that disappeared after treatment with high-dose steroids. This is thought to be the first case of RP presenting amnesic syndrome and mental disorder associated with nonparaneoplastic limbic encephalitis involving bilateral hippocampi and amygdaloidal bodies detected by MRI.",{},,Journal of the neurological sciences,10.1016/j.jns.2004.02.010,,,Case Reports; Journal Article,Netherlands,eng
7552055,Electroconvulsive therapy and intracranial aneurysm.,"Bader, G M; Silk, K R; Dequardo, J R; Tandon, R",Bader,"Little has been written regarding the safety of electroconvulsive therapy (ECT) administered to patients with intracranial aneurysms. The literature is reviewed and we report two additional cases of ECT safely and effectively employed to treat depressed patients with intracranial aneurysms. We found no reported cases of aneurysm rupture associated with ECT. We do not feel the presence of intracranial aneurysm is a contraindication to ECT, in most patients, with appropriate monitoring and control of arterial blood pressure.",{},,Convulsive therapy,,,,Case Reports; Journal Article,United States,eng
7711487,Apathy: a treatable syndrome.,"Marin, R S; Fogel, B S; Hawkins, J; Duffy, J; Krupp, B",Marin,"Apathy occurs frequently in neuropsychiatric disorders both as a symptom of other syndromes and as a syndrome per se. Histories are presented of patients with a syndrome of apathy who showed clinically significant, sustained benefit from pharmacological treatment. Etiologies included non-Alzheimer's frontal lobe dementia, cerebral infarction, intracranial hemorrhage, alcoholism, and traumatic brain injury. Agents included amantadine, amphetamine, bromocriptine, bupropion, methylphenidate, and selegiline. These histories support the suggestion that apathy is a discriminable dimension of behavior having its own pathophysiology and implications for psychiatric care. They raise the possibility of treatment for many patients previously thought untreatable. Studying the treatment of apathy may contribute to the clinical care and scientific understanding of neuropsychiatric disorders throughout the life span.",{},,The Journal of neuropsychiatry and clinical neurosciences,10.1176/jnp.7.1.23,,,Case Reports; Journal Article,United States,eng
12111671,Differentiating neurological disorders from psychiatric and the psychological impact of neurological diseases.,"Tucker, Gary J",Tucker,,{},,Seminars in clinical neuropsychiatry,10.1053/scnp.2002.0070163,,,Case Reports; Journal Article; Review,United States,eng
19339849,Resolution of bipolar II and panic disorders following subarachnoid hemorrhage.,"Etches, Selene Mya; Schmidt, Matthias; Alda, Martin; Hajek, Tomas; Kahn, David A",Etches,"Cerebral infarction producing psychiatric disorders such as depression and mania is a recognized phenomenon. However, resolution of affective disorders following stroke has not been previously reported. We describe the case of a 53-year-old woman with a 25-year history of treatment-resistant bipolar II and panic disorders. At the age of 46, she experienced a subarachnoid hemorrhage with secondary vasospasm that resulted in a stroke. Shortly following the hemorrhage, the patient experienced a complete remission of both psychiatric illnesses that has been sustained for 7 years. Initial computed tomography (CT) and angiography studies revealed subarachnoid hemorrhage with intraventricular extension, communicating hydrocephalus, and aneurysms of the left posterior communicating artery and the right anterior cerebral artery. Following clipping of the left internal posterior communicating artery aneurysm, the patient developed vasospasm with further stroke symptoms. A subsequent CT scan showed a fully developed ischemic infarct in the left temporoparietal region that was confirmed by follow-up magnetic resonance imaging (MRI). We present a 7-year follow-up with complete psychiatric interview, chart review, and MRI. The present case demonstrates the importance of continued efforts to localize neural circuits involved in the pathogenesis and maintenance of affective disorders.",{},,Journal of psychiatric practice,10.1097/01.pra.0000348368.42042.e2,,,Case Reports; Journal Article,United States,eng
29863700,[Cerebral cryptococcosys with depressive disorder].,"Artemieva, M S; Yurovskaya, I I; Gavrik, A N; Lukashenko, A A; Danilin, I E",Artemieva,"A case of cerebral cryptococcosis is described. Cryptococcus neoformans is the most pathogenic in humans. It often affects lungs, skin, muscles and tissues of the Central Nervous System (CNS). In case of CNS involvement, the main clinically diagnosed form of the disease is cryptococcal meningitis. The authors describe a patient with non-specific symptoms of anxiety-depressive disorder and further development of neurological symptoms and behavioral deviations.",{},,Zhurnal nevrologii i psikhiatrii imeni S.S. Korsakova,10.17116/jnevro20181184190-93,,anxiety; cerebral cryptococcosis; depressive episode; fungal infection,Case Reports; Journal Article,Russia (Federation),rus
4020369,"Major depression and carbon monoxide-induced parkinsonism: diagnosis, computerized axial tomography, and response to L-dopa.","Jaeckle, R S; Nasrallah, H A",Jaeckle,"A case of major depressive disorder complicated by carbon monoxide (CO)-induced Parkinson's syndrome is reported. Computerized axial tomography (CAT) revealed bilateral globus pallidus necrosis. Clinical, CAT, and neuropathological findings in other cases of CO encephalopathy with and without parkinsonism are reviewed. The utility of CAT in the diagnostic workup and in following clinical course is discussed, as are the difficulties of making a diagnosis of an antecedent primary psychiatric disorder in the presence of neurological and psychiatric sequelae of CO intoxication. There was no clinical response to a tricyclic antidepressant, but both the mood and movement disorders responded fully to L-dopa. The implications of these findings with regard to the central neurochemical pathophysiology in this patient and in major depressive disorder in general are discussed.",{},,The Journal of nervous and mental disease,10.1097/00005053-198508000-00009,,,Case Reports; Journal Article,United States,eng
24005463,Frontal lobe syndrome caused by a giant meningioma presenting as depression and bipolar disorder.,"Mumoli, Nicola; Pulerà, Flavio; Vitale, José; Camaiti, Alberto",Mumoli,"Frontal meningiomas may present only with psychological symptoms that resemble depression, anxiety states, hypomania and schizophrenia. Herein, we present the case of a 55-year-old man who was initially thought to have depression and bipolar disorder, but was eventually diagnosed with frontal lobe syndrome caused by a giant frontal meningioma.",{},,Singapore medical journal,10.11622/smedj.2013160,,,Case Reports; Journal Article,India,eng
8902178,Bipolar disorder following a stroke involving the left hemisphere.,"Liu, C Y; Wang, S J; Fuh, J L; Yang, Y Y; Liu, H C",Liu,"Post-stroke mania has rarely been noted and researched, and reported cases have mostly involved the non-dominant hemisphere. In this paper, we report a case of bipolar disorder secondary to a stroke over the dominant hemisphere. A 48-year-old, right-handed man had a cerebral infarct over the left temporal region. He became depressed after the stroke, and 4 months later developed a manic episode. The patient was treated with haloperidol and lorazepam. The symptoms subsided within 2 months after treatment. It is premature to consider mania to be a syndrome of the right, or non-dominant, hemisphere. We suggest that further study focusing on specific anatomical regions, rather than laterality, will help to elucidate the interrelationship between mood and brain function.",{},,The Australian and New Zealand journal of psychiatry,10.3109/00048679609062667,,,"Case Reports; Journal Article; Research Support, Non-U.S. Gov't",England,eng
9817628,Occurrence of trazodone-induced delirium.,"Lennkh, C; Fischer, P; Küfferle, B; Kasper, S",Lennkh,"Trazodone, a triazolepyridine derivate, is both chemically and pharmacologically distinct from other serotonin reuptake inhibitors and possesses antidepressant, anxiolytic and hypnotic activity. We observed trazodone-induced delirium in three depressed patients who also suffered from preexisting organic cerebral lesions (two cases) or thyroideal dysfunction (one case). The appearance of hallucinations, psychomotoric agitation, and cognitive changes after initiation of trazodone therapy and their prompt cessation after drug discontinuation led to the impression that these were drug-induced phenomena. One possible hypothesis for the observed deliria is an oversensitivity to the effect of meta-chlorphenylpiperazine, which is a metabolite of trazodone with specific 5-HT agonistic properties.",{},,International clinical psychopharmacology,10.1097/00004850-199809000-00006,,,Case Reports; Journal Article,England,eng
9627199,Fear of seizures: an investigation and treatment.,"Newsom-Davis, I; Goldstein, L H; Fitzpatrick, D",Newsom-Davis,"Despite the wealth of epidemiological evidence showing the comorbidity of epilepsy with various forms of psychopathology, there has been little systematic investigation of its relationship with affective disorders. This study aims to explore the phenomenon of seizure fear. Survey data have suggested that patients commonly fear death and/or brain damage as a result of their seizures, but documented cases of seizure phobia are rare and infrequently address issues of treatment. The study describes the exploration and successful cognitive behavioural treatment of a case of seizure phobia in a 26 year old woman with a 9 year history of epilepsy following a subarachnoid haemorrhage. The findings represent an important development in the much-neglected study of seizure fear. The case highlights some of the factors which may contribute to the genesis and maintenance of epilepsy-related psychopathologies and consequently has important implications for theoretical modelling in this area. Furthermore, it provides encouraging evidence to support the use of cognitive-behavioural techniques in treatment of these disorders.",{},,Seizure,,,,Case Reports; Journal Article,England,eng
12637187,Rapid cycling bipolar disorder after left temporal polar damage.,"Murai, Toshiya; Fujimoto, Shinsuke",Murai,"The case of a 48-year-old woman with rapid cycling bipolar disorder subsequent to a traumatic brain injury is reported. Both depressive and manic episodes had an average duration of approximately 1 month, alternating without stable euthymic periods. Neuroradiological examinations revealed a circumscribed lesion in the left temporal pole. After 1 year without treatment, psychiatric intervention and pharmacotherapy was initiated. Her mood swings were successfully treated with the co-administration of valproate and lithium. Case reports of rapid cycling bipolar disorder after traumatic brain injury are very rare and this case supports the idea that temporal polar dysfunction is a candidate for the neurobiological basis of rapid cycling bipolar disorder.",{},,Brain injury,10.1080/0269905031000070170,,,Case Reports; Journal Article,England,eng
21762998,Encephalopathy associated with autoimmune thyroid disease (Hashimoto's thyroiditis) presenting as depression: a case report.,"Liu, Chao-Yu; Tseng, Mei-Chih Meg; Lin, Po-Hsien",Liu,Encephalopathy associated with autoimmune thyroid disease (EAATD) is a rare condition associated with Hashimoto's thyroiditis or Graves' disease. It is often underdiagnosed because of the various clinical presentations and lack of widely accepted diagnostic criteria. We report a 46-year-old man who presented with an acute depressive episode and was proven to have encephalopathy associated with Hashimoto's thyroiditis. The exclusive psychiatric manifestations of this case called our attention to the fact that an improved awareness of EAATD in patients with a history of thyroid disease can lead to a timely diagnosis and excellent disease prognosis.,"DictElement({'Year': '2011', 'Month': '07', 'Day': '16'}, attributes={'DateType': 'Electronic'})",2011,General hospital psychiatry,10.1016/j.genhosppsych.2011.05.019,,,Case Reports; Journal Article,United States,eng
8149313,Attempted suicide using insulin by a non diabetic: a case study demonstrating the acute and chronic consequences of profound hypoglycemia.,"Cooper, A J",Cooper,"This paper describes the case of a non diabetic physician with a prior psychiatric history in which there was overwhelming biochemical and clinical evidence that he had attempted suicide by injecting himself with an overdose of insulin. He was extensively monitored from the time of his admission to hospital in a coma, until he fully recovered consciousness 30 days later and during the next eight months of his rehabilitation. This case attests to the high level of morbidity which might follow profound hypoglycemia. It also illustrates some putative psychodynamics of suicidal behaviour--notably ambivalence and denial (at the time of writing, the patient never acknowledged that he had overdosed with insulin). A selective review on some of the more recent literature on the neuropathological effects of insulin overdose and profound hypoglycemia is presented.",{},,Canadian journal of psychiatry. Revue canadienne de psychiatrie,10.1177/070674379403900207,,,Case Reports; Journal Article; Review,United States,eng
