pmid,title,authors,first_author,abstract,publication_date,publication_year,journal_info,doi,pmcid,keywords,article_type,country,language
30150329,"Hypothalamic relapse of a cardiac large B-cell lymphoma presenting with memory loss, confabulation, alexia-agraphia, apathy, hypersomnia, appetite disturbances and diabetes insipidus.","Ospina-García, Natalia; Román, Gustavo C; Pascual, Belén; Schwartz, Mary R; Preti, Hector Alejandro",Ospina-García,"A 37-year-old Hispanic man with a right atrial intracardiac mass diagnosed as diffuse large B-cell lymphoma (DLBCL) was successfully treated with surgery and chemotherapy. During 4 years, several total-body positron emission tomography and MRI scans showed no extracardiac lymphoma. On year 5 after the cardiac surgery, patient presented with sleepiness, hyperphagia, memory loss, confabulation, dementia and diabetes insipidus. Brain MRI showed a single hypothalamic recurrence of the original lymphoma that responded to high-dose methotrexate treatment. Correction of diabetes insipidus improved alertness but amnesia and cognitive deficits persisted, including incapacity to read and write. This case illustrates two unusual locations of DLBCL: primary cardiac lymphoma and hypothalamus. We emphasise the importance of third ventricle tumours as causing amnesia, confabulation, behavioural changes, alexia-agraphia, endocrine disorders and alterations of the circadian rhythm of wakefulness-sleep secondary to lesions of specific hypothalamic nuclei and disruption of hypothalamic-thalamic circuits.","DictElement({'Year': '2018', 'Month': '08', 'Day': '27'}, attributes={'DateType': 'Electronic'})",2018,BMJ case reports,10.1136/bcr-2016-217700,PMC6119376,cancer intervention; memory disorders; neuroendocrinology; neurooncology; sleep disorders (neurology),Case Reports; Journal Article,England,eng
18416482,Models of confabulation: a critical review and a new framework.,"Metcalf, Kasey; Langdon, Robyn; Coltheart, Max",Metcalf,"Confabulation can be defined as statements or actions that involve distortions of memories. This paper reviews current theories of confabulation focusing on source monitoring, temporal-context, and retrieval theories. The attributes and criticisms of these three models are discussed. From this review, a three-factor cognitive-neuropsychological framework is proposed, which can be used to explain the variable symptoms of confabulation. The framework takes its basis from the Langdon and Coltheart (2000a, 2000b) cognitive model of delusional belief formation. The model suggests that two deficits are likely in most cases of confabulation - an executive control retrieval deficit and an evaluation deficit. It also takes into consideration how the general organization of the autobiographical memory store and a person's individual emotional/motivational biases can influence confabulatory symptoms and content. This is an overarching framework that can be used to model confabulations, and it builds upon links between delusions and confabulation.",{},,Cognitive neuropsychology,10.1080/02643290600694901,,,Case Reports; Journal Article,England,eng
39149664,Reversible Bilateral Vision Loss: An Unusual Presentation of Wernicke-Korsakoff Syndrome.,"Guagliardo, Emily; Singh, Divya; Thakkar, Jasmine; Rodriguez, Wilson; Pastrana, Francesca; Qaqish, Hanan; Chand, Pratap",Guagliardo,"Neuro-ophthalmic manifestations of Wernicke encephalopathy (WE) are uncommon and vary from nystagmus, oculomotor palsies, anisocoria, and optic disc edema to vision loss. We describe a case of a 53-year-old woman presenting with subacute bilateral painless vision decline, lower-extremities weakness with impaired ambulation, headache, and abdominal pain. Neurological examination was pertinent for confabulation, bilateral decreased visual acuity with an absent blink to threat, absent afferent pupillary defect and fundus abnormalities, and significant allodynia in bilateral lower extremities. Besides elevated inflammatory marker with an erythrocyte sedimentation rate (ESR) of 130 mm/hr, her infectious, autoimmune, paraneoplastic, and neuromyelitis optica work-up was overall unremarkable. Brain MRI showed abnormal fluid-attenuated inversion recovery (FLAIR) signaling in bilateral mammillary bodies and around periaqueductal gray matter concerning WE. Due to concerns of Wernicke-Korsakoff syndrome (WKS), parenteral high-dose thiamine was initiated with significant clinical improvement. The patient was also later found to have a positive anti-myelin oligodendrocyte glycoprotein (MOG) antibody, which was deemed false positive given the atypical phenotype and symptomatic improvement with thiamine supplementation. This case encourages the consideration of vision loss as a manifestation of WKS, especially in patients who have risk factors. Testing serum levels of thiamine is strongly encouraged; however, initiating empiric treatment is advocated for high clinical suspicion due to its reversible nature and minimal risk for side effects.","DictElement({'Year': '2024', 'Month': '07', 'Day': '15'}, attributes={'DateType': 'Electronic'})",2024,Cureus,10.7759/cureus.64613,PMC11324805,anti-mog antibody; neuropathy; nutritional deficiency; optic neuropathy; optic perineuritis; retinal ganglion cell neuronopathy; thiamine; vision loss; wernicke-korsakoff syndrome,Case Reports; Journal Article,United States,eng
15458759,"Applied psychophysiology, clinical biofeedback, and rehabilitation neuropsychology: a case study--mild traumatic brain injury and post-traumatic stress disorder.","Ackerman, Rosalie J",Ackerman,"This article presents a case study of a 39-year-old European American married woman with a history of child and adolescent incest,marital rape, and physical abuse from her husband for more than 10 years. She was referred to a pain clinic for treatment of headaches and Tourette's syndrome. The client was evaluated with the Ackerman-Banks Neuropsychological Rehabilitation Battery to identify neuropsychological strengths and weaknesses. The Vulnerability to Stress Audit was used to identify life events that were positively and negatively influencing her life. The client was treated for mild traumatic brain injury, post-traumatic stress disorder,cognitive difficulties, impulsivity, confabulation, low frustration tolerance, and inability to evaluate and make decisions about socially appropriate behaviors. Treatment involved traditional psychotherapy, hypnosis, cognitive rehabilitation, biofeedback training, electromyography, finger temperature, and blood pressure.",{},,Physical medicine and rehabilitation clinics of North America,10.1016/j.pmr.2004.04.001,,,Case Reports; Journal Article,United States,eng
22649343,Confabulations after bilateral consecutive strokes of the lenticulostriate arteries.,"Carota, Antonio; Calabrese, Pasquale",Carota,We describe the case of a 75-year-old woman who manifested persistent confabulations after two consecutive strokes encompassing the area of the lenticulostriate arteries territory on both hemispheres. Findings reported on this rare clinical syndrome suggest that fantastic confabulations and delusional thoughts may arise after bilateral damage of subcortical nonthalamic structures.,"DictElement({'Year': '2012', 'Month': '03', 'Day': '16'}, attributes={'DateType': 'Electronic'})",2012,Case reports in neurology,10.1159/000337221,PMC3362221,Anterograde memory; Caudate nucleus; Confabulation; Delusion; Lenticulostriate arteries; Stroke,Case Reports,Switzerland,eng
9801707,Neuropsychological deficits in patients with an anterior communicating artery syndrome: a multiple case study.,"Beeckmans, K; Vancoillie, P; Michiels, K",Beeckmans,"The neuropsychological performance of five patients with an anterior communicating artery (ACoA) syndrome (amnesia, confabulation and personality changes) was studied. Neuroimaging techniques revealed a basal forebrain and frontal lobe pathology in all patients. The limbic system appeared intact. There was no evidence for an intellectual deterioration relative to the estimated premorbid IQ in four patients. Regarding attention, all patients showed significant deficits. Visuospatial disabilities could not be observed. On tests of executive functioning, all patients did exhibit severe problems. Every patient displayed a profound amnesic syndrome. A retrograde amnesia could be documented and was characterised by a temporal gradient. Short-term memory appeared normal. Concerning long-term memory, all patients scored out of the normal range on total immediate recall tasks. Four patients showed a normal recognition performance but produced a large number of false alarms. Despite a normal recognition performance, they were impaired in delayed recall tasks. However, one patient showed a full-blown amnesic syndrome, because his delayed recall and recognition of learned items were both depressed. Our results with regard to long-term memory functioning support the hypotheses which assume (1) the existence of recognition superiority and pathological false recognition, and (2) basal forebrain amnesia in ACoA patients.",{},,Acta neurologica Belgica,,,,Case Reports; Journal Article,Italy,eng
12884807,"[Amnesia, confabulation and nonaphasic misnaming after left thalamic infarct].","Hayashi, Ryuichiro; Ohashi, Masashi; Watanabe, Ryo; Mimura, Masaru; Katsumata, Yasushi",Hayashi,"A 72-year-old right handed woman developed amnesia, confabulation and abnormal (bizarre) verbal response after the left thalamic infarction. Clinical features including disorientation, euphoria and various kinds of paraphasia coincided in nonaphasic misnaming. MR images showed that lesions involved the genu of the internal capsule, the anteroventral nucleus, the lateroventral nucleus, intralaminar nuclei, the mamillothalamic tract and the region around the ventral thalamus. 99mTc-HMPAO-SPECT revealed decreased uptake in the left frontal lobe, probably due to the disconnection from the thalamus. These findings suggest that the dysfunction of the thalamus (mainly ventrolateral) and the left frontal lobe caused the disturbance of the self-monitoring in the language use, which generated confabulation and nonaphasic misnaming in our case.",{},,No to shinkei = Brain and nerve,,,,Case Reports; Journal Article,Japan,jpn
2193339,[Memory disorders in chickenpox encephalitis].,"Delerue, O; Houdart, P; Destée, A",Delerue,"A 31-year old man with chicken-pox encephalitis presented with a cerebellar syndrome and disorders of memory. The latter consisted of severe anterograde amnesia with normal retrograde memory, without confabulation or anosognosia. This suggested that the hippocampus was involved, probably functionally, since the outcome was rapidly favourable and the MRI was normal.",{},,Revue neurologique,,,,Case Reports; English Abstract; Journal Article; Review,France,fre
12972229,Korsakoff syndrome following chronic subdural hematoma.,"Inagaki, Takuji; Shimitzu, Yoshiko; Tsubouchi, Ken; Momose, Isamu; Miyaoka, Tsuyoshi; Mizuno, Soichi; Kishi, Toshiro; Yamamori, Chikako; Horiguchi, Jun",Inagaki,"We describe a patient who developed Korsakoff syndrome following a spontaneous chronic subdural hematoma. The present case demonstrates persistence of both amnesia and confabulation long after recovery from the acute phase of spontaneous chronic subdural hematoma. There are few reports describing persistent amnesia with confabulation following brain damage. We considered that chronic subdural hematoma in the bilateral frontal and temporal lobes caused amnesia and confabulations, and these conditions persisted as a result of organic atrophic changes of both the frontal and temporal lobes due to long-term compression by chronic subdural hematoma.",{},,General hospital psychiatry,10.1016/s0163-8343(03)00068-9,,,Case Reports; Journal Article,United States,eng
18597884,[Fantastic confabulations or delusion?].,"Peskine, A; Bruguière, P; Picq, C; Pradat-Diehl, P",Peskine,"Confabulations are inaccurate narratives purporting to convey information about the world or the self. Fantastic utterances from brain-injured patients are difficult to interpret as confabulation or delusion. Starting from two clinical observations, we analyse the terms ""spontaneous confabulations"" and ""delusion"". Two brain-injured patients presented with fantastic utterances; the adhesion was complete for both patients. They also suffered from amnesic and executive disorders. Clinical interviews with neuropsychologist and psychopathologist could not distinct between spontaneaous confabulations and delusion. Neuropsychological interpretations of spontaneous confabulations are (1) the deficient strategic retrieval process arising from executive failures and (2) confusion of the temporal order of information within memory. These hypotheses cannot explain the fantastic utterances described. Are spontaneous fantastic confabulations a specific entity or did these patients present a morbid association of neurological and psychiatric disorders? Fantastic confabulations are very scarcely described and the association of neurological and psychiatric impairments enables us to better describe the clinical observations. Spontaneous confabulations reported after amnesic and executive disorders are indeed typically composed of the patient's past experiences and do not usually comprehend fantastic utterances. Neurological and psychological analyses of the fantastic utterances from two brain-injured patients do not respond to the definition of spontaneous confabulation. Fantastic confabulations are a rare entity and we propose another explanation consisting of the association of neurological and psychiatric disorders.","DictElement({'Year': '2008', 'Month': '06', 'Day': '18'}, attributes={'DateType': 'Electronic'})",2008,Annales de readaptation et de medecine physique : revue scientifique de la Societe francaise de reeducation fonctionnelle de readaptation et de medecine physique,10.1016/j.annrmp.2008.05.005,,,Case Reports; English Abstract; Journal Article,Netherlands,fre
17347925,[On the reliability of severely brain damaged persons as witnesses of their own injury].,"Wallesch, C W; Bartels, C; Hasenbein, U; Birkhoff, H",Wallesch,"We report a court verdict in the second retrial of a murder case that was based exclusively on the witness account of a severely brain damaged victim, and its reversal by the German Federal Court. The assessment of evidence had to weigh up the probability of the presence of real accounts of the crime versus the possibility of alternative explanations, i. e. trauma related confabulation. The defendant was acquitted.","DictElement({'Year': '2007', 'Month': '03', 'Day': '08'}, attributes={'DateType': 'Electronic'})",2007,Fortschritte der Neurologie-Psychiatrie,10.1055/s-2007-959197,,,Case Reports; English Abstract; Journal Article,Germany,ger
10424149,[A case of limbic encephalitis associated with breast cancer developed in an HTLV-1 carrier].,"Kikuchi, A; Chida, K; Misu, T; Okita, N; Takase, S; Nagata, T; Sakai, K; Itoyama, Y",Kikuchi,"We here present a case of 44-year-old woman, a carrier of human T-lymphotrophic virus type-1 (HTLV-1), who suffered from limbic encephalitis and breast cancer. In December 1997, the patient's behavior became abnormal. Three weeks later, she became markedly forgetful. At that time neurological examinations revealed that she had anterograde and retrograde amnesia, disorientation, and confabulation, although her consciousness was clear. Anti-Hu and anti-Yo antibodies and antinuclear antibodies in the serum were negative. Flow cytometric study of the peripheral blood lymphocytes showed an increased percentage of CD3+CD25+ cells, although the percentages of CD4+CD45RA+ and CD4+CD45RO+ cells were normal. Lymphocytic responses to phytohemagglutinin or concanavalin A were normal. Anti-HTLV-1 antibody was positive both in the serum and in the cerebrospinal fluid (CSF). The level of immunoglobulin G was high and two oligoclonal immunoglobulin G bands were positive in the CSF. Cytological study of the CSF showed no atypical cells. Findings for herpes simplex virus type I and II DNAs were negative with polymerase chain reaction in the CSF. There was no elevation of antibody titers against viruses including herpes simplex virus, cytomegalovirus, and measles virus, either in the serum or the CSF. Magnetic resonance imaging showed signal abnormalities in the medial portions of both temporal lobes, in particular, in the bilateral hippocampus. Six weeks after the onset, a cancerous tumor in her right breast was detected and removed by open surgery. The pathological diagnosis was invasive ductal carcinoma with neuroendocrine features. After mastectomy, anterograde and retrograde amnesia and disorientation mildly improved. The follow-up magnetic resonance imaging showed that signal abnormalities in the medial portions of both temporal lobes decreased and that the bilateral hippocampus became atrophic. We diagnosed the present case as paraneoplastic limbic encephalitis. There has been only one case report of limbic encephalitis associated with breast cancer.",{},,Rinsho shinkeigaku = Clinical neurology,,,,Case Reports; English Abstract; Journal Article,Japan,jpn
11806121,[Qualitative features of confabulation in a case with basal forebrain amnesia].,"Abe, M; Ohtake, H; Suzuki, K; Suzuki, M; Fujii, T; Yamadori, A",Abe,"We investigated qualitative features of confabulation in a case with basal forebrain amnesia. A 66-year-old, right-handed woman with a 8th-grade education, was admitted to the Rehabilitation Department of Tohoku University Hospital, Japan, for evaluation and therapy of amnesia. Her previous medical history included hypertension. Nine months before admission, she went to a hospital because of headache and blurred vision. She was diagnosed as suffering from a suprasellar arachnoid cyst and unruptured aneurysm at the anterior communicating artery. Five months later, resection of the cyst and clipping of the aneurysm was performed. After the operation, she became disoriented and amnesic with marked confabulation. On admission to our hospital 3 months later, she was alert and cooperative. Detailed neuropsychological assessment was performed during the next two months. She remained clinically stable throughout her hospitalization. Neurological examination showed no abnormalities. Brain magnetic resonance images revealed lesions in the bilateral orbito-frontal cortices and basal forebrain. Measurement of blood flow with 123I-IMP single photon emission computed tomography showed hypoperfusion in the bilateral frontotemporal regions. We performed systematic investigations to clarify the qualitative features of her confabulations. Her confabulations included many facts she had experienced before, but they were out of context. Each fact was recalled in isolation or associated with erroneous places, persons or times. Her confabulations were never fantastic or momentary in nature, but were consisted with isolated facts. Experimental investigation revealed that she could recognize individual facts (a person, a place, a task and time) in each episode. However, she could not integrate individual facts into an episode. We propose calling this type of confabulation ""mosaic confabulation"".",{},,No to shinkei = Brain and nerve,,,,Case Reports; English Abstract; Journal Article,Japan,jpn
2598531,[Korsakoff's syndrome as a prominent feature of bilateral paramedian thalamic infarction--a case report].,"Ujike, H; Matsueda, H; Kazahaya, Y; Kuroda, S; Otsuki, S",Ujike,"We reported the first Japanese case of bilateral paramedian thalamic infarction associated with prominent Korsakoff's syndrome. 53-year-old man suffered from semicoma on the morning of September 16th, 1988. After recovery of consciousness disturbance, neurological examination revealed vertical eye gaze palsy, areflexia of lower extremities, apathy with hypersomnia and amnesia. Amnesia was accompanied with prominent confabulation, disorientation and lack of insight into his own disability. While X ray-CT revealed only ambiguous low density area in the bilateral thalamus, MRI of horizontal section by short spin echo revealed symmetrical low signal area restricted in the paramedian area of bilateral thalamus, and that of coronal section revealed characteristic butterfly-shaped lesion. Left BAG revealed that both posterior thalamoperforating arteries showed type 3 variation of Percheron's classification which arisen from artery arcade bridging between both side of interpeduncular segment of posterior cerebral artery. He showed gradual improvement in apathy with hypersomnia and disorientation but not in Korsakoff's syndrome nor ophthalmoplegia.",{},,Rinsho shinkeigaku = Clinical neurology,,,,Case Reports; English Abstract; Journal Article,Japan,jpn
16217071,Reality confusion in spontaneous confabulation.,"Schnider, Armin; Bonvallat, Julia; Emond, Héloïse; Leemann, Béatrice",Schnider,"A woman produced spontaneous confabulations after rupture of an anterior communicating artery aneurysm. She confused currently irrelevant with currently relevant information in implicit memory; confabulations about people concerned only new acquaintances; false reality could be induced by an intensive 5-minute discussion; and in a recognition task, she confused false repetitions in another modality with real item repetitions. The findings support the theory that the defect causing spontaneous confabulation precedes conscious memory processing.",{},,Neurology,10.1212/01.wnl.0000178900.37611.8d,,,"Case Reports; Journal Article; Research Support, Non-U.S. Gov't",United States,eng
18067427,Measurement of recovery after traumatic brain injury: a cognitive-neuropsychological comparison of the WAIS-R with the cognitive assessment system (CAS) in a single case of atypical language lateralization.,"McCrea, Simon M",McCrea,"A 20-year-old preferentially left-handed male suffered an extensive right, focal, medial, prefrontal hematoma and contusion with associated swelling, and an initially undetected progressive loss of consciousness following trauma to the forehead. Performance on the Cognitive Assessment System (CAS) at 1 and 6 months after traumatic brain injury was compared with performance on the WAIS-R at 6 months post-injury. The patient demonstrated significant residualized impairment on selected subtests of the CAS at 6 months post-injury (all ps < 0.05). The patient was also significantly impaired on the Information, Vocabulary, Arithmetic and Comprehension verbal subtests of the WAIS-R. The magnitude of these WAIS-R subtest discrepancies occurred with a low base rate (< 1%) in the WAIS-R standardization sample. In addition there was a significant VIQ versus PIQ discrepancy favouring PIQ of a magnitude occurring in less than 5% of the WAIS-R standardization sample. These findings could not be explained on the basis of any prior learning disability, poor educational opportunities, medication use, response bias, confabulation, or low level of general ability. The low scores on the verbal subtests of the WAIS-R in conjunction with the impairment on the CAS subtests are highly suggestive of lasting frontal-executive dysfunction in this patient. Incidental findings of persisting anomia, impaired processing of proverbs, acalculia, and fluctuating verbal attention, as well as impaired retrieval of verbal information in the context of intact PIQ and superior constructional praxis suggest some degree of bilateral representation of linguistic functions. The differential assessment of cognitive domains by these two instruments as well as theoretical concordance in the pattern of results is also addressed.",{},,Applied neuropsychology,10.1080/09084280701719419,,,"Case Reports; Comparative Study; Journal Article; Research Support, Non-U.S. Gov't",United States,eng
8422267,Presbyophrenia: a possible subtype of dementia.,"Zervas, I M; Fliesser, J M; Woznicki, M; Fricchione, G L",Zervas,"Presbyophrenia is characterized by memory impairment, disorientation, confabulation, hypomanic features, and a preserved social facade. These occur in the absence of prior history of alcoholism or affective illness. We present three cases with presbyophrenia and suggest that the syndrome is a recognizable subtype of dementia, possibly related to disruption of aminergic pathways in frontal and subcortical structures.",{},,Journal of geriatric psychiatry and neurology,10.1177/002383099300600104,,,Case Reports; Journal Article,United States,eng
11193542,"[A case of moyamoya disease presenting with geographic mislocation, person misidentification and fantastic confabulation].","Hayashi, R; Watanabe, R; Mimura, M; Kato, M; Katsumata, Y",Hayashi,"A 52-year-old woman presented with geographical mislocation (misidentification for place), person misidentification and fantastic confabulation as a result of cerebral infarction. Head MRI demonstrated a focal lesion in the right frontal lobe. Cerebral angiogram demonstrated occlusion in the circle of Willis with moyamoya vessels. The neuropsychological examination revealed memory impairment and frontal lobe dysfunction. The patient's misidentification for place and person as well as confabulation lasted for 1.5 months since admission, then gradually disappeared. We speculate that there existed a common mechanism for these three symptoms; i.e., misidentification and confabulation were based upon the impaired interpretation of the small events and partial objects in the surrounding circumstances, which might interfere with the appropriate integration and judgments of the outside information in general. The impaired monitoring and frontal dysfunction caused by the right frontal lesion appeared to be responsible for causing her deficits.",{},,No to shinkei = Brain and nerve,,,,Case Reports; Journal Article,Japan,jpn
