pmid,title,authors,first_author,abstract,publication_date,publication_year,journal_info,doi,pmcid,keywords,article_type,country,language
37038583,Acute Onset of Movement Disorders Accompanying Common Emergency Room Neurologic Disease Processes.,"Chapman, Jennifer; Horowitz, Michael; Bond, Ronnie; Fry, Janae; Joesph, Christy; Al-Saghir, Yousef",Chapman,"Emergency departments (EDs) of hospitals accredited for trauma and/or comprehensive stroke care treat a large volume of high-acuity patients. In this fast-paced environment, the primary focus is appropriate triage, rapid stabilization, diagnosis, and acute intervention for life-threatening conditions such as cerebral vascular accident (CVA). However, this approach may result in subtle or atypical neurologic signs and symptoms being overlooked. Often, these oversights are innocuous in terms of their influence on overall patient outcomes. They are, in the vernacular, ""of academic interest only""<i>.</i> These cases provide ED clinicians with a unique opportunity to witness signs and symptoms not classically associated with common neurologic maladies. These unusual manifestations may be fleeting as they often either resolve with intervention or are overshadowed by progressive clinical decline. If such findings are recognized, they can at a minimum provide fascinating insights into neuroanatomic function. At a maximum, early recognition can influence immediate treatments and long-term outcomes. We report three ED patient presentations that shed light on functional neuroanatomical pathways and, in one case, significantly affected a patient's immediate algorithmic care. Two such cases involved acute middle cerebral artery distribution ischemic strokes, which typically present with focal contralateral sensorimotor and potential language deficits. Such events less commonly initially present with involuntary motor movements (dyskinesias). Failure to recognize these less common ictal signs may delay appropriate ED intervention or yield etiologic misdiagnoses. A third case involved a loss of consciousness ictal event secondary to a frontotemporal lobe tumor. This case presented with aphasic stroke-like symptoms along with new acute orofacial dyskinesias. Imaging before and after medical, surgical, and endovascular intervention provided important clinico-anatomic lessons. Furthermore, proposed neurophysiologic mechanisms and review of pertinent literature are provided.","DictElement({'Year': '2023', 'Month': '03', 'Day': '09'}, attributes={'DateType': 'Electronic'})",2023,Cureus,10.7759/cureus.35924,PMC10082449,aphasia; athetosis; chorea; dyskinesia; hemiballismus; neoplasm; stroke; thrombectomy,Case Reports,United States,eng
36041022,Hyperglycemia and Hypoglycemia-Related Chorea in an 83-Year-Old Man.,"Spiegel, Jonathan; Collins, Bradley",Spiegel,"We report a case of a patient who first presented with hyperglycemic chorea, and subsequently with hypoglycemic chorea. The patient's hypoglycemia was thought to be iatrogenic, highlighting the importance of careful glucose management following glycemia- related chorea. Presumably secondary to the patient's chorea, the patient also suffered from new onset shoulder pain, which was managed with gabapentin. Unfortunately, due to the patient's renal failure, the gabapentin, combined with infection, led to encephalopathy in this patient. This report presents and offers useful tips on the management of a unique patient who suffered from hyperglycemic chorea, hypoglycemic chorea, and encephalopathy, all within a few weeks.","DictElement({'Year': '2022', 'Month': '09', 'Day': '01'}, attributes={'DateType': 'Electronic'})",2022,Rhode Island medical journal (2013),,,chorea; hyperglycemia; hypoglycemia; movement disorder,Case Reports; Journal Article,United States,eng
2407403,Hemichorea and hemiballismus: recent concepts.,"Lownie, S P; Gilbert, J J",Lownie,"An unusual case of severe hemichorea in an elderly hypertensive woman, precipitating acute pulmonary edema, is presented. There were small cystic infarctions in the contralateral neostriatum and thalamus, and intact subthalamic nuclei. The clinicopathologic correlation of hemichorea and hemiballismus is reviewed, and its relationship with the results of recent neuroanatomic research is discussed.",{},,Clinical neuropathology,,,,Case Reports; Journal Article; Review,Germany,eng
37113894,MRI of the brain mimicking autoimmune encephalitis in Sjögren syndrome with chorea: a case report.,"Gajurel, Bikram P; Giri, Subarna; Poudel, Navin; Kharel, Sanjeev; Jha, Saket; Karn, Ragesh; Rajbhandari, Reema; Ojha, Rajeev; Gautam, Niraj; Shrestha, Aashish",Gajurel,"Neurologic manifestations in primary Sjögren syndrome (SS) range in prevalence from 8 to 49%, and most of the studies suggest a prevalence of 20%. The incidence of SS patients developing movement disorders is about 2%. The authors herein report a case of a 40-year-old lady with MRI of the brain mimicking autoimmune encephalitis in SS who presented with chorea. Her MRI findings revealed T2 and FLAIR (fluid-attenuated inversion recovery) high signal intensity areas in bilateral middle cerebellar peduncles, dorsal pons, dorsal midbrain, hypothalami, and medial temporal lobes. There is still no evidence to support the definite use of MRI in characterizing the central nervous system involvement in primary SS, especially due to overlapping findings with age and cerebrovascular disease. Multiple areas of increased signal intensity in periventricular and subcortical white matter in FLAIR and T2-weighted image is commonly seen in primary SS patients. It is crucial to consider autoimmune diseases like SS as a cause of chorea in adults, even in those whose imaging findings are suggestive of autoimmune encephalitis.","DictElement({'Year': '2023', 'Month': '03', 'Day': '25'}, attributes={'DateType': 'Electronic'})",2023,Annals of medicine and surgery (2012),10.1097/MS9.0000000000000101,PMC10129085,Sjögren syndrome; autoimmune encephalitis; case report; chorea; neurologic manifestation,Case Reports,England,eng
38782432,Hemichorea-hemiballismus due to diabetic striatopathy a serious complication of uncontrolled diabetes.,"Middleton, Brian; Albany, Zhanna; Kamer, Aaron; Kara, Areeba",Middleton,We report the case of a man in his mid-80s with diabetes mellitus who presented to the emergency department with a 1-day history of right-sided choreiform movements and falls. Laboratory tests revealed blood glucose of 597 mg/dL. Non-contrast CT imaging of his head demonstrated a faint hyperdensity involving the left lentiform nucleus and brain MRI showed a hyperintensity in the left basal ganglia on T1-weighted images. These lesions are typical of diabetic striatopathy. Symptoms of hemichorea/hemiballismus did not resolve with glycaemic control and several pharmacological agents were tried with eventual improvement with risperidone. He was discharged to a rehabilitation facility and had mild persistent arm chorea at 6-month follow-up.,"DictElement({'Year': '2024', 'Month': '05', 'Day': '22'}, attributes={'DateType': 'Electronic'})",2024,BMJ case reports,10.1136/bcr-2023-259046,PMC11116358,Diabetes; Endocrine system; Movement disorders (other than Parkinsons); Neurology (drugs and medicines); Primary Care,Case Reports; Journal Article,England,eng
32027572,Generalized chorea associated with subcortical leukoaraiosis of Binswanger type: a case report.,"Espiritu, Adrian I; Saranza, Gerard Raimon M; Anlacan, Veeda Michelle M; Suratos, Cezar Thomas R; Jamora, Roland Dominic G",Espiritu,"Binswanger disease (BD) involves injuries to the brain small vessels, resulting to gradually progressive subcortical ischemia. This disorder manifests with dementia, gait abnormalities, upper motor signs and parkinsonism, and presents as extensive, confluent, bilateral cerebral white matter hyperintensities in the MRI. Cases of BD typically manifests with vascular risk factors, such as hypertension and multiple strokes. We report a unique case of a Filipino patient whom we have diagnosed with BD presenting with no cardinal signs of parkinsonism, but with generalized choreiform movement disorder and without a history of hypertension and symptomatic strokes. To our knowledge, this is the first report presenting an adult patient with subcortical leukoaraiosis of Binswanger type associated with a hyperkinetic movement disorder.","DictElement({'Year': '2020', 'Month': '02', 'Day': '06'}, attributes={'DateType': 'Electronic'})",2020,Neurodegenerative disease management,10.2217/nmt-2019-0021,,Binswanger disease; case report; chorea; leukoaraiosis,Case Reports; Journal Article,England,eng
35799877,Thalamic hemi-chorea: a rare complication after receiving the adenoviral vector-based COVID-19 vaccine: a case report.,"Shahali, Hamze; Farahani, Ramin Hamidi; Asgari, Ali; Hazrati, Ebrahim",Shahali,"Lacunar strokes occur when a branch of a large cerebral artery is blocked. The thalamus is often affected, causing uncontrollable motions. A 72-year-old previously healthy man presented with involuntary motions in the right limbs, which were present at rest, and exacerbated during voluntary actions. He had received the first dose of the adenoviral vector-based coronavirus disease 2019 vaccine (ChAdOx1 nCoV-19) 9 days ago. Severe thrombocytopenia and elevated levels of lactate dehydrogenase, ferritin, C-reactive protein, and D-dimer were found, without any evidence of connective tissue disease. Electromyography demonstrated typical choreiform movements, and the brain magnetic resonance imaging indicated a small high signal lesion on the left side of the thalamus. Detection of the immunoglobulin G antibodies against platelet factor 4 in the blood, negative heparin-induced platelet activation (HIPA) test, and positive modified HIPA test confirmed the thalamic stroke due to the vaccine-induced prothrombotic immune thrombocytopenia (VIPIT). He was admitted to the intensive care unit and received nadroparin, sodium ozagrel, edaravone, methylprednisolone, and haloperidol. His hemi-chorea improved gradually over 2 weeks, and he was discharged after 21 days with rehabilitation advice. VIPIT due to the ChAdOx1 nCoV-19 is a novel immune-mediated response that needs clinicians' awareness and further investigations.","DictElement({'Year': '2022', 'Month': '05', 'Day': '31'}, attributes={'DateType': 'Electronic'})",2022,Clinical and experimental vaccine research,10.7774/cevr.2022.11.2.217,PMC9200646,COVID-19 vaccine; Case report; Hemi-chorea; Immunoglobulin G antibodies against platelet factor 4; Lacunar stroke; SARS-CoV-2; Thrombosis,Case Reports,Korea (South),eng
38322679,Hemichorea in patients with temporal lobe infarcts: Two case reports.,"Wang, Xu-Dong; Li, Xing; Pan, Chun-Lian",Wang,"Hemichorea and other hyperkinetic movement disorders are uncommon presentations of stroke and are usually secondary to deep infarctions affecting the basal ganglia and thalamus. Therefore, temporal ischemic lesions causing hemichorea are rare. We report the cases of two patients with acute ischemic temporal lobe infarct strokes that presented as hemichorea. Patient 1: An 82-year-old woman presented with a 1-mo history of involuntary movement of the left extremity, which was consistent with hemichorea. Her diffusion-weighted imaging (DWI) revealed an acute ischemic stroke that predominantly affected the right temporal cortex, and magnetic resonance angiography of the head showed significant stenosis of the right middle cerebral artery (MCA). Treatment with 2.5 mg of olanzapine per day was initiated. When she was discharged from the hospital, her symptoms appeared to have improved compared with those previously observed. Twenty-seven days after the first admission, she was readmitted due to acute ischemic stroke. Computed tomography perfusion showed marked hypoperfusion in the right MCA territory. An emergency transfemoral cerebral angiogram was performed and showed severe stenosis in the M1 segment of the right MCA. After percutaneous transluminal angioplasty was successfully performed, abnormal movements or other neurologic problems did not occur. Patient 2: A 76-year-old man was admitted to our hospital for a 7-d history of right-upper-sided involuntary movements. DWI showed an acute patchy ischemic stroke in the left temporal lobe without basal ganglia involvement. Subsequent diffusion tensor imaging confirmed fewer white matter fiber tracts on the left side than on the opposite side. Treatment with 2.5 mg of olanzapine per day improved his condition, and he was discharged. When acute hemichorea suddenly appears, temporal cortical ischemic stroke should be considered a possible diagnosis. In addition, hemichorea may be a sign of impending cerebral infarction with MCA stenosis.",{},,World journal of clinical cases,10.12998/wjcc.v12.i4.806,PMC10841122,Acute ischemic stroke; Case report; Cortical hemichorea; Movement disorders; Temporal ischemic stroke,Case Reports,United States,eng
34418672,Crossed Choreoathetosis Caused by Unilateral Thalamic Hemorrhage.,"Kurihara, Sumire; Sato, Takeo; Murakami, Hidetomo; Komatsu, Teppei; Sakai, Kenichiro; Umehara, Tadashi; Omoto, Shusaku; Mitsumura, Hidetaka; Iguchi, Yasuyuki",Kurihara,"In general, involuntary movements after stroke are due to a disturbance in the unilateral cortico-basal ganglia loop and appear contralateral to stroke lesions. Crossed involuntary movements after unilateral stroke are very rare. We observed a case of crossed involuntary movements in the left upper limb and right lower limb after a right thalamic hemorrhage expanded to the right subthalamic nucleus. We considered a possible three-step theory as the basis of crossed choreoathetosis. This case informs our better understanding of the cortico-basal ganglia loop and involuntary movements after stroke.","DictElement({'Year': '2021', 'Month': '08', 'Day': '18'}, attributes={'DateType': 'Electronic'})",2021,Journal of stroke and cerebrovascular diseases : the official journal of National Stroke Association,10.1016/j.jstrokecerebrovasdis.2021.106049,,Cerebrovascular disease; Choreoathetosis; Cortico-basal ganglia loop; Hemorrhagic stroke; Involuntary movement; Movement disorders; Thalamus,Case Reports; Video-Audio Media,United States,eng
31736581,Adult-Onset Isolated Hemichorea Revealing Iatrogenic Hypoparathyroidism and Bilateral Basal Ganglia Calcification.,"Desai, Karan; Walzade, Priyanka; Ravat, Sangeeta Hasmukh; Agarwal, Pankaj A",Desai,"Isolated hemichorea (HC) in adults has a relatively restricted differential diagnosis including stroke of contralateral basal ganglia nuclei, nonketotic hyperglycemia, and basal ganglia toxoplasmosis in HIV infection. Hypoparathyroidism-related basal ganglia calcification can potentially cause neurological problems, including movement disorders, that are usually bilateral in keeping with bilateral symmetric lesions. We report a patient with video-documented isolated, adult-onset HC due to iatrogenic hypoparathyroidism and bilateral basal ganglia calcification. A 47-year-old woman presented with isolated adult-onset HC of 2 years' duration as the presenting and only neurological feature of hypoparathyroidism and bilateral extensive basal ganglia calcification, 20 years after thyroidectomy-induced hypoparathyroidism. Significant improvement in the unilateral hyperkinesia was noted after correction of hypocalcemia and hypoparathyroidism at 3 months. Isolated HC in adults is a rare presenting feature of hypoparathyroidism with bilateral basal ganglia calcification and is treatable with correction of the underlying metabolic abnormality. In all cases with a movement disorder and brain calcification, hypoparathyroidism should be actively sought as this treatable condition must not be missed.","DictElement({'Year': '2019', 'Month': '10', 'Day': '25'}, attributes={'DateType': 'Electronic'})",2019,Annals of Indian Academy of Neurology,10.4103/aian.AIAN_123_18,PMC6839308,Basal ganglia calcification; Fahr's; chorea; hemichorea; hypoparathyroidism,Case Reports,India,eng
33186069,"Catastrophic Antiphospholipid Syndrome: Skin, Eye and Brain Involvement.","Sanchez, Juan Martin; Davila, Mauricio; Amer, Radgonde",Sanchez,"To report on a patient with probable catastrophicantiphospholipid syndrome (CAPS) with eye, brain and skin involvement. Descriptive presentation of the case and of the relevant clinical photographs. A 17-year-old girl presented with fatigue, loss of appetite, arthralgia, lower limb skin ulcers and livedo reticularis. Workup showed anemia, elevated ESR, CRP, and positive anti-phospholipid antibodies. Right eye funduscopy showed cotton-wool spots along the inferotemporal arcade with arteriolar occlusion, perivascular retinal hemorrhages, and diffuse retinal ischemia in the temporal peripheral retina. Fluorescein angiogram confirmed the widespread retinal ischemia. Brain MRI revealed several white matter lacunar infarcts, minute cortical/subcortical hemorrhages and subarachnoidal insular hemorrhage. The patient was treated with immunomodulatory therapy, Enoxaparin and retinal laser photocoagulation. Within 2 months of treatment, the facial livedo reticularis resolved and the leg ulcers markedly improved. CAPS causes multiple organ thrombosis and is associated with high rate of mortality.","DictElement({'Year': '2020', 'Month': '11', 'Day': '13'}, attributes={'DateType': 'Electronic'})",2020,Ocular immunology and inflammation,10.1080/09273948.2020.1830122,,Antiphospholipid syndrome; livedo reticularis; sydenham’s chorea,Case Reports; Journal Article,England,eng
36312663,Neurological Manifestations of Chronic Methadone Maintenance Therapy: A Case Report and Literature Review.,"Gasimova, Ulviyya; Afzal, Khurram M; Acharya, Aninda B",Gasimova,"Methadone is a long-acting opioid medication that is used as maintenance therapy for heroin addiction. We present a case of a patient on methadone maintenance therapy for chronic back pain who developed neurological complications. The patient presented with mental status changes and choreiform movements. Workup revealed lesions involving the subcortical white matter and basal ganglia. Choreiform movements improved after the initiation of treatment with topiramate, clonazepam, and risperidone. This combination was chosen as several prior case reports published significant benefit and improvement in choreiform movements with the mentioned regimen.","DictElement({'Year': '2022', 'Month': '09', 'Day': '24'}, attributes={'DateType': 'Electronic'})",2022,Cureus,10.7759/cureus.29534,PMC9595224,basal ganglia; choreiform movements; leukoencephalopathy; methadone; toxicology,Case Reports,United States,eng
29764825,Sudden hemichorea and frontal lobe syndrome: a rare presentation of unbalanced polycythaemia vera.,"García-Cabo, Carmen; Fernandez-Dominguez, Jessica; Mateos, Valentín",García-Cabo,"Polycythaemia vera (PV) is an haematological neoplasm that frequently presents neurological symptoms. However, chorea is a rare complication of this disease, occurring in less than 5% of the patients. Cognitive impairment related to PV unbalanced is also a rare complication, and it can improve with proper treatment. We present a 96-year-old-man with acute-onset hemichorea and frontal lobe syndrome with no vascular pathology in the basal ganglia or frontal region. A clear relationship was observed between the onset of involuntary movements and the cognitive impairment and worsening of haematological parameters in the patient. After causal and symptomatic treatment, the patient's clinical status improved. In the elderly, PV must be considered as a cause of acute chorea and sudden cognitive impairment, as early diagnosis leads to effective treatment and prevention of complications.","DictElement({'Year': '2018', 'Month': '05', 'Day': '14'}, attributes={'DateType': 'Electronic'})",2018,BMJ case reports,10.1136/bcr-2017-223867,PMC5961552,haematology (incl blood transfusion); memory disorders; movement disorders (other than Parkinsons),Case Reports; Journal Article,England,eng
31890704,Neuroradiological Evolution of Glycaemic Hemichorea-Hemiballism and the Possible Role of Brain Hypoperfusion.,"Marinelli, Lucio; Maggi, Davide; Trompetto, Carlo; Renzetti, Paolo",Marinelli,"Lateralized involuntary movements consistent with hemichorea-hemiballism (HCHB) may appear following the development of contralateral haemorrhagic or ischaemic lesions of the basal ganglia, particularly the striatum (caudate nucleus and putamen). This condition is called vascular HCHB, but the same symptoms can be caused by a completely different striatal lesion. Glycaemic HCHB may occur in patients with uncontrolled hyperglycaemia: basal ganglia hyperdensity is seen on brain CT, while increased T1 signal intensity and reduced susceptibility-weighted imaging (SWI) and gradient-echo sequences (T2*-GRE) are detected on MRI. An 83-year-old man with multiple vascular risk factors and uncontrolled chronic hyperglycaemia was admitted for ischaemic stroke presenting with dysarthria and mild left hemiparesis. No involuntary movements were reported at admission. The emergent brain CT scan was negative for vascular acute lesions, while a mild bilateral hyperdensity of the striata was detectable. Involuntary movements on the left side of the body, consistent with HCHB, appeared 27 days later. The alterations on brain CT completely disappeared after 3 months. On brain MRI, the T1 signal alterations resolved after 10 months, while SWI and T2*-GRE sequences showed persisting alterations after 2 years. Detailed brain imaging demonstrated evolution of striatal alterations of glycaemic HCHB before the appearance of involuntary movements and during the following 2 years. The association between ischaemic stroke and glycaemic HCHB favours the hypothesis that chronic hyperglycaemia more likely determines striatal alterations and the clinical picture of HCHB when vascular hypoperfusion also occurs. Hemichorea-hemiballism (HCHB) may appear in patients with uncontrolled hyperglycaemia accompanied by typical neuroradiological features consisting of striatal alterations detectable on brain CT and MRI, often bilaterally.Unusually, striatal alterations can be detected before the appearance of involuntary movements and are fully reversible on brain CT and T1-MRI sequences.Brain hypoperfusion may facilitate the appearance of typical HCHB in patients with chronic hyperglycaemia.","DictElement({'Year': '2019', 'Month': '10', 'Day': '23'}, attributes={'DateType': 'Electronic'})",2019,European journal of case reports in internal medicine,10.12890/2019_001257,PMC6886634,Hemichorea; athetosis; hemiballism; hyperglycemia; hypoperfusion,Case Reports,Italy,eng
35186605,Seronegative Autoimmune Basal Ganglia Encephalitis Presenting as Acute Parkinsonism and Refractory Faciobrachial Seizures: A Case Report.,"Giri, Anamika; Andhale, Amol; Acharya, Sourya; Kumar Singh, Rohan; Talwar, Dhruv",Giri,Autoimmune basal ganglia encephalitis (BGE) typically presents with acute onset parkinsonism and on imaging is associated with lesions in the basal ganglia. It is associated with chorea and other movement disorders. Seizures are still rare. Various autoantibodies are associated with the development of basal ganglia encephalitis. These autoantibodies are against dopamine D2 receptor (D2R) and N-methyl-D-aspartate receptor (NMDAR). Another paraneoplastic antibody known as anti-recoverin antibodies (Abs) is also associated with basal ganglia encephalitis. We report a case of a 45-year-old male who presented in this hospital with a history of cognitive dysfunction and slowness of activities for eight days and faciobrachial seizures. Magnetic resonance imaging (MRI) of the brain revealed lesions in the putamen and caudate nucleus. Infection and antibody screening were negative. The seizures were refractory to conventional antiepileptics. The patient responded to intravenous immunoglobulin (IVIG) therapy.,"DictElement({'Year': '2022', 'Month': '01', 'Day': '17'}, attributes={'DateType': 'Electronic'})",2022,Cureus,10.7759/cureus.21351,PMC8849290,autoantibody; caudate; cognitive; paraneoplastic; putamen; receptor,Case Reports,United States,eng
16932507,A case of late-onset chorea.,"Suchowersky, Oksana; Muthipeedika, Joy",Suchowersky,"Background A 75-year-old woman with rheumatoid arthritis presented with a 4-year history of chorea to a hospital movement disorder clinic. The involuntary movements were initially mild, affecting only the right side of the body, but gradually worsened and became bilateral. There was no relevant family history. Medications included hormone replacement therapy (HRT), diclofenac sodium, vitamin D, folic acid, methotrexate and zopiclone. On examination, bilateral choreiform movements were seen, affecting the face and limbs, with the right side more severely affected than the left. Investigations Neuropsychological testing, laboratory blood and DNA testing, echocardiogram, MRI of the brain, and brain perfusion single-photon emission computed tomography (SPECT) scanning.Diagnosis HRT-related chorea, possibly caused by a predisposition secondary to rheumatoid arthritis and small-vessel ischemic disease, or subclinical childhood rheumatic fever. Management Discontinuation of HRT.",{},,Nature clinical practice. Neurology,10.1038/ncpneuro0052,,,Case Reports; Journal Article,England,eng
26944270,Radiotherapy-induced hemichorea.,"Isaacs, David; Cmelak, Anthony; Kirschner, Austin N; Phibbs, Fenna",Isaacs,,"DictElement({'Year': '2016', 'Month': '03', 'Day': '04'}, attributes={'DateType': 'Electronic'})",2016,Neurology,10.1212/WNL.0000000000002546,,,Case Reports; Journal Article,United States,eng
