pmid,title,authors,first_author,abstract,publication_date,publication_year,journal_info,doi,pmcid,keywords,article_type,country,language
7711357,Treatment of uncontrolled crying after stroke.,"Andersen, G",Andersen,"Uncontrolled crying after stroke is a disturbance of the motor concomitants of emotional affect. It manifests as stereotyped outbursts of crying that are excessive to an appropriate emotional response. The episodes can be triggered by almost any kind of emotional stimulus (happiness, excitement, sadness, just being looked at or talked to, the sight of a doctor, etc.) and can even occur without any obvious external or internal stimulus. The condition is socially embarrassing, and in the most severely affected patients the crying episodes can be so violent that they interfere with rehabilitation. Although frequent (1-year incidence is 20%), the condition often goes unrecognised because patients and relatives rarely complain about it spontaneously. Effective treatment has now been documented in 3 controlled studies of tricyclic antidepressants and the selective serotonin reuptake inhibitor citalopram. There seems to be a rationale for the latter approach to treatment, in that post-stroke pathological crying may be attributable to stroke-induced partial destruction of the serotonergic raphe nuclei in the brainstem or their ascending projections to the hemispheres. Although our knowledge of the aetiology and treatment of the condition is limited, and the need for further study is considerable, the present treatment possibilities can significantly improve quality of life for patients with this socially embarrassing and sometimes debilitating condition.",{},,Drugs & aging,10.2165/00002512-199506020-00003,,,Case Reports; Journal Article; Review,New Zealand,eng
32754407,"A Rare Case of a Large, Deceitfully Quiet Brainstem Arteriovenous Malformation Presenting Only as Dizziness.","Rao, Swathi; Giron, Fanny",Rao,"Dizziness is one of the most frequent complaints encountered in the medical practice affecting 15%-20% of adults yearly, and can be challenging to assess. Most patients use dizziness as a non-specific term, and thus suffer prejudice from the physicians' end and can be disregarded frequently. Dizziness can be a symptom of various diseases, some with sinister pathologies. We present a case of garden-variety vertigo that unfurled to be not-so-simple, emphasizing the importance of a thorough history and physical examination again even in the era of technology. A 32-year-old male patient with no past medical history presented with dizziness, later clarified as gradually progressive vertigo for two years, with unstable gait, dysarthria, and occasional diplopia. Physical examination found sustained nystagmus that changed direction with horizontal gaze, vertical nystagmus with upward gaze, dysarthria, and a wide-based ataxic gait. CT head without contrast revealed indeterminate hypodense areas in the left midbrain, pons, and cerebellar hemisphere. MRI brain identified a 2.8 x 3.4 x 4.2 cm Spetzler-Martin grade IV brainstem arteriovenous malformation (AVM) involving the left midbrain, pons, and cerebellum. Feeders were mostly from the posterior circulation, with three intranidal aneurysms, all draining into the deep venous system. The AVM was deemed inoperable, and the patient was treated with onyx embolization for two/three feeding vessel aneurysms. After treatment, the symptoms persisted, and the patient was diagnosed with major depressive disorder (MDD) six months after diagnosis, and was admitted a year later with suicidal ideation and substance use disorder. Brain AVMs are rare clinical entities that present in 0.1% of the population, mostly presenting as intracranial bleeds. When they do rarely present with isolated focal neurologic deficits, it has been attributed to a vascular steal phenomenon, hemorrhage, or a mass effect. The isolated findings of vertigo and dysarthria are highly non-specific; with such presentation, clinicians should consider etiologies under the realm of vertigo of central origin. An untreatable AVM reduces patients' quality of life and has been linked to depression and anxiety, and thus patients may benefit from psychosocial therapy. Although preventing intracranial hemorrhage (ICH) is the primary concern with brain AVMs, the rest of the patient's profile should not be forgotten.","DictElement({'Year': '2020', 'Month': '06', 'Day': '27'}, attributes={'DateType': 'Electronic'})",2020,Cureus,10.7759/cureus.8870,PMC7387078,arteriovenous malformation; dizziness; nystagmus; vertigo,Case Reports,United States,eng
9871849,ECT in the presence of intracranial aneurysm.,"Najjar, F; Guttmacher, L B",Najjar,"Two patients with known intracranial aneurysms (ICA) received electroconvulsive therapy (ECT). The first patient received ECT 4 years after the clipping of a right middle cerebral artery aneurysm. Treatment with esmolol failed to completely prevent an increase in blood pressure, but she did well nonetheless. The second patient underwent clipping of a basilar artery aneurysm 11 years before ECT. At the time of ECT, angiography showed a right paraophthalmic artery aneurysm. He received esmolol before each ECT, and, like the first patient, still had significant peri-ictal increases in his blood pressure, but otherwise tolerated the procedure well. Our experience and previously published literature indicate that even with pretreatment, patients often sustain significant increases in their blood pressure. However, this has not been accompanied by any morbidity. Possible guidelines for the management of ICA in association with ECT are discussed.",{},,The journal of ECT,,,,Case Reports; Journal Article,United States,eng
2282616,The head injured adolescent: a case report and review of the issues.,"Reiter, S; Kutcher, S P",Reiter,"Closed head injuries in adolescents are a common problem with potentially disastrous consequences to multiple areas of functioning. Through a case presentation and literature review, this paper considers treatment issues and research applications in an adolescent population with closed head injuries. Suggestions for understanding the symptom constellations are made and directions for future research and service delivery are given.",{},,Canadian journal of psychiatry. Revue canadienne de psychiatrie,10.1177/070674379003500804,,,Case Reports; Journal Article; Review,United States,eng
25666635,Clinical reasoning: an unusual case of subacute encephalopathy.,"Parikh, Neal; Merkler, Alexander E; Cheng, Natalie T; Baradaran, Hediyeh; White, Halina; Leifer, Dana",Parikh,,{},,Neurology,10.1212/WNL.0000000000001233,PMC4335989,,"Case Reports; Journal Article; Research Support, N.I.H., Extramural",United States,eng
33867413,[Non-aphasic misnaming: a case report and literature review].,"Inatomi, Yuichiro; Matsuda, Minoru; Mizuta, Hideko",Inatomi,"A 71-year-old, right-handed woman was admitted to our hospital due to a sudden difficulty with conversation. On admission, she was alert, but had a euphoric mood, disorientation, and a disturbance of recent memory. Her speech was fluent. Her repetition and auditory word cognition were excellent, but she had a slight difficulty with naming visual objects. She frequently showed word-finding difficulty and irrelevant paraphasia during free conversation and a word fluency task. Her irrelevant paraphasia was observed more frequently when she was asked to explain her outbreak of anger at the hospital, i.e., it was situation-dependent. She also had anosognosia. MRI showed an infarct in the territory of the left tuberothalamic artery. Single-photon emission computed tomography revealed low-uptake lesions in the left thalamus and orbital frontal, medial frontal, and medial temporal lobes. The patient was diagnosed with non-aphasic misnaming. The clinical characteristics of patients with non-aphasic misnaming in the literature were reviewed. All of the patients with non-aphasic misnaming had word-finding difficulty and irrelevant paraphasia. Additionally, they had either emotional disturbance or anosognosia.","DictElement({'Year': '2021', 'Month': '04', 'Day': '17'}, attributes={'DateType': 'Electronic'})",2021,Rinsho shinkeigaku = Clinical neurology,10.5692/clinicalneurol.cn-001545,,anosognosia; irrelevant paraphasia; non-aphasic misnaming; situation-dependent; thalamus,Case Reports; Journal Article; Review,Japan,jpn
33825944,A sudden and severe depressive episode after a left cingulate gyrus stroke: a case report of post-stroke depression and review of literature.,"Ribeiro, Nuno Filipe; Madruga, Luís",Ribeiro,"Post-stroke depression is a frequent complication of cerebrovascular lesions and mainly occurs within the first 6 months after stroke. Stroke patients who develop depression have slower recovery, greater disability, and higher mortality rates. The pathophysiology of post-stroke depression is not yet clearly defined, but studies suggest contributions from both psychosocial factors and stroke-related factors, such as lesions affecting the frontal-subcortical circuits. Early treatment has a positive impact on post-stroke rehabilitation outcome and survival. We present the case of an 82-year-old man with no psychiatric history who was brought to the psychiatric emergency department after two suicide attempts in the span of 7 days. He was severely depressed, with feelings of hopelessness, insomnia, and suicidal ideation. He had suffered a stroke the week before, affecting the anterior portion of the left cingulate gyrus, causing right hemiparesis and paresthesia. The psychiatric symptoms developed immediately after the stroke and were not present before the event. He was admitted to the psychiatry ward, treated with sertraline 100 mg/day and quetiapine 50 mg/day and discharged within 28 days, after full remission of symptoms. Our case strengthens the association between lesions located to the frontal-subcortical circuits and post-stroke depression. Physicians should be vigilant regarding the occurrence of depression in stroke patients, especially those who suffer lesions affecting the frontal-subcortical circuits and related regions.","DictElement({'Year': '2021', 'Month': '04', 'Day': '07'}, attributes={'DateType': 'Electronic'})",2021,"Journal of neural transmission (Vienna, Austria : 1996)",10.1007/s00702-021-02334-y,,Cingulate gyrus; Depression; Post-stroke depression; Stroke,Case Reports; Journal Article; Review,Austria,eng
7085582,Frontal lobe meningioma and depression.,"Lahmeyer, H W",Lahmeyer,The case of a 61-year-old woman with an apathetic depression and urinary incontinence is presented. Her depression and urinary incontinence were symptomatically treated with d-amphetamine prior to diagnosis of bilateral frontal lobe meningiomas. Similar but irreversible neurologic conditions might be successfully treated by using amphetamines.,{},,The Journal of clinical psychiatry,,,,Case Reports; Journal Article,United States,eng
33625177,Safe Administration of ECT in a Suicidal Patient With a Space-Occupying Astrocytoma.,"Youssef, Nagy A; Casola, Benjamin; Rosenquist, Peter B; McCall, William V; Spearman, Vanessa",Youssef,"Electroconvulsive therapy (ECT) can be lifesaving for patients suffering from treatment-resistant psychiatric conditions, especially acute suicidality or depression. However, space-occupying lesions pose risks associated with ECT use due in part to seizure-induced escalations in blood pressure with corresponding increases in cerebral blood flow and possibly intracranial pressure, subsequently increasing the risk of brain herniation. Here, we present the case of a patient with a left medial temporal lobe astrocytoma, worsening epileptic seizures, and nonepileptic seizures who underwent ECT for major depressive disorder and suicidality. The patient had improvement of depressive symptoms, resolution of suicidality, and brief cessation of nonepileptic seizures. Brief anterograde amnesia contributed to the termination of treatment. This case adds to the growing literature about the feasibility of ECT treatment in cerebral lesions prone to changes in intracranial pressure, such as the usually cystic astrocytomas.",{},,The journal of ECT,10.1097/YCT.0000000000000749,,,Case Reports; Journal Article,United States,eng
20033774,Post stroke depression: treatments and complications in a young adult.,"Capaldi, Vincent F; Wynn, Gary H",Capaldi,"Post-stroke depression has been noted to be one of the most frequent complications of stroke with an estimated prevalence of as high as 80%. However, the incidence of stroke in the young is extremely low and evidence based therapy for this complication is quite limited. The case of a 28-year-old woman who experienced a basilar artery vasospasmic stroke resulting in anoxic brain injury to the midbrain and paramedian thalamus is presented, along with a literature review of psychiatric complications of this injury to include post-stroke depression (PSD). Therapeutic modalities such as TCAs, SSRIs, atypical antipsychotics and stimulant medications are also reviewed as these medications may aid in the treatment of such patients but may also contribute to psychiatric sequelae.",{},,The Psychiatric quarterly,10.1007/s11126-009-9120-8,,,Case Reports; Journal Article,United States,eng
9293058,Behavioural and psychiatric aspects of silent cerebral infarction.,"Nagaratnam, N; Pathma-Nathan, N",Nagaratnam,"A number of psychiatric and behavioural symptoms have been described in relation to silent cerebral infarction. At least four symptom clusters were identified, namely, affective, paranoid delusional, confusional state and changes in mood with behavioural disturbances. The mechanisms involved are unclear. Biochemical changes involving neurotransmitter mechanisms, vascular compromise or structural damage to the anatomical pathways may be contributory if not causal. It is clear that in patients presenting with behavioural or psychiatric manifestations without any previous history of mental illness and without any focal or lateralising neurological signs, cerebrovascular disease should be a diagnostic consideration.",{},,The British journal of clinical practice,,,,Case Reports; Journal Article; Review,England,eng
33711769,Beyond the bipolar disorder diagnosis: Hypothalamus and its network damage in determining neuropsychiatric and Korsakoff-like memory disorders.,"Ricci, Monica; Ruggeri, Massimiliano; Gerace, Carmela; Brunori, Andrea",Ricci,"Craniopharyngiomas (CP's) are hypothalamic tumors often associated with psychological disorders. Nevertheless, its diagnosis is still challenging when psychiatric disorders are not associated with any other neurological symptoms. This single-case study describes a patient with a history of bipolar disorder before a diagnosis of a large CP arising the sellar and suprasellar region was posed. At the time of the present study the patient showed emotional/behavioral disorders and Korsakoff-like amnesia, that completely recovered after surgical resection of the tumor. This is one of those few cases described in literature, who presented cognitive/behavioral disorders because the compression of the diencephalic structures due to CP mass effect. This case offers further evidence on the functional neuroanatomy of the hypothalamus and its pathways.","DictElement({'Year': '2021', 'Month': '02', 'Day': '17'}, attributes={'DateType': 'Electronic'})",2021,Cortex; a journal devoted to the study of the nervous system and behavior,10.1016/j.cortex.2021.02.004,,Bipolar disorder; Craniopharyngioma; Hypothalamus; Korsakoff-like amnesia; Neuroendoscopic surgery,Case Reports,Italy,eng
6237316,Neuroradiology in psychiatry.,"Berman, K F; Weinberger, D R",Berman,"This article explored methods of brain imaging as they relate to the practice of psychiatry. In particular, technical aspects and clinical applications of CAT scanning are reviewed, and some neurologic conditions that may masquerade as psychiatric illness are considered. Suggested guidelines for CAT scanning in psychiatric patients are put forth, and implications of recent research findings in psychiatric disorders are discussed. In closing, we offer the following caveat: As ""psychiatric"" symptoms may be the earliest sign of structural CNS disease, the psychiatrist may be the first physician to evaluate patients with neurologic abnormalities. Because even the neurologic consultant may not be alert to the possibility of psychiatric symptoms alone heralding CNS pathology, the decision to augment the clinical impression with neuroradiologic or other brain imaging adjuncts (and to choose among them) may rest solely with the psychiatrist. Of these adjuncts, CAT scanning is almost always the most conclusive and reliable.",{},,The Psychiatric clinics of North America,,,,Case Reports; Journal Article; Review,United States,eng
20146125,A single case report of Moyamoya disease presenting in a psychiatric setting.,"Schwarz, Lauren R; Thurstin, Adrian H; Levine, Lindsay A",Schwarz,"Moyamoya disease (MMD) is a rare cerebral vasculopathy with limited information on the associated cognitive and emotional sequelae, particularly presenting in a psychiatric setting. We present the case of a 25-year-old female with a history of MMD and depressive disorder. She underwent revascularization surgery following an ischemic stroke at age 15 years. Magnetic resonance imaging at the time of the current assessment revealed markedly abnormal appearance in the anterior cerebral circulation with extensive periventricular collateral vasculature involvement. Neuropsychological assessment data revealed deficits in inhibition and problem-solving, consistent with frontal lobe dysfunction. We discuss the importance of further research on the neuropsychological sequelae of MMD.",{},,Applied neuropsychology,10.1080/09084280903519831,,,Case Reports; Journal Article,United States,eng
28007000,Reducing anger outbursts after a severe TBI: a single-case study.,"Rochat, Lucien; Manolov, Rumen; Aboulafia-Brakha, Tatiana; Berner-Burkard, Christina; Van der Linden, Martial",Rochat,"Anger outbursts constitute a frequent behavioural issue after a traumatic brain injury (TBI) and have a strong negative impact on the social outcomes resulting from the TBI. However, few studies have examined the efficacy of specific intervention strategies to reduce the frequency and intensity of anger outbursts. We therefore performed a single-case study on this topic by administering two successive and complementary psychological interventions with an AB design with maintenance (first intervention) and an AC design with maintenance plus a one-month follow-up (second intervention) to a patient with a severe TBI. Whereas the first intervention focused on improving the recognition and expression of basic emotions, the second consisted of a self-regulation programme, including various features such as psychoeducation about self-control strategies, relaxation and assertiveness training that aimed to establish adequate behaviours, which were further promoted by an implementation intentions strategy in the patient's daily life. The results indicated that all interventions resulted in a reduced frequency and intensity of anger outbursts, and the data upheld the specificity of these effects. In addition, a meta-analytic integration of the effects of both interventions on the outcomes indicated a medium effect size. Further research is needed on other patients who experience long-standing anger outbursts to examine whether the observed gains can be replicated, sustained on a longer-term basis and improved.","DictElement({'Year': '2016', 'Month': '12', 'Day': '23'}, attributes={'DateType': 'Electronic'})",2016,Neuropsychological rehabilitation,10.1080/09602011.2016.1270837,,Traumatic brain injury; anger; emotion recognition; implementation intentions; single-case,Case Reports; Journal Article,England,eng
19567770,Recurring episodes of Bell's mania after cerebrovascular accident.,"Bobo, William V; Murphy, Michael J; Heckers, Stephan H",Bobo,"Bell's mania (mania with delirium) is an acute neurobehavioral syndrome of unknown etiology that is characterized by the rapid onset of grandiosity, psychomotor excitement, emotional lability, psychosis, and sleep disruption consistent with mania, coupled with alterations in sensorium, and disorientation characteristic of delirium. Catatonia is a common feature of the syndrome. The authors describe a case of recurrent delirium/mania with prominent catatonic features after a cerebellar and pontine stroke, and subsequent successful treatment with lorazepam. Symptoms quickly resolved after antipsychotics were discontinued, with continuation of valproate and lorazepam treatment. Failure to recognize this patient's syndrome as a form of catatonia could have had severe, even life-threatening, consequences. The use of neuroleptic medications in cases of delirium/mania with catatonic signs may result in marked clinical deterioration, whereas high-dose lorazepam can ameliorate catatonic signs.",{},,Psychosomatics,10.1176/appi.psy.50.3.285,,,Case Reports; Journal Article,England,eng
34384351,Acute prolonged motor aura resembling ischemic stroke after COVID - 19 vaccination (CoronaVac): the first case report.,"Rattanawong, Wanakorn; Akaratanawat, Wasan; Tepmongkol, Supatporn; Chutinet, Aurauma; Tantivatana, Jarturon; Suwanwela, Nijasri Charnnarong",Rattanawong,"We report the first case of a patient who suffered transient focal neurological deficit mimicking stroke following CoronaVac vaccination. However, instead of an ischemic stroke, motor aura was suspected. A 24 year-old Thai female presented with left hemiparesis fifteen minutes after receiving CoronaVac. She also had numbness of her left arm and legs, flashing lights, and headaches. On physical examination, her BMI was 32.8. Her vital signs were normal. She had moderate left hemiparesis (MRC grade III), numbness on her left face, arms, and legs. Her weakness continued for 5 days. A brain CT scan was done showing no evidence of acute infarction. Acute treatment with aspirin was given. MRI in conjunction with MRA was performed in which no restricted diffusion was seen. A SPECT was performed to evaluate the function of the brain showing significant hypoperfusion of the right hemisphere. The patient gradually improved and was discharged. In this study, we present the first case of stroke mimic after CoronaVac vaccination. After negative imaging studies had been performed repeatedly, we reach a conclusion that stroke is unlikely to be the cause. Presumably, this phenomenon could possibly have abnormal functional imaging study. Therefore, we believed that it might be due to cortical spreading depression, like migraine aura, which we had conducted a literature review.","DictElement({'Year': '2021', 'Month': '08', 'Day': '12'}, attributes={'DateType': 'Electronic'})",2021,The journal of headache and pain,10.1186/s10194-021-01311-w,PMC8358547,COVID-19; CoronaVac vaccine; Cortical spreading depression; Neurological deficit; Sinovac,Case Reports; Journal Article,England,eng
31730304,When Depression Hides a Brain Tumor: A Case of Glioblastoma.,"Ferreira, Liliana P; Pinheiro, Carolina F; Fernandes, Nuno A; Ferreira, Carla N",Ferreira,,"DictElement({'Year': '2019', 'Month': '11', 'Day': '14'}, attributes={'DateType': 'Electronic'})",2019,The primary care companion for CNS disorders,10.4088/PCC.19l02455,,,Case Reports; Journal Article,United States,eng
28978577,Why in the age of CT scans and MRIs is a brain tumour mistaken for a psychiatric illness?,"Caruso, Riccardo; Piro, Antonio",Caruso,"The first author of this paper operated on two patients with brain tumour, who had been undergoing long-term treatment for depression. In the age of CT scans and MRIs, why are there still cases in which a brain neoplasia is mistaken for a psychiatric condition with consequent serious delays in diagnosis? In this article, we have highlighted what in our experience are three noticeable obstacles in achieving the right diagnosis.","DictElement({'Year': '2017', 'Month': '10', 'Day': '04'}, attributes={'DateType': 'Electronic'})",2017,BMJ case reports,10.1136/bcr-2017-220131,PMC5652357,mood disorders (including depression); neurooncology; neurosurgery; psychiatry,Case Reports; Journal Article,England,eng
23447651,Neurological pictures. Trigeminalepsy.,"Miró, Carlos; Ortiz, Tomás",Miró,,"DictElement({'Year': '2013', 'Month': '02', 'Day': '27'}, attributes={'DateType': 'Electronic'})",2013,"Journal of neurology, neurosurgery, and psychiatry",10.1136/jnnp-2012-304764,PMC3717588,Depression; EEG; Epilepsy; Neuropharmacology; Trigeminal Neuralgia,Case Reports; Journal Article,England,eng
20378354,Successful treatment of post-stroke apathy by the dopamine receptor agonist ropinirole.,"Kohno, Naoto; Abe, Satoshi; Toyoda, Genya; Oguro, Hiroaki; Bokura, Hirokazu; Yamaguchi, Shuhei",Kohno,"Dopamine D2/3 receptor agonists have been widely used to treat motor symptoms in Parkinson's disease and are also reported to improve cognitive and emotional disturbances. Here we describe a patient who developed severe apathy after cerebral infarction in the prefrontal cortex. After administration of ropinirole, his verbal output and spontaneity in daily life was improved remarkably. This improvement was associated with increased blood flow in the prefrontal cortex and basal ganglia. We suggest that ropinirole may be a treatment option for deficits in motivated behavior after prefrontal damage.","DictElement({'Year': '2010', 'Month': '04', 'Day': '08'}, attributes={'DateType': 'Electronic'})",2010,Journal of clinical neuroscience : official journal of the Neurosurgical Society of Australasia,10.1016/j.jocn.2009.09.043,,,Case Reports; Journal Article,Scotland,eng
