pmid,title,authors,first_author,abstract,publication_date,publication_year,journal_info,doi,pmcid,keywords,article_type,country,language
1897913,Paravermal infarct and isolated cerebellar dysarthria.,"Amarenco, P; Chevrie-Muller, C; Roullet, E; Bousser, M G",Amarenco,A patient with isolated cerebellar dysarthria is reported. Computed tomography showed a small infarct in the left paravermal zone of the rostal cerebellum (lobulus simplex and semilunaris superior) in the territory of the medial branch of the superior cerebellar artery. This patient demonstrates the important role of this area of cerebellum in the control of voice.,{},,Annals of neurology,10.1002/ana.410300215,,,Case Reports; Journal Article,United States,eng
7702203,Cerebral infarction in a young adult associated with protein C deficiency. A case report.,"Kato, H; Shirahama, M; Ohmori, K; Sunaga, T",Kato,"Protein C deficiency is a cause of thromboembolic disease. Venous thrombosis is the most common clinical manifestation. Arterial thrombosis is unusual and involvement of the intracranial arteries is especially rare. Herein the authors describe a case of cerebral [correction of cerebellar] infarction associated with protein C deficiency and review the relevant medical literature. A thirty-year-old man was hospitalized because of dysarthria, right limb ataxia, and a gait disturbance. Cranial computed tomography disclosed an infarction in the right cerebellar hemisphere and brachium pontis. Three months earlier the patient had had a transient ischemic attack with truncal ataxia and gait disturbances. On admission, the protein C antigen was 57% and protein C activity was 45%. Investigation of family members revealed protein C deficiency in an uncle. Literature review of stroke cases associated with protein C deficiency revealed that most had had a previous vascular event and/or a positive family history or had used oral contraceptives chronically. Protein C deficiency should be considered in young stroke patients with a positive family history of vaso-occlusive disease, previous ischemic events, or chronic oral contraceptive use.",{},,Angiology,10.1177/000331979504600212,,,Case Reports; Journal Article; Review,United States,eng
20400317,Pure dysarthria due to an insular infarction.,"Hiraga, Akiyuki; Tanaka, Saiko; Kamitsukasa, Ikuo",Hiraga,"Cortical infarction presenting with pure dysarthria is rarely reported. Previous studies have reported pure dysarthria due to cortical stroke at the precentral gyrus or middle frontal gyrus. We report a 72-year-old man who developed pure dysarthria caused by an acute cortical infarction in the insular cortex. The role of the insula in language has been difficult to assess clinically because of the rarity of pure insular strokes. Our patient showed pure dysarthria without aphasia, indicating that pure dysarthria can be the sole manifestation of insular infarctions.","DictElement({'Year': '2010', 'Month': '04', 'Day': '18'}, attributes={'DateType': 'Electronic'})",2010,Journal of clinical neuroscience : official journal of the Neurosurgical Society of Australasia,10.1016/j.jocn.2009.10.026,,,Case Reports; Journal Article,Scotland,eng
31222543,"""Accent issue"": foreign accent syndrome following ischemic stroke.","Di Stefano, Vincenzo; De Novellis, Antonella Maria Pia; Dono, Fedele; Onofrj, Marco; De Angelis, Maria Vittoria",Di Stefano,"Foreign accent syndrome (FAS) is arare syndrome associated with altered speech rhythm and prosody, which listeners perceive as foreign; cerebrovascular accidents, tumors and multiple sclerosis are reported as possible causes of FAS. The pathophysiology of FAS is not yet understood. A 68-year-old Italian man was admitted to the EmergencyDepartment for non-fluent aphasia and dysarthria. Computed tomography (CT) scan did not show abnormalities; the patient was treated with systemic thrombolysis. A repeated brain CT and magnetic resonance imaging (MRI) confirmed an infarct in the left primary motor cortex and mild extension to cortico-subcortical frontal regions. In the following days he gradually improved, speaking Italian fluently with a typical German accent. In conclusion, FAS is a rare motor speech disorder, often related to cerebrovascular accidents involving critical regions in the dominant hemisphere. In addition, the present case adds further evidence to the role of the left primary motor cortex in modulation of prosody. In rare cases FAS can be the only sign of stroke or can appear after recovery from post-stroke aphasia.","DictElement({'Year': '2019', 'Month': '06', 'Day': '20'}, attributes={'DateType': 'Electronic'})",2019,Neurological sciences : official journal of the Italian Neurological Society and of the Italian Society of Clinical Neurophysiology,10.1007/s10072-019-03962-9,,Aphasia; Foreign accent syndrome; Prosody; Speech disorders; Stroke,Case Reports; Journal Article,Italy,eng
19185982,Optic neuritis and palatal dysarthria as presenting features of post-infectious GQ1b antibody syndrome.,"Robbins, Matthew S; Roth, Stephen; Swerdlow, Michael L; Bieri, Phyllis; Herskovitz, Steven",Robbins,"A 31-year-old man had optic neuritis 2 weeks after a diarrheal illness, followed by several deficits including palatal dysarthria, diplopia, ataxia, sensory dysfunction, and mild dysautonomia. Brain MRI and CSF were normal. Nerve conduction studies were initially normal and subsequently showed mild reduction in sensory amplitudes. Anti-GQ1b IgG titer was positive. Deficits resolved after treatment with IVIg. This clinical constellation represents an overlap between Miller Fisher syndrome (MFS) and the pharyngeal-cervical-brachial (PCB) variant of Guillain-Barre syndrome (GBS), along with the infrequently reported central feature of optic neuritis. Campylobacter jejuni enteritis may have triggered the syndrome by molecular mimicry. GQ1b antibodies are associated with MFS, GBS, Bickerstaff brainstem encephalitis and PCB; they form an overlapping spectrum of features, hence the anti-GQ1b syndrome.","DictElement({'Year': '2009', 'Month': '01', 'Day': '30'}, attributes={'DateType': 'Electronic'})",2009,Clinical neurology and neurosurgery,10.1016/j.clineuro.2008.12.005,,,Case Reports; Journal Article,Netherlands,eng
30379742,Disseminated High-grade Glioma in a Long-term Survivor of Medulloblastoma: Implications and Management of Radiation-induced Malignancies.,"Porter, Alyx B; Sio, Terence T; Nelson, Kent D; Raghunathan, Aditya; Bendok, Bernard R; Mrugala, Maciej M",Porter,"We describe a gentleman diagnosed with a posterior fossa medulloblastoma in 1998, successfully treated with craniospinal radiation therapy (RT) and posterior fossa RT boost, followed by 12 months of adjuvant chemotherapy. Nineteen years later, at the age of 28, the patient presented with multiple cranial neuropathies and was found to have disseminated high-grade glioma with leptomeningeal dissemination. In addition to the salient features of this case, we provide a brief review of RT-induced malignancies and the need for further research regarding surveillance and prevention strategies.",{},,The neurologist,10.1097/NRL.0000000000000199,,,Case Reports; Journal Article,United States,eng
29108806,Cerebral Infarcts by Nonbacterial Thrombotic Endocarditis Associated with Adenomyosis: A Case Report.,"Kim, Byungseok; Kim, Seong-Hoon; Kim, Taewon",Kim,"We report a case of multiple embolic cerebral infarcts associated with nonbacterial thrombotic endocarditis (NBTE) in a patient with adenomyosis. The patient presented with dysarthria, left perioral sensory change, and left-hand weakness. Magnetic resonance imaging revealed multiple vascular territory infarctions involving the bilateral cerebellum and the right precentral gyrus. Magnetic resonance angiography was normal. d-Dimer, carbohydrate antigen (CA) 19-9, and CA125 levels were elevated. Abdominal and pelvic computed tomography with iodine contrast enhancement revealed a huge adenomyosis with left ovarian cyst. Transesophageal echocardiography (TEE) with agitated saline injection test demonstrated shaggy vegetation at the coapting edge of both mitral leaflets and mitral regurgitation. A diagnosis of NBTE was established and treatment with anticoagulation was initiated. Two weeks later, the thrombi reduced significantly on follow-up TEE and transthoracic echocardiography. The patient underwent an abdominal hysterectomy with bilateral salpingo-oophorectomy, and pathological specimens confirmed adenomyosis. The possibility that adenomyosis can be associated with NBTE suggests one of the underlying thromboembolic mechanisms in adenomyosis. Clinicians should be aware of the potential thromboembolic risk of adenomyosis. Further reporting of similar cases is needed to confirm the thromboembolic mechanism.","DictElement({'Year': '2017', 'Month': '11', 'Day': '03'}, attributes={'DateType': 'Electronic'})",2017,Journal of stroke and cerebrovascular diseases : the official journal of National Stroke Association,10.1016/j.jstrokecerebrovasdis.2017.10.005,,Adenomyosis; anticoagulation; ischemic stroke; nonbacterial thrombotic endocarditis,Case Reports; Journal Article,United States,eng
2001193,Horner's syndrome from hypothalamic infarction.,"Austin, C P; Lessell, S",Austin,"We report a case of Horner's syndrome due to ipsilateral posterior hypothalamic infarction, occurring in the absence of other signs of hypothalamic dysfunction. Associated symptoms of contralateral faciobrachial weakness and dysarthria correlated with the extension of the infarct into the posterior limb of the internal capsule seen by magnetic resonance imaging. The likely vascular anatomy of this lesion is discussed.",{},,Archives of neurology,10.1001/archneur.1991.00530150104027,,,Case Reports; Journal Article,United States,eng
14977062,Simultaneous ischemic and neurotoxic brain damage after coronary angiography.,"Schulte-Altedorneburg, Gernot; Rüb, Kerstin; Scheglmann, Konrad",Schulte-Altedorneburg,Transient cortical blindness following intra-arterial catheter angiography is a known rare complication. We report the case of a 56-year-old man who suffered from transient cortical blindness and neuropsychological deficits after coronary angiography. Serial CT scans revealed reversible pathologic parenchymal contrast enhancement of the right occipital lobe as well as left middle cerebral artery infarction at the same time. CT changes and time course of clinical symptoms are presented and discussed for both lesions of presumably different etiology.,{},,Neurological research,10.1179/016164104773026570,,,Case Reports; Journal Article,England,eng
8304847,Are multiple cerebral infarcts synergistic?,"Wolfe, N; Babikian, V L; Linn, R T; Knoefel, J E; D'Esposito, M; Albert, M L",Wolfe,"The goal of this study was to characterize the cumulative effects of multiple strokes on cognition. We conducted a prospective, longitudinal case study with neuropsychological, neurological, and radiological evaluations. Research was conducted at the Boston (Mass) Veterans Administration Medical Center, Neurology Service, on successive inpatient hospital admissions. We followed up a 66-year-old right-handed man with multiple subcortical lacunae during a 3.5-year period during which he suffered two additional cortical infarctions. Each evaluation included approximately 3 hours of neuropsychological testing spanning a range of cognitive domains (attention, language, memory, visuospatial functions, response inhibition, and mental flexibility), full neurological examination, and computed tomographic scan. The patient's stepwise cognitive decline was characterized by unexpected exacerbation of ""frontal"" neurobehavioral features following the occurrence of two posterior cortical lesions. At initial evaluation, the computed tomographic scan showed bilateral subcortical lacunae in basal ganglia and periventricular white matter, and symptoms included dysarthria and perseveration. The second evaluation, following a left posterior parietal lesion, revealed a range of new frontal features, including impulsivity, pull-to-stimulus, and difficulty shifting set. Following a subsequent right occipital infarct, further frontal lobe impairments emerged: forced grasp reflex and incontinence. We hypothesize that the cumulative effects of infarcts were synergistic. That is, the posterior cortical infarcts elicited frontal features that would not be expected from a simple sum of these lesions' effects.",{},,Archives of neurology,10.1001/archneur.1994.00540140129022,,,"Case Reports; Journal Article; Research Support, Non-U.S. Gov't; Research Support, U.S. Gov't, Non-P.H.S.; Research Support, U.S. Gov't, P.H.S.",United States,eng
17482346,Cortico-hypoglossal and corticospinal conduction abnormality in Bickerstaff's brainstem encephalitis.,"Lo, Y L; Ratnagopal, P",Lo,"The Miller Fisher syndrome, Guillain-Barre syndrome and Bickerstaff's brainstem encephalitis are related conditions in which anti-GQ1b antibody positivity occur in varied frequencies. This report demonstrates the presence of corticobulbar and corticospinal dysfunction in BBE, by means of a novel transcranial magnetic stimulation technique. It further supports the presence of protean manifestations in anti-GQ1b IgG antibody-positive spectrum of disorders.","DictElement({'Year': '2007', 'Month': '05', 'Day': '04'}, attributes={'DateType': 'Electronic'})",2007,Clinical neurology and neurosurgery,10.1016/j.clineuro.2007.03.006,,,Case Reports; Journal Article,Netherlands,eng
1895127,Mid-brain pathology of Wilson's disease: MRI analysis of three cases.,"Hitoshi, S; Iwata, M; Yoshikawa, K",Hitoshi,"MRI scans were obtained from three patients with Wilson's disease, all of whom showed rigidity and dysarthria; two also showed tremor and dystonia. Two had been treated with D-penicillamine for seven and 14 years, respectively and their neurological abnormalities had improved, but the third patient had not been treated. T2-weighted MRI of the mid-brain in all three revealed the characteristic ""face of the giant panda"" sign, consisting of high signal intensity in the tegmentum except for red nucleus, preservation of signal intensity of the lateral portion of the pars reticulata of the substantia nigra and hypo-intensity of the superior colliculus. The clinical significance of these MRI abnormalities is discussed.",{},,"Journal of neurology, neurosurgery, and psychiatry",10.1136/jnnp.54.7.624,PMC1014434,,Case Reports; Journal Article,England,eng
30335269,A rare condition mimicking stroke: Diabetic uremic encephalopathy.,"Tekesin, Aysel; Erdal, Yuksel; Mahmutoglu, Abdullah Soydan; Hakyemez, Ahmet; Emre, Ufuk",Tekesin,"Uremic encephalopathy (UE) is a metabolic disorder associated with acute or chronic renal failure. It is characterized by the acute or subacute onset of reversible neurological symptoms and specific imaging findings. It is uncommon for uremic encephalopathy to be associated with acute bilateral lesions of the basal ganglia in diabetic uremic patients, and this can be seen most often in Asian patients. Here, we report a patient with diabetic uremic encephalopathy and bilateral basal ganglia lesions who developed acute onset dysarthria. The clinical and magnetic resonance brain imaging findings resolved after hemodialysis treatment.",{},,Ideggyogyaszati szemle,10.18071/isz.71.0358,,bilateral basal ganglia; dysarthria; uremic encephalopathy,Case Reports,Hungary,eng
18552494,Scanning dysarthria secondary to spontaneous midbrain hemorrhage: case report and review of literature.,"Perez, F J Alvarez; Nuñez, C Teijo",Perez,,"DictElement({'Year': '2008', 'Month': '06', 'Day': '14'}, attributes={'DateType': 'Electronic'})",2008,European neurology,10.1159/000138957,,,Case Reports; Letter; Review,Switzerland,eng
18566032,Midbrain lesions and paroxysmal dysarthria in multiple sclerosis.,"Blanco, Y; Compta, Y; Graus, F; Saiz, A",Blanco,"We describe three patients with relapsing-remitting multiple sclerosis who presented with paroxysmal dysarthria. In one patient, the symptoms were the only manifestation of an acute relapse. In the other two patients, the attacks appeared during the recovery of a brainstem relapse. All three patients had an acute lower midbrain lesion. The location was central in two patients and left paramedian in the other, and probably involving cerebellothalamocortical pathways. Treatment with carbamazepine was effective.",{},,"Multiple sclerosis (Houndmills, Basingstoke, England)",10.1177/1352458507087846,,,"Case Reports; Journal Article; Research Support, Non-U.S. Gov't",England,eng
17613613,Dysarthria and dysphagia due to the opercular syndrome in multiple sclerosis.,"Pender, M P; Ferguson, S M",Pender,"We report a patient with relapsing-remitting multiple sclerosis (RRMS), who developed bilateral severe tongue weakness due to the anterior opercular syndrome. This was caused by a recent inflammatory demyelinating lesion in the right perisylvian juxtacortical region, superimposed on a pre-existing left perisylvian lesion, which had previously caused temporary isolated right tongue weakness.","DictElement({'Year': '2007', 'Month': '02', 'Day': '16'}, attributes={'DateType': 'Electronic'})",2007,"Multiple sclerosis (Houndmills, Basingstoke, England)",10.1177/1352458506073481,,,Case Reports; Journal Article,England,eng
2360789,The dysarthria-clumsy hand syndrome: a distinct clinical entity related to pontine infarction.,"Glass, J D; Levey, A I; Rothstein, J D",Glass,"Using magnetic resonance imaging, we studied 6 patients with the dysarthria-clumsy hand syndrome. All were found to have pontine infarctions contralateral to the symptomatic side. Clinically, these patients exhibited dysarthria; ""clumsiness,"" characterized by dysmetria, dysrhythmia, dysdiadochokinesia and sometimes truncal and gait ataxia; and mild ipsilateral weakness. Previous clinical-anatomical correlations for this syndrome are limited by inconsistencies in clinical diagnostic criteria and low-resolution imaging methods. In our patients, and in a review of the literature, the overwhelming majority of patients with the dysarthria-clumsy hand syndrome had pontine infarcts. We conclude that if rigid clinical criteria are used, the label of the dysarthria-clumsy hand syndrome predicts a lesion in the contralateral basis pontis.",{},,Annals of neurology,10.1002/ana.410270506,,,Case Reports; Journal Article,United States,eng
29712567,Wernekink commissure syndrome with palatal myoclonus at onset: a case report and review of the literature.,"Mullaguri, Naresh; Battineni, Anusha; Chuquilin, Miguel",Mullaguri,"Wernekink commissure syndrome causes a peculiar combination of internuclear ophthalmoplegia, dysarthria, and delayed-onset palatal myoclonus. Palatal myoclonus is thought to be secondary to delayed hypertrophic degeneration of the bilateral inferior olivary nuclei secondary to involvement of bilateral dentatoolivary tract. We describe a case of a patient with early-onset palatal myoclonus. A 53-year-old Caucasian man with several vascular risk factors presented to our emergency room with slurred speech, double vision, difficulty with swallowing and walking, and rhythmic contractions of the soft palate. Brain magnetic resonance imaging showed an acute infarct of the right caudal midbrain and an old infarct of the right medulla. We hypothesize that the cause of early palatal myoclonus in our patient was a two-hit mechanism with degeneration of the right olivary nucleus resulting from prior right medullary lacunar stroke with the new infarct affecting the dentato-rubro-olivary tract on the left side, causing bilateral dysfunction initiating palatal myoclonus. Wernekink commissure syndrome with palatal myoclonus at onset suggests the presence of a prior ischemic insult in the medulla. Careful examination is important to identification of this presentation.","DictElement({'Year': '2018', 'Month': '05', 'Day': '01'}, attributes={'DateType': 'Electronic'})",2018,Journal of medical case reports,10.1186/s13256-018-1657-4,PMC5928570,Ataxia; Dysarthria; Guillain-Mollaret triangle; Internuclear ophthalmoplegia; Palatal myoclonus; Wernekink commissure syndrome,Case Reports; Journal Article,England,eng
36999917,"Increased Improvement in Speech-Language Skills After Transcranial Photobiomodulation Plus Speech-Language Therapy, Compared to Speech-Language Therapy Alone: Case Report with Aphasia.","Estrada-Rojas, Karla; Cedeño Ortiz, Nidia Patricia",Estrada-Rojas,"<b><i>Objective:</i></b> This is a case report showing that transcranial photobiomodulation (tPBM) combined with traditional, speech-language therapy improved and accelerated the results from speech-language therapy, in a stroke person with aphasia (PWA). <b><i>Background:</i></b> tPBM is a safe, noninvasive technique using red and near-infrared light to improve the metabolism of cells. tPBM helps by promoting neuromodulation, while decreasing neuroinflammation and promoting vasodilation. Several studies have shown that tPBM can help individuals with stroke or traumatic brain injury achieve significant cognitive improvements. <b><i>Methods:</i></b> A 38-year-old female, who sustained an ischemic stroke on the left side of the brain, received two, 5-month series of treatments. The first series of treatments included traditional speech-language therapy, for the first 5 months poststroke. The second series of treatments included tPBM in combination with speech-language therapy, for the next 5 months. The tPBM treatments included application of red (630 and 660 nm) and near-infrared (850 nm) wavelengths of photons applied to left hemisphere scalp areas. The major cortical language areas were subjacent to the scalp placements along the line of the Sylvian fissure. At each session, first a light-emitting diode (LED) cluster head with red (630 and 660 nm) and near-infrared (850 nm) wavelengths, with an irradiance (power density) of 200 mW/cm<sup>2</sup>, a beam size of 4.9 cm<sup>2</sup>, and a fluence (energy density) of 12 J/cm<sup>2</sup> per minute, was applied to the left side of the scalp/brain, along the Sylvian fissure for 60 sec at each at the following eight, language network target areas: frontal pole, prefrontal cortex, and inferior frontal gyrus (Broca's area); supramarginal gyrus and angular gyrus in the parietal lobe; inferior motor/sensory cortex (mouth area); and posterior superior temporal gyrus (Wernicke's area) and superior temporal sulcus in the temporal lobe, for a total of 8 min. Second, for the next 20 min (1200 sec), simultaneous with speech-language therapy, an LED PBM helmet was applied to the scalp/head. This helmet contained 256 separate LED lights, near-infrared (810 nm) wavelength, 60 mW power per LED light, total power, 15 W; energy, 72 Joules; fluence, 28.8 J/cm<sup>2</sup>; and irradiance, 24 mW/cm<sup>2</sup>. <b><i>Results and conclusions:</i></b> During the initial, 5-month treatment series with traditional speech-language therapy only, there was little to no improvement in dysarthria and expressive language. During the second, 5-month treatment series, however, with tPBM applied first, to the left hemisphere only, and second, to both hemispheres during each session plus simultaneous speech-language therapy, there was marked improvement in the dysarthria and expressive language. After the first 5-month series, this PWA had utilized a slow rate of speech with a production of ∼25 to 30 words-per-minute during conversations and spontaneous speech. Utterance length was only 4-6 words with simple, grammatical structure. After the second, 5-month series of treatment combining tPBM plus speech-language therapy, the rate of speech increased to 80+ words-per-minute and utterance length was increased to 9-10 words, with more complex grammatical structure.","DictElement({'Year': '2023', 'Month': '03', 'Day': '30'}, attributes={'DateType': 'Electronic'})",2023,"Photobiomodulation, photomedicine, and laser surgery",10.1089/photob.2022.0024,PMC10171962,LLLT; PBM; aphasia; low-level laser therapy; photobiomodulation; speech-language therapy,Case Reports; Journal Article,United States,eng
29905156,Two cases of opercular myoclonic-anarthric status epilepticus.,"Muñoz-Lopetegi, Amaia; Fernández García de Eulate, Gorka; Rodríguez-Antigüedad Muñoz, Jon; Bergareche, Alberto; José Poza, Juan",Muñoz-Lopetegi,"Opercular myoclonic-anarthric status epilepticus (OMASE) is a rare form of epilepsia partialis continua presenting as fluctuating dysarthria, or even anarthria. The condition is caused by an epileptogenic lesion involving the opercular cortex of either hemisphere. Speech impairment is secondary to bilateral epileptic activity affecting the glossopharyngeal muscles. This bilateral nature of the condition is due to the fact that innervation of cranial nerves V, VII, IX, X and XII from the opercular area of the primary motor cortex is bilateral. The aetiology of the condition varies, and includes vascular lesions, tumours, and encephalitis, among other causes. A low threshold for clinical suspicion is necessary in order to ensure the timely initiation of antiepileptic treatment, thereby preventing the condition from becoming drug resistant. We present two cases of OMASE which differ in terms of aetiology, clinical course, and treatment response. [Published with video sequences on www.epilepticdisorders.com].",{},,Epileptic disorders : international epilepsy journal with videotape,10.1684/epd.2018.0973,,anarthria; dysarthria; epilepsia partialis continua; glossopharyngeal musculature; status epilepticus,Case Reports; Journal Article,United States,eng
