pmid,title,authors,first_author,abstract,publication_date,publication_year,journal_info,doi,pmcid,keywords,article_type,country,language
23962063,Pathological generosity: an atypical impulse control disorder after a left subcortical stroke.,"Ferreira-Garcia, Rafael; Fontenelle, Leonardo F; Moll, Jorge; de Oliveira-Souza, Ricardo",Ferreira-Garcia,"Changes in socio-emotional behavior and conduct, which are characteristic symptoms of frontal lobe damage, have less often been described in patients with focal subcortical injuries. We report on a case of pathological generosity secondary to a left lenticulocapsular stroke with hypoperfusion of several anatomically intact cortical areas. A 49-year-old man developed excessive and persistent generosity as he recovered from a left lenticulocapsular hematoma. His symptoms resembled an impulse control disorder. (99m)Tc-HMPAO SPECT demonstrated hypoperfusion mostly in the ipsilateral striatum, dorsolateral, and orbitofrontal cortex. This case study adds pathological generosity to the range of behavioral changes that may result from discrete unilateral lesions of the lenticular nucleus and nearby pathways. In our particular case, post-stroke pathological generosity was not ascribable to disinhibition, apathy, mania, or depression. Because pathological generosity may lead to significant distress and financial burden upon patients and their families, it may warrant further consideration as a potential type of impulse control disorder.","DictElement({'Year': '2013', 'Month': '08', 'Day': '20'}, attributes={'DateType': 'Electronic'})",2013,Neurocase,10.1080/13554794.2013.826681,,Basal ganglia; Frontal lobe syndrome; Generosity; Impulse control disorder; Stroke,"Case Reports; Journal Article; Research Support, Non-U.S. Gov't",England,eng
8327149,Hemiballismus and secondary mania following a right thalamic infarction.,"Kulisevsky, J; Berthier, M L; Pujol, J",Kulisevsky,"An 81-year-old woman had the sudden onset of left-sided ballismus and an accompanying behavioral change characterized by elation, distractibility, inflated self-esteem, and insomnia, suggesting secondary mania. An MRI revealed a small ischemic infarction of the right thalamus.",{},,Neurology,10.1212/wnl.43.7.1422,,,Case Reports; Journal Article,United States,eng
22325164,Caudate nucleus and social cognition: neuropsychological and SPECT evidence from a patient with focal caudate lesion.,"Kemp, Jennifer; Berthel, Marie-Camille; Dufour, André; Després, Olivier; Henry, Audrey; Namer, Izzie J; Musacchio, Mariano; Sellal, François",Kemp,"Most studies in social cognition have focused on developmental diseases or analyzed the consequences of acquired frontal lesions on the integrity of Theory of Mind (ToM), but, to our knowledge, none to date has addressed the eventual consequences of damage to the basal ganglia on ToM. To investigate the possible consequences of such lesions on social cognition, we tested a selected patient, MVG, a 44-year-old man with a focal caudate nucleus (CN) lesion following stroke. In the aftermath of this stroke, MVG shows loss of empathy and difficulties recognizing emotions in others. The dual aims of this study were first, to evaluate the implications of CN on ToM and recognition of emotion, and second, to discuss these results as a consequence of a disconnection of the sub-cortical orbito-frontal (OF) loop due to caudate damage. We performed a complete neuropsychological assessment of MVG, as well as different tasks evaluating social cognition, such as the Faux-Pas Test and the Reading the Eyes in the Mind Test. No deficits were found in the neuropsychological tests. However, on tasks assessing social cognition, MVG showed impairments in the ""warm"" or ""affective"" part of ToM as well as in the ability to recognize negative emotions (i.e., sadness and fear). These results indicate that damage to the head of the left CN can lead to impairment of ToM and emotion recognition. Furthermore, the data shows that, in MVG, such impairment appears to be due to a disconnection of the sub-cortical OF circuit resulting from damage to the CN. Neuro-imaging data tends to confirm this hypothesis by bringing out a hypo-perfusion in both, the territory of his left CN and prefrontal (i.e., ventromedial) brain areas.","DictElement({'Year': '2012', 'Month': '01', 'Day': '15'}, attributes={'DateType': 'Electronic'})",2012,Cortex; a journal devoted to the study of the nervous system and behavior,10.1016/j.cortex.2012.01.004,,,Case Reports; Journal Article,Italy,eng
21601729,Post-stroke mania precipitated by withdrawal of antidepressant in an elderly patient with chronic major depression.,"Yeh, Yi-Wei; Peng, Giia-Sheun",Yeh,"Post-stroke mania is a rare neuropsychiatric complication that is observed in less than 1% cases of stroke and is less common than depression. Growing evidence suggests that it may be associated with the specific regions of the brain, preexisting subcortical atrophy, a family history of mood disorders, and chronic vascular burden. However, the development of bipolar disorder after stroke is uncommon in a patient with chronic major depression. In this report, we present the case of an elderly woman with depression and chronic vascular burden; she experienced her first episode of mania after a lacunar infarct on the right side and the withdrawal of antidepressant therapy.","DictElement({'Year': '2011', 'Month': '01', 'Day': '26'}, attributes={'DateType': 'Electronic'})",2011,General hospital psychiatry,10.1016/j.genhosppsych.2010.12.007,,,Case Reports; Journal Article,United States,eng
30720550,Subarachnoid Hemorrhage in the Setting of Electroconvulsive Therapy in a Patient With an Unsecured Cerebral Aneurysm: A Case Report and Review of the Literature.,"Gugger, James J; Dunn, Lauren E",Gugger,"The aim of the study was to report a case of a patient who experienced a fatal aneurysmal subarachnoid hemorrhage during the course of electroconvulsive therapy (ECT). This is a case report and review of the literature. Electroconvulsive therapy is widely viewed as a safe and effective treatment for major depressive disorder; however, there remains some uncertainty regarding the safety of ECT in patients with cerebral aneurysms. Many cases exist documenting the safety of ECT in patients with both secured and unsecured cerebral aneurysms; however, these patients had aneurysms that were associated with a low (ie, ≤2.6%) 5-year cumulative rupture rate, whereas the patient in our case had an aneurysm associated with a 14.5% five-year cumulative rupture rate. We stress that ECT should not be viewed as a universally safe procedure in patients with cerebral aneurysms and the 5-year cumulative aneurysm rupture rate should be used in the discussion of the risk-benefit ratio of ECT in patients with unsecured cerebral aneurysms.",{},,The journal of ECT,10.1097/YCT.0000000000000573,,,Case Reports; Journal Article,United States,eng
31893353,Cerebellar cognitive affective syndrome after bilateral caudal paramedian midbrain infarction.,"Chen, Kui; Wu, Li; Chen, Wei",Chen,,"DictElement({'Year': '2020', 'Month': '01', 'Day': '01'}, attributes={'DateType': 'Electronic'})",2020,Acta neurologica Belgica,10.1007/s13760-019-01265-6,,Ataxia; Cerebellar cognitive affective syndrome; Midbrain infarction; Wernekink commissure syndrome,Case Reports; Journal Article,Italy,eng
26063348,Prognostic and Mechanistic Factors Characterizing Seizure-Associated Crossed Cerebellar Diaschisis.,"Graffeo, Christopher S; Snyder, Kendall A; Nasr, Deena M; Murphy, Meghan E; Carr, Carrie M; Hocker, Sara E",Graffeo,"Crossed cerebellar diaschisis is a rare finding of hemispheric cerebellar depression following contralateral cerebral injury, hypothesized to result from excessive neuronal excitatory synaptic activity along cortico-pontine-cerebellar pathways. The phenomenon is typically observed following ischemic stroke, but has also been characterized during seizure activity--in particular, status epilepticus (SE). Neurological outcome has varied widely in published reports, with some patients achieving full neurologic recovery, while others experience persistent disability. Case report and literature review. We present a 54-year-old man found unresponsive with a right hemispheric syndrome several days after discharge following amygdalohippocampectomy for refractory right temporal lobe epilepsy. Prolonged electroencephalogram demonstrated one subclinical right frontal seizure, along with right frontal periodic lateralized epileptiform discharges, presumed to be associated with SE preceding his admission. Initial MRI demonstrated restricted diffusion on diffusion weighted imaging in the right cerebral hemisphere, ipsilateral thalamus, and contralateral cerebellum. A head CT one week later showed diffuse sulcal effacement with loss of gray-white differentiation in the right frontal and insular regions with low attenuation changes of right thalamus. An MRI showed worsened diffusion restriction, despite a corresponding increase in perfusion. The patient remained paretic at discharge and follow-up. Follow-up MRI at 2 months demonstrated pronounced right cerebral and left cerebellar atrophy, loss of gray matter in much of the right cerebrum, and scattered areas of T2 hyperintensity, consistent with permanent right fronto-temporal neuronal loss. Collectively, these observations indicate that imaging findings of persistent cerebral restricted diffusion and cytotoxic edema in the subacute post-ictal period may predict irreversible neuronal injury and poor long-term outcome-even when accompanied by evidence of cortical hyperperfusion and recovery of second- and third-order neurons along the involved circuit.",{},,Neurocritical care,10.1007/s12028-015-0155-4,,Deafferentation; Excitotoxic injury; Hyperactivation; Status epilepticus,Case Reports; Journal Article,United States,eng
27188097,Consultation Dilemma Catatonia in a Patient with Prior TBI: MentaI or Medical Disorder?,"Khalafian, Andrey; Dukes, Charles; Tucker, Phebe",Khalafian,"Mr. R, a 27 year old Hispanic male with history of traumatic brain injury (TBI) over ten years prior but no psychiatric history, presents to the psychiatric consultation service with recent onset of mutism, psychotic behavior and new diagnosis of epilepsy. The differential diagnosis is broad and includes both medical and psychiatric causes: post-ictal state, non-convulsive status epilepticus, delirium due to metabolic conditions, drugs, catatonia, conversion disorder, major depression with psychotic features, new onset schizophrenia or a combination of these possible diagnoses. We explore different medical causes that can present with symptoms of catatonia, as it is crucial to rule out a possible treatable medical cause.",{},,The Journal of the Oklahoma State Medical Association,,,,Case Reports; Journal Article,United States,eng
2136096,Dopamine-responsive dysnomia?,"Lauterbach, E C; Spears, T E; Prewett, M J",Lauterbach,,{},,The Journal of neuropsychiatry and clinical neurosciences,10.1176/jnp.2.3.353,,,Case Reports; Letter,United States,eng
3258356,Manic delirium and frontal-like syndrome with paramedian infarction of the right thalamus.,"Bogousslavsky, J; Ferrazzini, M; Regli, F; Assal, G; Tanabe, H; Delaloye-Bischof, A",Bogousslavsky,"A disinhibition syndrome affecting speech (with logorrhoea, delirium, jokes, laughs, inappropriate comments, extraordinary confabulations), was the main manifestation of a right-sided thalamic infarct involving the dorsomedian nucleus, intralaminar nuclei and medial part of the ventral lateral nucleus. Resolution of conflicting tasks was severely impaired, suggesting frontal lobe dysfunction. These abnormalities correlated with the finding on SPECT of a marked hypoperfusion in the overlying hemisphere predominating in the frontal region. We suggest that this behavioural syndrome was produced by disconnecting the dorsomedian nucleus from the frontal lobe and limbic system.",{},,"Journal of neurology, neurosurgery, and psychiatry",10.1136/jnnp.51.1.116,PMC1032723,,Case Reports; Journal Article,England,eng
18275371,Clinicopathological findings of suicide in the elderly: three cases.,"Peisah, Carmelle; Snowdon, John; Kril, Jillian; Rodriguez, Michael",Peisah,"The neuropathological correlates of suicide in older persons have received little research attention. Our recent study of elderly suicide victims from an Australian forensic medicine department (n = 143), unlike a previous case-control study, did not find an increased prevalence of Alzheimer's disease (AD) in older persons who committed suicide despite a history of dementia in 6.3%. Both studies were limited to the examination of AD-related pathology by the availability of tissue. We present clinicopathological data on three cases from our study for whom autopsy findings were available. These cases included: a community-dwelling male in his early eighties with dementia who was found to have multiple cortical and striatal lacunes and glial scars, small vessel cerebrovascular disease (SVD) and AD-related pathology; a community-dwelling male in his mid-seventies with depression and loss of concentration, with brainstem predominant Lewy body disease (LBD) and AD-related pathology; and a female nursing home resident in her nineties with a history of stroke and prior suicide attempts who was found to have infarcts and SVD in frontal regions. Neuropathological findings in elderly suicide victims may include multiple neurodegenerative pathologies. The burden and distribution of neurodegenerative diseases apart from AD, including SVD and LBD, should be assessed as possible pathophysiological factors contributing to late life suicide.",{},,Suicide & life-threatening behavior,10.1521/suli.2007.37.6.648,,,Case Reports; Journal Article; Review,England,eng
22907854,Neuropsychiatric manifestation after a stroke: newly developed symptoms or side-effect of drug?,"Tan, Eng Chai; Aziz, Noor Azah; Ahmad, Saharuddin",Tan,"A 55-year-old woman presented with sudden onset of left-sided body weakness and numbness, which was diagnosed as multifocal cerebral infarct with right thalamic bleed. She had concurrent hypertension, diabetes mellitus and chronic kidney disease. She suffered from central poststroke pain and reactive depression as poststroke complications, for which amitriptyline was prescribed. Unfortunately, she developed symptoms suggestive of mania and psychosis upon initiation of medications, which resolved upon withdrawal of amitriptyline. Amitriptyline is effective for treatment of poststroke pain and particularly useful in concomitant depression. Unexpectedly, this patient developed new psychopathologies after initiation of this medication. This case highlights the development of new psychopathologies that could be due to the antidepressant, underlying bipolar disorder or a complication of the stroke itself. Primary care providers need to actively enquire regarding neuropsychiatric symptoms because they can adversely affect the patient's quality of life as well as impede rehabilitation efforts.","DictElement({'Year': '2012', 'Month': '08', 'Day': '18'}, attributes={'DateType': 'Electronic'})",2012,BMJ case reports,10.1136/bcr-2012-006518,PMC4544885,,Case Reports; Journal Article,England,eng
16337700,Secondary mania of vascular origin in elderly patients: a report of two clinical cases.,"Nagaratnam, Nages; Wong, Ka-Kit; Patel, Ilesh",Nagaratnam,"The concept of secondary mania continues to be debated together with unresolved or partially resolved issues such as lateralization, localization, age of onset, disinhibition syndromes, and others. We have described two patients with secondary mania following a stroke. One had a large left hemisphere cerebral infarction and the symptoms arose about 2.5 years later, possibly triggered by a transient ischemic attack involving the right hemisphere. The other had an infarction in the right posterior artery territory extending to the thalamus and internal capsule together with infarctions in the deep border zones of both hemispheres at the level of the centrum semiovale with the manic symptoms concomitant with the onset of the event. The clinical and neuro-anatomic mechanisms that underlie the diverse locations of secondary mania are discussed. The cerebral components of secondary mania and disinhibition syndromes are very similar and it is proposed that disinhibition syndromes, secondary hypomania and secondary mania with and without psychotic symptoms are simply a continuum of severity of mood disorder and secondary mania with psychotic symptoms may be an extreme form. The concept of secondary mania in the elderly is not likely to disappear although several unresolved issues remain. For the neurophysician, geriatrician, and the psychiatrist there is much to be attained by simplifying the issues and accepting the view that secondary mania is a discrete entity.","DictElement({'Year': '2005', 'Month': '12', 'Day': '07'}, attributes={'DateType': 'Electronic'})",2005,Archives of gerontology and geriatrics,10.1016/j.archger.2005.10.009,,,Case Reports; Journal Article,Netherlands,eng
26257194,Late-onset recurrent mania as a manifestation of Wallenberg syndrome: a case report and review of the literature.,"Das, Piyush; Chopra, Amit; Rai, Abhishek; Kuppuswamy, Preetha Sharone",Das,"The aim of the present case report was to describe the late onset of recurrent mania in a patient after ischemic injury to the cerebellum and dorsolateral medulla. We studied an 86-year-old male with no prior psychiatric history who developed recurrent episodes of mania following a brain stroke. Additionally, he had neurological symptom constellation typical of Wallenberg syndrome. Magnetic resonance imaging of the brain revealed infarction in the inferomedial right cerebellar hemisphere and the right dorsolateral medulla in the right posterior inferior cerebellar artery (PICA) distribution. He was successfully managed with a combination of antipsychotic and mood-stabilizer medications. Post-stroke mania may be one of the rare manifestations of Wallenberg syndrome. This case adds to the emerging literature on cerebellar involvement in mood regulation and pathology of mania.","DictElement({'Year': '2015', 'Month': '08', 'Day': '08'}, attributes={'DateType': 'Electronic'})",2015,Bipolar disorders,10.1111/bdi.12318,,bipolar disorder; cerebellum; mania; stroke,Case Reports; Journal Article,Denmark,eng
1778691,Spontaneous remission of depression after attempted suicide by hanging: a case report and literature review.,"Calache, M J; Achamallah, N S",Calache,"This is a case report of a spontaneous remission of depression after an attempted suicide by hanging. The patient suffered from cardiopulmonary arrest and anoxic encephalopathy, but recovered without apparent neurologic sequelae. The authors review the literature and explore the possible effects of hypoxia and hypercapnea on the locus ceruleus and the limbic system which could contribute to the patient's remission of symptoms. Also discussed are the psychosocial factors affecting patients' moods after a suicide attempt.",{},,International journal of psychosomatics : official publication of the International Psychosomatics Institute,,,,Case Reports; Journal Article; Review,United States,eng
9012946,Anxiety and depression in elderly patients receiving treatment for cerebral tumours.,"Kaplan, C P; Miner, M E",Kaplan,"Little is known regarding affect and the quality of life of elderly persons with malignant brain tumours. More elderly patients are currently being diagnosed with primary malignant CNS tumours and current, aggressive treatment has extended median life expectancy. This case study indicated significant levels of clinical depression and anxiety may be experienced. Additionally, trait anxiety was found to increase with tumour progression. The patient's concern regarding loss of conjugal closeness and social inactivity was identified for the first time in persons with malignant brain tumours. Being progressively less active physically, and more isolated emotionally, this patient used her relatively good general intellectual abilities to worry about her situation. At the present time integration into the community and distress over her ability to be assertive decreased. Practical barriers to the delivery of psychological services were encountered and are likely to have been under appreciated.",{},,Brain injury,10.1080/026990597123728,,,Case Reports; Journal Article,England,eng
19540415,[Carbon monoxide intoxication and anterograde amnesia].,"Mahmoud, O; Mestour, M; Loualidi, M",Mahmoud,"Carbon monoxide (CO) intoxication is still one of the most frequent conditions causing brain damage as a result of hypoxia in Morocco, and the main area of brain damage is the hippocampus. The role of the hippocampus in the memory process has been known for long and we usually associate hippocampus damage with anterograde amnesia. Nevertheless, the pure amnesic syndrome is retrieved in the isolated damage of the hippocampus as is seen in the anoxia caused by CO intoxication. The outcome of the patterns depends on the extent of brain damage, the age of onset and the early diagnosis. This study presents the case of a young female patient who presented with anterograde amnesia after massive and prolonged accidental exposition to CO that presented disproportional radiological and clinical outcome. Primary care was in the intensive care unit during 24 hours and based on oxygen therapy and diuretics. The psychiatric examination found an acute stress disorder and symptoms of delirium in the form of reduced awareness and memory deficit. The amnesia was anterograde and the patient exhibited diminished ability to remember time, space and persons. The Galveston orientation and amnesia test (GOAT) score on awakening in the intensive care unit was 46. The laboratory findings did not provide direct physiological disturbances. The brain computed tomography (CT) scan revealed bilateral hippocampus low-density in the cerebral white and grey matter. The clinical and the radiological outcome of this pattern were not correlated. The GOAT scores were 46 on the 10th day and 50 when the patient was discharged three weeks later, although the brain CT scan showed a decrease of the low-density in the hippocampus. Forty-five days later, the GOAT score was still 49 and the brain CT scan did not show any low-density lesion. Clinical symptoms of a major depressive episode were installed. These results are correlated to the findings of several series in which the CT scans in CO intoxication show common characteristic features that are symmetrical low-density lesions in the cerebral white matter in some specific brain structures such as the globus pallidus and the hippocampus. The early diagnosis is usually difficult because the brain CT scan findings do not always provide morphological changes and fail approximately one half of the time to detect low-density in the white matter of the hippocampus, and the use of MRI is not as easy as the CT scan. The long period of unconsciousness, the white matter damage and the late diagnosis result in complications in the outcome.","DictElement({'Year': '2008', 'Month': '08', 'Day': '20'}, attributes={'DateType': 'Electronic'})",2008,L'Encephale,10.1016/j.encep.2008.02.011,,,Case Reports; English Abstract; Journal Article,France,fre
16127310,Electroconvulsive therapy after repair of cerebral aneurysm.,"Sharma, Arun; Ramaswamy, Sriram; Bhatia, Subhash C",Sharma,"There are cases in the literature describing the use of electroconvulsive therapy (ECT) in patients with intracerebral aneurysms. We report the clinical course of a 60-year-old woman with a history of a recently ruptured intracerebral aneurysm and placement of a ventriculoperitoneal shunt that was successfully treated with ECT for major depressive disorder. Beta blockade with esmolol 20-50 mg was used to maintain her blood pressure, which ranged from 100/63 to 170/94 mm Hg. Propofol was used for anesthesia. There were no vascular complications secondary to the ECT procedure.",{},,The journal of ECT,10.1097/01.yct.0000174214.93301.c2,,,Case Reports; Journal Article,United States,eng
23859292,A juvenile case of cerebellar arteriovenous malformation with gradual onset of dysphoria and headache.,"Rispoli, R; Di Chirico, A; Sibille, M; Carletti, S",Rispoli,"A 25-year-old woman was admitted because of frequent vomiting and headache which had lasted over one week. She had initially clear consciousness but slowly progressive mild headache and dysphoria. Emergency cranial CT revealed a 4 cm haematoma in the left cerebellar hemisphere. CT angiography showed a 2×2 cm nidus of an arteriovenous malformation (AVM) in the left hemisphere fed from the left posterior inferior cerebellar artery and draining into the inferior hemispheric vein. We performed a surgical resection of the AVM after decompression therapy to counteract the brain oedema. She recovered completely without any neurological deficits. This case recalls the importance of cooperation between diagnostic neuroradiology and neurosurgery in emergency, considering AVM, even if infrequent, among possible diseases.","DictElement({'Year': '2013', 'Month': '07', 'Day': '16'}, attributes={'DateType': 'Electronic'})",2013,The neuroradiology journal,10.1177/197140091302600314,PMC5278850,,Case Reports; Journal Article,United States,eng
